Comment ID,Author,Score,Body,Publish Date
fwiub5c,ruustyshackleford,26,"be honest, u mining bitcoin.",2020-07-01 07:14:23
fwizbgo,jsktrogdor,26,"It's the first time they've ever been wrong.  

I bought bitcoin when Bruce told me to.  I havn't even checked in on the price I'm so confident",2020-07-01 07:57:48
fwi4f27,rrubinski,18,"... they totally can be traced back to you, I don't know why people think that Bitcoin is untraceable since the feds have been catching literally every mfker that uses Bitcoin for fraud or w/e, ever since like 2012 now.",2020-07-01 03:48:38
fwj3mqx,GhostSierra117,18,"Hijacking top comment sorry.

VPN companies do what you could call a ""test""-advertisement.

Basically they reach out to YouTubers, people who blog etc pp. and tell them that they should test and review the VPN services. These people get a code, for example ""VPN-blog3"".

On www.vpn-blog3.notadomain you then read a ""test"" that NordVPN is super good etc and you even get a buttload of discount if you use the code ""VPN-blog3"".

Now NordVPN knows where you're coming from. And the dude from VPN-blog3 now recievers a share of what you bought, because he basically referred you to NordVPN.



As far as I'm aware mullvad is the only VPN service who do not do that. You don't even need a damn mail address. You can pay via bitcoin, check and other fairly private options. No logs, nothing. 5 bucks flat per month.

https://mullvad.net/


Also: https://www.thatoneprivacysite.net/",2020-07-01 08:37:06
fwjdhl6,some_crypto_guy,14,"It wasn't a garden variety scam. That was a well orchestrated deception that you wouldn't suspect unless you think like a criminal. I also don't believe CSW came up with the idea. It was perpetrated by a team that wanted to manufacture an excuse for taking over the Bitcoin client and rate limiting Bitcoin to a non-threatening number of transactions per day.

Gavin was a bit naive, but wow was it a better community when blockstream shills weren't steering the bus and censoring everything about scaling Bitcoin to a global decentralized currency without 3rd parties, which is the entire point.

How many years has the lightning network been 18 months from being ready? How many years has blockstream been operating without any revenue or products people pay to use? Someone should introduce me to their investors. I must have been talking to the wrong ones.",2020-07-01 10:13:02
fwj47yi,1MightBeAPenguin,14,"I feel bad for Gavin. The guy did a lot to try and make BTC successful, but instead his character got assassinated, and he was kicked out from having commit access. He also stopped being as vocal about his support for Bitcoin Cash, and has so far been diplomatic in an effort not to get smeared by the Core crowd.",2020-07-01 08:42:24
fwib5on,TheLovingTruth,13,"Where do I turn in my Bitcoin, tho?",2020-07-01 04:42:14
fwi9jtm,Thatonebagel,12,There are also still other cryptocurrencies like monero which are much more difficult to track than BTC. Additionally you could buy bitcoin in cash and have it transferred to an unregistered wallet. Could set up a burner phone and use a Bitcoin Atm. There are ways to still hide your stuff.,2020-07-01 04:29:29
fwim22w,Stupid_ethics,12,"Lots of misinformation here... tumbling is not proven to protect anonymity and Bitcoin most certainly is not anonymous. Your best route is to just buy Monero, which is more anonymous.",2020-07-01 06:07:08
fwix9xo,an525252,12,Why stock market up and bitcoin no go up,2020-07-01 07:39:49
fwhyvhm,Addywhoom,9,People use Bitcoin normally or some other form of electronic currency that can't normally be traced back to you,2020-07-01 03:05:58
fwig999,BenK929,8,isnt that the bitcoin miner guy who said you should just game on a console,2020-07-01 05:22:24
fwi9og8,satoshisbitcoin,8,"GBTC buying bitcoin as a long term holding / store of value literally is the use case for bitcoin. So are the dozen of other financial on ramps that have been in accumulation mode as well.

What is happen now is the same as previous cycles, the broader market continues to accumulate while prior holders slowly sell. Eventually supply is exhausted and the price then starts to move, which creates a snowball effect as more short term buyers join the momentum as well. 

Or do you think BTC is only for short term trading?",2020-07-01 04:30:30
fwhple1,DATY4944,8,"Except the US dollar is based loosely on the US GDP, whereas the price of bitcoin is entirely based on the demand for Bitcoin. It's not as good a solution as you think.",2020-07-01 01:53:17
fwhtbqa,razorsyntax,8,Just because he’s wrong about cryptocurrency doesn’t mean he’s wrong about the economy. He’s a gold maximalist. It’s just as silly as a Bitcoin maximalist. But both maximalists are calling out the same problems and that’s what’s important.,2020-07-01 02:22:50
fwitcy3,TheMohawkNinja,6,"Except in the &lt;10 years it's existed, the value of one Bitcoin has risen by like 6 orders of magnitude. If the USD did that, it would completely destroy the world economy. A good currency needs to be stable.",2020-07-01 07:06:14
fwj1qb1,skinnyqueenss,6,"i just had an email from btc support saying that there’s been some transaction attempt of $18,000 ?? i mean it’s obvs a scam, i’ve never once done anything related to bitcoin or whatever, and the email address is like zgjskalaa@fososoapaoa.com but still, it’s creepy",2020-07-01 08:19:50
fwi87d5,Belzebump,6,And they are controlling bitcoin 😉,2020-07-01 04:18:42
fwi3v6v,wickedkookhead2,6,"Buy a bunch of bitcoin, buy loads of counterfeit cash on the deep web, buy gift cards with all the cash, buy more bitcoin, buy more cash",2020-07-01 03:44:20
fwin2o4,Vaskre,6,"Sure, Monero is a better option, but it's not like the feds are out here catching every single person who ever did a single illicit thing with Bitcoin either.",2020-07-01 06:15:16
fwizkd5,--Trash-Panda--,5,"High time preference thinking.  

Better off selling??  Ok, sure.  It's been about 6 weeks since the halving and the market is being artificially propped up by trillions of newly printed currency.  The fundamentals of bitcoin have never been stronger. 

But sure, you're the genius here.",2020-07-01 08:00:01
fwibpk8,500239,5,"Bitcoin Core had a scaling plan? That's news to me. The 18 months deadline getting kicked around for the last 6 years was self evident it was never going to happen. 

For each issue LN solved it created 2 new ones. Still can't send money to people offline, still are capped with balances of under $1k, still must check in periodically, ie perma hot wallet, etc.

I always understood that LN was forever 18 months away from completion, while Blockstream tried coaxing users into using Liquid which solved all of Bitcoins problems yesterday. Hell even Adam Back positioned Liquid before Lightning: https://twitter.com/adam3us/status/1217813293940793344

To this day even their most active cheerleader /u/vegarde can't give a deadline for when Lightning would reach feature parity with Bitcoin's p2p cash function that existed prior to Blockstream's influence.",2020-07-01 04:46:39
fwiy9e2,CONTROLurKEYS,5,because bitcoin is correlated.,2020-07-01 07:48:27
fwizek2,nullc,5,"Yes, I'm angry. I'm angry that despicable scammers like you fraudulently trade on the Bitcoin name and prey on the technical ignorance of ordinary people to enrich yourselves at their expense.

&gt;  that Bitcoin Cash exists ... not in consensus when SW activated

BCH (or BCC as it was called then, until someone realized that using the same name to help offload bitconnect bags had bad optics) existed well before then, ever since it was created by Bitmain in a naked takeover attempt that ultimately caused them more than a billion dollars in losses.

The lesson you should take away from that is: Fuck with bitcoin, get wreaked.

When segwit activated &gt;90% of nodes were running segwit enforcing software (when bcash was created too).  And fortunately, the remaining 10% weren't screwed because segwit is backwards compatible.

In the last BCash hardfork only about half the nodes were compatible the rest were knocked off the network, out of consensus. LOL.  Similar happened in prior forks and as a result BCH is now down to just a few hundred nodes.  Originally you and your co-scammers bragged about many implementations, but most of them have been forked off the network through your ""upgrades"" and are now unusable. There is even BSV which was created because BCH's authorities insisted on forcing CTOR-- still unused years later-- onto everyone, other implementations like ""bitcoin xt"" just gave up in response.

&gt; and upgrade on schedule just like Bitcoin did from the beginning

Bitcoin was never hardforked by Satoshi-- upgrades have always been done the same way in bitcoin: via softforks.

&gt; so back to my original statement that the actual space usage of SW blocks is hidden with accounting tricks

Repeating your lie without any basis or substantiation doesn't make your lie any more true or convincing.  I showed everyone outright how the actual size is computed and displayed right there, unmolested and unhidden in the size field returned in the bitcoin software.

What have you shown? *absolutely nothing*.  Instead you just tell the same tired old lies over and over again. Boring and  repetitive. ""BEEP BOOP BCASH IS THE REAL BITCOIN. SEGWIT IS FLAWED AND HAS TECHNICAL DEBT BEEP BOOP. INSERT COIN TO CONTINUE."" 

And we're left back at the original point. You fraudulently claimed that because of segwit, if Bitcoin were to hardfork to a larger blocksize limit it would saddled with using more resources for the same limit compared to just directly making that hardfork in the first place.  This is an extraordinary baseless lie which you keep repeating to convince your victims that the shitcoins you're selling them aren't shit.

If some blocksize hardfork didn't want to use weight and instead wanted to limit itself on the size of the standard on-disk serialization, it simply would do so-- and wouldn't be any more complicated as a result of the history. Your claim is a lie, plain and simple.

The fact that you and the various bcash developers spread and allow lies like this to persist demonstrates your complete absence of integrity and ethics.  The result forms part of an *ethical debt* that bcash will never be able to recover from.

&gt; actual space usage has a cost, a cost that is hidden with accounting tricks that is more than just a getblocksize

You ninjaed in this sentence-- but the size returned in the interface is the actual complete and total size on disk. There is no hidden anything there.  I chose a specific block as an example. If I was being untruthful about its size you could counter with whatever size you claim it actually has.  But I am not.  The size returned there is just the size... the actual size, the space it takes up on an unpruned full node. There is no greater size or hidden cost there. There is no interaction with pruning, or segwit or anything else. It's just the size.

I *know* you know all this already, but people read lies like yours and get tricked because they can't believe that someone would be so audacious to tell such obvious lies with such confidence. This exactly how they are tricked by Wright.  ... I am so fucking sick and tired of it.

You need to stop the bullshit now, dirtbag.

How about we agree to a wager?  I say the size of 0000000000000000000b83dd8b5891ba9dffa52b0f17b5a571e00c5d9feb8124 on disk is 1142782 bytes, just as my node reports in the size field of the getblock command.

What terms do you suggest?

Come on, DaSpawn, SHOW ME THE BLOCKSIZE.

&gt; and made even more confusing with signature pruning

Yeah, section 7 of the Bitcoin white paper. Sooo confusing. &lt;eyeroll&gt;",2020-07-01 07:58:34
fwig5su,CloggyDutch,5,It’s like the price graph of /r/bitcoin/,2020-07-01 05:21:40
fwj8lbv,1MightBeAPenguin,5,None of us will support Bitcoin because it's pro-censorship. Almost everyone in this community was a Bitcoin supporter before the started supporting Bitcoin Cash.,2020-07-01 09:24:33
fwi2htc,Photoshop_psd,4,"Why? Partners aren't enough for you? What about physical products like LidBot which is being tested by American Airlines? Or the multiple smart cities integrating IOTA?

Man it's not dead, it's more adopted than any other crypto at this point as it's even the only one to ever be standardized, bitcoin tried for a standard and was put down, so has every other crypto to try to get one except for IOTA which has 2 standards lol",2020-07-01 03:33:46
fwifgjk,statisticsprof,4,Amazing. I remember when the /r/investing people were laughing about Bitcoin and how it's a manipulated market that makes no sense.,2020-07-01 05:16:13
fwjkcs8,MemesAreBad,4,"I'm confused; are you implying that practice is bad? The referral codes let those content creators get paid, and I don't see how it would negatively effect your privacy. Obviously displaying cherry-picked reviews is problematic, but unfortunately that seems standard. 

Also, I'm unsure how a check is anything resembling private. Bitcoin definitely is though.",2020-07-01 11:22:46
fwjwza4,p0ok3r,4,If it wasn't because of Roger Ver and the rest of the community BCH was dead after hash war. Amaury has no mining power to protect the chain (or even protect himself from the lawsuits from nChain) and Craig and Calvin would own 100% of the network by now. Amuary only started something with the promise of keeping the original Bitcoin protocol intact and that's why the rest invested on BCH.,2020-07-01 13:40:31
fwm8jcw,Armor_of_Inferno,49,"I've told this story on Reddit before, but this might illustrate why Primerica is particularly bad.

I blame Primerica for the death of my best friend.

His name was Vance, and we'd been bros since he moved to town at age 13.  He was smart, witty, and had the kind of technical savvy that would have made him a Bitcoin millionaire.  Unfortunately he developed brain cancer at age 17, and had to have some pretty serious surgeries to fix it, but he came out in full remission.  He needed regular brain imaging every 6 months to ensure he stayed in remission, and if not, so that they could catch it early enough to treat him.

Vance was unfortunately surrounded by family who were all trying to get rich quick.  He had pulled me into my first pyramid scheme at age 18.  Selling long distance calling cards, if you can believe that.  The 90's were a weird time.   Anyway, we'd both been around the MLM block and knew what to watch out for.

Primerica was different though.  He asked me to go with him to a group interview at age 23, and they looked very different from the other schemes we'd been pulled into.   They were part of Citigroup at the time, and they sold financial products like life insurance and mutual funds.  Their pitch was that they'd get you licensed to sell stuff like that, and that seemed tempting.  Yep, the course would cost money, and so would the test, but then you'd be off to a career that would make you a millionaire by age 30.

It set off my red flag sensor, because they ""hired"" all 15 people who were in the ""group interview"" with us.  I saw that most of the people in that room were not people I would hire, and knew something was fishy.  He couldn't be deterred, though, and signed up.   He still worked his day job, but he spent all his free time trying to recruit family members and sell stocks and life insurance to friends and family who were dirt poor.  Other than trying to recruit me every few months, we didn't talk about it much.

A year later I got him a great job working in a call center.  Yep, call center jobs suck, but compare that to cold calling people to sell them a pyramid scheme and it starts to look like a dream job.   He worked out well in the company, and had full health insurance.

He lasted 6 months, and then quit so he could work Primerica full time, because his upline told him the reason he wasn't succeeding was that he wasn't working enough hours.  These were the same people who rented Ferraris by the hour to show up at a potential client/employee's house to look rich, all while living in one bedroom apartments. 

Eventually Vance had to move in with his wife's parents (out of state) because he couldn't make rent on his own, and of course had no health insurance.   He stopped getting those preventative brain scans because he couldn't afford them -- *yet*.  He would have no problem paying for them just as soon as he ""built his company"", and was always saying that it was just a few months over the horizon.   

One day Vance suddenly couldn't get out of bed, and he was sick beyond sick.  His brain cancer had returned, and was at that point inoperable.  I saw him once before he died when he was on hospice care, and he could only stay awake for about 3 minutes.   I will never forget his funeral, where I watched his devastated wife - pregnant with their kid - being restrained by family members while she tried to stop the officiant from closing his casket for the last time.  That shit haunts me, man.  

He died of a tumor that likely was preventable had he kept his health insurance.  Instead, the bastards he worked for at Primerica convinced him to believe in a fake reality, a dream that even they would never achieve.

So Primerica is particularly evil, because it looks like legitimate work.   It has a cult culture that thrives on looking successful, and it can fool even brilliant people who should know better into selling everything they own at a shot to be rich.  A shot that will never happen.

Fuck Primerica.",2020-07-02 04:45:59
fwm8msi,itsGOOSEYx,13,Im sorry this is my fault - I actually focused on getting the bitcoin farm and clearly it had to get nerfed.,2020-07-02 04:46:43
fwm679y,redsquirrel0249,13,"bitcoin down to 100k as well. RMT or no RMT, this is another change that hurts casual players and rewards extensive grinding",2020-07-02 04:28:29
fwmeh8g,TangyDanKness,10,"I was so happy to get my bitcoin farm and to start producing level 2-3 items in the hideout. Now all of it is worth shit. Covers the fuel to keep producing items to cover the fuel to keep producing items.... they're slowing the progression of players real bad, but I guess that's what they always wanted. A game that takes 2 years of regular playing to get max level",2020-07-02 05:30:27
fwn9jot,gotbannedagain__,9,"That's ironic as fuck considering the mods of r/bitcoin are censoring posts for their own monetary gain, which is literally against reddit's ToS. There's countless grounds to have them removed as moderators. I don't even understand how they get away with it.",2020-07-02 09:45:31
fwm759p,satoshisbitcoin,8,"The next hype cycle is starting, say what you will about them but each hype cycle increases the number of digits predicted...

https://www.zerohedge.com/crypto/bitcoin-set-288k-bull-run-2020-popular-btc-price-model-says",2020-07-02 04:35:33
fwn32dr,christophertacon,8,Whilst I understand people being protective of bitcoin and etherium (and seeing everything else as worthless) - I really do since I own both and want to see both rise in price. I really think ADA will bring a lot to the table. I don't think it will kill of Etherium but I don't see why there can't be two competing technologies with different methodologies.,2020-07-02 08:45:07
fwncfce,J23450N,7,Got banned from r/Bitcoin the other day for mentioning that there was no trace of the Liquid issue on the sub. Had avoided it for years for some reason. Finally said fuck it.,2020-07-02 10:13:09
fwmbtmo,msuvagabond,7,"I spent a year using Bitcoin nearly everyday in some fashion, including doing basic shit like buying a cup of coffee. I can't do that anymore, I can't help drive mass adoption. 

Bitcoin is relegating itself to only be used by money launderers, that's it. Read the white paper, it has so much more ability and potential but none of that is possible if day to day people cannot use it.",2020-07-02 05:10:22
fwleg6e,RIFIRE,7,"I have some bonds and international, not just VTSAX.  That's more commonly accepted elsewhere than it is here.

I also have some bitcoin and ethereum.  Not a lot, I think of it more like a lottery ticket that might hit big in the future but if it goes to 0 it doesn't hurt me much.",2020-07-02 00:56:54
fwlo2li,irony_tower,7,"Mike Gravel's 2008 campaign website is now some German Bitcoin blog now, if anyone was wondering

https://www.gravel2008.us/",2020-07-02 02:12:40
fwlu91u,firefly907,7,ironically i have seen hate for jpowell only from trumpers and bitcoin liberterians,2020-07-02 02:59:51
fwnxzao,Morlaix,7,At least bitcoin is still alive,2020-07-02 14:01:03
fwm9zse,win10helpme3,6,Use Bitcoin Cash. It solved the fees problem (by increasing the stupid 1MB block size) and works as Bitcoin was always supposed to. It's a shame the market was really picking up on Bitcoin (even Steam and Microsoft accepting it) until fees skyrocketed making it unusable. Who knows where we'd be at if the trend had continued.,2020-07-02 04:56:47
fwnbfs2,paoloaga,6,"It is BTC that stole the Bitcoin name. It would have more sense to ban or takeover r/bitcoin that doesn't represent anymore what Bitcoin has been and what made Bitcoin so popular.

[https://twitter.com/paolo\_aga/status/1278420799649611778](https://twitter.com/paolo_aga/status/1278420799649611778)

""BCH didn't steal the Bitcoin name. It's BTC that changed it's very means and stolen the name. BTC should be called BitSettle because it's not anymore a ""peer to peer electronic cash system"" (whitepaper), it has been turned into a ""layerable settlement system and store of value"".""",2020-07-02 10:03:36
fwlay5p,JaxzKyd,6,r/bitcoin standing by.,2020-07-02 00:28:03
fwmizbk,SexyCrimes,5,This is good for Bitcoin,2020-07-02 06:03:38
fwlqyz0,stake_pool,5,"Justin Sun from Tron to buy ITN for 1 billion $ cause it's the best blockchain out there

Bitcoin SV to be renamed to CV

Warm Sunny Colorado AMA-days to become official holidays in the US

Wolfram to release oracles on Cardano

Vitalik to leave Ethereum and join Cardano

Just my two lovelaces",2020-07-02 02:34:56
fwn29za,drewshaver,5,Those are great topics and imo the best intro is the explanation for why bitcoin not how to use it.,2020-07-02 08:37:54
fwn1f0z,naviejsason,5,"Yes, it would take a lot of “shaken faith” in the current system for the demand for bitcoin to hit such highs.

While not outside the realm of possibilities, definitely not likely to happen anytime soon.

If this were to happen. The sad truth is that it would create a new system of inequality. This would be based on technological awareness. Those that are risk takers and technologically sound would be the new economy leaders.

These same people are ones who are seeking new frontiers and are not on board with a lot of the “conventional” items. 

It will be interesting, to say the least.",2020-07-02 08:30:09
fwnnrub,Florbdorb657,5,"This is essentially the only step 

Replace bitcoin (btc) with monero (Xmr) and ur good",2020-07-02 12:06:27
fwldqjk,MoonNoon,4,"You seem to not know that there was majority support for bigger blocks until censorship, meetings with no intention to raise the limit, DDoS attacks, reputation smearing, Sybil attacks, gaslighting on how Satoshi said bitcoin would scale and anything else I’m forgetting to anyone who considered raising the limit. Big block supporters moved to r/BTC because you couldn’t talk about bigger blocks without getting banned. All this before BCH even existed. Learn the history.",2020-07-02 00:51:06
