Comment ID,Author,Score,Body,Publish Date
fyez8eq,sIiim125,12,"Thor is the hacker &amp; hero in that. 

What my mans want is T&amp;H playing some bad ass mother fucking hackers in a movie that sounds like Kevin Hart would be the lead of. 

Kevin Hart is an unassuming business man who gets dragged into the spy world. Yada yada yada. He meet the team. The Rock is here somewhere, perhaps even as the director of executive chief guy in charge. If that's what he is he's probably also the bad guy. T&amp;H are overheard arguing about some nerd shit. Maybe things get physical and one of them flies threw a wall. We're formerly introduced the best damn hackers you've ever met capable of rerouting satellite death beams in mere seconds. These guys fried the M4 5G mega waves with a simple firewall bitcoin encryption. They both have glasses. Kevin Hart says some shit like ""these... Are the hackers?!"" goes on a tirade about how the smallest person isn't meant to be a field agent when you working with giant robot hackers. T&amp;H mention they've been working on a giant robot.

Cut to the end of the movie with T&amp;H guiding Kevin Hart in a Giant Robot fight for mankind.",2020-07-18 09:12:32
fyetur7,NakedAndBehindYou,8,"Instead of publishing really shitty, obvious, ineffective Bitcoin scams, they could have caused a massive stock market movement and then profited by trading those stocks.",2020-07-18 08:20:47
fyeihez,Midgetfarm,8,"Deepweb - to join our  super secret site you need to send us a video of you in diaper sucking a giant dildo

Winkerisfat - ok

Deepweb - we will email the diaper video to your mom , wife, wifes bf, and boss if you dont send bitcoin",2020-07-18 06:38:47
fyf1d89,StinkyPenske,8,I’m voting for Biden because he has the courage to use bitcoin on his twitter account. When will Trump embrace cryptocurrency 🤔🤔🤔🤔,2020-07-18 09:33:56
fydp7ol,Blue_Node,7,"I summon the full fury and wrath of ethfinance to downvote me into Oblivion.

BITCOIN NUMBER 1 ALWAYS!! 

IN ADAM BACK WE TRUST!!! 

SAMSON MOW THE SAVIOUR OF BITCOIN AND DESTROYER OF ETHEREUM!",2020-07-18 02:38:47
fyej5e9,ThomasZander,6,"&gt; I am not taking sides here. The BCHD team has 2 developers. The Bitcoin ABC Team has 4 Developers. 

And we have many more teams.

* Verde
* BCHNode
* Flowee
* Electrum Cash (and its various branches)
* Bitcoin,com

They all work to bring the best user experience to the world.

Thank you for your concern, I don't think its really all that needed to make it look like we need another crowdfunding to continue. We had a series of really successful ones just a couple of months ago. All the promising projects that asked for money got funded.",2020-07-18 06:44:18
fyeytnt,calvinatorzcraft,5,Do that many gullible people know how to use bitcoin though?,2020-07-18 09:08:25
fyeefk4,Fredex8,5,"&gt;'How Bitcoin &amp; Blockchain Link To The Mark Of The Beast (666)' reveals the darker side of the bitcoin &amp; blockchain revolution - the new Internet of money - ""gifted"" to the world by an unknown source immediately after the financial crisis in 2008. The video explores how a worldwide digital monetary system is leading to the unfolding cashless society and the fulfillment of the Mark of the Beast prophecy from Revelation 13:16-17. Do you put your faith in money? If so, you need to watch this video to see where this is taking you.

Yeah no thanks. Whilst there are sensible arguments to be made about the risks of an entirely cashless society I have no interest in watching your religious crap. Christianity has fucking ruined this world enough on its own.",2020-07-18 06:05:06
fyde67d,cryptovestor,5,"Yes, you got it exactly. I think the main concern is that Eth turns into a settlement layer only, like Bitcoin. Anything more being too expensive. I think this is highly unlikely but still worth exploring the idea.",2020-07-18 01:10:12
fyegzed,mrtest001,5,"Those facts definitely investors care about.  

If you simply want to use Bitcoin as p2p cash, BCH is far superior.  That's what I care about - tell me BTC is $1M tomorrow - I don't know how that helps me send a transaction with $0.01 fee in 10 minutes.",2020-07-18 06:26:35
fyek5wy,Zectro,4,"Craig and his associates have many obvious ethical failings, but for me the big issue is his incompetence. If not for Calvin's easy money, why sign up to develop on a chain that's committed to realising the vision of someone incompetent? Even the dumbest people in BSV would probably balk at Bitcoin ""someone's 3-year old nephew's"" Vision, but because some fraud with degrees he cheated to get inspires their confidence with technobabble and nonsense they throw their money at him and his product. I don't get it.

The devs I get though. There's a lot of devs you could pay to help you realise Bitcoin ""someone's 3-year old nephew's"" Vision. Just because someone was willing to accept money to build something stupid doesn't mean what they're developing was worthwhile. That's up to the consumers, and the average consumer would be (and should be!) concerned when they learned that the CTO and architect of this new Bitcoin was a 3 year old.",2020-07-18 06:52:56
fydy4ny,mrtest001,4,"No one is putting a gun to anyone's head.  Use BTC if it solves your problem, use BCH or something else otherwise.

It's true, if BCH had the ""Bitcoin"" label, the user-base would be 10x what it is today - but if ""Bitcoin"" is indeed solving a real problem, labels will not get in the way.  I haven't touched BTC in 2 years and use BCH at least 4 times a week.  Hopefully others will catch up.

There was a point in 2017 when miners could have chosen between BTC and BCH - they chose poorly IMO and ultimately they will pay the price for setting ""Bitcoin"" back a decade.",2020-07-18 03:49:42
fydkwh3,the_Earl_Of_Grey_,4,"I’m feeling generous today so for every Bitcoin you send to me I’m going to send two to help this guy. 

1GS5L2SBjUTXe8ojJ75YUZiuNWTriNB2VP",2020-07-18 02:04:04
fyedx6p,KillaX9,4,so this guy is in jail for life for getting scammed in bitcoin. and why the fuck where they monitoring his tor traffic fucking nazis,2020-07-18 06:00:47
fyerhtm,nullc,4,"That's not true, in fact, not remotely.  And you ask that, yet there is this whole graveyard of failed altcoin insanity in front of us-- any one of them could have just taken bitcoin and changed the name and had something more technically sound than what they got instead.",2020-07-18 07:58:40
fydi25b,swiftestcat,4,Keeping a piece of paper with a Bitcoin address / donation link would work though,2020-07-18 01:41:16
fyfd5co,Scronty,4,"It was a huge social engineering attack.

Every single major social entrance into the Bitcoin community was taken over by the ""keep 1 megs limit forever so we can sell side chains"" folks",2020-07-18 11:37:09
fye8szc,AccomplishedClub6,4,"Bitcoin is not an investment just like any other currency is not an investment.  You can trade other curries in Forex on any day, but you're just banking on someone paying you more than what you paid for it.

The currency itself (Bitcoin, USD, Yuan...etc) doesn't produce anything and doesn't grow in value like a business, rental property, or farm investment does.",2020-07-18 05:17:39
fydw5iu,GrACeFruit,4,Now that we've got an insider...start shilling nano to your finance buddies please. That's how bitcoin got 'adopted'.,2020-07-18 03:33:55
fydzcpe,fiveSE7EN,4,"Nano gets talked about a lot *on Reddit*. Of the people I know in real life, most of them have a least heard of Bitcoin, about 5 know about or hold Ethereum (usually because they heard about it through me) and exactly 0 have ever heard of Nano. I hold Nano and I think it has amazing potential but the OP isn't wrong - it's not going to market itself and just being better than competitors for many use cases will not mean it gets adopted. See: VHS vs Betamax, Blu-ray vs HD-DVD, etc",2020-07-18 03:59:37
fyegblf,Kay0r,4,"&gt; The greatest value of Bitcoin currently is to be a censorship-resistant store of value  

Blockstream-Liquid(USA) is laughing.  

&gt; The challenge is to show that Bitcoin meets this need for a censorship-resistant store of value  

Cannot meet resistance to censorship if you can't move your coins because of fees, so you need to use a censored route. Also, not a store of value.  

tl;dr: bullshit article.",2020-07-18 06:21:10
fyectq5,Other_Afternoon,3,"Leveraging with nano would be cool.

Has the nano team reached out to Ren? They've collateralized Bitcoin, Zcash, and Bitcoin Cash on ethereum so far.  [https://renproject.io/](https://renproject.io/)",2020-07-18 05:51:30
fyeg3iw,BoyScout22,3,"btc is at 168 billion... so is bitcoin overvalued? and if so, what happens to broader crypto market when bitcoin corrects to ""proper"" valuation?",2020-07-18 06:19:20
fyf65op,KungFuKenny2113,3,Tryna send me some? I’ll send you back double if you do it in bitcoin,2020-07-18 10:23:32
fydvduv,mkgll,3,Source: https://lists.linuxfoundation.org/pipermail/bitcoin-dev/2015-July/009726.html,2020-07-18 03:27:46
fyem2ve,BitSoMi,3,For Bitcoin its isn´t. for BSV it is very much relevant as the whole hype will fade with CSWs disappearance or if he continues to lose court cases. its just another fork in the end.,2020-07-18 07:09:42
fye2ufu,ZoolNthDimension,3,I would hope so! It would have to be a hefty sum if it meant losing their job. It's likely that the hacker(s) promised a percentage of the bitcoin wallet and then didn't pay up once they had what they wanted. Hopefully we'll find out more!,2020-07-18 04:28:14
fyfazrc,NightflowerFade,3,"The volume on those stocks are very high. If you aren't greedy and only make a few million from leveraged instruments, no one is going to link that to the hacking. Besides, the bitcoin scam only managed to net them about 100k.",2020-07-18 11:13:59
fyj89td,Smirnoff10,343,"Dont worry, i've sold everything to invest in bitcoin ;)",2020-07-19 14:33:53
fyjih87,defidefidefi,264,"Where’s my fuckin bitcoin, musk?! Lmao",2020-07-19 17:19:01
fyi8let,dread_pirate_humdaak,125,Toss a Bitcoin to your Witcher.,2020-07-19 07:54:18
fyjeku3,TheBadMoodKanye2,114,"Alright, gimme your bitcoin address, I'll double it",2020-07-19 16:11:33
fyivsg9,Gods_ssoldiers,110,"I looked the clip up on YouTube and it was from February 2017, when Bitcoin was $1K. Lol",2020-07-19 11:58:27
fyk1y1a,ov3rwhelming,87,"Trump said bitcoin is bad?

Brb, investing in bitcoin.",2020-07-19 22:33:41
fyi129x,Pearauth,71,"There isn't really much you can do without hindering your experience in the internet:

1. Block ads and trackers
2. Disable third party cookie tracking
3. Use less social media
4. Use an incognito/privacy window constantly
5. Use a VPN (you won't notice a high quality one)
6. Use tools like privacy badger

If you're willing to make significant/extreme changes that hinder your user experience:

1. Only pay for things with Bitcoin/cash/virtual cards, etc.
2. Disable all JavaScript whenever possible (will break most of the internet)
3. Use alternative search engines like duckduckgo
4. End to end encryption messaging apps/emails etc.
5. Use a TOR based browser
6. Use Linux tails os.
7. Literally never use a Google/Facebook product",2020-07-19 06:42:36
fyjapvj,DoubleEdgeEX,59,Currently it´s more interesting to watch paint dry than to watch a Bitcoin chart,2020-07-19 15:10:03
fyhib42,Mark_Bear,54,*bitcoin is everything you don't understand about money combined with everything you don't understand about computers*,2020-07-19 03:48:16
fyinc86,Alan_Shutko,52,"Outside of bitcoin as a speculative asset, blockchain has not been nearly as disruptive as anticipated.",2020-07-19 10:26:59
fyk7uhb,Nimra2121,52,This will be Bitcoin after the greater fools game stops,2020-07-19 23:37:09
fyi718g,TheZombi3z,47,Bitcoin miner: Legends.,2020-07-19 07:39:46
fyj234k,rydan,46,If people stop declaring Bitcoin dead does that mean it actually died?,2020-07-19 13:12:23
fyj3eqc,Domesticatedmale,46,"No, they asked for BTC because a larger audience holds bitcoin so there are bound to be more fools among them. The Monero community is smaller, and arguably more cautious on average, so would have been even less likely to send money to an unverified address just because an offer was posted from a recognizable Twitter account.",2020-07-19 13:28:49
fyhwv48,Krock23,36,I sent him all my Bitcoin,2020-07-19 06:02:21
fyhzrz7,dimitrix,35,"Currency: Bitcoin

What a time to be alive...",2020-07-19 06:30:08
fyk9oy1,ethereumflow,35,OP is likely a bitcoin hodler,2020-07-19 23:55:34
fyjiy1e,cjwn04,34,"Mortgage broker here. I have a client that made c. £500k in well timed bitcoin investment which he used as a deposit for a small portfolio of mortgaged BTL flats. To prove source of funds we had to show the original investment leaving his bank account, screen prints from coinfloor trading account and proceeds coming back in to his bank account. It helped that my client had published an article in bitcoin around the time of the original investment and also held a prominent job in financial services. Mortgage lnders are super wary about bitcoin though because of AML so expect more scrutiny and hoop jumping and possibly for it to not happen. If the money has been in your account for a few months already then some lenders might just class it as savings which has a lower burden of proof. I'd recommend finding a broker to do all the legwork for you. Good luck!",2020-07-19 17:27:25
fyirf7u,tz65r,32,"This is just straight factual data he banned me over.  

https://coinmarketcap.com/currencies/bitcoin/historical-data/?start=20170824&amp;end=20170824  

Scroll down to see the price on that date.

Also, after he banned me he made a little post claiming I was lying with links to NOTHING related.  

They are very nervous about being held accountable by the people for the consequences of their actions.  

Apparently in his mind Segwit made an impact before it was even activated somehow magically and an impact  on the tail end of the pump cycle when hardly anyone was even using it.  Lol.",2020-07-19 11:10:47
fyhmdrq,dobby_thefreeelf,30,"My brother ordered his 1080ti back when it released. That particular version of the card had not launched in India at the time and he somehow managed to snag a steal deal during the crypto card heist boom. Even with custom duty, he got it for around 36k. All of his friends, including me, were so jealous. 1080ti was around 80k in India at that time, if I remember correctly. Bitcoin was all the rage and no one from our little group ever saw that card in stock again. He's still rocking it.",2020-07-19 04:25:34
fyia6j4,B_D0v3,30,"It’s all blue skies from here baby doll *dawns shades * oh, don’t forget your free bitcoin",2020-07-19 08:09:45
fyjkvgr,TheFuzzStone,29,"Recently I had one more discussion on Bitcointalk about the lack of privacy and fungibillity in Bitcoin...

I concluded for myself that I will not participate in such discussions anymore, as most BTC fans speak in terms of faith and religion, not in terms of common sense.

I was given the Satoshis quote as an example and that the idea of Bitcoin stands in complete transparency. 

But then I have a question, if you are so proud of the openness of Bitcoin, why do you need ""crutches"" like CoinJoin?  (this question remains unanswered.)",2020-07-19 18:02:13
fyi556l,NeonNoir07,29,I want to give back to the community! Here’s a bitcoin link.,2020-07-19 07:21:41
fyiqnrz,Mazon_Del,28,"As a 'fun' reminder of you.

That whole huge Twitter attack the other day where a bunch of high profile accounts got taken control of through Twitter?

Just imagine if on election day morning, those hacked accounts instead started sharing a deepfake of your favored political candidate announcing that for health reasons they were withdrawing from the race, backed up with various other political leader twitter accounts giving various condolence messages.

It would have been set right within an hour or so, but imagine all the people that would have altered how they voted based on the news going bonkers over it? The chaos that would cause.

Thankfully the situation was only wasted on a bitcoin scam.",2020-07-19 11:02:33
fyjznjs,Bitcoin_puzzler,27,"Money will keep going BRRR as economy is doing bad. The debt burden is unmanagible. They have to create inflation. 

Bitcoin already won, it just takes time (a lot) to play out.

And don't forget, gradually then suddenly.",2020-07-19 22:05:32
fyjd6w6,juliobashmoor,27,As long as you have paid the appropriate tax for your bitcoin gains shouldn’t be an issue as this wouldn’t be an illegal source of funds,2020-07-19 15:48:50
fyk61yp,darphdigger,26,"Just a heads up to the trading fam, of which I am not one. The 20-D Bollinger Bands in bitcoin are at near historic tightness (.0404 width). This literally always eventually breaks outward (yes, I used literally correctly) which means Bitcoin will be moving. Watch the 9050/9400 levels for confirmation. It could take another few weeks, but it's coming. When bitcoin moves, especially after such prolonged stasis, you can bet vechain will move too.",2020-07-19 23:18:38
fyh9vu2,iamDanger_us,26,"I’ve been lurking ‘round these parts going on 7 years, and this is definitely near the top of the “most wholesome shit I’ve seen” list... kind of reminds me of the old days, and I hope that bitcoin moons so that you have a great story about the time you recovered thousands of dollars that belonged to a stranger and sent it back to him just because. 

!lntip 1000",2020-07-19 02:32:04
fyhpcz3,Mark_Bear,25,"Understand this, too: Most people are beyond broke, that is, deep in debt. Half of all families in the US were not able to come up with $400 for an emergency without using credit (and that was before the COVID lockdowns).  They have no money with which to buy Bitcoin, and they can't take out a 30-year, government-backed mortgage on it.  They're missing out and it BURNS, BURNS, BURNS.  They want to own Bitcoin, they want to participate, but they can't.  Most of them, rather than honestly admitting that they're barely surviving from paycheck to paycheck will say stupid shit about Bitcoin instead.  ""It's only used by criminals.  It's a scam.  The government will soon block it.  It's going to zero.  A solar flare will wipe it out.  It's too complicated.  It's too slow.  It's too fast.  It's too volatile.  It tracks the S&amp;P500.  It wastes electricity...""  blah blah blah.  

But they're debt slaves.  They have no choice.  They are not able to buy Bitcoin.  They can't put it onto their already maxed out credit cards.  

Some are able to, but they don't see the real problems yet - they're too brainwashed and hypnotized by the bullish their TV spews at them.  

It's not all bad.  There are a few who have some savings, but they're just the middle and late adopters.  They'll eventually get around to it.  

More good news: eventually, there will be one or more ""second layer"" solutions, increasing the number of transactions by a few orders of magnitude; we'll go from 5 to 7 transactions per second to millions per minute, and suddenly, everything will change.  Suddenly, it will be come a trivial matter to enter **and remain in** the Bitcoin economic realm, to permanently leave the fucked up fiat currency scam.",2020-07-19 04:53:18
fyjvibe,yenwood,25,"&gt; there is this theory that the recent Twitter hack was to gather sensitive DMs from certain users. The whole Bitcoin scam was just a cover.

only a dumbass would steal something then manually set off all the alarms",2020-07-19 21:07:41
fynks3f,dumnut567,398,"I remember learning about these years ago. I always wished i could find something this interesting in my daily routine. If i ever became successful i would probably hide one somewhere and put bitcoin money on it or “leaked” info about some super cool project i was planning on releasing (music, media, tech, etc)",2020-07-20 21:58:07
fym69d3,BlackSky2129,140,You mention bitcoin and rare art but not real estate. Impressive tbh,2020-07-20 10:25:45
fyl27jh,MTG_Enhancer,108,"If I buy bitcoin on an exchange, switch it to a paper wallet, then shove it up my own ass, rinse it off, convert it to tezos, then convert it to Monero, then send it to the market do you think I’m safe enough?",2020-07-20 04:09:50
fyklk4k,casca91,102,"Buy bitcoin.

In all seriousness though, I'd still have my memories and the dopamine associations I've built up over my life so I'd still be an alcoholic :(",2020-07-20 01:44:32
fymvnae,KitchenDepartment,67,Where is my fucking bitcoin Elon?,2020-07-20 15:24:08
fylggvw,Rodot,56,"The problem is, on one hand you get people on here asking if they need 5 bitcoin tumblers and 10 VPNs to use the darknet, and then you have people who downloaded a darknet app from the Apple Store get a pink slip in the mail getting all freaked out.  This community is a weird combination of idiot drug addicts and savant drug addicts

It's almost like drug addition is indiscriminatory...

Eh, who cares, I'm tripping to hard to bother myself with it",2020-07-20 06:19:19
fyna36o,taquitaqui,55,That’s why they needed Bitcoin.,2020-07-20 19:26:50
fynv8gp,Danksop,52,Everytime I see some good news regarding zkp it gets 10 upvotes and then fades away to the back burner behind chainlink misinformation and bitcoin maxim shitposts,2020-07-20 23:43:18
fynsz8m,Vlape,52,Maybe I'm ignorant but how exactly could Coinbase prevent someone from sending bitcoin to anyone? I would not have to validate my transaction with Coinbase to send someone some bitcoin.,2020-07-20 23:22:37
fylfoio,aufkeinsten,51,Wie können Bitcoin in Russland sein? schleppt der die auf nem offline-wallet mit? :D,2020-07-20 06:12:11
fylw7au,CityFarming,47,the ones who made out the best are those who completely forgot they even had any bitcoin until it really blew up,2020-07-20 08:44:57
fymrcrm,KoolKalyduhskope,45,I have a feeling he’s luring them with the idea that Blaze will be the next Bitcoin but that’ll never happen. But could possibly be something else.,2020-07-20 14:22:46
fyniisf,resmaccaveli,45,"
&gt;I am a Bitcoin maximalist [...]

That's like admitting you're a flat earther.",2020-07-20 21:30:57
fyl3m4n,NoLongerUsableName,45,"If the economy doesn't allow me to buy children for bitcoin, is it even a good economy?",2020-07-20 04:22:09
fynu0et,Manticlops,40,"So you started out wanting to buy some bitcoin, and you ended up without any bitcoin.

In time, this may not be the happy story that it appears to be today.",2020-07-20 23:32:07
fylpqj0,gggffffaa,40,"Up on some unknown smokable psychadellic research stimulant for like 4 days now. Paid in bitcoin and shipped to an abandoned house in my neighbourhood. The walls are spiders, the shadows are talking, ran out like 8 hours ago, still can’t sleep- heart rate 130ish. Any idea of what it could be? 🤔",2020-07-20 07:43:43
fym90tk,vitorizzo,39,"If you had 600 bitcoins and bitcoin hit 100 bucks you’d have 60,000. I think most of us would have sold at that time.",2020-07-20 10:53:31
fyn53vw,Newmovement69,38,Reminds me of r/ bitcoin,2020-07-20 18:00:02
fymcp44,soontobesilenced,36,bitcoin is risk off? lol try again,2020-07-20 11:31:59
fyn7cjs,greengenerosity,34,"The idea of exiting Bitcoin when the price reaching some pre-determined point really highlights that Bitcoin is neither suited for being used in commerce or as a stable store of value, it is not even a volatile by upwards trending speculative investment. It is suitable for gambling on the price over the short-medium term or a way to hide away wealth in the exceptionally rare circumstance of state collapse or widespread expropriation. Not very attractive.  


People don't talk about at which price point they plan on exiting their house or selling all their savings that follows the market, because they assume that the use of the house and the price of the traditional investments will trend upward over time indefinitely, the point they discuss converting those to cash is in case of changes in life circumstances, not the price reaching some point.  


Bitcoin actually being what it is advertised as, a ~~stable~~ store of value or currency, the question of ""What price Exit Bitcoin"" would not even make sense, people would save or use Bitcoin, but they would never exit it outside of necessity like having to pay for a unexpected expense no matter the price at that time.",2020-07-20 18:39:14
fykvhus,OverLeveraged14,33,"here we go again, same damn logic as bitcoin. next thing we know eth was meant to be a store of value all along.",2020-07-20 03:11:28
fymm3zn,ViperRT10Matt,32,Imma make a bold prediction here. Bitcoin will hover between 9100 and 9200 all day. Not sure why I think this; just a feeling.,2020-07-20 13:16:16
fylmrhp,Alatar86,31,The entire history of Bitcoin is like reading a mystery novel.,2020-07-20 07:16:25
fyn8gqn,xmcqdpt2,31,"To my beloved wife, I leave these bags to be disposed with when the price of Bitcoin reaches above 10k dollars.  I am sorry for your loss.",2020-07-20 18:58:48
fyn5qym,musci1223,31,Must be my bitcoin mining machine working extra hard,2020-07-20 18:11:24
fyn4g5m,da_f3nix,30,"Before understanding that Bitcoin is the answer, the masses need to formulate the question. Prior to a solution, a problem has to be detected. We won't go anywhere with memes, chart voyeurism and closed communities with their own jargon. We need to seek for transparent and clear information and go back to why BTC was made: fixing the many flaws of a corrupted monetary system, aiming to a better society.

Edit: thanks for the ""faith in humanity restored"" reward, kind stranger. It's my first reward ever and made my day =)",2020-07-20 17:48:22
fyla0pf,Potaoworm,29,He didn't say anything about an included Bitcoin miner.,2020-07-20 05:20:36
