Comment ID,Author,Score,Body,Publish Date
fx95c7s,YourBestMateRobbo,7,"
""He added that testing cross-chain communication between Litecoin (LTC) and Cardano (ADA) is an idea he desires and loves, believing that they have some things in common.""

he wants to use it to test sidechains...which was the idea for the ITN rebirth.

and if ada can talk to litecoin then it can talk to bitcoin and any other PoW coin out there",2020-07-08 07:34:04
fx9qeg4,Winkerisfat,6,"was wondering why dogecoin was mooning while bitcoin was basically flat.

went on stocktwits

top trending search: dogecoin

someone started a dogecoin tiktok challenge. tik tokers encouraged to buy $25 of dogecoin, sell when it hits a dollar and make $10,000",2020-07-08 10:53:36
fx8ynyr,LeCrushinator,6,"If I had a time machine I'd just invest in Apple when the stock was below $1, and then bitcoin when it was first released (and then dump it all at the right time).",2020-07-08 06:37:12
fx9f4je,chris211602,6,"I thought about that too and I don’t have much knowledge when it comes to crypto but I heard that bitcoin is a tier 1 cryptocurrency and can actually be used widely on various platforms including amazon. But dogecoin, as far as I understand, is a tier 2 crypto and is more of a meme although it do can be used as a form of exchanging money. So idk I’d say it’d make no sense for people with bitcoin to ditch and hop on the doge train. I may be completely wrong, and please someone correct me if what I have wrote above is incorrect.",2020-07-08 09:02:56
fx9qmto,Tiaan,6,"I don't do TA or anything like that. This just my observation. Stocks and gold have been mooning. Now random altcoins like VeChain, Link, Cardano, Doge etc have been mooning. The bitcoin halving was earlier this year and bitcoin price is still below what it was back in Feb pre covid. It's been consolidating in the 9k-10k range for months now. It just feels like the odd one out atm with everything else mooning - I honestly wouldn't be surprised to see it 2x by the end of the year.",2020-07-08 10:55:53
fx9rk1o,Bushmage,6,why do people care so much about what bitcoin maxi's do or say? Even people I really respect within this community just can't seem to get over bashing bitcoin maxi's regardless of how silly or hypocritical they sound. What does any of that actually contribute to Ethereum?,2020-07-08 11:05:06
fx8yq1b,Boly_13,6,NMTs = Bitcoin,2020-07-08 06:37:41
fx9ukod,karmanopoly,6,"If you are a bitcoin Maxie only holding btc right now all these other coins jumping

![gif](giphy|KBaxHrT7rkeW5ma77z)",2020-07-08 11:35:01
fx9jadg,sleepdeprivedindian,5,"Man, you guys are really trying hard to put him in good light. Also, giving too much credit for his contribution to bitcoin. He has given a lot more negative publicity and steered people away from Bitcoin than what could have been. Still a lot of people associate bitcoin with underworld, drugs etc.",2020-07-08 09:43:10
fx8pzka,mrtest001,5,naw r/btc was and is a bitcoin subreddit.  the only difference to r/bitcoin is really that it is uncensored.  If r/bitcoin was uncensored people would be talking about bitcoin there too.,2020-07-08 05:26:40
fx9nx44,Dani_Is_Gagged,5,Buy Bitcoin when you're 21!!,2020-07-08 10:28:59
fx9v2mk,KBrot,5,"To summarize my thoughts... BTC is to ETH what banks are to BTC.

At first, we wanted them to join us. In fact, many did. ETH was initially funded via BTC.

Then, we pitied them. Ethereum is simply better tech in every single way.

Now, we are angry with them. They have a ton of money, which equals power, and they are holding us back from the future.

In short, Bitcoin lived long enough to become the villain.

note: Plenty of people are invested in both. It's not totally black and white. But this is my general theory.",2020-07-08 11:39:54
fx9qy1t,banetrex,5,I Don't think r/bitcoin will ever stop reeeing,2020-07-08 10:59:02
fx9ajtx,gotbannedagain__,5,"there's plenty of people who call out blockstream on their scam. the reason you don't see them on r/bitcoin is because they get banned instantly. r/bitcoin is not a representation of bitcoin holders, it's just whatever agenda makes most money for blockstream",2020-07-08 08:20:48
fx8nyqw,ojjordan78,5,"&gt;Seriously though, who does /u/Bitcoin_Error_Log think he is?

Bitcoin thot leader wannabe, when people like Roger Ver were promoting bitcoin all over the globe this sissy little man was in his mama's basement jerking off.",2020-07-08 05:10:09
fx9j9bq,nanslayer9,5,Buy bitcoin,2020-07-08 09:42:53
fx87lbn,spboss91,5,"Soo I sold 100,000 link in 2017 for a small profit.. now I'm the 2020 version of bitcoin pizza guy?",2020-07-08 03:01:35
fx9d18l,HarryZKE,5,It would be funny if whales tried to liquidate WBTC cdp positions and had to crash the spot price of Bitcoin to do it,2020-07-08 08:43:33
fx9qtix,Marshosaurus,5,"YW remember you are your own bank, save your passphrase written on paper (airgapped) in multiple locations, trust no one, “not your keys not your coins”, listen to some basic crypto podcasts ( the Cardano Effect, What Bitcoin Did had a good but long starter series at the start of this year, CryptoBasic episode 239 shows some pitfalls)",2020-07-08 10:57:45
fx9cio7,Rhader,4,"Is the WBTC maker cdp limit already hit? Massive demand to use btc on eth as collateral. I hope renBTC/tBTC work out. So far so good, but only time can give me confidence to put my hard earned Bitcoin into those protocols. Probably about 1-2 years of time",2020-07-08 08:38:50
fx830d7,K_tty,4,"Panels are almost exactly the same, except the titles of the articles are, in order:    
- Bitcoin hits $1,000    
- Bitcoin crashes to $10,000    
- Bitcoin PLUMMETS to just $100,000

It's one of his normie comics supporting bitcoin.",2020-07-08 02:26:07
fxd4ypy,S_Napster,23,Usually its done with bitcoin though.,2020-07-09 07:55:34
fxcvw36,PerpetualCamel,13,"@danheld on Twitter:

&gt;Crypto narratives: 

&gt;2014 - Year of the alt coin

&gt;2015 - Year of the smart contract platform

&gt;2017 - Year of the ICO

&gt;2018 - Year of the stable coin

&gt;2019 - Year of the bank coin

&gt;2020 - Year of DeFi 

&gt;Trends come and go, ₿itcoin doesn't.

Does anyone else here see this as a list of bullish trends that have made a ton of notability and money for the crypto community? And for some reason it's tied to bitcoin, and not Ethereum, the only thing that made all of that development possible.",2020-07-09 06:39:39
fxd5h3g,DCinvestor,13,"I certainly don't have faith in his analytic / critical thinking skills.

Instead, I have faith in the fact that he's abandoned his Bitcoin Maximalism. Evidence that it’s a dying religion.",2020-07-09 08:00:02
fxcwc9f,DCinvestor,12,"Qiao's response was the best:  [https://twitter.com/QWQiao/status/1280879250061570053](https://twitter.com/QWQiao/status/1280879250061570053)

&gt;If you ignore the noise and listen closely, every single one of these narratives happened because of Ethereum. And there’s a fundamental reason behind it. Ethereum enables creativity.  
&gt;  
&gt;I love Bitcoin. But it doesn’t mean everything else is shit.",2020-07-09 06:43:19
fxdjomq,plausibleyetunlikely,11,"No one says Las Vegas lures young gamblers, sometimes with devastating results, because we all know the odds. 

The same is true of the market. 

I remember on these subs (and r/personalfinance) when crypto was peaking there were all these posts of people saying, “I just bought $40k worth of Bitcoin and it’s already worth $200k!”

A couple of months later there were a bunch of posts like, “Don’t judge. I lost everything in the Bitcoin collapse. How do I file bankruptcy? I just need to know the process.”",2020-07-09 10:13:16
fxcycbk,inspiredcrypto,10,He's calling everything in crypto except Bitcoin a fad. That's a bit sophistic considering ETH has been going from strength to strength since its inception.,2020-07-09 06:59:34
fxd015j,SeaMonkey82,10,"&gt; ~~Trends come and go, ₿itcoin doesn't.~~  

""New use cases for Ethereum keep coming and coming.  Bitcoin stays the same.""

There.  Fixed it.",2020-07-09 07:13:28
fxdnruu,4rr4y,10,"I wouldn't change what I have done, wisdom is built from fun stuff too :) For example, my friends and I joined a chain of 500 rubber bands for a catapult to launch paper balls at a bee nest and spend the next 4 hours hiding in the computer lab beside as bees are everywhere. Sure it was very dumb and not right to do that, but you don't forget these things as part of growing up\~

I would also tell my younger self to buy bitcoin and not put money in a piggy bank.",2020-07-09 10:52:28
fxd83s9,ChronicAbuse420,9,"It’s conspiracy level crazy, but if they really REALLY wanted to, maybe they could track the bitcoin to the purchase and look for cameras in the area and use facial recognition software? Crazy unlikely but big brother is getting bigger and stronger everyday.",2020-07-09 08:23:40
fxcxx7f,drkstlth01,9,Didn't ppl used to get that from the dark web using bitcoin?,2020-07-09 06:56:10
fxcwb74,decibels42,9,"Also, none of those “trends” disappear. They just get added to the list of use cases for Ethereum.

To the person who asked recently why people call out Bitcoin maxis, this is another example. They’ll pick and choose the narrative they want to spin. They’ll adopt “stablecoins” or “DeFi” as great use cases of “blockchain” when it supports the Bitcoin narrative, but also cite those things as “trends” when they want to act like Bitcoin is and always will be the one true coin.",2020-07-09 06:43:05
fxcjc33,YangGangBangarang,8,"Ethereum is a gateway drug. Was Bitcoin only for 6 months, got Ethereum a week ago, now I have Cardano and Kyber also",2020-07-09 04:59:18
fxcomrl,LittleSpanishGuy,8,Are you playing against Bitcoin or Biteun? Make your mind up,2020-07-09 05:41:32
fxcvy6b,fan_of_hakiksexydays,8,"After having lost so much money to several failed ""promising"" shit coins, it's nice to see my $1.80 Chainlinks at $6.

It's nice to have a big win for once. But overall in shit coins I'm still deep in the red. Luckily Bitcoin, ETH, and Cardano put my overall portfolio in the green.",2020-07-09 06:40:07
fxc403b,djfc,8,"So I'll let the community chime in, but here's just my perspective.

The lack of price action (bart) to me is something good - as it stabilizes price action (the bbands and volatility). Bitcoin being Bitcoin, doesn't like it. It's like trying to keep a kitten inside a pen for a long time, after a while it'll figure its way out.

That movement out of this 9k-10k is what the entire trading community is waiting for. So yes, I do think something is going to happen to get us above or below.

The majority of sentiment that I've seen is that if it goes down, it'll follow fib levels as low as $6000something, to something above $10500.

If it breaks $8800, I expect a lot of traders to buy the dip, and investors to buy as well. The further the dip, the more action as people scoop up bitcoin at a ""discount"", with the sentiment being ""anything below $10k is good in the long term"".

If it breaks $10500, you'll see FOMO hit and people jump in resulting in a wild ride.

The elephant in the room is the Fed - specifically liquidity/inflation/etc... 

Personally, I think we're going to see higher highs in the equities markets since Trump wants to get reelected, and after the recession I feel like the crash will happen.

Would love to hear what others here are thinking.

(I wish I was in the USA so I could use robinhood.. y'all is so lucky)",2020-07-09 02:59:36
fxcu97z,queensaly,7,Everyone who sold their Bitcoin years ago HATES themselves. Just saying bro,2020-07-09 06:26:30
fxcymiy,PerpetualCamel,7,"I don't even think it's exaggeration to say that since 2014 every notable thing in crypto has been because of Ethereum. It's even debatable that the ICO craze is what allowed bitcoin to surpass its ATH in the first place. As far as I'm concerned, crypto as we know it is built on the back of ETH, but BTC wears the ribbon.",2020-07-09 07:01:52
fxdojyv,Newez,7,Save up as much as you can - and around 2009 when you come across this commodity hype termed Bitcoin- invest all your money in it.,2020-07-09 10:59:52
fxchxfo,Mr-Zwets,6,"""her last post was about someone mysteriously sending almost $1 billion in bitcoin on Wednesday, June 30, 2020.""",2020-07-09 04:48:10
fxd5v2b,drlolbl,6,It would probably be done with a untraceable currency like bitcoin,2020-07-09 08:03:27
fxc2uwv,auspiciousham,6,"Tesla, Uber, Netflix, WeWork, etc etc are extremely overvalued.  You have two choices though: be a shareholder or not.  If you want to be one you pay the market demand, as more people see value in the tech the more people want in the more the price naturally moves up.  Investments are extremely decoupled from actual earnings at this point in history.  You can either stand on the sidelines or try to make money off of it.  It's all gambling, may as well consider repeating history and fomo taking things to unreasonable prices.  Look at bitcoin - it's basically ONLY a trading instrument.  Nobody actually uses that garbage in society and likely never will.  Still has a market cap of 175b",2020-07-09 02:50:49
fxcjg97,NPerez99,6,In before Bitcoin crowd gets here.,2020-07-09 05:00:12
fxcii7d,Masontron,6,It’s true. Everybody thought bitcoin was a joke and then people kicked themselves in the ass for not investing. I’m 100% holding no matter what even if I lose money. Rather lose $300 than miss out on thousands,2020-07-09 04:52:42
fxcyb28,TangledWilderness,5,"Bitcoin is easy to trace, it’s difficult to figure out who owns any given wallet.",2020-07-09 06:59:18
fxcoxhb,LuckyLootz,5,It's a very long time for me. Im not touching a vet until the end of the next bitcoin bull cycle.,2020-07-09 05:43:57
fxczx8h,Naviers_Stoked,5,"Yep. The problem is he's made Bitcoin maximalism part of his identity. He's not worried about making rational/profitable/better decisions, he's worried about being ""right"" and ""knowing"" from the beginning. He's looking to farm clout, and he's all-in on it.",2020-07-09 07:12:34
fxd7pf9,myshoesarebrown,5,They're gambling. They're not ready for Bitcoin.,2020-07-09 08:20:01
fxdhwl5,CaptJimmyJews,5,"when bitcoin was at like 20,000 doge was at 2 cents, its not hitting a dollar, I just wanna see it hit a cent",2020-07-09 09:56:20
fxca3d1,drrgrr123,5,You are buying a Robinhood product that follows the price of Bitcoin. It's not Bitcoin unfortunately.,2020-07-09 03:46:33
fxdxu88,wtfbro_,5,I also heard you can find free bitcoin at the end of rainbows.,2020-07-09 12:32:32
fxgu9ry,poorly_timed_leg0las,43,"Lol nowhere near. Theres so many shit coins these days. Just printing money for a small group. The idea behind bitcoin is dead. It was taken over a long time ago.

Dont even get me started on the exchanges. My god ill have a fucking aneurysm. Imagine if you put something on ebay then immediately someone put 100 x your item cheaper. Unless you have bots running your being played if not by other people then the actual exchange is fucking with the prices and amounts that are for sale.

Then them faking volume/trades and moving prices to the same as other exchanges whilst arbitrage trading.

ICO - initial coin offerings. Exchanges be like ""oh heres a coin with no miners or value"" let's make it up and promise to pay you when we get the coins. Bunch of suckers.",2020-07-10 06:46:25
fxgwfhh,lachryma,14,"""Crypto is the future! Don't mind the infighting between every single crypto camp that has literally ever existed! Bitcoin $variant is the only true Bitcoin!""

What is it about crypto that puts people at odds like this? It's baffling to me. It's a good idea with seemingly terrible politics, speaking as an outsider. Even your comment is a pretty good lens into what I'm saying -- not going after you, just a broader observation.",2020-07-10 07:04:26
fxh5f7p,LiveLaughHodl,12,"Daily Reminder: At most, there will only ever be roughly &lt;3.5M ethereum validators.

That's \~6x more digitally scarce than Bitcoin. How many people do you know with 6 Bitcoin?",2020-07-10 08:23:13
fxgoaez,punos_de_piedra,11,I keep the plants inside Bitcoin mining servers.,2020-07-10 05:57:28
fxghlra,ChaosElephant,10,"On October 23, 2014, [Blockstream goes public](https://blockstream.com/2014/10/23/why-we-are-co-founders-of-blockstream.html) and announces funding and the formation of their company. Shortly after Blockstream was [incorporated](https://archive.is/qzsVe), they received [$50 million](https://www.crunchbase.com/funding_round/blockstream-series-unknown--66d2817a#section-investors) in venture capital from AXA, Khosla Ventures, Horizon Ventures, etc., some of the most powerful venture firms in the world. The [Blockstream board of directors](https://np.reddit.com/r/btc/comments/7kflur/anybody_ever_find_anything_interesting_in_these/dre1508/) are all bankers.

In the Summer of 2015, all of the primary Bitcoin communities such as /r/Bitcoin, mailing lists, Bitcoin Talk, wikis, etc., began [massive censorship campaigns](https://medium.com/@johnblocke/a-brief-and-incomplete-history-of-censorship-in-r-bitcoin-c85a290fe43) against any and all topics that had to do with scaling Bitcoin beyond the 1MB limit which, by the way, was temporarily added by Satoshi Nakamoto back in 2010 as a stop-gap measure to prevent spam in the early days.

The Bitcoin name and repository were hijacked by a for-profit organisation so they could make a buck on their own patented and convoluted ""solution"" for a problem that doen't even exist (in fact; they themselves created it). In this process, Bitcoin (BTC) was turned into an altcoin by implementing SegWit (the coin itself is no longer a “chain of digital signatures,” as per Fig. 1 of the white paper).

Luckily, Bitcoin as described in the whitepaper by it's inventor Satoshi Nakamoto continues to exist under the name Bitcoin Cash before BTC forked off with SegWit. It uses the superior scaling solution as described by Satoshi and keeps all transactions Peer-to-Peer on the blockchain.

TLDR: [Blockstream fucked Bitcoin over](https://youtu.be/jctc85X_PCI?t=79) and r/Bitcoin bans people talking about it.

bonus: [Why Some People Call Bitcoin Cash ‘bcash’. This Will Be Shocking to New Readers.](https://medium.com/@jonaldfyookball/why-some-people-call-bitcoin-cash-bcash-this-will-be-shocking-to-new-readers-956558da12fb)",2020-07-10 05:03:51
fxhlfjq,tuesdayrain,10,"&gt;Bitcoin Is Your Antidote Against the Cantillon Effect

Turns out it was actually AAPL and AMZN stocks",2020-07-10 10:58:18
fxgr4d0,ecosystems,10,Jokes on you thats just my BiTcOiN mIniNg riG officer,2020-07-10 06:20:30
fxh1wx5,BlackSpidy,9,Shush. Bitcoin can't perform while everyone's looking.,2020-07-10 07:51:41
fxhrq5r,Nickppapagiorgio,8,"Because it's incredibly volatile, which makes it not very useful as a currency, because you'd have to constantly adjust your prices, and you'd have no assurance that the BitCoin you got from a customer a week ago will still hold even close to that value.

Also, r/buttcoin",2020-07-10 12:01:26
fxg3afb,cryptogrip,8,"Trading, short term, it's all over the place. Long term, with the signs of infrastructure and growth popping up left right and centre, how could anyone realistically NOT be bullish on Bitcoin?",2020-07-10 03:11:39
fxgg1k7,500239,7,By declaring a congested coin a feature. By applying scaling approaches that don't work as advertised which are still broken to this day and calling it a victory. By influencing the majority of Bitcoin Core influencers to keep Bitcoin in this state. By removing all the major big block supporters from Bitcoin Core. By promoting credit cards over using Bitcoin as money.,2020-07-10 04:51:29
fxhw3ss,Hoogstaav,7,"Neat, let's accelerate climate change even more in the pursuit of internet funbuxx.  Crypto is an ecological disaster and a shitty ~~currency~~ ~~store of value~~ speculative asset.

https://digiconomist.net/bitcoin-energy-consumption",2020-07-10 12:47:45
fxgqzja,Podcastsandpot,7,"nano, monero, bitcoin. nothing else seems to have any real value or usability.",2020-07-10 06:19:25
fxh8jdp,nanooverbtc,7,[The Cantillon Effect](https://medium.com/in-bitcoin-we-trust/bitcoin-is-your-antidote-against-the-cantillon-effect-fbd2f7e81cf2),2020-07-10 08:51:46
fxh63ej,JPMontoyaAndChase,6,"Bitcoin? More like bitchcoin

Got em",2020-07-10 08:29:17
fxfuo28,irukandjie,6,"lol, its a 200 dollar correction bro, that's heaven sent in bitcoin",2020-07-10 02:05:22
fxgjz82,tandoori_sizzler,6,"Gambling ruined your life, not Bitcoin. Like someone else said, you should be telling this story to a professional therapist, not reddit. Really hope you get the help you need, for what it's worth, there are a lot of people out there who have come back from a lot worse.",2020-07-10 05:22:32
fxgbgyt,jsebean,5,"I'd argue csgo is in the same arena. Unless you have bad trust, I rarely encounter a blatant cheater at all.

Now perhaps there are players really good at hiding it. So good in fact, that they play like normal players and are so unnoticeable that it doesn't apparently affect your win rate at your skill level. In which case, even if people are ""cheating"" like that, does it even matter?

Now perhaps it's not as effective at higher skill levels, I'm only a casual player. But for people who insist on client side anticheat can play faceit or Bitcoin mining ESEA (barf). At least it's a choice and has no effect on players who don't want their software freedoms and privacy so blatantly violated.",2020-07-10 04:15:23
fxhrst1,Iwannaplay_,5,Because they know bitcoin is fraud.,2020-07-10 12:02:11
fxgpi9t,Railionn,5,"Does anyone feel like on longer time frames everything just falls in place? The long term charts say we have our run up to 100k starting next year with ath around end 2021. Makes perfectly sense given the world is weird right now, people are focused on stocks more now. when everything settles (2021) the eyes turn to bitcoin.

Idk, just rambling here. What i'm trying to say is, if bitcoin was developed a year earlier, rising to ath this year would make me think that it wouldn't be the best time because of all the other stuff going on.

yeah rambling",2020-07-10 06:07:24
fxgrbq6,namecopy101,5," Jeff is the Founder and CEO of Uptrennd, the world’s most engaged blockchain-based social media platform. He is the host of The Bitcoin and Crypto Podcast, and runs the worlds most engaged FB crypto group.  - That in itself was what got me in.",2020-07-10 06:22:11
fxgxi1d,Excal2,5,"&gt;What is it about crypto that puts people at odds like this?

Basically the people at the top  of the crypto pyramid, for years, pumped and dumped bitcoin alternately with other cryptocurrencies. I've heard them referred  to as  ""seasons"" as in ""it's bitcoin season"" which means bitcoin is getting juiced before a massive sell off and reinvestment into an alt-coin like Monero. The alt-coin of choice would change season to season, but a given alt-coin's community would take their pump season as evidence that they were superior to all other alt-coins.

""One coin to rule them all"" kind of thinking, because if you were in on the right coin that managed to survive long term (this never happened because once the  pump was done all the money was moved back to the now reduced-price bitcoin) then you'd be  one of the next cryptocurrency millionaires that totally exist all over the place and it's so easy dude your computer does all the work why would you *not* be doing this?!

The people at the bottom of the pyramid thus became very  competitive  and political with one another based on what season it was and what coins were doing well, this was especially prevalent for  communities whose coins managed to kinda survive the dump at the end of a season and become actually self-sustaining  for a period of time like Monero.

As a casual observer this is what I've picked up, very much open to corrections  on this.",2020-07-10 07:13:33
fxh7oaj,Epicurses,5,"You claim there is no true libertarian nation, yet you are choosing not to post this hot take from a bitcoin-financed penthouse in Mogadishu. 

Curious.

*Mohamed Farrah Aidid*

*Founder, Turning Point Somalia*",2020-07-10 08:43:44
fxhei7s,originfoomanchu,5,"If you have gone sli in the last 5 years for anything other than rendering/bitcoin mining,

You are an idiot and just wasting money.",2020-07-10 09:49:35
fxgbt2i,monkeydoodle64,4,Hmm yeah. If everything goes up... bitcoin goes up. Genius.,2020-07-10 04:18:03
fxh76o8,DoctorReinhardt,4,"Be wary since bitcoin can not be reversed once sent
Also OP you got time stamps?",2020-07-10 08:39:11
fxgk6xx,kinakomochidayo,4,"You're so spot on, it hurts. While I was harping about how great ETH is back in 2018, my friend in real life essentially got burned buying shitcoins like EOS and such, and then he was 'awakened' by Bitcoin. I did the best I can as a person who got into Bitcoin in 2013 and saw the shitshow that happened in 2017, to convince him that Bitcoin got taken over by powerful corporate interests before he got into it. Didn't work at all. In fact, feeling pessimistic after hearing me talk, he talked to his toxic maximalist friends in real life, and doubled down on how the current core devs are incredibly smart. It's incredibly disappointing as he's relatively smart software engineer, but can't see through the human bullshit and groupthink.

I guess it's that black and white thinking. Gotta see things in shades.",2020-07-10 05:24:14
