Comment ID,Author,Score,Body,Publish Date
fz11tus,SwagtimusPrime,37,"https://usa.visa.com/visa-everywhere/blog/bdp/2020/07/21/advancing-our-approach-1595302085970.html

Are you guys reading this? Because you should.

Guess where all the stablecoins are at? DING DING DING that's a bingo. They're on Ethereum.

Doesn't get more bullish than this.

Edit: I also love how they mentioned Bitcoin like the prototype that it is and then quickly moved on to the interesting stuff like stablecoins. Lol.",2020-07-24 07:26:14
fz0x07q,steuer2teuer,37,"For the people reading this and thinking Bakkt is dead.. this is not the case. The article talks about Options, while the main aspect of Bakkt are its Futures. Check out the Bakkt Volume Bot to see how it's going. Nothing spectacular but what do you expect in times of price going sideways. 

https://twitter.com/BakktBot

Bitcoin Options are almost exclusively traded on Deribit (as stated in the article).",2020-07-24 06:46:03
fyzll6m,TheWillDudley,35,"in 2017 he said bitcoin could be worth 100k in 3-4 years, likes commenting on hype trains. [cnbc link](https://www.cnbc.com/2017/12/12/social-capitals-palihapitiya-says-bitcoin-is-going-to-1-million-in-the-next-20-years.html)",2020-07-24 00:34:28
fz27fox,mandingob,35,"MARA - Bitcoin miming company that will move with bitcoin price. They had a offering so you might be able to get a good entry. Was killing it the past few days reaching 1.10-1.20 current price Is .99 but offering was announced a couple hours ago but volume today might’ve been enough to fill the offer. May open around .90 which would be a great swing to $1-1.20.

CHEK - Coming hot off à warrants offering unfortunately the market has a aneurism near the end of the market which fuxked up all the momentum this baby was gaining. Will probably retest the .62-.63 area tomorrow and hopefully get back to .64 then continue climbing.

BKYI - Offering closed should see a nice spike and volume increase as more people start buying back in.

Good night see y’all in the morning",2020-07-24 14:04:19
fz09tkh,jtoomim,35,"No, [my version uses fixed-point math](https://gitlab.com/freetrader/bitcoin-cash-node/-/blob/daa/aserti3-wip/src/pow.cpp#L113) too.

His version uses a relative definition (which is susceptible to the accumulation of approximation error, and which requires clients to examine at least one more block header when computing the difficulty), and attempts to negate historical drift. His version also uses chainwork, which seems unnecessary, and maybe a bit superstitious. It also includes clipping, which is risky, as it can allow for infinite block attacks if done poorly.",2020-07-24 03:41:49
fz3dfk6,SamsungGalaxyPlayer,33,"Peter McCormack:

&gt; In some ways, in the world of Bitcoin versus altcoins, Monero is the most credible one that you could add to your listing.",2020-07-24 23:28:25
fz0m9pf,MobTwo,32,I don't know why Bitcoin ABC is doing this to themselves over and over again.,2020-07-24 05:18:04
fz0ml2k,jtoomim,31,"I did not send them a link and say, ""I hereby submit this code for review."" Instead, when they complained about not having code to review, I sent them a link and said:

&gt; if you want to peek at the code, freetrader's branch seems to be the most up-to-date most of the time

&gt; https://gitlab.com/freetrader/bitcoin-cash-node/-/commits/daa/aserti3-wip

&gt; you're also welcome to join the bchn slack. most of this is in channel #code-reviews, but some of it also has gotten scattered into different channels

They appear to have done neither of those two things. Instead of clicking on a link to existing code, and maybe copy-pasting code over, they preferred to write their own incompatible implementation.",2020-07-24 05:20:35
fz2f9e1,etherbie,31,I’d be okay with bitcoin staying where it is whilst we reclaim 0.1.,2020-07-24 15:48:48
fz5i8e7,PM_ME_FIREFLY_QUOTES,227,Buy Bitcoin and hodl,2020-07-25 10:12:36
fz5ycbg,RondyDoneDidit,190,Sometimes when I’m talking about bitcoin I start shaking uncontrollably and my head spins around in circles and I get down on all fours and start crawling up the wall and on the ceiling making high pitches noises and spitting like a llama,2020-07-25 12:58:12
fz4oni0,j0j0r0,143,"## Dragonchain TL;DR;

Dragonchain has demonstrated **twice Reddit’s entire total daily volume (votes, comments, and posts** [**per Reddit 2019 Year in Review**](https://redditblog.com/2019/12/04/reddits-2019-year-in-review/)**)** in a [24-hour demo](https://youtu.be/pSfBid1_US4) on an operational network.  Every single transaction on Dragonchain is decentralized immediately through 5 levels of Dragon Net, and then secured with combined proof on **Bitcoin**, **Ethereum**, **Ethereum Classic**, and **Binance Chain**, via Interchain. At the time, in January 2020, the entire cost of the demo was approximately $25K on a single system (transaction fees locked at $0.0001/txn). With current fees (lowest fee $0.0000025/txn), this would cost as little as $625.

If you’d like to read the full proposal with formatting go to the [Dragonchain blog](https://dragonchain.com/blog/reddit-ethereum-blockchain-scalability).

## Hello Reddit and Ethereum community!

I’m Joe Roets, Founder &amp; CEO of Dragonchain. When the team and I first heard about The Great Reddit Scaling Bake-Off we were intrigued. We believe we have the solutions Reddit seeks for its community points system and we have them at scale.

For your consideration, we have submitted our proposal below. The team at Dragonchain and I welcome and look forward to your technical questions, philosophical feedback, and fair criticism, to build a scaling solution for Reddit that will empower its users. Because our architecture is unlike other blockchain platforms out there today, we expect to receive many questions while people try to grasp our project. I will personally answer all questions across two locations. First, I will be live on a special episode of Super Happy Dragon Lucky, Tuesday, July 28th at **6PM EST** where I will answer questions. I will then answer all questions here in this thread on Reddit.

We have seen good discussions so far in the competition. We hope that Reddit’s scaling solution will emerge from The Great Reddit Scaling Bake-Off and that Reddit will have great success with the implementation.

[Turn on notifications if you’d like to be reminded about the livestream](https://www.youtube.com/channel/UC2_StJYNWFrQz2wiL8n6hoA)

## Executive summary

Dragonchain is a robust open source hybrid blockchain platform that has proven to withstand the passing of time since our inception in 2014. We have continued to evolve to harness the scalability of private nodes, yet take full advantage of the security of public decentralized networks, like Ethereum. We have a live, operational, and fully functional Interchain network integrating Bitcoin, Ethereum, Ethereum Classic, and \~700 independent Dragonchain nodes. Every transaction is secured to Ethereum, Bitcoin, and Ethereum Classic. Transactions are immediately usable on chain, and the first decentralization is seen within 20 seconds on Dragon Net. Security increases further to public networks ETH, BTC, and ETC within 10 minutes to 2 hours.

Smart contracts can be written in any executable language, offering full freedom to existing developers. We invite any developer to watch the demo, play with our SDK’s, review open source code, and to help us move forward. Dragonchain specializes in scalable loyalty &amp; rewards solutions and has built a decentralized social network on chain, with very affordable transaction costs. This experience can be combined with the insights Reddit and the Ethereum community have gained in the past couple of months to roll out the solution at a rapid pace.

## Response and PoC

In *The Great Reddit Scaling Bake-Off* post, Reddit has asked for a series of demonstrations, requirements, and other considerations. In this section, we will attempt to answer all of these requests.

## Live Demo

&gt;A live proof of concept showing hundreds of thousands of transactions

On Jan 7, 2020, Dragonchain hosted a 24-hour live demonstration during which a quarter of a billion (250 million+) transactions executed fully on an operational network. **Every single transaction** on Dragonchain is decentralized immediately through 5 levels of Dragon Net, and then secured with **combined proof** on **Bitcoin**, **Ethereum**, **Ethereum Classic**, and **Binance Chain**, via Interchain. This means that every single transaction is secured by, and traceable to these networks. An attack on this system would require a simultaneous attack on all of the Interchained networks.

**24 hours in 4 minutes:** [**https://youtu.be/pSfBid1\_US4**](https://youtu.be/pSfBid1_US4)

The demonstration was of a single business system, and any user is able to scale this further, by running multiple systems simultaneously. Our goals for the event were to demonstrate a consistent capacity greater than that of Visa over an extended time period.

Tooling to reproduce our demo is available here:

[https://github.com/dragonchain/spirit-bomb](https://github.com/dragonchain/spirit-bomb)

## Source Code

&gt;Source code (for on &amp; off-chain components as well tooling used for the PoC). The source code does not have to be shared publicly, but if Reddit decides to use a particular solution it will need to be shared with Reddit at some point.

* [Dragonchain Core](https://github.com/dragonchain/dragonchain)
* [Tooling for demonstration](https://github.com/dragonchain/spirit-bomb)
* [Dragonchain Github](https://github.com/dragonchain/)

## Scaling

&gt;How it works &amp; scales

## Architectural Scaling

Dragonchain’s architecture attacks the scalability issue from multiple angles. Dragonchain is a hybrid blockchain platform, wherein every transaction is protected on a business node to the requirements of that business or purpose. A business node may be held completely private or may be exposed or replicated to any level of exposure desired.

Every node has its own blockchain and is independently scalable. Dragonchain established *Context Based Verification* as its consensus model. Every transaction is immediately usable on a trust basis, and in time is provable to an increasing level of decentralized consensus. A transaction will have a level of decentralization to independently owned and deployed Dragonchain nodes (\~700 nodes) within seconds, and full decentralization to BTC and ETH within minutes or hours. Level 5 nodes (Interchain nodes) function to secure all transactions to public or otherwise external chains such as Bitcoin and Ethereum. These nodes scale the system by aggregating multiple blocks into a single Interchain transaction on a cadence. This timing is configurable based upon average fees for each respective chain.

For detailed information about Dragonchain’s architecture, and *Context Based Verification*, please refer to the [Dragonchain Architecture Document](https://dragonchain.com/Dragonchain-Architecture.pdf).",2020-07-25 05:45:26
fz5ifor,Frednn,93,"Every 10 minutes a new block is mined. The reward for every new block right now is 6.25 BTC ( plus the transaction fees)

To be able to mine 1 BTC every 10 minutes ( 144 BTC / day) , means you should be able to calculate around 22,000,000 Tera hashes per second, or 22,000 peta hashes per second.


That translates to roughly 200,000 antminer S19 units. Each costing at around 2,000 usd. Which is about 400,000,000 usd in mining hardware alone.

Don't forget electricity ! Each unit consumes around 3250 Watts of power just to operate. Running such a huge scale farms needs about 650 MWh of energy !!!


Soooo ... Yeah.

No single person is mining 1 BTC every 10 minutes. Mining Bitcoin is hard. It's deliberately that way to make it a scarce asset. 


People nowadays gather around in virtual groups called "" mining pools "" , and combine their computational power to mine a block. Then they share the reward among pool members based on computational power each member provides.


Ps . Numbers calculations might be off a bit. I didn't double check them, but you get what i wanted to say.",2020-07-25 10:14:32
fz77sk9,Did_I_Die,74,how will Bitcoin work in a world without a working electric infrastructure?,2020-07-25 23:48:23
fz5unlg,screechplank,62,I wonder how many computers they have mining bitcoin?,2020-07-25 12:17:51
fz3snx1,CryptoStarMaps,62,bitcoin is unstoppable now.  To $4k we gooo!,2020-07-25 01:33:18
fz4tszp,Fresh_Body,59,"Let me ask you another question that might help you. What else are you going to invest in? 

T-bills? Nope

Bonds? Nope

A savings account? Get left on the sideline either way.

Gold? Maybe

Bitcoin? China is trying to ban it, and government regulation could wipe it out overnight, but the collapse of the dollar would make it soar. The highest risk/reward you could choose.

Individual stocks? What companies have more cash to weather the storm and have whole generations of cult-like fans and reliant businesses that will use their products/services?

Market index? Smartest most of the time.",2020-07-25 06:28:06
fz64eow,ExMoFojo,53,"Have you dug around online?  I was able to order tabs of 1p-lsd really easily with Bitcoin.  It's not anything too crazy I don't think.  Dmt and ketamine are real easy to order as well.  The site I used (it's gone now, but there are others) even posted independent lab results so you knew what you were getting.",2020-07-25 14:10:48
fz62off,Michaelwaisjr,52,[Bitcoin 2030](https://i.dailymail.co.uk/1s/2018/10/12/08/4979650-0-Christian_Bale_looked_completely_unrecognisable_as_he_showed_off-a-27_1539330645616.jpg),2020-07-25 13:49:11
fz6xuxf,dEBRUYNE_1,49,"Coinbase is basically the largest exchange with proper fiat on-ramps and would therefore be a great addition to the Monero ecosystem. A listing would significantly increase liquidity as well as improve ease of access. Furthermore, it would signal and confirm that Monero is not incongruent with incumbent compliance and regulatory policies.

&gt;Having Monero on coinbase will definitely pump the price

Whether we like it or not, price draws attention and is a decent method to advertise a currency. Furthermore, a larger market cap arguably leads to ecosystem growth, which will ultimately benefit all stakeholders. 

&gt;If you use Coinbase, you can be certain that all your information will be shared with shady companies and governative agencies

I think it is unreasonable to expect that this information ultimately won't be shared. The Common Reporting Standard (CRS) has been in place for several years now and one can reasonably expect for it to also apply to cryptocurrency companies in the foreseeable future. 

https://en.wikipedia.org/wiki/Common_Reporting_Standard

Using Monero is actually beneficial here, as it limits the amount of information that can be shared. Essentially, the only information shared is information related to the account at the exchange, as Monero protects the user from the exchange following transactions going forward. Brian Armstrong uses a similar line of reasoning in the What Bitcoin Did podcast:

&gt; Peter Mccormack: Are you worried about the data stored by Coinbase if the government were to become more authoritarian?

&gt;Brian Armstrong: We need to make this a technological solution, something where it can't be tracked, where you don't have to trust Coinbase. In some ways that's a more crypto-native solution. 

**Source:** https://twitter.com/sethisimmons/status/1286753615185678338

&gt;I would never suggest a Monero user to join coinbase, not when i'm aware of the fact that i would be endangering this person's privacy with my suggestion.

Signing up for any centralized exchange with mandatory KYC/AML is a privacy trade-off basically insofar as one has to share personal data in order to get account approval. However, centralized exchanges typically have significantly better liquidity and are way easier to use. We essentially need them in order for the ecosystem to be able to grow. Besides, I don't think we can expect for (i) the average Joe to use a decentralized exchange, which typically require technical competence to use and (ii) centralized exchanges being able to operate without mandatory KYC/AML (at least for higher sums) in the current regulatory climate.

&gt;I don't want Monero to be listed on Coinbase

You basically list reasons for why one should not use Coinbase, not why it would be a net negative for Monero the cryptocurrency. I've said this before, not trying to get as many listings as possible for Monero would basically be shooting ourselves in the foot.",2020-07-25 21:56:11
fz5rjct,Deathspiral222,46,"I'm going to give you exactly one option each time because I assume you want something you can actually do, rather than micromanaging everything. It's all pretty simple:

0. Get any free programs from your job that you can use but forgot to sign up for. 
1. Pay your essential bills (and cut as much crap as you can).
2. If you have money left over, save the money in cash until you have at least a month's expenses (eventually you want six months or so in cash, but just focus on this bit for now).
3. Once you have the one month saved, contribute to your 401K (if you have one) up to the maximum for the match. This money comes out before taxes and it's a fantastic way to save.
4. Pay off your debt above 5% interest.
5. Pay into your 401K until you max it out for the year ($19,500 a year).
6. If you still have money, put up to $6000 into an IRA each year (for both you and your spouse if you have one).
7. If you have kids and want to save for college, set up a 529 plan for each of them, making sure it's one that is good for whatever state you live in. The money will grow tax free if spent on education. Stick whatever you want in here.
8. If you still have money left over, put it in a taxable account with Vanguard.

As for what to invest in: for retirement, you want a (very) low cost ""target date retirement fund"". Basically you decide you are going to retire in, say, 25 years, so you buy the ""2045 Target Date Fund"".

There are two main reasons things may go badly for you: you pay too much in fees, or you get shitty advice and invest in stuff that isn't suitable for you.

You don't need a ""money guy"". You don't need to invest in bitcoin. You don't need a RobinHood options account. Those are all ways to lose money. Just be boring and get boring, average returns. Your main risk right now is yourself - don't chase quick riches with your retirement savings, you are not smart enough to do that (and neither am I). If you want to speculate, do it with a tiny amount of money you can afford to lose.

Two other quick things:

1. At some point you need to figure out insurance, especially when you finally get a bunch of money.
2. Don't invest money you need to use quickly (like to buy a house).",2020-07-25 11:45:05
fz54ut4,RHYM3NOC3RROS,44,"Due to the FiR flea market, the hideout gives a unique opportunity to craft your non-FiR items into FiR and then sell them.


For instance, if you shove a couple sugars in your secure container and die. You can either sell them to Therapist (2,093) or use them in a moonshine craft, realizing their value of somewhere between 60,000-70,000. 



Additionally, if you shove a graphics card in your secure container and die, it is still super valuable for your bitcoin farm! 



At the end of the day, what makes the game more fun for you? It’s all about having fun and enjoying. I loved being able to craft a decent chunk of quest items instead of trying to find them all (ie flash drives).",2020-07-25 08:06:14
fz5ixxf,thebabyburner,43,"There is still time. Start a facebook group ""strong warriors for trump"" or something. Become an affiliate for stuff like vitamins, weapons, water filters, my pillow etc. Put up a wordpress site with sensationalized headlines and thumbnail photos with one paragraph articles, for example ""the left wants to cancel school forever"" a photo of a kid sitting at a desk with a big red ""no"" symbol on it juxtaposed with a screaming blue haired college girl.  share to the group and say something like ""our PATRIOTS need to know about this!""

Then after you've gained enough idiots sharing your bs, make something up about how the liberals are trying to take down your site! the left is canceling you. you need help to FIGHT them! set up a gofundme, a patreon, put your bitcoin address out there. tell them GOD is on their side and show them a picture of trump giving the thumbs up.

\-profit and repeat",2020-07-25 10:19:31
fz61inc,0x7fEeD,41,"&gt; If you’re getting a stimulus check, don’t use it to buy Bitcoin you absolute fucking idiots lol

Talks sense, *Gets downvoted to death*",2020-07-25 13:35:09
fz605qi,_TROLL,40,"Oompah Loompah Doopity Doo

Gold's price is rising, silver is too

Oompah Loompah Doopity Dee

Bitcoin is next, I think you'll agree
_________
What do you do if you're bad at T.A...?

Hold all your coins, cross your fingers, and pray

What do you think when you look at the price?

Two hundred thousand bucks! Sounds! Nice!",2020-07-25 13:18:59
fz3v15w,tbsb1001,38,"Did you know if you give me one bitcoin I will give NONE BACK, sounds like a wonderful deal just click   [Here](https://youtu.be/dQw4w9WgXcQ)",2020-07-25 01:51:47
fz5hvx7,lib3rty47,37,Canada first to adopt bitcoin.,2020-07-25 10:09:16
fz6zay8,HandsomeChocolateBar,37,Exactly. They just download a client or find a script somewhere. The clients probably bitcoin mine their computers and they dont know it,2020-07-25 22:14:23
fz4ak0w,redditbsbsbs,35,It will be a great day when Ethereum finally flips Bitcoin,2020-07-25 03:52:37
fz3p0xs,timetopat,35,Only 15 percent? I feel it has to be higher than that. Whenever musk shits out a tweet he has no plans to follow through with they go crazy. “I’m gonna use bitcoin blockchain to get us to mars like in dark souls 420 69 XD”  easily will get you some medals there if musk tweeted it.,2020-07-25 01:04:33
fz5v9kz,Elean0rZ,35,"Cool. But also, here's some perspective from less CAPSLOCK-happy media outlets:

[https://cointelegraph.com/news/new-ruling-classifying-bitcoin-as-money-isnt-anything-special](https://cointelegraph.com/news/new-ruling-classifying-bitcoin-as-money-isnt-anything-special)

[https://news.bloomberglaw.com/us-law-week/bitcoin-deemed-money-under-d-c-financial-services-law](https://news.bloomberglaw.com/us-law-week/bitcoin-deemed-money-under-d-c-financial-services-law)

etc.

TL;DR, certainly not bad news (except for the dude trying to use 'Bitcoin isn't money' as his defense), but not MASSIVE NEWS and doesn't change much in the bigger picture.",2020-07-25 12:24:27
fz4amny,The_Meissner_Effect,32,Does this mean I can stop paying capital gains taxes on it when trading deflationary bitcoin for inflationary fiat?,2020-07-25 03:53:10
fz4wker,Newmovement69,32,"How would bitcoin look in 2030? +30kg, snorting coke of hookers?",2020-07-25 06:51:57
fz3u1la,futotta_ratto,29,"Rone - would suck Dan’s asshole dry bc he doesn’t want to go back to battle rapping for a paycheck

Brandon - disagrees

Caleb - thinking about bitcoin

KB &amp; Nick - don’t like a Trump but enjoy the spectacle 

Steven Cheah - still trying to figure out how Hilary can win",2020-07-25 01:44:07
fz4alla,elmariachi304,28,"You might want to wait until you actually get ""rich off bitcoin"" before you start with the gloating memes",2020-07-25 03:52:56
fz48dtj,jtoomim,25,"Yep, that's something we could change. However, it's much less of a problem for our code than for Amaury's, because we're not converting from chainwork to nextwork and then to target again. Our code is just shorter because we weren't doing any of that unnecessary chainwork stuff.

All we do with the target is we [shift it *n* bits to the left or right](https://github.com/jtoomim/bitcoin-abc/commit/83de74761631e509cba3fd58455b9f094e219a8c#diff-867d47d4c9e4c736374a97c3ac684680R143) (to effectively multiply it by 2^(n), where n is an integer), then [check it for over/underflow](https://github.com/jtoomim/bitcoin-abc/commit/83de74761631e509cba3fd58455b9f094e219a8c#diff-867d47d4c9e4c736374a97c3ac684680R153), and finally [multiply it by our approximated 2^(x-n) residual](https://github.com/jtoomim/bitcoin-abc/commit/83de74761631e509cba3fd58455b9f094e219a8c#diff-867d47d4c9e4c736374a97c3ac684680R168). Doing all of that calculation directly on the nBits values would probably be a little more work overall, since we'd have to check for overflow on the exponents as well as carrying on the mantissa, and of course we'd need to separate the two before we did anything. Gaining precision over the current stupid rounding scheme does sound attractive, though. There's a substantial loss in our approximation's precision when we get into the region where nBits only gives us 15 bits of precision (e.g. 0x1c008000 gives a mantissa of 0x8000).",2020-07-25 03:35:29
fz78anx,Foxhead_Blue,24,"Here's my contribution:  


**Name:** S. Luttington

**Email:** turdingpoopCUM@gaytard.loveme

**Message:** DENNIS MARK PRAGER, YOU HAVE BEEN CURSED! YOU WILL SUFFER THE WRATH OF 1001 ANGRY BEES FOR ALL TIME IF YOU DO NOT SEND $30 IN BITCOIN TO OUR ADDRESS. INSTRUCTIONS TO REACH US WILL BE FOUND ON THIS SITE. [https://knowyourmeme.com/memes/trollface](https://knowyourmeme.com/memes/trollface)

DO THE RIGHT THING.",2020-07-25 23:53:24
