Comment ID,Author,Score,Body,Publish Date
e6l39fd,redditIsAShithole6,97,"&gt;Show physical affection

Pee on him. It's affectionate because it tells him he's yours.

&gt;Respect your husband (From the video: “Wives, respect your husbands. It’s biblical - it’s in the bible.”)

Do *not* go to Olive Garden and throw your Tour of Italy at him because he ate the last breadstick. Do *not*.

&gt;Be his confidante

Constantly remind him that you know all his most damaging secrets. &lt;3 &lt;3 &lt;3

&gt;Fuel his love language

If he feels most loved when you make him a cup of tea, constantly give him tea. Even if he complains. That just means he wants it more. Tie him to the bed and pour piping hot tea over his open screaming mouth.

&gt;Give him space

Disappear for days at a time.

&gt;Don’t stop giving

If he complains that you're buying too many big screen TVs - keep buying more big screen TVs. He loves them. Don't stop giving, even if the bank takes your house and you end up living in a fort made out of big screen TVs.

&gt;Never stop learning

Men love it when you know off-the-wall things like how to build a pipe bomb, or how to use bitcoin to buy cocaine on the dark web.

&gt;Be interesting

Keep a room in your house just for you. Lock the door to the room and wear the key around your neck. Place a machine in the room that makes random noises like dogs barking or children screaming. Whenever you and your husband hear the noises, drop whatever you're doing and say ""I must tend to my flock"" and go inside the room for 1 hour. Never let him come with you.

&gt;Accept his help

Pretend you've forgotten how to wipe your ass. Men like to feel needed.

&gt;Do not compare him

Act like no other men even exist. Accidentally bump into random men in public and look confused. If you ever need to interact with a man in public, loudly question where the disembodied voice is coming from. Make sure your husband is in earshot so he knows how much you love him.

Ok so I didn't watch the video, but I think I got it!",2018-09-25 10:34:25
e6ly5al,braden41500,79,"Sell your bitcoin, INVEST IN TUNA",2018-09-25 22:50:54
e6krdnl,Apaullo35,66,For a small price of one whole bitcoin,2018-09-25 07:29:55
e6ksxsh,chainxor,65,""" It seems to me like Bitcoin Core supporters dismiss Bitcoin Cash as a scam without providing solid arguments or using logical reasoning. ""

That is correct and pretty much all there is to it. There are some people who get really aggressive when they feel competition. Bitcoin Cash is a competitor for the Bitcoin ""throne"" and it works as digital p2p cash as it was intended in the white paper. This is seen as a threat by some Core supporters.",2018-09-25 07:54:04
e6kf0dk,mabezard,51,"Check the Weekly MACD. It's been cruising just under crossing up for many weeks now, kind of held down flat by these waves of selling. The histogram has gone green as of last weeks close. The other times this happened was October 2015... just before launching out of 300. And yep that's the only other time.  


To me that pattern indicates selling pressure cannot overcome buying pressure. The long term bull current of bitcoin is too strong for bears to paddle against. I continue to think 2018 is a sped up version of our post gox bear market. Bear market lite. I continue to DCA in.",2018-09-25 04:36:04
e6m25dl,LiiteralyUnplayable,43,There goes r/bitcoin. Time for them to pack it up and find a new exchange.,2018-09-25 23:51:45
e6lxy9m,VeChain4TheWin,40,"It’s only a matter of time for our favourite local crypto project. Market conditions are pretty rubbish right now, but the news at large is constantly about development and growth (I mean in terms of businesses - custodians, trading desks coming online etc). It’s clear what’s on the horizon but I can understand why some people are antsy about price. This will all change. The next bull run is going to be insane, one of he few times the ‘little guys’ are in before proper institutional players. Banks and stock markets are recommending diversification in to crypto assets of around 5% - that’s a huge chunk of money sat waiting on the side lines right now. One of the reasons I’m excited to see how BAKKT plays out.

Gott keep a firm eye on those fundamentals. We’ve endured the year thus far in bear conditions. I’m numb to it now, I dont know about you guys. No point worrying about price, or even checking, frankly! It’s just demoralising and we all know not representative of the future. 
It could still be another 6 months before the markets turn, I think the catalyst now will be regulatory clarity and institutional access. Once that comes and the space is legitimised in the eyes of legality, there an influx of money waiting to diversify into this emerging asset class.

VeChain still needs time to really get on its feet, too, so I think at first we’ll ride a wave of bitcoin bulls, then, as VeChain becomes more established and we see a proper flow of business through the Blockchain that blasts away the talk of ‘scam’ ‘China hustle’ and the doubts many for some reason place on this world class project, we’ll see highly bullish movements in to VeChain. 

I believe this will all take place in 2019. By 2020, we’ll be rocking and the rest will be history.

Im extremely excited to be here. I have a strength node and I feel like it’s going to be life changing. I am excited every day I wake up, it doesn’t feel real. Normal people don’t get these kind of chances, do they?",2018-09-25 22:47:41
e6jvgji,mrcoolbp,39,"THIS is my problem with BCH, it's just dishonest. Search ""bitcoin"", get result saying ""bitcoin.com"" and ""cash"". This is confusing and misleading for newcomers.",2018-09-25 00:05:59
e6jxxkv,jimbtc,39,"Consenus has failed.
We know miners don't matter and are evil and don't control BCore's BTC.
Therefor we have to go with majority vote - the real Bitcoin is the one with unchecked inflation. The users (nodes) have decided....",2018-09-25 00:41:21
e6kodml,hhuzar,36,"Let's go a bit further. ""Thanks to massive CO2 footprint, this hurricane was brought to you by Bitcoin""",2018-09-25 06:44:54
e6kw8rj,jtooker,36,"&gt; [that's] all there is to it.

That does not explain _why_.  The simplest reason is that blockstream _needs_ to have a second layer to make money.  Bitcoin (Cash) threatens that business model.  They cannot show their coin works better, so you are left with propaganda.",2018-09-25 08:47:14
e6kqazs,LukeTheFisher,32,"I've been consistently let down by people who claim to love RATM and System of a Down irl. They always have this surface level understanding of the lyrics and it's always disappointing af when you try and discuss the bands with them. Like... do people not examine the lyrics they're listening to? Serious rap fans are the only people I can consistently depend upon to have an actual understanding of the lyrics from the artists they like. I tried recommending some anarcho punk to a girl who claimed to be really into System (one of her favourite bands apparently.) Just a Crass and Subhumans song each. And she responded with ""It's so nihilistic - I love it!"" 😐 She's also keeps talking about Rick n Morty. 


My manager at work is a huge Rage fan but completely misunderstands the message. Ignoring the fact that he's a manager, he's all like ""Fuck the man"" but his expression of that is hot takes like ""Bitcoin is a revolutionary technology and we need to use it to change the world.""",2018-09-25 07:13:30
e6kvy6g,zluckdog,31,"#Bitcoin soft fork with segwit &amp; bitcoin cash hard fork did not fork at the same time!


And the graphic artist shows people 'confused' vs 'well informed' can't even get the info right...",2018-09-25 08:42:23
e6lhriy,Ant-n,31,"Seriously?

&gt; Luke Dashjr
@LukeDashjr
·
14h
Reducing total usage is a way to increase full node ratio.

The whole « Bitcoin can only stay strong if it stay small » mindset..

",2018-09-25 15:13:19
e6lz48j,USAisDyingLOL,31,"Wealth of Nations is the chud Bible, as in they don't actually read it or understand it, but they point to it every time they want to justify their own asshole behavior. 

Look at [this guy](https://www.reddit.com/r/Bitcoin/comments/98uecl/localbitcoinscom_is_illegally_holding_my_93/e4jpcd9) saying ""omg did you even read wealth of nations?!"" Then when I quote it to him and it proves my point, he stumbles and says ""Nuh uh that proved you wrong"" and when pressed as to how, runs away crying",2018-09-25 23:06:25
e6lxpwv,jonald_fyookball,30,"u/vbuterin interesting.  So is this something SPV clients would be doing for each and every block?

Btw, I've been talking to some developers on full node implementations (Bitprim and BU) about implementing the ElectrumX protocol as part of the full node bitcoin software, which doesn't seem that hard if its basically just RPC messages... this would give the BCH network much more nodes to connect to through Electron Cash, which is a benefit by itself...it may be then possible to implement something like this fraud proof idea.",2018-09-25 22:43:54
e6kcsa2,crasheger,30,"because nobody gives two fucks about uneconomical ghost nodes.
not even bitcoin itself",2018-09-25 04:06:13
e6lxpix,StuGats,30,Anyone as pumped as I am about the new partnership announced between Bitcoin and scrabble?,2018-09-25 22:43:43
e6m2dnn,veggin,30,"A little excitement for my friend and I you might like. Friend works at Fidelity, the largest 401k provider with $2.4 Trillion+ In assets under management. Friend was always sort of poked at/made fun of for being the only guy in the office involved with crypto-several months back. An executive came to their branch and asked if anyone held crypto in a prep rally-like meeting. The sneers and pointing came to said Friend. Executive put him on the spot, asking him to explain bitcoin/blockchain. He did the best he could, and the executive liked his explaination. Executive states ""you may laugh, but anything that has value, you'd better believe Fidelity is involved in it."" 

Fast forward to today, Friend is now signed up to do internal beta testing for a Fidelity Crypto App. He'll have the last laugh. ",2018-09-25 23:55:00
e6jxhu2,jakesonwu,29,"Bitcoin whitepaper purists should take note that the following things are NOT described in the whitepaper:

multisig mining pools 21M coin cap GPU &amp; ASIC mining 10 minute block times HD address generation best chain = cumulative PoW, not longest chain and much, much more...",2018-09-25 00:35:13
e6lxv69,spacedv,29,"The amount and quality of research Vitalik produces is just incredible. Latest piece from him posted on r/ethereum: [https://www.reddit.com/r/ethereum/comments/9irabr/fraud\_proofs\_maximising\_light\_client\_security\_and/](https://www.reddit.com/r/ethereum/comments/9irabr/fraud_proofs_maximising_light_client_security_and/)

Of course he's accompanied by a lot of other amazing people who deserve acknowledgement too. I guess Ethereum attracts a lot of brilliant researchers because it's much more likely to get support for new ideas (as long as they are good) than with Bitcoin.",2018-09-25 22:46:16
e6l1nu8,CryptoRedemption,29,"There are a few different reasons.

For one, there are costs to process transactions and to secure the chain. How would those costs be recuperated without a coin?  It could take place through the legacy banking/financial system, but then it would either need to be pre-paid at a certain rate, or charged afterward and the tx's basically being extended on credit (in what will ideally be a incredibly dynamic system).  Having the ability to transfer value directly on the chain automatically based on actual usage greatly reduces friction/overhead, and eliminates risks of non-payment or under-payment.

Alternatively, an existing cryptocurrency could be used to transfer value (bitcoin? nano? stellar?) but then you're introducing reliance upon another cryptocurrency that can vary wildly in costs, new and unknown security risks, potential bottlenecks in speed, etc.  One of the core value propositions of VeChain's platform is that they intend to keep the cost of using the chain (cost per/tx via VTHO) relatively static.  This way, enterprises can anticipate and budget their costs like any other business expense.

On top of all of paying for the costs of writing/processing tx to the blockchain, a major goal of the VeChain platform is to facilitate trustless exchange between enterprises; That is not limited to data access, but also extends to value (money). This can be payment for data, payment for services, and payment any number of other costs that can come up via smart contracts and certain metrics/thresholds. Many of these things will be paid  for a la carte, or on an ongoing basis. Having a cryptocurrency that interacts with smart contracts allows for a whole new speed of business than what is possible otherwise, and reduces their dependence on trust!",2018-09-25 10:11:18
e6k133u,jerryskids_,28,"Rival? Uh.. no.   
Tilray has 5% the capacity.. people were just treating it like bitcoin and lo and behond, tons of people have now lost their shirts due to the greatest pump and dump in the cannabis sector's history.  


Silly opinion piece headline.",2018-09-25 01:25:53
e6kdy5p,SnapshillBot,27,"shit i cant quit my job what a wakeup call

Snapshots:

1. *This Post* - [archive.org](https://web.archive.org/20180924192137/http://www.reddit.com/r/Buttcoin/comments/9iidkq/lily_white_libertarian_just_got_into_crypto_222/), [_megalodon.jp\*_](http://megalodon.jp/pc/get_simple/decide?url=http://www.reddit.com/r/Buttcoin/comments/9iidkq/lily_white_libertarian_just_got_into_crypto_222/ ""could not auto-archive; click to resubmit it!""), [removeddit.com](https://www.removeddit.com/r/Buttcoin/comments/9iidkq/lily_white_libertarian_just_got_into_crypto_222/), [archive.is](https://archive.is/kwAvG)

2. https://np.reddit.com/r/Kanye/comme... - [archive.org](https://web.archive.org/20180924192141/http://www.reddit.com/r/Kanye/comments/7xg9ey/the_life_of_pablo_2_year_anniversary/du915na/), [_megalodon.jp\*_](http://megalodon.jp/pc/get_simple/decide?url=http://www.reddit.com/r/Kanye/comments/7xg9ey/the_life_of_pablo_2_year_anniversary/du915na/ ""could not auto-archive; click to resubmit it!""), [removeddit.com](https://www.removeddit.com/r/Kanye/comments/7xg9ey/the_life_of_pablo_2_year_anniversary/du915na/), [archive.is](https://archive.is/VVU61)

3. /u/willienelson24 - [archive.org](https://web.archive.org/20180924192145//u/willienelson24), [_megalodon.jp\*_](http://megalodon.jp/pc/get_simple/decide?url=/u/willienelson24 ""could not auto-archive; click to resubmit it!""), [_archive.is\*_](https://archive.is/?url=%2Fu%2Fwillienelson24&amp;run=1 ""could not auto-archive; click to resubmit it!"")

4. https://cointelegraph.com/bitcoin-p... - [archive.org](https://web.archive.org/20180924192151/https://cointelegraph.com/bitcoin-price-index), [_megalodon.jp\*_](http://megalodon.jp/pc/get_simple/decide?url=https://cointelegraph.com/bitcoin-price-index ""could not auto-archive; click to resubmit it!""), [archive.is](http://archive.is/ZjVVt)

5. https://np.reddit.com/r/bestof/comm... - [archive.org](https://web.archive.org/20180924192154/http://www.reddit.com/r/bestof/comments/9ifrhr/guy_acting_like_he_is_from_the_streets_on_a/), [_megalodon.jp\*_](http://megalodon.jp/pc/get_simple/decide?url=http://www.reddit.com/r/bestof/comments/9ifrhr/guy_acting_like_he_is_from_the_streets_on_a/ ""could not auto-archive; click to resubmit it!""), [removeddit.com](https://www.removeddit.com/r/bestof/comments/9ifrhr/guy_acting_like_he_is_from_the_streets_on_a/), [archive.is](http://archive.is/bLNxB)

*^(I am a bot.) ^\([*Info*](/r/SnapshillBot) ^/ ^[*Contact*](/message/compose?to=\/r\/SnapshillBot))*",2018-09-25 04:21:58
e6o067x,itzprospero,595,"I won't say all, but many.

The *Unite the Right* rally in Charlottesville was organized by **Jason Kessler**, who was also a writer for the *Daily Caller* ^[[1]](https://www.splcenter.org/hatewatch/2017/08/16/daily-caller-has-white-nationalist-problem). Here is a [recent clip ^[2]](https://www.youtube.com/watch?v=mk8kt15bX3Y) from Showtime’s *The Circus*  where  people working at the *Daily Caller* are interviewed by Mark McKinnon.  *The Daily Caller* was co-founded by **Tucker Carlson**.

**Tucker Carlson** posed for a [picture ^[3]](https://www.thewrap.com/tucker-carlson-poses-with-hate-group-members-in-fox-news-green-room/) with **Roger Stone** and a couple of DC *Proud Boys* on March 17, 2018. 

The same *Proud Boys* **Carlson** posed with in the previous picture can be seen flashing that gesture [here. ^[4]](https://www.instagram.com/p/Bi9fiShguMA/?taken-by=rogerjstonejr)

**Gavin McInness** , formerly of *The Rebel Media* and ex-cofounder of *VICE*, founded the “western chauvinist group” *The Proud Boys* ^[[5]](https://rewire.news/article/2017/08/28/hate-goes-mainstream-gavin-mcinnes-proud-boys/) ^[[6]](https://www.theguardian.com/world/2018/jul/14/proud-boys-far-right-portland-oregon).  McInnes is currently with *CRTV* alongside Mark Levin and Michelle Malkin and others.  

**Roger Stone** could be seen [here^[7]](https://twitter.com/markpersons5/status/970395142879199232) flashing a co-opted white power hand gesture with a group of Proud Boys at some bar.  It’s a common gesture among alt-right figures that visited the White House some time agoThis same gesture has been shown multiple times at the White House by several people affiliated with the alt-right, ranging from interns ^[[8]](http://www.dailymail.co.uk/news/article-5216137/White-House-intern-flashes-white-power-sign-Trump.html) to “reporters” like [**Mike Cernovich** , **Lucian Wintrich**, **Milo Yiannopoulos**, and **Cassandra Fairbanks** ^[9]](http://markmaynard.com/2017/04/white-power-shoutouts-from-the-white-house/). ^[[10]](https://www.huffingtonpost.com/entry/mike-cernovich-james-gunn-fired_us_5b5265cce4b0fd5c73c570ac)

Here is Kim Guilfoyle hanging with an alt-right troll [flashing the gesture over the 4th of July](http://observer.com/2018/07/kimberly-guilfoyle-july-4-trump-family-pizzagate-conspiracy-theorist/).  

*The hand gesture is all about context*
*The alt-right likes to hide behind innocent symbols.* 

*Here are a few video examples of the hand gesture being used*

- Here is a [Periscope video ^[11]](https://twitter.com/JackPosobiec/status/963819140422209536) posted by **Jack Posobiec** who was filming **Mike Flynn Jr** in DC at a fundraiser on Feb 14, 2018.  Watch at (0:25) when the camera pans.  A guy wearing glasses waves the sign directly to the camera.  

**Posobiec** is a known figure from the alt-right that **Donald Trump** retweeted after the Unite the Right Rally. ^[[12]](http://www.latimes.com/politics/la-pol-updates-everything-president-trump-retweets-alt-right-blogger-who-1502769297-htmlstory.html) **Posobiec** can be seen posing for a picture with **Richard Spencer**,  a key figure in the alt-right movement. ^[[13]](https://twitter.com/richardbspencer/status/876564807142572032?lang=en)
 
- Another [video example ^[14]](https://www.knoxnews.com/videos/news/local/2018/02/17/traditionalist-worker-party-members-march-speech-ut/110526690/) from Knox News shows a member from the Traditionalist Worker Party flashing the white power hand sign discretely.  Focus on the guy with the white hat and a beard at (1:22).

Here is an example is from the Patriot Prayer/Proud Boy rally in Portland on Aug, 4, 2018.

- [Ford Fischer video - Proud Boys/Patriot Prayer Bus OK gesture ^[15]](https://twitter.com/FordFischer/status/1025789902938505222).

Fischer tweeted q profanity laced, pre-rally battle prayer from a Proud Boy: 

- [“We’re basically going into, pretty much a f@#$in’ war zone” ^[16]](https://twitter.com/FordFischer/status/1025792158194749440)

**Even some congressmen are affiliating themselves with individuals who make the gesture during pictures**

Holocaust denier **Chuck Johnson** gave **Dana Rohrabacher** the maximum donation of $5,400 campaign contributions in Bitcoin from alt-right holocaust denier Chuck Johnson.  ^[[17]](http://www.latimes.com/politics/essential/la-pol-ca-essential-politics-updates-far-right-blogger-chuck-c-johnson-gave-1508457881-htmlstory.html)  **Johnson** and **Rohrabacher** [pose together for a picture^[18]](https://www.yahoo.com/news/alt-right-figure-set-assange-meeting-refuses-cooperate-senate-intel-probe-172020121.html) as Johnson flashes the co-opted white power OK hand gesture. 


The two are familiar because Johnson helped set up the meeting between Rohrabacher and Julian Assange.  Johnson, who was also [invited to the State of the Union by **Matt Gaetz**^[19]](https://www.thedailybeast.com/florida-congressman-invited-infamous-troll-chuck-johnson-to-trumps-state-of-the-union), sat in on a meeting between **Rand Paul** and **Rohrabacher** at the capitol.  Rohrabcher’s spokesperson, Pitkin, says they discussed cannabis and Assange’s legal situation, among other things.  ^[[17]](http://www.latimes.com/politics/essential/la-pol-ca-essential-politics-updates-far-right-blogger-chuck-c-johnson-gave-1508457881-htmlstory.html) 

**Gaetz, Rohrabacher**, and **Charles (Chuck) Johnson** were all hanging out together alongside **Palmer Luckey** on a yacht recently.  ^[[20]](https://www.motherjones.com/politics/2018/09/alleged-holocaust-denier-chuck-johnson-attends-matt-gaetz-fundraiser-dana-rohrabacher/)


**Devin Nunes** was recently caught [posing for a photo while his supporter flashed the sign ^[21]](https://www.fresnobee.com/news/politics-government/politics-columns-blogs/political-notebook/article218763830.html).  Probably part of why he’s not allowing phones or pictures at his upcoming event. ^[[22]](https://www.sacbee.com/news/politics-government/article218555450.html)

-----

1) [SPLC - The Daily Caller Has A White Nationalist Problem](https://www.splcenter.org/hatewatch/2017/08/16/daily-caller-has-white-nationalist-problem)

2) [Youtube - Showtime’s The Circus - Daily Caller Segment](https://www.youtube.com/watch?v=mk8kt15bX3Y)

3) [The Wrap - Tucker Carlson Poses With Members of ‘Hate Group’ Proud Boys in Fox News Green Room](https://www.thewrap.com/tucker-carlson-poses-with-hate-group-members-in-fox-news-green-room/)

4) [Instagram - Roger Stone’s Instagram](https://www.instagram.com/p/Bi9fiShguMA/?taken-by=rogerjstonejr)

5) [Rewire.News - How Hate Goes ‘Mainstream’: Gavin McInnes and the Proud Boys](https://rewire.news/article/2017/08/28/hate-goes-mainstream-gavin-mcinnes-proud-boys/) 

6) [The Guardian - Who are the Proud Boys, 'western chauvinists' involved in political violence?](https://www.theguardian.com/world/2018/jul/14/proud-boys-far-right-portland-oregon)

7) [Twitter - Roger Stone Drinking With Proud Boys Flashing White Power Hand Sign](https://twitter.com/markpersons5/status/970395142879199232)

8) [DailyMail - White Power At The White House - Trump Intern Flashes ‘Alt-Right’ Symbol Used By Notorious Extremists During Group Photo With The President](http://www.dailymail.co.uk/news/article-5216137/White-House-intern-flashes-white-power-sign-Trump.html)

9) [Huffington Post - How Pizzagate Pusher Mike Cernovich Keeps Getting People Fired](https://www.huffingtonpost.com/entry/mike-cernovich-james-gunn-fired_us_5b5265cce4b0fd5c73c570ac)

10) [MarkMaynard.com - White Power Shoutouts From The White House](http://markmaynard.com/2017/04/white-power-shoutouts-from-the-white-house/)


11) [Twitter - Mike Flynn Jr Speaks at Trump DC!](https://twitter.com/JackPosobiec/status/963819140422209536)

12) [Los Angeles Times - Trump retweets alt-right media figure who pushed ‘PizzaGate’ and Seth Rich conspiracy theories](http://www.latimes.com/politics/la-pol-updates-everything-president-trump-retweets-alt-right-blogger-who-1502769297-htmlstory.html)

13) [Twitter - Photo of Richard Spencer and Jack Posobiec at a bar during the RNC](https://twitter.com/richardbspencer/status/876564807142572032?lang=en)

14) [Knox News - Traditionalist Worker Party members march to speech at UT](https://www.knoxnews.com/videos/news/local/2018/02/17/traditionalist-worker-party-members-march-speech-ut/110526690/) 

15) [Twitter - Ford Fischer Proud Boys/Patriot Prayer Bus OK gesture](https://twitter.com/FordFischer/status/1025789902938505222)

16) [Twitter - Ford Fischer - The bus is in a speech and prayer. “We’re basically going into a fuckin war zone” they say](https://twitter.com/FordFischer/status/1025792158194749440)

17) [LA Times - Far-right blogger Chuck C. Johnson gave bitcoin donation to Dana Rohrabacher](http://www.latimes.com/politics/essential/la-pol-ca-essential-politics-updates-far-right-blogger-chuck-c-johnson-gave-1508457881-htmlstory.html)

18) [Yahoo - ‘Alt-right’ figure who set up Assange meeting refuses to cooperate with Senate intel probe](https://www.yahoo.com/news/alt-right-figure-set-assange-meeting-refuses-cooperate-senate-intel-probe-172020121.html)

19) [Daily Beast - Florida (Congress)Man Invited Infamous Troll Chuck Johnson to Trump’s State of The Union](https://www.thedailybeast.com/florida-congressman-invited-infamous-troll-chuck-johnson-to-trumps-state-of-the-union)

20) [Mother Jones - Two Republican Congressmen Hobnob With an Alleged Holocaust Denier. Again.](https://www.motherjones.com/politics/2018/09/alleged-holocaust-denier-chuck-johnson-attends-matt-gaetz-fundraiser-dana-rohrabacher/)

21) [Fresno Bee - Was Clovis man flashing white power symbol in photo with Nunes? Activist says no](https://www.fresnobee.com/news/politics-government/politics-columns-blogs/political-notebook/article218763830.html)

22) [Fresno Bee - Mystery Nunes event requires guests to submit to personal search, no cell phone photos](https://www.sacbee.com/news/politics-government/article218555450.html)",2018-09-26 21:29:41
