Comment ID,Author,Score,Body,Publish Date
e629rp1,MidnightOnMars,27,"I think this overcorrection illustrates that price is often decoupled in both directions from the utility of a network and even rational speculation based on future utility. If we just go by comparing to other chains, look at how insanely high Bitcoin is still valued despite not having the decentralization, security, utility, or developers of Ethereum. The cycle will turn.

Augur will continue to grow but there's so much more to look forward to than just that - we have state channels live on the network, we've got the first Plasma implementations coming, we've got Grid+ launching the first mainstream blockchain application for non-crypto oriented customers in Q1 2019, we've got Gods Unlimited and other blockchain games coming, we've got the Constantinople issuance reduction that will diminish selling pressure once live, we've got the most used crypto platform, basically we've got more going on than I could hope to list in a single comment response without writing all day. 2018's price action has been brutal but that hasn't slowed developers and we're just getting warmed up.",2018-09-16 15:37:24
e62e7pv,castorfromtheva,26,"LN doesn't ""save"" Bitcoin, it just extends it. Bitcoin was never in better constitution than it is right now, I don't know why you think it has to be saved!? No coin will ever replace bitcoin imho. It's the underlying standard of all cryptos and soon also of all the other currencies, that's what I think. LN and submarine swaps, as well as other BIPs will grant further fungibility, scalability and privacy. In my eyes the probability of bitcoin being replaced is *zero*. It's the only crypto driven by community instead of authority.",2018-09-16 18:14:33
e60uxs3,zhell_,26,"I am sad to admit I share this feeling. Maybe changing the wording might help. Something like ""scan this with any bitcoin cash wallet to claim your tip, more info available at if this is your first time ..."" but still not great. Any idea on how to solve this problem? ",2018-09-16 00:14:13
e62fews,CatatonicAdenosine,25,Bitcoin Cash is a community fork of the Bitcoin protocol. It is as much a continuation of Bitcoin as BTC is. Some like it better. That’s all that has ever been claimed. ,2018-09-16 19:02:30
e639rmr,WorldPeaceIsSoMetta,282,Did you know: Bitcoin mining consumes less energy per year than a pulsar?,2018-09-17 04:35:02
e62yug5,just_read_my_comment,210,because the market cap of bitcoin is minuscule compared to any of those things. ,2018-09-17 02:07:39
e62wnne,Afkbio,206,I'm not sure the energy consumption of the bitcoin network is something to be satisfied of.,2018-09-17 01:33:52
e64r16k,latetot,175,"Agree completely.  The payment for “gas” analogy is no longer valid.  ETH is a native currency and store of value for the internet.  There is an entire permissionless financial system being built on top of it which depends on ETH value for security.  Vitalik seems to recognize this too and is advocating for move to zero inflation after PoS.  Bitcoin can be digital gold, ETH is money.  ",2018-09-17 22:53:40
e633lpg,arc_11,153,What is this a Bitcoin price chart,2018-09-17 03:13:00
e6352wm,sgtjack86,135,"Additions:

- don’t compete with Amazon
- ask yourself what your added value is e.g. writing articles about your product and creating a community for users or do you give x% to charity etc. 
- don’t dropship if wait time is over a few weeks. Nobody wants to wait that long. I used to have a bespoke leather craft website and my shipping policy was 5 days. Only reason I could get away with this was because of the promise of ‘hand made’ (takes more time)
- don’t dropship out of another country/continent, find local dropship warehouses who act as middle man to cut down on shipping times, as soon as you start making profit, invest in inventory
- only use dropshipping as a means to bootstrap your business, in the long run, it’s always best to invest in own inventory to improve margins
- don’t go with the hype (‘omg I made 6 figures with dropshipping/bitcoin/gold/betting on sports ...’  money never comes easy but for some reason people always tend to fall in flocks for these so-called quick wins. If it looks too good to be true, it always is
- if your idea already exists, that means it’s a good idea, you only need to find your niche/value add
- Finally: work hard :)",2018-09-17 03:32:48
e637iyq,darthstupidious,132,"One of my favorite ""internet"" mysteries revolves around the creation of Bitcoin.

In 2008 (during the financial crisis), an unknown individual named Satoshi Nakamoto - a pseudonym - published a whitepaper calling for a decentralized banking system named Bitcoin. Two months later, Bitcoin was officially launched, and ever since, it has grown to a point where it's now worth tens of billions of real dollars.

This unknown creator (""Satoshi Nakamoto"") is still holding on to nearly a million Bitcoins, which is valued anywhere between $6 - $8 *billion*. They haven't touched their btc wallet in years, but are one of the wealthiest people on the planet (despite nobody knowing who they are).

I covered this story on my podcast, Unresolved, and you can find the episode and the write-up [here](https://unresolved.me/satoshi-nakamoto).",2018-09-17 04:05:08
e630s03,Atheia,129,"Don't stop it. Buy Apple and Amazon stock. Then when Bitcoin comes out, buy that.",2018-09-17 02:35:05
e64m08n,BetterDeadThanRed99,92,If I had a Bitcoin wallet with 1000 Bitcoin in it from 6 years ago and I split it into 100 wallets of 10 Bitcoin each to reduce risk that would count here....  Muggles.,2018-09-17 21:14:59
e62yn4b,PangaeaRepublicParty,86,"If you divided that on a per transaction basis, I’d bet bitcoin is exponentially higher.. and growing ",2018-09-17 02:04:35
e646nn0,starflavors,73,"&gt; We need to organize and develop the right tools to build the crypto ecosystem.

This is rich. I donated a thousand dollars to Amir's dark wallet project years ago, and then they never worked in it.

This guy is off in wonderland speaking half-hysteric doom and gloom anarchy, just romping the world like a bum, not doing shit.

The real people pushing crypto forward are writing code. That includes Bitcoin cash and, sorry, it does include lightning developers, too.

Amir is just a charlaton and a loser.",2018-09-17 13:19:40
e63j384,freeradicalx,65,"These are all really dumb comparisons because they are terrible analogies. The only utility of bitcoin mining is securing the BTC blockchain. So the 138M GJ/year is for *just* that end purpose. The utility of gold mining on the other hand is multifold as gold is a periodic element with tons of different uses. It's not just a store of value, it's also ubiquitous in electronics, popular in jewelry, and probably has dozens of novel scientific and medical uses (Half of the readers of this post probably have some permanently fixed in their mouths, for instance).

The energy costs of bitcoin mining are an unignorable and exorbitant liability that we're better off recognizing and honestly attempting to address than try to hand-wave away with limp, sorry apologies like this doof is wasting *his* energy on. His #23 is essentially 'wasting energy will accelerate efforts to build fusion tech'. Good fucking grief, dude. Untie yourself out of that embarrassing knot you've bent into.",2018-09-17 06:42:52
e63nk32,breakfastcookies,64,We should replace the entire government with bitcoin miners.,2018-09-17 07:50:53
e636wu0,TJ11240,61,"It's not comparing apples to apples, its completely unnecessary and likely to erode the previous points that were made. The purpose of Bitcoin isnt to replace governments. ",2018-09-17 03:57:19
e64r2cw,biba8163,60,"This title and the article are fake.

Roubini outlines a lot of things that will lead to a recession but never mentions institutions favoring Bitcoin.  Same points here as in the Economist article that anyone can read:

https://www.theguardian.com/business/2018/sep/13/recession-2020-financial-crisis-nouriel-roubini

Or listen to:

https://www.wsj.com/articles/dr-doom-still-basking-in-his-fame-after-warning-of-housing-collapse-1523628000

I am a big believer in Bitcoin but it makes us look like fools when people in crypto go around making up lies to advocate crypto.   Roubini actually has gone and said Bitcoin will not weather us from the storm.  ",2018-09-17 22:54:13
e63dpst,SocialImagineering,59,Whisky-Actual-FUCK lol. Is that the standin for unloaded model I wonder? Or can we now collect Dogecoin as well as Bitcoin? Love these devs’ sense of humor. ,2018-09-17 05:25:48
e64awne,FascinatedBox,55,"I envy you people that don't need code to survive. I need code every waking moment of the day from when I first wake up.

My heart is controlled by a pacemaker that's powered by an internet of things connection. This allows me to have an app installed on my heart that tells me what pace it's beating at. I also installed another app that uses the energy of the blood pumping to generate electricity. Anyone know if hearts generate enough energy to make bitcoin?

My daily routine usually involves me brushing my teeth and once a week I put deodorant on. My mom says I smell but I don't like taking showers because the shower knobs are analog and not digital. Showers would just be so much more efficient if I could hack them to put in, like, an app to control the temperature or a weather app to see what the temperature is outside, or one to clean the bathtub (oh wait my mom does that).

Also my fridge won't open unless I knock on it and also say ""SELECT STAR FROM FRIDGE WHERE ONE EQUALS EQUALS ONE"". But when I do then everything from the fridge is in my hands and it's really heavy so I have to put it into the sink and start to yell more commands ""FROM SINK IMPORT WATERMELON. FROM KITCHEN IMPORT KNIFE, FORK, SPOON"". If I didn't have these code tech powers, I wouldn't be able to do basic household chores. I need every bit of these to survive.

Later on when I go outside, the sun hurts my eyes because I'm so used to staring at a computer monitor that I try to yell XRANDR BRIGHTNESS ONE HALF ONE FOURTH but ic cant because I already yelled so much when I breakfast made food this ronming that the words don't even come outt.

please dont' make fun of peepul who need to use code to survive like i do. My throat hurts from screaming code all the time ",2018-09-17 15:09:45
e62u4ae,ionxeph,55,"This is being sold for 350k dollars

I wonder if he actually ended up making money from this..

Is this the next new investment hype? Forget Bitcoin, time to trade with FGO whale accounts 

edit: nvm, 350k dollars it the amount spent on the account, the current bid is only half that",2018-09-17 00:53:08
e63ay5z,eggn00dles,52,But it's not weird. Bitcoin is not common for payments. You're just making yourself look delusional.,2018-09-17 04:49:54
e62x5ty,georgeguy007,52,"Lots of people are sour on Blockchain because so many people treat it like a cure for cancer when its really just a niche data structure(ish) that has only a few good uses, and even then most of those good uses could be achieved using other technology. In the time blockchain has been created, the smart phone has rocketed from a novelty to a technological marvel while BC has created a pump and dump penny stock and a few corporate solutions. 

&amp;#x200B;

Furthermore, with the 2017 bubble of BitCoin, lots of devs in the work force had to hear nonstop about the marvels of the blockchain from bosses or bag-holders,  while devs knew it would not helpful in their environment, so I'm sure there is some resentment. 

  
tldr: Its just anti-hype.  
",2018-09-17 01:41:44
e639ry4,Willshw,44,"It's been fun, guys. Been trading for almost a year now and finally reached my Bitcoin holding goals. From this point on, I'm going to hold to my price target and start trading other markets. Thanks for everyone's input, bullish and bearish. It was useful whether or not we agreed. ;)

Best of Luck",2018-09-17 04:35:10
e64q73r,sirtaptap,43,"Turns out with washtrading, any amount of volume is possible!!

Please ignore the reports of commercial transactions with bitcoin being nearly 0 and how perfectly this meshes with ""just hodl"" mentality",2018-09-17 22:39:17
e640jkp,Kain_niaK,42,"fun fact, the creator of this meme has been banned from /r/bitcoin. 
",2018-09-17 11:23:50
e633l1w,theredditsoyboy,42,And then everyone clapped and a stranger paid for his meal while tipping OP 1 bitcoin.,2018-09-17 03:12:47
e63qb5x,leon_oswald,42,"&gt;Should the Bitcoin price for example return to its current all time high of $19,535, those buying in now would see around 400% return on their investment.

lol - that's a nice way to say that it's down 75%",2018-09-17 08:33:26
e63lmlp,sirenCiri,40,Or a thousand years from now with 1 bitcoin,2018-09-17 07:21:23
e63k9k0,GS-Sarin,40,Not even Medieval Bitcoin smh,2018-09-17 07:00:25
e62vw10,[deleted],40,You mean Bitcoin Cash (BCH). Wouldn’t want anyone making an error because of your misinformation. ,2018-09-17 01:21:39
e64me6c,DirgeHumani,36,The only thing that would improve this story would having the number of bitcoin vary wildly throughout the story.,2018-09-17 21:23:45
e62uzyx,aceat64,36,"This isn't the first, I did a proof of concept sending a bitcoin transaction via aprs over a year ago.

https://github.com/aceat64/bitcoin_aprs",2018-09-17 01:07:10
e66kfkl,Nw5gooner,362,"I love those adverts.

""I've made MILLIONS from the stock market with this FOOLPROOF method and instead of continuing to rack up my millions I've decided to stop using it and instead GIVE BACK to the community by teaching everyone my SPECIAL FOOLPROOF SYSTEM. Just sign up today and pay me $100 for the first installment and I'll give you 50% off the remaining $800 subscription. I'll even throw in a copy of my new BITCOIN E-BOOK that I wrote even though I made all my money in stocks!

Not convinced? Look, here's a picture of me in a Ferrari.""",2018-09-18 16:33:59
e66mvzh,dalebewan,180,"Related -&gt; True story from yesterday:

I park my car about 10 minutes away from my office, since the company I work for doesn't have enough parking spaces.  When I left work yesterday and was walking to my car, I passed one of those charity fundraising pop-up stands on the street.  A girl intercepted me and started on her story about why their charity is the best way to help starving people in war-torn east African countries.

To be honest, I'd be happy to give a little donation.  The charity sounded alright.  However I am the blue shirted guy in this comic... I only use bitcoin.

While it would be funny to tell you that she gave me money, that didn't happen.  What did happen though is that she'd never heard of it, and called over one of her colleagues.  He confirmed that they don't in fact accept bitcoin donations (he was aware of bitcoin, but only superficially).  The three of us then spent about 10 to 15 minutes talking about what bitcoin is and how - with proper planning on the charity's side - it would be something they really could get behind given how control over money is one of the ways that these countries are being oppressed by those in power.

So, no donation from me yesterday, but they said they'll talk to their supervisor/organiser and see if they can at least start accepting bitcoin donations in the future, even if it's just to convert to fiat at first.  I also somewhat got the impression that both of them were likely to go out and investigate it further themselves.  They both seemed really quite excited about the idea of it as I explained it to them.",2018-09-18 18:06:13
e66phyv,Blank-612,152,this is good for bitcoin.,2018-09-18 19:41:18
e671hcf,Su-Bae,104,"Agree everything until moving USD to bitcoin or metals. That’s a suicide. 

",2018-09-18 23:38:34
e66tav6,Javihache,98,How do you use only bitcoin? Where do you live?,2018-09-18 21:18:21
e66u1at,HumbleInflation,85,It's like you're freeloading power and making money on it. BITCOIN FOREVER!,2018-09-18 21:33:30
e66y596,SnapshillBot,74,"let me be the first to say if you dont have bitcoin you are a pussy and cant really purchase anything worldwide. You have no global reach

Snapshots:

1. *This Post* - [archive.org](https://web.archive.org/20180918134702/https://i.redd.it/g68mnkwg40n11.jpg), [_megalodon.jp\*_](http://megalodon.jp/pc/get_simple/decide?url=https://i.redd.it/g68mnkwg40n11.jpg ""could not auto-archive; click to resubmit it!""), [archive.is](https://archive.is/HY8ly)

*^(I am a bot.) ^\([*Info*](/r/SnapshillBot) ^/ ^[*Contact*](/message/compose?to=\/r\/SnapshillBot))*",2018-09-18 22:47:03
e6588a0,Erumara,65,"Bitcoin is an idea, not the result of some quasi-empirical gatekeeping.

Bitcoin is a fully-validating, infinitely redundant, distributed database which administers write-access using PoW proofs.

Bitcoin is not a specific algorithm, is not a specific forum, nor a specific group of people.

Bitcoin is not even a ticker symbol, it is Satoshi's vision of permissionless P2P cash for the entire world.

If you're trying to wrap your head around the fact that Bitcoin (BTC) barely qualifies as Bitcoin anymore, you're certainly not alone.",2018-09-18 03:02:41
e65uczh,xAmppy,53,So...  is it Bitcoin?! ,2018-09-18 08:13:52
e65ih56,jpdoctor,52,"From an advertising and promoting perspective, ""BCH is the REAL Bitcoin"" has always been a terrible slogan.  It might make people who already know the difference feel good, but it is a classic ""wannabe"" strategy as far as communications strategy to new entrants.

I don't think it's winning us many converts so much as preaching to the choir.",2018-09-18 05:22:29
e66xm1r,DelfinGuy,51,"After 2008, I know better than to trust Bankers, governments, ... ETFs, Bakkt, etc.

&amp;#x200B;

My keys, my Bitcoin.

&amp;#x200B;

Not my keys, not my Bitcoin.",2018-09-18 22:38:15
e66j2ld,Fairix,49,I stop playing for a bit and y'all start farming milk instead of bitcoin,2018-09-18 15:48:38
e66pttm,j_ockeghem,49,"SEC's Hester Peirce remarks before the Cato Institute’s FinTech Unbound Conference:

[https://www.sec.gov/news/speech/speech-peirce-091218](https://www.sec.gov/news/speech/speech-peirce-091218)

""I speak, of course, of my dissent from the Commission’s decision to reject an exchange-traded product that was designed to give investors access to bitcoin. \[...\]

In response to my dissent, I was informally dubbed CryptoMom.  I always have wanted to be a mother, so acquiring this new title was quite an honor. Admittedly, this is not the form of motherhood I envisioned, but one of the wonderful aspects of motherhood is that children are quite different than their mothers anticipated they would be.

If I were a mother, I suspect that I would be a free-range mother rather than a helicopter mom.  A helicopter mother hovers over her child in order to ensure the child’s success, although this strategy often backfires. A free-range mother, by contrast, encourages her child to explore with limited supervision, which requires the acceptance of a certain level of risk.""

&amp;#x200B;

""The technological revolution the financial industry is experiencing now is very exciting. New asset classes like cryptocurrencies and new ways for financial companies to communicate with investors are likely to make our world look very different ten years from now than it did ten years ago.  As a regulator—and one who is not adept with new technology—humility is, as I have noted, important. I do not know which technologies will succeed and fail. It is not my job to assess the relative merits of different products and services. Humility is also important as we think about how our attitudes and processes need to change to make the U.S. a comfortable home for the next generation of innovators.""

&amp;#x200B;

&amp;#x200B;",2018-09-18 19:51:39
e66kf35,playfulexistence,43,They selectively enforce their rules in order to promote their narrative. It's well known that r/bitcoin is a cult.,2018-09-18 16:33:30
e66t8l6,flattail,43,"Here is the unscientific approach I have taken: 1) Become deeply engrossed in Bitcoin (3 years ago). 2) Become an active cryptocurrency trader, making occasional gains but mainly suffering great losses. 2.5) By luck of being in before 2017 turn everything around (at least for now). 3) Shift from active trader to investor, spending a lot more time learning about the cryptocurrencies I was investing in and sharing in the excitement of their potential applications. 4) Discover Iota. Realize that their team and their technology are different than all other cryptos. 5) Become convinced over time that basically anything any crypto can do, Iota can do better. Realize that I like IOTA better than ANY other cryptocurrency and the more I learn the more excited I become. 6) Sell all other cryptocurrencies to buy more IOTA. 7) Look at the value of all cryptocurrencies and realize it is all hype and speculation. 8) HODL IOTA in the belief that it will survive all the drama and come out as a true leader.

The cryptocurrency market has gone from $750 Billion in total market cap to $200 Billion this year. Can any sort of analysis make sense of that?? (or how it went from $17 B to $600B in 2017??). The price of IOTA gets whipped around (with all the others) based on overall sentiment and Bitcoin price. The Iota Foundation basically does not care--instead of focusing on price or market cap they are focusing on building their team, their partnerships, and their technology, I think it was Dom who said this will either be a trillion dollar project or a failure. A $1T market cap would put 1 Mi at $360. I think eventually it will get there, but I don't know if that is 5 years or 50 years. The current IOTA market cap is less than 2% that of BTC and less than 10% that of ETH. I see nothing fundamental that would justify that disparity--in my mind IOTA is the most valuable of all three of them. The price disparity is simply about the small demand for IOTA, which is largely a product of a) difficulty trading IOTA (on far fewer exchanges), b) active FUD campaign that has scared a lot of people away, and c) no marketing campaign by the Iota Foundation. Iota is actually building something before trying to sell it to the world, whereas most everyone else is first selling their idea, pumping their price as much as possible, and then seeing if they can build something. ",2018-09-18 21:17:00
e650mpa,HostFat,41,"&gt; What is layer 2?

What ever is permitted to be developed on bitcoin cash, **without crippling the layer 1**. So even LN.",2018-09-18 01:17:39
e650dsn,belcher_,41,"Bisq is surely one of the top 5 most important open source projects in bitcoin today.

The privacy point is sometimes overlooked; if every single one of your bitcoin trades requires handing over your ID documentation then you have **absolutely no privacy** even if technology like CT, Dandelion, Coinjoin, Coinswap, Lightning, etc etc became widely adopted in bitcoin.

Recently we saw that Localbitcoins.com and Shapeshift were forced to require ID documentation for trading on them under certain conditions. This was a big change, I remember a time when you could go to a new city and place your own ad on localbitcoins. If you set a favourable price you could usually convert your bitcoins into local currency pretty quickly in a permissionless and anonymous fashion. No more now that localbitcoins.com requires ID documents to place ads. Of course it's not their fault, just the basic fact that centralized entities are central points of failure that can be easily squeezed and censored. Decentralized projects like Bisq are crucial for defending bitcoin's privacy and fungibility, and to keep bitcoin usable by unbanked people.",2018-09-18 01:14:13
e653ffo,SnapshillBot,40,"But it doesn't really matter what you think. Bitcoin has come to destroy all governments and bring about the libertarian utopia of my dreams. This is inevitable and you will have no choice in the matter. Your ability to oppress other people via government thugs is coming to an end very soon. Hail Bitcoin

Snapshots:

1. *This Post* - [archive.org](https://web.archive.org/20180917165625/http://www.reddit.com/r/Buttcoin/comments/9gm2h7/some_fine_specimen_from_rcryptocurrency_daily/), [_megalodon.jp\*_](http://megalodon.jp/pc/get_simple/decide?url=http://www.reddit.com/r/Buttcoin/comments/9gm2h7/some_fine_specimen_from_rcryptocurrency_daily/ ""could not auto-archive; click to resubmit it!""), [removeddit.com](https://www.removeddit.com/r/Buttcoin/comments/9gm2h7/some_fine_specimen_from_rcryptocurrency_daily/), [archive.is](http://archive.is/F0mdL)

2. https://www.reddit.com/r/CryptoCurr... - [archive.org](https://web.archive.org/20180917165628/http://www.reddit.com/r/CryptoCurrency/comments/9ghvvu/daily_discussion_megathread_september_17_2018/), [_megalodon.jp\*_](http://megalodon.jp/pc/get_simple/decide?url=http://www.reddit.com/r/CryptoCurrency/comments/9ghvvu/daily_discussion_megathread_september_17_2018/ ""could not auto-archive; click to resubmit it!""), [removeddit.com](https://www.removeddit.com/r/CryptoCurrency/comments/9ghvvu/daily_discussion_megathread_september_17_2018/), [archive.is](https://archive.is/pKYUE)

*^(I am a bot.) ^\([*Info*](/r/SnapshillBot) ^/ ^[*Contact*](/message/compose?to=\/r\/SnapshillBot))*",2018-09-18 01:56:31
