Comment ID,Author,Score,Body,Publish Date
e5692wn,Howyoudooooing,225,"https://www.reddit.com/r/Bitcoin/comments/2y97hl/the_next_bubble_the_10k_25k_one_will_be_epic_and

Will history repeat itself? 🐒",2018-09-01 04:22:21
e56a06a,OfficialHermanCain,118,This is good for bitcoin.,2018-09-01 04:36:04
e56jyrb,vrocha2020,104,100k per bitcoin? such lol. Never going to happen dude. And I'm a Bitcoiner all through. $10k this year would be a stretch.,2018-09-01 07:12:12
e57f7x9,JackVideogames,102,Reminds me of that guy that went asking around for a free gaming rig that had crazy specs because he was living in some impoverished South American country and he wanted it to support his family mining Bitcoin.,2018-09-01 19:50:32
e566wok,life_is_cheap,98,"Sound like OP left out some crucial details in his story. When he initially gets questioned by the bank about where his money is coming from why does he feel the need to lie instead of just tell them he was bitcoin trading? He said he told the teller it's for renovations or something. He must have known he'd done something illegal, which according to the comments below was possibly not paying tax on the capital gains. But OP didn't mention that in his post. 

Looking at this point A to point B; The bank question OP about where his money is coming from. Instead of telling the truth he tells them lies. They decide to start investigating him and thus confiscate (freeze?) the funds in his account. OP potentially was not paying tax on his bitcoin profits and knew that not only would he not get his 13k in savings back but he'd probably owe up to 50k in back taxes to the ATO after being investigated. Conclusion: OP wants to suicide because he'll be charged with tax evasion and end up owing possibly over 50k to the ATO. I believe this is a common scenario in the US involving the IRS and business men caught evading taxes. ",2018-09-01 03:50:10
e56hfyo,macabre_irony,95,Invest in bitcoin and I get some insane PRs?,2018-09-01 06:30:35
e565n1f,ztsmart,84,"This is why Bitcoin is such a game changer.  It provides people an opportunity to opt out of inflation.  Once people realize the advantage of doing this, it will make seigniorage impossible, which will apply economic constraints to size and scope of government.

I do not think it is an overstatement to say Bitcoin will free mankind from the bondage of oppressive and war-loving governments.",2018-09-01 03:32:01
e57po4b,derrickshields,77,"It was the right thing to say. Patents have no place in Bitcoin, period. Thanks for taking the high road. ",2018-09-01 23:49:00
e56jcqn,zwarbo,69,"Read the comments, makes you think don’t they.

“10k per bitcoin? such lol. Never going to happen dude. And I'm a Bitcoiner all through.
$300 this year would be a stretch.“

I want that 700B marketcap back damnit! !remindme in 5 years.

Edit: i said 700k, don't want that to happen :p.",2018-09-01 07:02:07
e56cwh5,tugadoc,57,"[Incredible, a master of the craft.](https://www.reddit.com/r/Bitcoin/comments/1ee0bc/feds_reveal_the_search_warrant_used_to_seize_mt/c9zeq75/?context=3)",2018-09-01 05:19:03
e56mwom,[deleted],57,"Why was there such a vicious cult around no mans sky? Some people just have some weird mental issue where they go full zealot on things. It's not just games, look at some of the bitcoin crowd or the people who practically worship marijuana. People read what star citizen promises, choose to believe it will surpass their wildest dreams, and are unable to even accept alternatives",2018-09-01 08:02:29
e56ojnc,Coinstage,53,"The real truth is that we're being raided. This is classic take-over tactics, they try to invade our group, create artificial in-fighting that didn't previously exist and use vote-bots en-masse to promote their agenda. Now we're at a point of their take-over process where they are getting normal users riled up to join the artificial fight they created.

There's many good reads on the topic, but this one in particular is stored on the Bitcoin Cash blockchain https://bookchain.cash/read/qzzzzzy9qx93jrvh4eguejk96uexe590dyx35yxe3j",2018-09-01 08:31:41
e55tbrf,REbr0,52,"What the fuck is up with all you virgin bitcoin losers coming here to finger-wag? 

How do you figure, as a person with a completely warped sense of good/bad/right/wrong, that your criticisms would do anything other than invigorate us? Is it because you’re insanely fucking naive and have no clue how the world works? 

All you dipshits are the same. You’re like early-to-mid twenties, and found some loud confident guy in the internet, and you’re too fucking stupid to realize he’s a huckster, so you throw yourself fully behind this asshole and completely deluded yourself into thinking that the problem with the world is the *mean people*. 

Jesus fucking Christ.

When the world is melting your logic and reason bullshit won’t mean anything at all. Quit being such a pearl-clutching baby and reckon with you awful bullshit. You suck so much ass.",2018-09-01 00:37:35
e55rm64,tschwib,51,100.000$ bitcoin!,2018-09-01 00:13:23
e56h0ya,BitcoinXio,48,"Stress Test day is a community initiative to test Bitcoin Cash and see how it scales and handles large blocks (by filling them with a lot of txns). 

You can read more about it here: https://stresstestbitcoin.cash/

You can help stress the network by using this tx script here: https://www.scale.cash/ 

**The planned Stress Test date is Sept 1st 12:00 UTC (about 14.5 hours from now)**

*** 

**EDIT: Stress Test day has officially started!**",2018-09-01 06:23:50
e563zxl,Maave,47,Dr Bitcoin practices informed consent,2018-09-01 03:08:19
e57elcn,MobTwo,43,"The success of a cryptocurrency is based on its community. Having said that, I feel really disappointed that Craig was so disrespectful in doing what he did. Does Craig feel that disrespecting people and being openly hostile to everyone will help promote Bitcoin Cash's cause? I agree with Craig's goal of making BCH the one money for the world but I cannot agree with the way he is going about doing this.

And that's because the strength and value of a cryptocurrency comes from its community.",2018-09-01 19:27:56
e56s3qv,ih8x509,42,I cant wait till i can go to a vending machine and pay 0.00000150 Bitcoin to get me a plastic submachine gun printed in 30 seconds,2018-09-01 09:37:09
e57f8ft,jonas_h,36,"Thanks for this.

&gt; I do not know why there were two conferences.

&gt; What was strange about the CoinGeek article was the timing.

&gt;  perhaps there is some other explanation

Disinformation. Lies and propaganda.

&gt; Dr. Wright suddenly decided to leave the conference, exclaiming ""Lies and Bullshit!""

&gt; although other nChain representatives denied that the ABC answer was ""bullshit""

Apparently nobody can back up Craig's bullshit claims.

&gt; When pushed, nChain was unable to give objections to OP_CHECKDATASIG, stating that they had not investigated it enough or that the people who could explain were not present.  

Because Craig is the only one with objections and they cannot be logically explained.

&gt; Canonical transaction ordering (CTOR) was treated in a similar manner, with only the briefest explanation of objections given (that it involves Merkel insertion rather than appends) and no further discussion took place.

Kind of worrying as there are actual arguments against it.

&gt; There was little to no attempt to compromise from anyone.

Looking forward to a split then. Is Bitcoin Unlimited the only ones who actually work towards a compromise, which everyone seems to want?

&gt; Unfortunately, Calvin Ayre did not attend.  I think a successful compromise or agreement would have been more likely in his presence. 

Oh you sweet summer child.",2018-09-01 19:51:03
e5751zk,jawknee21,34,Invest in Netflix and bitcoin. ,2018-09-01 14:02:30
e55vzt5,BeardMilk,32,I was wrong. I made about 26k in profit on the 40.26 bitcoin I owned. It could have been about 800k if I held it.,2018-09-01 01:15:12
e566zra,ajmonkfish,29,"Ether issuance reduction, this is great news for bitcoin!",2018-09-01 03:51:26
e5612ly,The_BCH_Boys,29,"Since Contrarian is going through every post and since we greatly respect Ryan Charles, it is worth mentioning this :

His evidence for saying all of this is timestamped in the conversation we did with him: [https://youtu.be/YtHnBTtzh4k?t=1785](https://youtu.be/YtHnBTtzh4k?t=1785)  


Clemens Ley and himself met Craig after Clemens independently concluded Bitcoin is Turing complete.",2018-09-01 02:26:46
e561ekq,mythriz,29,Bitcoin mining company,2018-09-01 02:31:28
e56kl4o,BitcoinXio,29,Because Bitcoin Cash cares about community. Companies are welcome to participate also. ,2018-09-01 07:22:23
e56ng1h,Cpt_Soban,28,"So, dodgy Bitcoin trading + expired ID + LYING to bank staff + dodgy transactions + NOT PAYING TAX?

  No sympathy from me. He's a fucking moron. And for once the bank did the right thing.",2018-09-01 08:12:03
e57o2z7,mummouth,28,"&gt; Surely whatever the future brings, it will bring UNTOLD supercomputing power. Computers are already that much better at cryptographic problem-solving, thanks to Bitcoin itself.

Future quantum computers will be able to derive private keys from public keys using [Shor's algorithm](https://en.wikipedia.org/wiki/Shor%27s_algorithm). Classical computers will never be able to do so, because, no matter how sophisticated they get, they run on atoms, and there are not enough atoms in the world (or even the solar system) to build a classical computer large enough.

&gt; SHA256 hash may be high-grade for its time

It's more than that. The standards that are set by NIST take your considerations into account. They are designed to be future-proof. It would be bad practice to use a cryptographic primitive 10 times too hard for the best supercomputer to break; that would simply be broken by the best supercomputer 4 years down the line, or a laptop after 15 years. So they make them many, many orders of magnitude too hard to solve.

&gt; but am I correct in saying that all you need to beat it is more raw computing power? A large amount, but... no higher degree of complexity. Just power and time.

Hashing is a different cryptographic primitive from dual-key cryptography. You can't unhash hashes, even with a quantum computer. You are correct in saying it is just a matter of enough time and power, but remember that there is only so much time and power in the observable universe. There are about 10^80 [atoms in the universe](https://en.wikipedia.org/wiki/Observable_universe#Matter_content). Between spin of quarks, momentum of electrons, etc., each atom has around 10^2 bits of information, so there are around 10^82 bits of information in the universe. From the Big Bang to the heat death of the universe is only about 10^18 seconds, so you're on about 10^100 operations over the lifetime of the universe. There is simply not enough time and information around to compute [certain mathematical problems](https://en.wikipedia.org/wiki/Shannon_number), like [cryptographic standards](https://www.reddit.com/r/theydidthemath/comments/1x50xl/time_and_energy_required_to_bruteforce_a_aes256/).

&gt; It does seem implausible, but presumably anybody who accomplished this task would end bitcoin and destroy a 100 billion dollar market. 

Yes, but first they'd have to destroy the observable universe to turn it into a computer, which is a bigger problem.

&gt; Presumably Satoshi knows precisely how the hashing function works. 

It's open knowledge. Everyone knows how SHA-256 works.

&gt; Wouldn't that help him to reverse engineer keys? If not, why not?

No, because https://en.wikipedia.org/wiki/Kerckhoffs%27s_principle

You are asking very good questions.",2018-09-01 23:21:43
e574x15,jonald_fyookball,28,"Do you mean the SV client or the general idea of satoshi nakamoto whitepaper?  I find the lack of distinction between the two very confusing, perhaps done intentionally by some.  Bitcoin ABC, BU,XT all support bitcoin peer to peer electronic cash which is the same vision of sn. Equating the SV client w the concept is a politically expedient ambiguity. ",2018-09-01 13:59:00
e5665oi,SupahAmbition,27,Satoshi recusing himself from bitcoin and Craig forcefully including himself in the ownership of Bitcoin demonstrate two opposite personalities. You can't reconcile the two. ,2018-09-01 03:39:27
e57jwk9,fiah84,26,"and just now a 13,5 MB block:

https://blockchair.com/bitcoin-cash/block/545969",2018-09-01 22:01:43
e585x6a,Kill_teemo_pls,242,"A vegan, bitcoin holder and f2p swgoh player walk into a bar. Which one tells the bartender about it first ? ",2018-09-02 04:05:48
e58cvs7,littlegreenb18,154,To go buy lots of bitcoin,2018-09-02 05:57:19
e59bnlv,webupnz,95,Scrapes together $100 per paycheck and buys BTC as mBTC as it glacially moves towards owing a whole Bitcoin....then sees trading sheets of people selling 100BTC like its M&amp;Ms....,2018-09-02 18:24:25
e591tna,TrueButNotProvable,84,"Let's see. The show ended in 2006, so 12 years would have passed since then.

(I didn't think it was going to become this long, but I was having so much fun I almost kind of want to develop this into a script or fanfic. Would anyone be interested in that?)

**Malcolm**: By now, he *probably* would have gone through university -- it's possible he's still working on his PhD, but my guess is he wouldn't take very long with that. I'd like to think that he somehow tried to work his way to being president like Lois says, although that's a bit odd, since his interest is more in science than in politics. However, as a compromise, perhaps he's working his way up the ladder to be a science advisor for some government agency.

**Reese**: Here's an idea. It's a little silly, but hear me out. 

Reese works as a janitor for a while, but works on his cooking skills in his spare time. One day, he decides to apply to compete in Hell's Kitchen with Gordon Ramsay. The producers see his tape and let him on, because they're sure his aggressive nature will cause lots of drama which will make for an entertaining show. Gordon notices Reese's rebellious nature, and tries to break his spirit. But Reese is so used to having criticism yelled at him -- from years of living with Lois, to working in the meat plant, not to mention being in the military -- that he just shrugs it off. Eventually, Reese wins the competition and becomes a famous chef, winning Gordon's begrudging respect along the way.

**Francis**: Francis is still working for the same business he was working for when he graduated, and has worked his way up through middle management. He and Piama have two kids and they live in a nice house in the suburbs. However, whenever Lois calls or visits, he still pretends he's a free-spirited burnout and tries to hide his success.

**Dewey**: He's worked his way through Juilliard studying piano performance, and works as an accompanying pianist on Broadway. However, I think he'll get disillusioned by the glitz and glamour, and he'll eventually take his fortune and use it to fund music education programs for underprivileged children as well as special needs children.

**Jamie**: We don't know much about Jamie or the new baby. I suspect Jamie will look up to Dewey in the way that Malcolm and Reese look up to Francis, but in a more positive way (i.e. he'll see Dewey as a role model).

**Lois**: Lois begins to go through menopause. Hal is about to console her about the inevitability of aging, only to find out that she's ecstatic about it -- it means they can have all the sex they want, and not have to worry about having any more kids. (Sure, menopause comes with its own inconveniences. But compared to giving birth to, and raising, all of her kids, it'll be a walk in the park for her.)

The only kids left in the house are Jamie and the new kid from the last episode. But they're old enough to take care of themselves most of the time, and they're not nearly as much of a handful as (say) Reese or Francis. So, Lois finally has the time to be a manager at Lucky Aide.

**Hal**: This is another silly one, but hear me out.

Sometime in 2012, one of Hal's poker buddies mentions some new thing called ""Bitcoin"". Everyone at the poker table agrees that you'd have to be a complete idiot to invest in something so risky. Hal agrees with them at the poker table, but being the impulsive risk-taker he is, he secretly goes to the internet later that night and finds out how to invest in Bitcoin. He presses the wrong button and accidentally invests his and Lois's entire life savings (only a few hundred dollars).

Hal has trouble figuring out how to get his money back, but his employers see him stressing out at the computer constantly checking the price of Bitcoin. They assume he must be working hard, and start giving him raises and promotions. Hal notices this, pretends to work even harder, and eventually refills their savings account so Lois never notices anything was wrong.

When Bitcoin eventually skyrockets in price, Hal finally enlists Malcolm's help in figuring out how to get the money -- which Malcolm does, for a percentage of the cut. Now Lois and Hal suddenly have hundreds of thousands of dollars on their hands, which they use to fix up the house. The neighbours become suspicious and tell the police that they suspect Hal of being the meth kingpin ""Heisenberg"", who Hal has an unfortunate and coincidental resemblance to.

**Craig**: Now I'm having too much fun putting a story together. Let's see if I can merge this with Lois's and Reese's stories.

Craig continues to work at Lucky Aide even after Lois becomes manager -- in fact, he gets a secret perverse thrill out of her being dominant and ordering him around.

When Reese competes in Hell's Kitchen, Craig cheers him on, being the supportive roommate that he is. When Reese decides to start a restaurant, he asks Craig to be his business partner -- after all, Craig supported him the whole time, and Craig does have management experience from Lucky Aide.

Craig gives a tearful goodbye to Lois (Lois tells Craig that she's busy right now, and if he wants to quit to start a restaurant with Reese, he should do it. Plus, if he's going to be working with Reese, obviously she'll still see him around.)

Craig is a bit dejected to know that he won't be able to spend as much time with Lois. Soon enough, Reese introduces him to the accountant they've hired as a contractor for the restaurant. She has a commanding presence, tells Craig exactly what he needs to do, and looks and acts a lot like Lois. Craig immediately falls in love, and he works up the nerve to ask her out. She says, sure, what the heck.

**Stevie**: Stevie gets wealthy working in quantitative finance, and uses his wealthy to start a venture capital firm investing in technology. He's achieved a reputation as ""Elon Musk on wheels"". He and Malcolm still call each other regularly. Malcolm is secretly envious of Stevie's financial success, but he also knows it's good to have powerful friends in industry.

EDIT: Spelling",2018-09-02 13:17:05
e57xrql,MobTwo,84,"For any Bitcoin Cash supporters reading this, take a moment and think critically.

Craig disagreed with where the entire Bitcoin Cash community (Roger Ver, Haipo, Jihan, Rick Falkvinge, Jonald Fyookball, ABC, BU, etc) is going.

Even if you're a blind Craig supporter, I hope there is some sense left in you to think for a moment. Is it more likely that the problem lies on a single person or the entire BCH community?

If Craig wants to make BCH the global p2p money, I am all up for it. But if he wants to split/destroy the community and start smearing anyone who disagrees with him, then I simply cannot see myself aligned with such behaviors.

Even if Craig is part of Satoshi, such behaviors cannot and should not be tolerated. The value and strength of a cryptocurrency is dependent on the community behind it. You destroy the community and there is no value left. And more than anyone, Satoshi should know this.",2018-09-02 01:58:03
e59k9eb,runninman20107,83,Bitcoin was about $57 at our current market cap,2018-09-02 22:48:48
e58buqm,C00mbsie,75,"OK OP I think you misunderstand what market cap really tells you.  Saying this stuff makes crypto look bad, and is why people think that crypto  creates money out of ""thin air."" I can go find some no volume shit-coin which last traded at .01c and is sitting at 1m MC, and then put a buy order in for a couple coins at $100. If someone (probably out of a group of 2 people who actually own the coin) fills that buy order(why would they not), then the coin is all of the sudden 10000% up, and now the market cap is also x100 up. So now the market cap is 100m. Does that mean I created $100m worth of money? No. There is a couple 100 dollars in the coin, and that's all there is. Not a single damn person would be willing to buy at $100. Market cap is an extremely poor indication of how much money has been put in or can be taken out of a crypto asset that has low volume/liquidity. Even for Bitcoin it is estimated that each dollar put into BTC raises the MC by $25-$50. 

&amp;#x200B;

Think about some top 10 like Cardano. It's market cap is $2.8 billion. If everyone wanted to cash in their Cardano for USD, would all that Cardano become 2.8 billion? No because the volume of Cardano is only 68M. Not near enough volume to buy up 2.8B worth. 

&amp;#x200B;

Whoever did this probably filled his own buy and sell orders just to mess around. If he did not, then the ""scammer"" probably lost a bunch of money. He bought the coin for 1600, and then sold it for 850 (You can tell because it is vertical lines, which means it was a single buy/sell order).  This is a non-issue.",2018-09-02 05:40:56
e59koxm,Der_Bergmann,69,"Bitcoin Unlimited performed excellently during the StressTest. 

With xthin, graphene and parval it employs the most advanced scaling technologies. Even old 32bit old laptop nodes have been able to keep up with blocks up to 12mb, while middle class systems did not even really notice the biggest blocks during the test.

The system performance is glorious. I don't know if BitcoinABC performed worse. A lot of them broke during the test, but it might be because they run on low-grade systems or VPS credits run out (1st of September!). 

It seems BitPrim was taken out nearly entirely. Only 2 of 32 nodes kept running.

The decrease of ABC nodes and the growth of BU nodes might be caused by political reasons. BU appears to be the only client which is focused on keeping the chain together and enabling the ecosystem to find a consens over hardfork changes, while other imps rather try to impose their consens on the ecosystem.

Running a BU client will be the only safe solution when the hardfork gets ugly, while ABC's course seems to be ""Hope that we will or go down with us."" With BU it is ""Try to push your will, but if you fail, follow the hashrate.""

Edit: Same as about BU can be said about XT. Also, XT nodes are on the rise. ",2018-09-02 22:57:53
e58o2t5,BTCorBCH,65,"TIL if you are a fan of a coin you are automatically a 'bridgading shill'

Let it go /r/cryptocurrency, some people enjoy pushing the limits of what bitcoin and crypto can do. ",2018-09-02 09:02:16
e598xm7,trentinparadise,64,"I like these types of enthusiastic and positive posts, but can I make a small correction.. Lightning is working towards 'helping' Bitcoin to scale, but it's not the sole solution for scaling Bitcoin. But its great step in the right direction! ",2018-09-02 16:39:54
e57zvqo,TheWaterBug,63,"Alright, here's $23.15 worth of Bitcoin. Don't spend that $19.56 all in one place!",2018-09-02 02:30:01
e59ju0j,hybridsole,58,"Babies' first words: ""Bitcoin (BCH) is the real bitcoin""",2018-09-02 22:39:26
e57vuc0,RSZephoria,55,Bitcoin only my man,2018-09-02 01:28:17
e587lh2,CryptoNoob-17,49,"First he said 28k by end on 2018. Then it came down to 25k. Is he predicting 20k now. Even a broken clock is right twice a day.

Making bitcoin predictions is so 2017. Too many people bought bitcoin at $12,000 - $19,600 and got burned. It is gonna be hard to get back up to ATH.",2018-09-02 04:33:16
e597q9g,dustymcp,47,Dont ask for advise here people Will tell you to buy terrible coins like verge. Buy some bitcoin and start researching from there.,2018-09-02 15:58:09
e598naz,iwakan,47,"Lighting is not proven at scale yet. No one knows if it is truly up to the task of handling the potential traffic. And it is not proven in reliability either. Bitcoin's main advantage is that it is relatively simple and robust with a 9 year track record, but lightning is not. Just because it is built on top of bitcoin doesn't mean it is equally secure, it needs to prove itself all over again.",2018-09-02 16:29:40
