Comment ID,Author,Score,Body,Publish Date
e5pnzu8,WWWWWWWWWWWWWWWWWW1,87,"This bear market has been absolutely brutal, and it seems like the sentiment is the complete opposite of where it was in early January, which makes me tentatively bullish. This sub is overrun with trolls and fudders that are almost certainly margin short along with the rest of the greedy herd, so I've compiled some links to counteract their FUD and hopefully present traders with a more accurate picture of Ethereum and why its still the best opportunity in the world right now.

1. [Solidity searches for Eth development have maintained their volume this year despite the massive drops in price](https://trends.google.com/trends/explore?q=solidity)
2. [There have been over 1 million queries on StackExchange related to Ethereum development, again showing massive dev interest](https://data.stackexchange.com/ethereum/queries?order_by=everything)
3. [Consensys was recently named as one of the top 50 startups in the US. They build exclusively on Ethereum.](https://www.linkedin.com/pulse/linkedin-top-startups-2018-50-most-sought-after-us-26-50-daniel-roth)
4. [No dapps? Here are 40 working dapps you can use today](https://media.consensys.net/40-ethereum-apps-you-can-use-right-now-d643333769f7?_hsenc=p2ANqtz---D_66Kyc-m0IxqoP2FYq58J8Ym74u_ehRwigyGslOMoTaAPN32iGmkEZmd7klJFgxh9_UV-rGCqDFn6-lWaZdmBxtBQ&amp;_hsmi=65783568)
5. [Week in Ethereum shows dev updates across the Eth eco-system, and clearly shows how devs are actively working behind the scenes building the future](http://www.weekinethereum.com/)
6. [Ethereum addresses are still growing every day at an unprecedented rate with no sign of slowing](https://etherscan.io/chart/address)
7. [0xtracker shows DEX volume has been ticking up solidly this year showing increasing usage](https://0xtracker.com/)
8. [The most successful investment fund in the US (A16Z) has a massive Crypto Canon that mentions Eth much more than any other alt and even Bitcoin. They are also actively investing in Eth based startups](https://a16z.com/2018/02/10/crypto-readings-resources/)
9. [Go Ethereum is one of the most actively maintained Git repos in Crypto. Commits happen almost daily showing developer dedication and progress into the future](https://github.com/ethereum/go-ethereum/graphs/commit-activity)
10. [Every single day dozens to hundreds of new smart contracts are deployed to Ethereum, which is the whole point of using the network. Smart contract deployment numbers have been increasing all year](https://etherscan.io/contractsVerified)

BONUS EDIT:

11. [ETHBerlin just finished, and has posted a list of all the top notch projects building on Eth. Dapps range from social media, utilities, trading tools, to cutting edge SNARKs implementations](https://ethberlin.devpost.com/submissions)",2018-09-10 16:51:32
e5okehy,FireFork,77,Send all the gamers to the bitcoin mines where they belong,2018-09-10 04:56:53
e5o2y8y,Supernova752,70,"You're not missing anything here, everyone else is just not paying attention anymore or is delusional thinking wall street wants introduce their platforms they've worked on for over a year only to pound the price and volume to zero.  In the next 6 months, it's very likely that Bitcoin will be listed on the stock exchange and available to pension funds, 401ks, and every grandpa who wants to add 1-2% of a risky investment to his stock/bond portfolio.  Bakkt has specifically stated that they are focusing on mass adoption and long-term investors - not traders.
      
Bitcoin has been repeatedly bouncing off of strong support around $6k.  Do we really think that it won't go up over the next 6 months as Bakkt, NASDAQ, and the ETF are introduced to the market?  IMO I think we'll enter another bubble, say up to $25-30k and then drop to $10-15k, and I fully intend to take advantage of it.",2018-09-10 00:43:24
e5ocz5w,hallucinoglyph,64,"The Holo fuel value being tied directly to the network’s power and demand is the one reason this crypto will actually have any real value at all! And the more machines that come online, the more buying power Holo fuel will have = price goes up. That is why people are buying HOT tokens now (placeholder ERC20 “coupons”): we expect the price to shoot up when we flip over to Holo fuel.

Don’t kid yourself - no other cryptos are taking this agent-centric approach. It is entirely novel and unbelievably more efficient than the forced centralized perspective of a blockchain. They’ve been working on Ceptr/MetaCurrency/Holochain since before the Bitcoin whitepaper.  Word is getting out and I don’t see Holochain/Holo failing if they can deliver on their promises. And people are drooling over the code they’ve made available so far - I think they’re likely to deliver. 🤙",2018-09-10 03:15:03
e5pbcsy,theredkrawler,58,"Sweet, so OP either paid $10 for a car wash, or $100. Or $85. Or $2.

This is good for bitcoin.
",2018-09-10 11:48:46
e5q298p,olausonxd,56,"Fast han skrev att han slår vad om 1 000 kr i Bitcoin, 1 000kr i Bitcoin är fortfarande 1 000 kr. Hade han skrivit att han slår vad om 1 Bitcoin så hade det varit en annan femma... ",2018-09-10 23:13:28
e5pgxj4,AyChihuaxua,49,"I downloaded Coinbase after a coworker of mine kept going on and on about crypto.  This was shorty after the big dip in prices.  I ""invested"" about $100 in various coins, and watched them all dip about 25%.  No biggie.  But /r/cryptocurrency is just... well... I have no idea what the fuck is going on.  Every day it's some new currency being talked about by someone, or how Blockchain is now being implemented by so and so.  It's painfully obvious that the big reason crypto boomed is because the media kept talking about it and suddenly everyone wanted some.  Now that the media attention died down, Bitcoin seems to be pretty steady around it's current price.  

The idea behind the technology is great, and it's honestly revolutionary in a way.  But what I see now is millions of people trying to get in on the ground floor of a new currency that will make them millionaires, and I just don't see that happening.  I think Bitcoin will stick around for a while, but it will only be successful in the long run if it gives the average consumer some incentive in using it that goes beyond being an investment.  ",2018-09-10 13:29:50
e5p24u4,PMmeSquattyPotty,47,"

[Here is the graphic of... **""How fully developed of a human""**, various groups were  ranked by alr-right Russiapublicans.](https://cdn.vox-cdn.com/uploads/chorus_asset/file/9054793/Screen_Shot_2017_08_15_at_2.19.58_PM.png)

---

One would naturally ask, ""How does a group of people get so pumped up on hate..?""

[God's Own Party](https://youtu.be/TFSA0IPMqew) is a book about how the Christian Right became.

It started in the 1930s when big business tried and failed to push their anti taxation *(only rich paid taxes back then)* small government message... aginst Trustbusting Roosevelt.

They failed because people saw through their BS... so they did a study finding **preachers to be ""the most trusted men in 1930s America""**

Acting on this, their efforts then focused on disseminating their message through donations to ""friendly"" churches. 

Before this, religious people didnt have any particular political affiliation. It's in the book. That's how it started... 

...then in the 1970s after Nixon felt the media was mean to him over Watergate... Fox, Rush L, and the conservative media movement begun, intended as a right wing propaganda machine. That is detailed in [Brainwashing of my Dad](https://youtu.be/Qh3TeTxgNVo)

**Conclusion** - This all adds up to the rightwing ""followers"" being like slave computers in a bot net, albeit used as human voter slaves... 

Unlike a bot Master using your computer's processing power like a slave to mine Bitcoin, or some other task.",2018-09-10 09:20:49
e5onuyi,Soraka_Is_My_Saviour,47,"Yeah, that is a reason why some people will only do friends and family on PayPal. It's really common for peer to peer bitcoin to be bought that way. It allows you to bypass the ID requirement to buy crypto.

I assume that eventually PayPal will just ban you if you do it enough. Amazon is similar in the buyer always being right, but they will ban you for too many returns or refunds.",2018-09-10 05:44:20
e5omps3,ThomasZander,43,"There is no block size limit in BCH, the idea to 'remove' it makes no sense. Its already removed.

The idea to upgrade it to 128MB (which is really a [minimum maximum](https://www.yours.org/content/a-brief-look-at-bitcoin-cash-block-sizes-386a7e2b902a)) while most clients can't handle that, that is just irresponsible.

The people pushing this don't seem to care about little details like facts.",2018-09-10 05:28:09
e5pkp6e,thinkscotty,43,"Anyone who says that crypto investing is anything other than gambling is seriously fooling themselves and others. 

I had a very serious conversation with a guy on here right when Bitcoin was hitting 10k. He said Bitcoin was projected to peak at over 100k. This was at the start of its big rise. He said he had most of his porfolio in crypto. I don't even want to know how much that poor sap lost.

I mean I guess there's time. Maybe it'll turn around. But it's gambling.",2018-09-10 15:04:38
e5pd2xy,cryptorebel,42,"Interesting factoid, Charlie Lee once said [""Maybe I'm wrong, maybe Bitcoin Cash is Bitcoin. Maybe in the future Bitcoin Cash does overtake Bitcoin and it becomes the real Bitcoin.""](https://old.reddit.com/r/btc/comments/8ank5a/charlie_lee_on_youtube_maybe_im_wrong_maybe/). ",2018-09-10 12:17:26
e5py4yo,chazmuzz,41,"&gt; centralised bad, decentralised good, trust me pls

~ bitcoin worshiper",2018-09-10 22:00:13
e5pd72l,cryptorebel,40,Another interesting factoid: [Charlie once also admitted that Satoshi is probably in the big blocks camp along with other early adopters](https://www.reddit.com/r/Bitcoin/comments/40m9l5/maybe_satoshi_is_in_the_big_blocks_camp/),2018-09-10 12:19:25
e5pwex9,lazarus_free,38,"The problem is that you are treating Bitcoin like a stock from a well established company. It is not, it is mostly like investing in a start-up with a binary outcome, you can be right or not about it.

So focus on the technology developments and hold if you think it is going to be successful. Don't look at the price. If you are right does not matter if you bought at 2,000 at 6,000 or at 10,000.",2018-09-10 21:24:16
e5peiv0,copharion,38,Sweet. Our bitcoin is now literally worth garbage.,2018-09-10 12:41:23
e5ondrs,NotSeeTroll,37,Bitcoin is popularizing the notion of sound money supply. Bitcoin is succeeding where the Austrians failed. ,2018-09-10 05:37:38
e5pchy5,theredkrawler,37,"Yeah I'd like my car washed tomorrow afternoon please

Certainly sir, just initiate your bitcoin transaction now and by the time you arrive it should almost have completed. 

Sounds convenient! What do I need to do to pay?

Why it's easy! Just create a wallet with some software you found on best-bitcoin-software.xnation.feralhosting.com/totallyfree.php, find a market named something like CoinBitJarFlex100, pay real currency for pretend currency at the market rates for that hour less a random percentage fee based on the lunar cycle of the moon, wait 48 hours for half a dozen Chinese server farms to approve a transfer to your wallet, then open up a website in France, enter our 87 digit secure code, initiate a transfer from your wallet to our wallet and voila! Assuming some Russian kid didn't steal it from you in the mean time, in just one week you can pay for a car wash.

Thanks mate, the future sure is amazing. 

By the way don't delete your wallet file or all your money is gone forever. This includes losing your phone, dropping your phone, having your phones internal SD corrupting, or having the bloke from Telstra do a factory reset on your phone next time you're in there complaining about yet another billing issue.



",2018-09-10 12:08:11
e5obcez,zhell_,36,"miners are big blockers. They want to collect lots of fees as bitcoin becomes PP cash for the world. That's why they LIKE BCH, but mine BTC for the profit. That's why BCH can survive as a minority chain while BTC could not and would be attacked.

Basically you are right, we are an existential threat ti BTC and that's why we see so much trolling, manufactured dissent and vote manipulation in this sub",2018-09-10 02:52:41
e5q2gkj,fallenkeith1990,35,"I hope you guys have an awesome day today! Please don't stress out about crypto, crypto is here to stay and your health (both physical and mental) should come first. If you aren't feeling happy, try to go outside and get some fresh air and have some fun, it'll help get your mind off of the market :)

Also if it's any consolation, bitcoin has crashed many times throughout its history. A lot of you may be new to crypto but if you remember the previous years during the $1000 ATH and the 2013-2014 market, it's eerily similar to what's happening in this market. Bitcoin will go on another bullrun in the future and historically, it always happens 5-6 months before the next halving. Not only that but bitcoin is still up in price a considerable amount compared to last year as well as the fact that the volume is more than 300% higher compared to previous years. With adoption growing as well and much more structure in-place, it's quite possible for bitcoin to hit new ATHs in the near future.
",2018-09-10 23:16:44
e5oxh04,it_ends_with_a_D,35,"Yeah, I know that's your interpretation of it. You didn't need spell out the example (though considering, you probably have that on file for copy/paste). 

I'd contend there is a bit of ambiguity. Your argument is that the multiple-sub-rules part is the dominant, controlling clause. But it seems silly to use a word like ""isolated"" for community management if that's not really the case. But then again, when has reddit ever been anything but vague? (งツ)ว It's obviously apparent that you can do whatever the hell you want as mod. 

I swear when the revamped guidelines were first brought up the first reaction from the admins was that auto-bans should be frowned upon. I assume that mods like, well you, pushed back on that with the admins. If I wasn't too lazy, or cared enough, I'd try to dig up those discussions to see if my memory serves me. 

Regardless, this is all good for bitcoin.",2018-09-10 08:06:49
e5pfe28,Kain_niaK,35,"Charlie Lee cloned Bitcoin when it was not needed, and when it was needed and we did clone (Bitcoin Cash), he called it a scam. 

",2018-09-10 12:57:37
e5pfg09,Pontlfication,35,"Well, if you read satoshi's posts on the original Bitcoin forum you'd say ""no shit"" ",2018-09-10 12:58:37
e5o7xx0,savage-dragon,34,"Want to know the best way not to give a fuck in this shitstorm of FUD articles and bullshitteries? Google Bitcoin 2014. Search for all articles mentioning Bitocoin and cryptos shortly after its ""crash"" in 2013. See how similar the sentiments back then vs. the sentiments now. It's all the fucking same. All the same financial ""journalists"" trying to spread fear and trying to sound smug in a ""we told you so"" kind of voice. Why the fuck should you even care what those people say. Keep calm and remember why you decided to put in your money in the first place.",2018-09-10 02:03:46
e5ozozr,bobbyhamburger,32,"Dude, you’ve made 3 posts about this in the past 2 months and you’ve been informed of the consequences each time.  

Call your family, borrow from your girlfriend, cash in your bitcoin, do whatever it takes to get out of the united states if you want to enjoy the privilege of visiting in the future. ",2018-09-10 08:41:20
e5p1x4c,entropywins9,32,"Also:

Satoshi Nakamoto (Bitcoin)

Vitalik Buterin (Ethereum)

Alan Turing (WWII codebreaker, a founding father of computing)

Bill Gates &amp; Paul Allen (Microsoft)

Marc Andreessen (Netscape, VC)

Zuckerberg (FB)

Jack Dorsey (Twitter)

Larry Ellison (Oracle, one of richest people in the world)

Larry Page and Sergey Brin (Google)

Jerry Yang (Yahoo)

Guido van Rossum (Python)

Sid Meier (video game creator who put his name in the titles)

Bram Cohen (Bittorrent)

And within coding at least, those competitive coder wunderkinds, like [Gennady Korotkevich](https://en.wikipedia.org/wiki/Gennady_Korotkevich), [Petr Mitrichev,](https://en.wikipedia.org/wiki/Petr_Mitrichev) etc.

",2018-09-10 09:17:18
e5pn71y,NHLBUMOSQA,32,"It’s very noticeable that anytime Bitcoin drops in price there is a huge wave of posts saying “bear market for years” and “bitcoin has no value”.

Yet, last week (and prob next week) these types of posts will be quite rare.

“Bear market for years” and “Bitcoin has no value” cannot be a situation that only exists for a very short period  :) 

My assumption is that people sell or short and then Spam here with fictional negative opinions to influence others. It’s a shame if that’s the case — but the sub does have these windows where &gt;50% of posts are of this type, then a few days of a week later this sentiment disappears.

Edit: Good to see so many replies about this. Ultimately everyone is entitled to whatever bearish/bullish opinion they have -- but avoiding persistent spamming (on either side) does make the sub a much better read. ",2018-09-10 16:22:43
e5pl737,rockybeethoven,30,"That's a classic reverse-Bart/Bart formation showing a long overdue healthy correction followed by organic growth.

This is good for bitcoin.",2018-09-10 15:19:09
e5o2j81,Kain_niaK,29,"It's very  hard to find a ~~crypto~~ Bitcoin startup that Roger did not invest in. 

But over at /r/bitcoin they call him a demon investor rather then an angel investor.

Cause in Core everything is up side down. 

",2018-09-10 00:36:29
e5rlqtt,Millennial_,210,"Look on the bright side, you didn’t blow $100MM of Bitcoin on a couple of pizzas.",2018-09-11 12:55:50
e5qh8iq,Mralfredmullaney,202,"Made his money from bitcoin, extreme hoarder, paranoid, had tunnels? Yeah, this guy is whack. ",2018-09-11 02:50:08
e5qh78q,phl_fc,189,The personification of /r/bitcoin,2018-09-11 02:49:37
e5s7x5u,MetaFlight,175,"Proportional to size, The Allende government was far more dangerous to Capitalism than nearly any other state. They came to power through parliamentary means, they operated through parliamentary means and begun implementing cybernetic economic planning. Something that the soviet bureaucrats killed and western leftist often feared would be authoritarian.

I don't think it's a coincidence that following the 70s so much of the left has become so primitivist and technology/science skeptic. I don't think it's a coincidence STEM has been bombarded with rightist propaganda and leftists have been taught to pick on the faults of those in STEM more than other industries.  I think this is likely straight up encouraged by psyops. As if the people who knew how to manage the technology that runs modern capitalism were largely leftist, they could bring it to a halt and start implementing the means to replace it.

Instead, STEMers are worshipping Musk and chasing Bitcoin, while this sub is talking about giving them swirlies and pretending their magical anarcho-garbagism society wouldn't immediately collapse into feudalism or be destroyed by Capitalists.",2018-09-11 22:44:04
e5qfh2t,NowImAllSet,157,"Same username the guy used. This account hasn't posted in a year, prior to that had made posts about nuclear threats, as well as bitcoin. Mildly active in r/msha which is a subreddit dedicated to mining tunnels. I would say with pretty high certainty it's the same dude. ",2018-09-11 02:25:05
e5qlhgv,SAKO4444GODZ,148,and Bitcoin,2018-09-11 03:49:46
e5qlnmq,zootam,140,"He is a mentally unstable person whose interests coincided with bitcoin before it was widespread.

Either he had a lot of bitcoin, or stole it from others via 'hacking'.

He might call himself a day trader, but I'd wager he made most of his money by having bitcoin.",2018-09-11 03:52:08
e5rnbaz,work_login,139,"I bought $500 worth of bitcoin when it was $2 and sold at just over $4. Was kinda kicking myself when I saw it over 15k lol. But you can't let that shit get to you, hindsight is 20/20. If everyone was depressed about investments they didn't hold on to, we'd have a pretty sad world lol. I look at the bright side, I doubled my money with some ""fake"" internet coins that I didn't understand back then.",2018-09-11 13:26:49
e5qmklw,aminok,96,"I agree. When I search 'Ethereum' on Twitter, the top tweets are usually from some Bitcoin Core personality or another bashing Ethereum with ridiculous FUD (though not today; today Ethicionados are coming out swinging). Cryptocurrency has become an echo chamber where sentiment is based on substance-free narratives rather than informed opinions on the fundamentals.

A significant portion of posts in /r/CryptoCurrency are about projects based on Ethereum, but they rarely contain 'Ethereum' in the title. The cryptocurrency media is inadvertedly or deliberately under-reporting Ethereum's role at the centre of the majority of blockchain developments.

The titles of a large share of cryptocurrency news should have 'Ethereum' in it, but for some inexplicable reason, if it's about Ethereum, it almost always refers only to the generic 'blockchain', whereas when it's about BTC, or some irrelevant competitor to Ethereum, the name of the network will be specifically mentioned in the title.

So I agree with your call to market Ethereum's primacy better. It is totally dominant in all facets of the emerging decentralized finance economy, from tokens, where 93 of the top 100 tokens by market capitalization are on Ethereum, and where new standards like ERC721 are the emerging industry standard for representing particular classes of assets, to decentralized exchanges, where over a dozen ERC20 DEXes are now operational, to transactions per day, where Ethereum does more than triple what BTC does per day (600,000 to less than 200,000), to development tools (Truffle, Embark, remix).

There are more projects being developed on Ethereum than all other cryptocurrency platforms combined. It's time Ethereum gets the credit it deserves. From purely the perspective of fundamentals, it is more dominant and promising now than Bitcoin has ever been in its history.",2018-09-11 04:05:39
e5qnvis,Ghostbustaj,92,"Yet, its still the only one being actually used. Let me know when you can purchase a house using Iota. Lol

If Bitcoin fails the whole ecosystem derived and born (from and because) of it, will likely fail.  Bitcoin IS cryptocurrency, regardless if you like it or not. Especially in the eyes of the regular public and institutions that do not understand the tech.",2018-09-11 04:24:40
e5r76rg,nolanla,77,Why can’t bitcoin work like this? This makes bitcoin look like ‘90’s tech. ,2018-09-11 09:08:17
e5qmobs,Worthyness,75,"No idea either, but given the use of big words and terminology, this must be good for bitcoin. ",2018-09-11 04:07:08
e5qp46j,Dixnorkel,74,"Holy shit.  Tone says that he doesn't send BTC to companies like Microsoft and Expedia because they don't give a shit about Bitcoin and will sell it, tanking the price.

Then Roger asks him what he bought most recently with BTC, and he said he sold it for cash lol.  What a dense, oblivious shill he is.",2018-09-11 04:41:28
e5qelhq,aardvark-lover-42,68,"Hasn’t posted in a year, comments on bitcoin threads, has the same username the guy used at a Con.

",2018-09-11 02:12:41
e5r8t69,ASadRedLion,66,"There are so many flaws with this argument that I don't even know where to begin. Mario, a fungi-based undead zombie who metabolizes bitcoin? Don't make me laugh. First off Mario does not *metabolize* coins. Notice that when Mario comes in contact with a coin, it completely disappears often only leaving a sparkle behind. In fact, Mario does not have to physically touch the coins (see coin blocks) to, in your words, ""metabolize"" coins. Does he consume the coins? Don't be ridiculous. Rather I believe that the true Mario exists in some kind of different plain. 

**Mario is obviously the astral projection of a druid**

You might wonder: ""But, Mario is obviously an Italian name, you sad fucking red lion. He can't be a druid."" Of course *you* of all people would think that. First off, if Mario was Italian he would obviously consume pasta instead of mushrooms. During one of the invasions of Gaul by the Roman empire, Mario's great-great-grandmother, a Gaelic druid, fell in love with one of the raiding Roman legionaries. This soldier left the poor druid with only two gifts: a child that was growing in her womb and a single name: Mario before perishing of disease. It became a family tradition to name every first born male ""Mario"" after that. The phrase, ""It's a me, Mario,"" is a poor translation of the Gallic phrase, ""Ishta mea, Mario."" This loosely translates to, ""I am the druid Mario, the last of my kind."" The entire series of Mario is a metaphor of the conversion of the pagans to Christianity. Mario is the last Pegan of his kind. Peach represents the conversion of his state by the Catholic Church, with Bowser being the Pope. Peach is always being captured. There is nothing Mario can do to stop the conversion of his people. He can only delay it. Mario uses various druidic items to help him on his quest. His powers grow when he consumes psilocybin and he can transform into various animals. Yoshi is his familiar. It all adds up.

Tl;dr: I haven’t slept in a day send help please I beg you
",2018-09-11 09:33:40
e5qp2xj,KWheels,65,"I literally changed jobs in January...not because of me telling people about Bitcoin in December, but I was certainly glad not to have to answer to them when I came back from my winter holiday. ",2018-09-11 04:41:01
