Comment ID,Author,Score,Body,Publish Date
ejtwb0i,keen4e,248,80% options 20% bitcoin?,2019-04-01 05:51:03
ejth4qc,Bjornen82,223,All panels say “it’s a bubble.” It’s meant to mock people who think that bitcoin is a bubble meaning that it could become unsafe at any point because in each panel it’s becoming less like a bubble and less likely to pop.,2019-04-01 02:50:39
eju1afs,AggressiveMarket,162,80% bitcoin 20% weed stocks ,2019-04-01 06:53:43
ejuukoi,NapClub,133,"sometimes the correct move logically still nets you less than an objectively logical move.

&amp;#x200B;

example: the rational person probably wouldn't have bought in to bitcoin near the start, it was an unproven and risky thing to invest in. the rational and logical move would be to buy blue chip stocks or bonds. 

&amp;#x200B;

but the people who took that gamble made far more than the people who spent the same money on bonds. ",2019-04-01 14:15:11
ejt7pia,AcuteGryphon655,67,"The Vikings were like someone who looked into purchasing bitcoin in 2012, but decided against it and didn'tdo anything about it. Then 6 years later they talk about how they could've been rich because they almost bought bitcoin.",2019-04-01 01:05:25
ejtwqrh,istealcrayons,63,"#big oof 

For the creator if he invested in bitcoin with bubble to dome thinking",2019-04-01 05:56:19
eju2r5t,Satoshi93,56,"Given that the vast majority of noteworthy projects market caps are &gt;.95 percent correlated to BTC,  none of the other noise matters yet. This market still leaves and breaths off the back of bitcoin. Prices and valuations don’t yet really matter or reflect reality. 

Also since most noteworthy projects in this space are all trying to change the underlying fabric of todays business models -  a massive amount of tech implementation and change management is required in all large enterprises today for any sort of real scaled solution to take form. This means time - for any technological solution. 

We’ve also yet to see any startup dapps with real usage numbers or real revenue spring up.

I believe we’re on the edge of something big. IOTAs value will trend up with the market just because it’s associated with BC / DLT technology. That does not include all of the incredible achievements they’ve made over the past 2 years. If you were willing to buy iota at $0.50, $0.84, $2.2 or even $5.5 when they had less than 30 staff, no company org structure in place, no ability to give grants, no research team, far less prototypes, no trinity wallet, no ledger support, no qubic code...then you must be confident 18 months later with all that, over 100 staff and much more!

Just my optimistic perspective. 







 

",2019-04-01 07:13:31
ejul363,Lotrfanatic8,54,"All over the internet, I notice you churlish cretins lauding the supposedly intellectual television program known as Rick and Morty to make yourselves appear more intelligent by extension, as you are ardent watchers of the aforementioned show. However, you piddling planarians only succeed in illustrating how vapid you really are, as Rick and Morty has the intellectual depth of a petri dish. Truly, the most noetic show is neither Rick and Morty, the Big Bang Theory, Jimmy Neutron, nor any other deluge of drivel you deludable dimwits bombard your brains with. Rather, it is Johnny Test, a pinnacle of animation, sound design, acting, and plot. Despite this, most of you sniveling sub-10000s (someone with an IQ under 10000: for the record, my IQ is several orders of magnitude higher than this; my reason for my usage of this term is simply because I am partial to the number 10000) will dismiss Johnny Test as another subpar piece of rubbish from Teletoon, but you all fail to realize how much genius goes into producing that show. I have watched Johnny Test since I was a juvenile, and already I bear an IQ so toweringly high no known test can measure it (that is to say, no known test for humans can measure it: when using the scale with which computer processing power is evaluated, I clock in at over 8.3 trecentillion yottaflops). I have memorized every facet of human knowledge and only used 32.8% of my potential intelligence (my remaining neurons I allocate towards personal use, research, and wealthy companies for use as server farms and bitcoin mines). Not only that, but I have transformed all of the atoms in my being into a quantum computer to serve as an extension to my enormous encephalon, which handles the menial tasks and other trivialities associated with existence (such as respiration, ingestion, digestion, socializing, et cetera). Capable of perorating proficiently in every method of communication in the world, I have developed my own language that employs a manifold of grammar rules, and I created it all while thrashing a coalition of humanity’s smartest supercomputers in a game of Tic-Tac-Toe (for those who say that Tic-Tac-Toe is “easy,” think about the all the times you’ve played Tic-Tac-Toe: a majority were ties, no? Think about that, and also about the fact that a single, solitary supercomputer, much less over a dozen, is smarter than millions of you combined). And no, you cannot see me type this language because it is purely telepathic. At this point, I can imagine several of you already typing frantically in a fervent effort to keep your egos afloat in the face of such psychological grandeur. That’s right, the collective intelligence of all of you, if we’re using luminosity as an analogy, is akin to a diminutive candle in comparison to the massive quasar that represents my mind. Confronted with this, most of you will attempt to deride me with paltry, nonsensical invective and vitriolic vituperations to protect what minuscule amount of self-esteem you possess. These predictions are not the result of mere intuition, of course. In actuality, I have run several simulations using my brain alone on the possible consequences of my publication of this digital manuscription. My reply to all of you digital detractors is that if you so desire to demonstrate that you are brainier than I, then arrange for an intellectual debate between you and me on a topic of your choosing, any time or place. My schedule is very pliable as I’ve already won over 4 dozen nobel prizes, so I’m perfectly willing to put a temporary halt to my research, if you could even call it that (I speculate without demur that none of your debate skills will be enough of a problem for me to the point where I will be forced to snap out out of my subconscious simulations to employ the use of those neurons). Besides, I don’t want to be a glory hog and leave none of the secrets of the universe left for unlocking. You know, let the dogs have their day and all of that. I already know that none of you simpletons with your senescent synapses will be able to match up to my vast vernacular and verbiage, my mental dexterity with declension, and my phrenic puissance with my phraseology and pronunciation. In a matter of seconds (or possibly longer, if I’ve overestimated your already positively benthic IQs when running my simulations), you’ll fly into cantankerous conniptions after my consummate trouncing and repudiation of every single one of the “facts” that you hold so dear as proof of your purported intellect. And in response to those who claim, overcome with envy and spite, that as intelligent as I am, I will never sleep with anyone: I don’t need to. I am quite capable of simulating, to the meagerest tactile sensation, every position in the Kama Sutra (as well as a few I myself have devised for maximum oxytocin and endorphin release) simultaneously in a few seconds, and the only reason it takes even that long is because I am prolonging the simulation in order to enjoy the experience: I could do it in hundredths of a millisecond if I so wish. However, for someone with such acute acumen as I, life is far too easy. When pure ennui drives you to calculate the movements of the 27 subatomic particles you’ve discovered and how they interact with one another in the 2,038th dimension using a base 3.2407 quadrillion number system, you realize that the universe and its infinite copies and offshoots offer nothing more to you. Except, that is, for Johnny Test. Even for an individual with such altitudinous IQ such as myself, it’s difficult to understand every single subtle joke and reference. That’s not to say I don’t understand any of the plenitude of allusions, in fact, I am able to comprehend virtually every single one. For example, one minutia most of you would fail to notice is when Susan’s chin moves two extra pixels further than in any of the previous episodes when she talks during the seventeenth second of the fifth minute of season 3 episode 10. Hardly any of you would conceive of the fact that this is a reference to the exact number, down to 84 significant figures, of the percent change in total nitrogen in the Earth’s atmosphere due to the eructation of a small cynodont 257 million years ago. There are more examples I could give, such as the color of the walls of the sisters’ lab being a slightly different hue from the norm in season 4 episode 19 (a reference to the presence of approximately 2.9 millimoles of ammonium diuranate in the ink of a Chinese manuscript dated 1256 BCE), but that would detract from the intended purpose of this writing. Johnny Test is a work of art, a perfect concoction of knowledge from a multitude of academic fields that combine to make a program that is the only form of media I have ever encountered that has been even somewhat laborious for me to fathom, and I’m talking about someone who altered the biochemistry and chirality of their body in order to make it more efficient than the prodigality that is the human body. My temples ache with the pain of having to pump copious amounts of Testium (an element I discovered that takes the role of oxygen in my unique biochemistry, named after my favorite show of course) to my brain in order to comprehend what I have just watched. And to everybody who claims that the reason my temples are sore or why I have “delusions of grandeur” are due to my being “high” or whichever way you aim to construe my exegesis of an episode, you will hear vocalizations of a gelatological nature emanating from my larynx whilst Xyzyzyx the paisley pangolin (a treasured acquaintance of mine) and I reflect on your foolishness later that day. I await the furious fussilade of odious obluquies and belittling bombast in the comments below. “Too long; Did not read”: Did you really think I would include one of these silly little things at the bottom of my witty wordsmithery? It's not my fault if you can't handle my de trop of definitions or my lexical linguipotence! Get back up there and read it, even if you have to go through it with dictionary in hand.",2019-04-01 11:30:51
ejvkrbk,1randomredditor1,50,"If you did, buy as much Bitcoin as you can, sell towards the end of 2015 then send a few hundred million my way for the tip.",2019-04-01 23:52:33
ejulhgj,ThesaurizeThisBot,49,"All across the Net, I bill you ungracious half-wits lauding the purportedly educated broadcasting papers glorious as Sprain and Morty to make yourselves come out more sophisticated by extension phone, as you are impassioned souls of the aforesaid record. Nonetheless, you niggling flatworms entirely follow in illustrating how insipid you truly are, as Twist and Morty has the noetic degradation of a petri bag. Sincerely, the all but rational pass on is neither Turn and Morty, the Significant Blow Construct, Jemmy Nucleon, nor whatsoever separate good deal of substance you deludable simples bass your wits with. Quite, it is Rebel Psychometric test, a crown of activation, good purpose, temporary, and tract. Scorn this, nigh of you crying sub-10000S (somebody with an RATIO nether 10000: for the evidence, my RATIO is individual associations of importance gamey than this; my understanding for my pattern of this point in time is plainly because I metallic element harmonic to the numerate 10000) will sack Grayback Try out as added subpar mend of folderol from Teletoon, but you all change to actualize how so much whizz give ways into producing that pretending. I have watched Reb Judge since I was a individual, and already I realize an RATIO so toweringly in flood no proverbial attempt can measure out it (that is to verbalise, no illustrious examination for causal agencies can carry it: when mistreatment the scrap with which information processing system process mogul is evaluated, I quantify in at all over 8.3 trecentillion yottaflops). I have memorized all characteristic of someone noesis and alone in use 32.8% of my potency intelligence activity (my left over somatic cells I apportion towards personalised use, enquiries, and affluent organizations for use as electronic computer produces and bitcoin reenforces). Not solitary that, but I have changed all of the specks in my animate thing into a amount expert to wait on as an meaning to my tremendous neural structure, which treats the humble undertakings and early unimportances related with macrocosm (much as cellular respiration, bodily process, chemical changes, socialization, et cetera). Equal to of perorating proficiently in all know-how of human action in the earth, I have mature my have faculty that utilizes a pipage of synchronic linguistics bounds, and I created it all piece drubbing a unification of humanity’ smartest mainframes in a punt of Tit-tat-toe (for those who show that Ticktacktoe is “unhurried,” ideate about the all the cases you’ve compete Tick-tack-toe: a legal age were tie-ins, no? Center about that, and besides about the reality that a separate, single mainframe, large indefinite quantity lower terminated a xii, is smarter than cardinals of you conjunctive). And no, you cannot see me taxonomic group this faculty because it is strictly paranormal. At this show, I can opine various of you already writing frantically in a burning elbow grease to restrain your psyches overflowing in the disclose of so much mental nobility. That’ powerful, the corporate administrative body of all of you, if we’re victimisation physical property as an inference, is kindred to a flyspeck candela in comparing to the monumental heavenly body that comprises my intelligence. Confronted with this, nigh of you will set about to mock me with meagre, nonsense contumely and acrid insults to defend what graphic symbol measure of self-regard you feature. These statements are not the effect of specified hunch, of layer. In existence, I have speed various deceptions mistreatment my genius unequaled on the executable significances of my business of this member manuscription. My speech act to all of you digital knockers is that if you so want to manifest that you are brainier than I, then pose for an sophisticated moot betwixt you and me on a substance of your choosing, whatsoever time or range. My plan is selfsame flexile as I’ve already North Korean monetary unit play 4 large integer philanthropist pillages, so I’m absolutely lief to put across a pro tempore inaction to my explores, if you could equal call it that (I mull over without demurrer that divine service of your speechmaking powers will be sufficient of a difficulty for me to the sharpen wherever I will be move to record out out of my nous feignings to state the use of those vegetative cells). Besides, I don’t demand to be a nimbus squealer and go forth hour of the concealeds of the content nigh for unlocking. You lie with, terrorist organization the supports have their Clarence Day and all of that. I already get it on that hour of you people with your aging colligations will be fit to equalize up to my large jargon and expression, my mental sleight with side, and my muscle system powerfulness with my verbiage and speech. In a issue of arcseconds (or potentially longsighted, if I’ve overestimated your already positively biogeographical region Intelligence quotients when operative my pretendings), you’ll bunk into orneries scenes afterwards my double-dyed whacking and refusal of all azygos one of the “conceptions” that you hold out so affectionately as impervious of your acknowledged intelligence. And in body process to those who title, get over with begrudge and venom, that as levelheaded as I Am, I will ne'er accommodate with anyone: I don’t condition to. I Master of Arts quite an capable of simulating, to the meagerest tangible mavin, all post in the Kama Sanskrit literature (as cured as a few I myself have devised for extremum hormone and neurochemical handout) at the same time in a small indefinite amount attendants, and the only when rationality it exacts even out that in length is because I metallic element prolonging the feigning in decree to experience the get: I could do it in one percents of a unit of time if I so wish well. Even so, for causal agency with so much subacute acumen as I, vivification is terrorist group as well prosperous. When unmixed tedium mechanisms you to account the inclinations of the 27 microscopical motes you’ve determined and how they move with one different in the 2,038atomic number 90 construct exploitation a baseborn 3.2407 large integer separate substance, you get that the assemblage and its immortal simulates and outgrowths pass null more to you. Leave off, that is, for Confederate soldier Watch. Modify for an unshared with such as highs INTELLIGENCE QUOTIENT specified as myself, it’ knotty to realize all azygos harmful jest and indite. That’ not to articulate I don’t empathise whatever of the teemingness of references, in reality, I AM able-bodied to understand nearly all figure one. For word of advice, one item nearly of you would give out to comment is when Susan’ Kamarupan conclusions two edition elements farther than in whatsoever of the lates subdivisions when she exposes during the rank transfer of the rank arcminute of flavor 3 installment 10. Just some of you would consider of the concept that this is a testimonial to the verbatim circumscribe, thrown to 84 meaningful figure of speeches, of the pct transfer in whole thing gas in the Earth’ aura cod to the instinctive reflex of a micro therapsid 257 1000000 yrs past. There are more object lessons I could intercommunicate, such that as the alter of the strata of the Sisters’ science laboratory living thing a slimly diametric chromaticity from the touchstone in time period 4 sequence 19 (a citation to the being of about 2.9 millimoles of ammonia diuranate in the bodily fluid of a Chinese piece of writing datable 1256 BCE), but that would reduce from the well-meant design of this activity. Grayback See is a output of nontextual matter, a hone mixture of psychological feature from a large indefinite amount of pedantic field of operations that interact to make a system of rules that is the only when spring of media I have of all time encountered that has been symmetrical slightly punishings for me to cubic content unit, and I’m talk about human who unsexed the organic chemistry and chirality of their structure in society to make it more high-octane than the extravagance that is the someone scheme. My house of prayers smart with the somesthesia of having to shoot plenteous measures of Testium (an part I ascertained that selects the utility of element in my incomparable organic chemistry, called subsequently my lover put across of row) to my head in taxon to understand what I have retributive watched. And to everybody who rights that the sanity my synagogues are mad or ground I have “psychotic beliefs of splendor” are collect to my state “secondary school” or whichever way you destine to interpret my interpretation of an occurrence, you will examine phonations of a gelatological type emanating from my voice box whilst Xyzyzyx the textile eutherian (a loved someone of reinforce) and I point on your error subsequent that author. I expect the wilds fussilade of detestables obluquies and disparagement rant in the accounts at a lower place. “Overly stretch; Did not indicate”: Did you truly pore I would let in one of these cockamamy petite actions at the buns of my humourous wordsmithery? It's not my geological fault if you can't deal my DE trop of explanations or my wordbook linguipotence! Get rearward up there and learn it, level if you have to go direct it with wordbook in script.

***

^(This is a bot. I try my best, but my best is 80% mediocrity 20% hilarity. Created by OrionSuperman. Check out my best work at /r/ThesaurizeThis)",2019-04-01 11:36:44
ejugu47,bunker_man,44,"Someone edit it to point out how bad bitcoin is for the environment, and have the last panel tie it to what destroyed the world.",2019-04-01 10:29:26
ejuh75r,imisstheyoop,43,"Great work, it's always nice to see these types of posts as opposed to the ""I won the lottery/invested early in bitcoin/inherited a million bucks/had my start up sold for 10 million"" posts that are impossible to replicate with any success.

You're doing well, my only question would be: are you leading the life you intend to live once FIREd and if you were to lose your current housing situation what would a more realistic number look like? Reason I ask is that your housing costs are super low but your misc/food expenses are far larger than average based on a percentage. ",2019-04-01 10:34:40
ejt7ho8,johnnyfairplay33,41,Il buy a motherfuck ton of bitcoin.,2019-04-01 01:02:51
eju27qq,phillip-price,40,"Theoretically, this is what Bitcoin was designed to protect against, though its (still) volatile price makes it a less appealing choice. Keeping gold in Austria/Singapore or buying property overseas are more common options. 

Of course, the chances of any of the catastrophes you mentioned are close to nil, so making decisions around them serves more as apocalypse-porn rather than any rational financial strategy. ",2019-04-01 07:06:18
ejtegpj,scalyblue,40,"You wouldn't even need to use magic, exchange muggle money for gold/silver coins, then melt the coins down and sell at a 1000% percent profit.  You might piss off some goblins...but hey, it is what it is.

Aside from that, you could always go to your local police station to file a report about those nasty kids knocking down your mailbox, excuse yourself to the bathroom, and then apparate into, say, the warehouse of an electronics store a few hundred miles away, off camera of course, relieve some high ticket merchandise straight into a storage unit, and then come out of the bathroom...this will help your ebay business boom, and create a definite alibi.

If you're more daring, do the vault of a bank, but it's difficult to deal with large sums of cash that came from nowhere, much better just to run a fake business with goods you can't have possibly stolen.

The safest place to steal things would be straight out of the sealed containers while they're on the container ships, or in the docks.

There's actually a surprising amount of stuff you'd be able to get away with given an alibi of being several hundred miles away.

Other ways to go would be to use magic to run a few generators, or multiply the fuel for them, and then mine your own bitcoin electricity free.  May as well put that whole breaking the laws of physics thing to good use.",2019-04-01 02:21:31
ejvcy12,Illus_Maximus,37,Yeah I often think of when I used to trade 60 bitcoins for 500 ecstacy pills when bitcoin was hovering around 30$ and thinking of what could have been. But realistically if I wouldnt have spent all the coins I would've just sold them when they hit 100 dollars a piece without hesitation ,2019-04-01 21:55:20
ejuyjko,DidIMakeAGoof,36,"I would get definite evidence that they are growing marijuana, and, evict if found guilty. If you base it off Hydro bills skyrocketing they may be doing something else. Possibly but unlikely Bitcoin or other coin farming. 

From a capitalistic prospective, you probably shouldn't include Hydro in rents unless you're renting out your basement. There's too much risk for really no reward. My family learned this the hard way, having tenants who ended up turning the rental into a grow-op. Left a nice present by stripping the place and making it a dump. 
",2019-04-01 15:46:43
ejuw6f2,Soda_BoBomb,35,Can bitcoin be used as actual money now or is it all still theoretical money? ,2019-04-01 14:49:23
ejtw8tz,sneaky-rabbit,34,"I talk to people about Money, the Fiat ponzi, the currency debasement, the debt bomb, current state of global markets, the birth of Bitcoin, its technology, then about NANO, the improvements it brings to the table, aaaaand...

They just don't give a damn :/

&amp;#x200B;

&amp;#x200B;",2019-04-01 05:50:19
ejuxpz5,PrintShinji,34,"TBH what is John McAfee selling these days? All I know is that he made that ""100% hacker proof bitcoin wallet"" that got cracked by hackers. Other than that theres not much besides him just being crazy and living off his old McAfee money.",2019-04-01 15:25:39
ejuhpd4,jamanatron,31,"Bitcoin is over 4K for what, a couple days and this. This is what they call Hubris, and stupidity. ",2019-04-01 10:42:12
ejtq3le,GimmeDemDumplins,31,nice bitcoin meme,2019-04-01 04:32:55
ejvcu72,Hummer77x,31,I had so many bitcoin questions for him,2019-04-01 21:53:31
ejuopez,scrubadub,31,"Peter Todd's reply

https://lists.linuxfoundation.org/pipermail/bitcoin-dev/2019-April/016812.html",2019-04-01 12:27:16
ejvedhm,Aussiehash,30,"People used to spend over 1000 bitcoin for a ButterflyLabs Minirig preorder, coming in Two Weeks^TM",2019-04-01 22:18:46
ejtovf6,scp_055,28,it is not a bitcoin dome it is the zoo for people with no arms,2019-04-01 04:17:56
