Comment ID,Author,Score,Body,Publish Date
elgqlyz,Azuaron,69,"Guess it's time to [trot this out again](https://www.reddit.com/r/AskReddit/comments/8xamvz/your_life_resets_to_1990_and_you_have_all_of_your/e22e55e/):

I'm born.

I become the most depressed and intelligent pre-K child in the history of the world, due to the abrupt loss of my wife and children. My parents don't understand what's happening, and I don't tell them, because it sounds absolutely crazy. I am not taken to a psychiatrist for years because we don't have insurance and can't afford it out of pocket.

I have behavioral problems at school. No one can deny my seemingly preternatural intelligence, but I'm so bored by the required work that, instead of doing what's assigned, I make up and solve my own calculus problems. I write code in programming languages that don't exist yet. I do not have access to a computer, and frequently demand access to a computer. My grades tank, I'm often sent to the principal's office for disrupting class. But, this is America, so I graduate grade after grade after grade. My fourth grade teacher recognizes how much I already know, and feeds me high school textbooks. It's a good year. The next year returns to normal, and crushes me.

In 8th grade, my mom's insurance coverage shifts, and psychiatric issues are finally covered. I go to a psychiatrist for the first time. I have been living retrograde for about a decade. The sharp edges of grief have somewhat dulled, but the boredom of an adult living as a child has not. I extract a promise from the psychiatrist. A promise not to tell my parents, or my teachers, or the police, FBI, or *anyone* what I'm about to tell him. He agrees.

I tell him I've been transplanted back into my own life from 2018, that I should be 411 with a wife and kids, and I've been dealing with this alone since I was 4. He doesn't believe me. I write him some computer code in versions of languages that don't exist yet. I write calculus problems and polar equations that I shouldn't understand. He thinks I'm a prodigy, but crazy.

I tell him George W. Bush will win the Presidential election. He thinks I'm guessing. I'm shouting now. I scream at him about 9/11, one year away. He's no longer laughing. I've made a mistake. He thinks I'm dangerous. He thinks I am planning 9/11. I try to backpedal, to say that it's Al Qaeda. He asks me if Al Qaeda speaks to me. I know I've lost him.

They put me on anti-psychotics. It kills my mood, stunts my mind, ruins my enthusiasm for everything. I'm no longer ""depressed"" or ""acting out"", so the treatment is hailed as a success. I get regular checkups from the psychiatrist.

9/11 happens. I'm dragged into a meeting with my parents, the psychiatrist, a police officer, and two men in suits. My parents don't understand what's happening. They try and get me to talk, but I refuse. They have all internet traffic from my house, some of which is embarrassing, but none of which is incriminating. I demand to be taken off the drugs and allowed to return to baseline. They agree. I am under house arrest with an ankle bracelet. I can go to school and home. I don't care; I never made friends, even my old friends from my past life were too juvenile.

A month later, a repeat of the meeting. How did I know about 9/11? I ask for a lawyer. They deny me one. I shrug and stop speaking. They get me a lawyer.

I tell my lawyer everything. He doesn't believe me. I ask for a new lawyer.

I tell my new lawyer everything. He doesn't believe me. I ask for a new lawyer.

I tell my new lawyer everything. She doesn't believe me. But says she'll work on my behalf as if she did. I agree.

We tell them nothing. The house arrest is a violation of my rights, and the Patriot Act doesn't exist yet (barely) for them to be able to hold me on suspicion of anything. My lawyer threatens to go public. They back off.

My freshman year grades are terrible. I realize I need my grades up if I want to go to the right college to find my wife, so I double down on my school work. I go from a D average screw off to acing every class. My teachers are confused, but relieved.

It's senior year. I apply to only one college. My parents think I'm crazy. I get in. I apply to the Honors Program. The Honors Program, where I met my wife nearly 30 years ago on my personal timeline, where I'd live in the same dorm building as her, and work late on the same engineering team as her, the time when our relationship began.

I don't get in. My grades are too low, after tanking my freshman year. I'm going to the right college, but I can't replicate the circumstances of our meeting.

There's hope, but it's a slim hope. I go to college. I know what clubs she goes to, what friends she has. I contrive to be wherever she is. I spend months in her orbit, working up to asking her out. How do you ask out someone you were with for 12 years, then lost 14 years ago, who doesn't remember you at all? How do you approach her with the baggage of your entire relationship that she has no knowledge of?

Eventually I do it. I ask her out. She says no. I don't understand. My entire world is crashing down around me. She is my wife, doesn't she understand? I go crazy, it scares her and she runs away. I try to follow her, but she hits a campus safety panic button.

With my history of ""mental illness"", I'm involuntarily committed. I spend a month in the asylum.

Two men in suits ""visit"" me one day. They say they can get me out. But, I have to tell them about 9/11. It's the FBI agents from all those years ago. I've given up. I tell them everything. They get me out. I'm setup with a nice house in the middle of nowhere, a good computer, state of the art internet. And I have to keep feeding them information about the future.

In my free time, I'm a software engineering consultant. The FBI pays my expenses, so anything I make is spare money. January 2, 2009 I've built a GPU beast of a computer. January 3, 2009 I start mining BitCoin. I mine a *lot*. I mine far more than anyone expected someone could mine so early. The BitCoin economy never takes off, because no one else can get in on the early mining with normal computing hardware. ""Cryptocurrency"" fails before it can even get a start.

Two years later the FBI approaches me, looking for more information about the future. I've got nothing left; I've told them everything I can remember.

They kick me out, and repossess all the computers they bought me, and ""appropriate as evidence"" all the ones I bought myself.

I've got nothing left. I wander the streets of small towns, hitchhiking haphazardly. I lay down on a park bench one night.

The next morning, I don't get up.

1 Edit: I was 31 in 2018. I spent 10 years in the past. 10 + 31 = 41.",2019-04-22 10:18:23
elfktvt,jonald_fyookball,58,"I think they censored it because it was a little TOO obvious.  

BTC has no real principles left.  

Almost everything their thought leaders say is expedient and mercurial.  Payments are good if fees happen to be cheap this week or if we're talking about layer 2.  If fees are high this week, well that's what keeps bitcoin secure and you must be stupid if you don't get it.  Blocks aren't full, thanks to segwit and batching but if they are, it must be someone spamming like veriblock.  When in doubt blame Roger.  /s",2019-04-22 01:30:00
elhm673,Fantom1992,56,News report: Someone who owns bitcoin says buy bitcoin,2019-04-22 21:00:54
elftuk0,CrassiusCurio-,54,"To paraphrase Knowing Better, if you knew about bitcoin but didn't invest, did you discover it?",2019-04-22 03:12:09
elgtmeg,ClamChowderBreadBowl,46,Someone I know told me about a friend back in Russia who spliced into the electric line and then started running bitcoin mining servers.,2019-04-22 11:02:05
elgm2ih,whuttheeperson,45,"I'm surprised so many people here are completely missing the point. This is huge, this is the major banks in the globe using an Ethereum-like private network to conduct 'b2b' interbank settlements.

This is basically like a private little mini Bitcoin like network to keep track of payments. The whole DLT thing. 

This is amazing for Eth.

They are all investing and learning in Eth like technologies which will naturally entrench them within the Eth ecosystem and Ethereum would be an obvious choice for a public network should they choose to interact outside with the public, which they absolutely will.",2019-04-22 09:14:57
elgm436,bangobuck,45,"Why RIP? You could save birthday money, chores, even small amounts. 

Bitcoin was so cheap you could still easily generate millions of dollars worth in 2018.",2019-04-22 09:15:35
eli2ovc,farmthis,3144,"Well, I’m guilty of mailbombing someone, and I hope it permanently disabled their email account.

Scammers somehow breached our server and installed ransomware that encrypted every single file. They demanded 0.7 bitcoin as payment back when it was about $7,000, and to contact an email address to arrange payment. 

I was able to restore 99.9% of our files from local and online backups after a useless dialog with the scammers where I tried to negotiate them down to $300 of Dogecoin.

Afterward, I used a mailbombing website to sign them up for thousands of emails a day, and hopefully made their operation much harder to run.",2019-04-23 00:56:48
eljndyz,Shichroron,195,Noob. I just maxed all my credit cards buying Bitcoin,2019-04-23 11:51:14
eljlwua,Qryptoskydiver,173,Definitely looks like someone who would buy a pizza with bitcoin.,2019-04-23 11:32:22
eli0atu,Mark_Bear,134,"Gold is relatively heavy, and takes up space.  Gold sets off metal detectors.  People hide tungsten inside gold bars/coins.  Gold is expensive to securely store and/or transport.  Gold can be, and has been confiscated by government.  

&amp;#x200B;

Bitcoin has no weight, takes up no space.  Memorized private keys cannot be detected, nor confiscated.  Bitcoin cannot be counterfeited.  Bitcoin is inexpensive to securely store and/or transmit.

&amp;#x200B;

New gold can be, and is being mined.  There will never be more than 21 million BTC  -- there aren't enough Bitcoin for every millionaire to have 1.",2019-04-23 00:27:53
eljd5y2,Slamdunkdink,104,"I use an adblocker.  I tried turning it off at one point just for Reddit and within an hour I got an alert from my anti virus program that a website was trying to install a bitcoin miner on my system.  I of course turned my ad blocker back on.  When I sent a complaint to Reddit I got a response of ""we can't control what our advertisers do"".",2019-04-23 09:40:57
elj7twf,Dropdat87,90,"Do you really need proof for 70 shares? That’s pretty modest, not like he’s saying he made millions off bitcoin",2019-04-23 08:30:12
eljdxk5,welloffdebonaire,70,At least it wasn’t a Porsche. The bitcoin of automobiles. I wonder when they’ll have their restomod moment.,2019-04-23 09:50:58
elk82m6,upchuckdownthroat,61,"Stopped reading at: 

""The list of ways that Bitcoin has proved useful to criminals keeps growing, from the ransom payments on locked-up computer files — or even hostages — to illegal drug sales.""

What has the dollar and other govt. issued currencies been used for for decades.

I'm tired of this lazy journalism. hyperbole. etc.",2019-04-23 19:02:02
eljeuyj,ZippyDinkleheimer,56,"All over the internet, I notice you churlish cretins lauding the supposedly intellectual television program known as Rick and Morty to make yourselves appear more intelligent by extension, as you are ardent watchers of the aforementioned show. However, you piddling planarians only succeed in illustrating how vapid you really are, as Rick and Morty has the intellectual depth of a petri dish. Truly, the most noetic show is neither Rick and Morty, the Big Bang Theory, Jimmy Neutron, nor any other deluge of drivel you deludable dimwits bombard your brains with. Rather, it is Johnny Test, a pinnacle of animation, sound design, acting, and plot. Despite this, most of you sniveling sub-10000s (someone with an IQ under 10000: for the record, my IQ is several orders of magnitude higher than this; my reason for my usage of this term is simply because I am partial to the number 10000) will dismiss Johnny Test as another subpar piece of rubbish from Teletoon, but you all fail to realize how much genius goes into producing that show. I have watched Johnny Test since I was a juvenile, and already I bear an IQ so toweringly high no known test can measure it (that is to say, no known test for humans can measure it: when using the scale with which computer processing power is evaluated, I clock in at over 8.3 trecentillion yottaflops). I have memorized every facet of human knowledge and only used 32.8% of my potential intelligence (my remaining neurons I allocate towards personal use, research, and wealthy companies for use as server farms and bitcoin mines). Not only that, but I have transformed all of the atoms in my being into a quantum computer to serve as an extension to my enormous encephalon, which handles the menial tasks and other trivialities associated with existence (such as respiration, ingestion, digestion, socializing, et cetera). Capable of perorating proficiently in every method of communication in the world, I have developed my own language that employs a manifold of grammar rules, and I created it all while thrashing a coalition of humanity’s smartest supercomputers in a game of Tic-Tac-Toe (for those who say that Tic-Tac-Toe is “easy,” think about the all the times you’ve played Tic-Tac-Toe: a majority were ties, no? Think about that, and also about the fact that a single, solitary supercomputer, much less over a dozen, is smarter than millions of you combined). And no, you cannot see me type this language because it is purely telepathic. At this point, I can imagine several of you already typing frantically in a fervent effort to keep your egos afloat in the face of such psychological grandeur. That’s right, the collective intelligence of all of you, if we’re using luminosity as an analogy, is akin to a diminutive candle in comparison to the massive quasar that represents my mind. Confronted with this, most of you will attempt to deride me with paltry, nonsensical invective and vitriolic vituperations to protect what minuscule amount of self-esteem you possess. These predictions are not the result of mere intuition, of course. In actuality, I have run several simulations using my brain alone on the possible consequences of my publication of this digital manuscription. My reply to all of you digital detractors is that if you so desire to demonstrate that you are brainier than I, then arrange for an intellectual debate between you and me on a topic of your choosing, any time or place. My schedule is very pliable as I’ve already won over 4 dozen nobel prizes, so I’m perfectly willing to put a temporary halt to my research, if you could even call it that (I speculate without demur that none of your debate skills will be enough of a problem for me to the point where I will be forced to snap out out of my subconscious simulations to employ the use of those neurons). Besides, I don’t want to be a glory hog and leave none of the secrets of the universe left for unlocking. You know, let the dogs have their day and all of that. I already know that none of you simpletons with your senescent synapses will be able to match up to my vast vernacular and verbiage, my mental dexterity with declension, and my phrenic puissance with my phraseology and pronunciation. In a matter of seconds (or possibly longer, if I’ve overestimated your already positively benthic IQs when running my simulations), you’ll fly into cantankerous conniptions after my consummate trouncing and repudiation of every single one of the “facts” that you hold so dear as proof of your purported intellect. And in response to those who claim, overcome with envy and spite, that as intelligent as I am, I will never sleep with anyone: I don’t need to. I am quite capable of simulating, to the meagerest tactile sensation, every position in the Kama Sutra (as well as a few I myself have devised for maximum oxytocin and endorphin release) simultaneously in a few seconds, and the only reason it takes even that long is because I am prolonging the simulation in order to enjoy the experience: I could do it in hundredths of a millisecond if I so wish. However, for someone with such acute acumen as I, life is far too easy. When pure ennui drives you to calculate the movements of the 27 subatomic particles you’ve discovered and how they interact with one another in the 2,038th dimension using a base 3.2407 quadrillion number system, you realize that the universe and its infinite copies and offshoots offer nothing more to you. Except, that is, for Johnny Test. Even for an individual with such altitudinous IQ such as myself, it’s difficult to understand every single subtle joke and reference. That’s not to say I don’t understand any of the plenitude of allusions, in fact, I am able to comprehend virtually every single one. For example, one minutia most of you would fail to notice is when Susan’s chin moves two extra pixels further than in any of the previous episodes when she talks during the seventeenth second of the fifth minute of season 3 episode 10. Hardly any of you would conceive of the fact that this is a reference to the exact number, down to 84 significant figures, of the percent change in total nitrogen in the Earth’s atmosphere due to the eructation of a small cynodont 257 million years ago. There are more examples I could give, such as the color of the walls of the sisters’ lab being a slightly different hue from the norm in season 4 episode 19 (a reference to the presence of approximately 2.9 millimoles of ammonium diuranate in the ink of a Chinese manuscript dated 1256 BCE), but that would detract from the intended purpose of this writing. Johnny Test is a work of art, a perfect concoction of knowledge from a multitude of academic fields that combine to make a program that is the only form of media I have ever encountered that has been even somewhat laborious for me to fathom, and I’m talking about someone who altered the biochemistry and chirality of their body in order to make it more efficient than the prodigality that is the human body. My temples ache with the pain of having to pump copious amounts of Testium (an element I discovered that takes the role of oxygen in my unique biochemistry, named after my favorite show of course) to my brain in order to comprehend what I have just watched. And to everybody who claims that the reason my temples are sore or why I have “delusions of grandeur” are due to my being “high” or whichever way you aim to construe my exegesis of an episode, you will hear vocalizations of a gelatological nature emanating from my larynx whilst Xyzyzyx the paisley pangolin (a treasured acquaintance of mine) and I reflect on your foolishness later that day. I await the furious fussilade of odious obluquies and belittling bombast in the comments below. “Too long; Did not read”: Did you really think I would include one of these silly little things at the bottom of my witty wordsmithery? It's not my fault if you can't handle my de trop of definitions or my lexical linguipotence! Get back up there and read it, even if you have to go through it with dictionary in hand.",2019-04-23 10:03:05
eli47b0,andreicon11,55,"Gold is a finite resource as well, we just haven't determined the entire supply yet. New Bitcoin still can and is being mined we just know it'll be 21 millions of them.",2019-04-23 01:14:49
elj1djt,maxcoiner,50,"The $1m bubble is clearly 2 bubbles away, so I'm looking for it to happen in about 5 years from now. 

The upcoming bubble around 2020 is going to take us over $100k, I'd say $250k or even $300k likely at the very top.

For a few uncomfortable days there at that top, banks will be wetting themselves, likely trying to stop all TXs with the words ""Bitcoin"" or ""Crypto"" on them at all. 

However, we have decentralized exchanges now like Bisq so many folks won't care; banks won't be a part of their world anymore. (Obviously the mainstream won't be that savvy yet.)

But then the price will fall 75%-80% again, let's say back down to a new low of $50k over the period of a few months in 2021 or 2022. 

Few will have noticed the small but real damage done to the the world's fiat currencies that time; at $250k the market cap of bitcoin alone will be $4.5 trillion, which of course eats up a lot more fiat than the mainstream will have thought possible. I think banks will try to hide this from the world, somehow, and make the situation appear just like the 2017 bubble. As we come back down to $50k or so, fiat will seem to repair itself and the world won't have crashed yet. There just aren't enough people believing in BTC yet, but this will open up a lot more eyes.

4-5 years later, the damage dealt to fiat on the rise to $1m will most definitely cause a major, global, inflationary event. It'll be quite chaotic and painful for many, I'm sad to report. But Bitcoin's superiority will become obvious and most of humanity will finally know they can't avoid holding onto some bitcoin as savings at that point.  

Some things we'll see on the way up to that: 

* Smaller countries start adding BTC to their national reserves
* The weakest fiat currencies will throw in the towel
* Although govts may never call it legal tender, BTC will become the defacto money in some small countries soon afterwards
* Central banks will be fruitlessly trying to launch their own crypto, which simply won't catch on unless forced on their citizens. If it does, they'll be tradeable for bitcoin and start inflating again anyway.
* We hodlers will start to be seen as the new elites, and the people with the most hardship will hate us, no matter what we do for them 

Will banks fold and go away?

No. They'll all turn into Coinbases, basically. There won't be a need for so many branch offices though, so their appearance in society will be much less obvious.

It's the central banks that need to worry the most; after it becomes obvious that their digital fiat can't compete with Bitcoin, (2035?) economists worldwide will have no choice but to declare Keynesianism a failed experiment and embrace both bitcoin and the deflationary economy as proper.",2019-04-23 07:07:21
elkqnry,anyoneinthere,47,"As I sit here and reminisce on Q1/2019 I think about those calling for triple digit bitcoin and for the “CaPItulAtiOn WIcK” or the “alts MUST ALL DIE” while most alts including LTC were already down 95%-100%.

So many of those obnoxious bears are liquidated. Some have even logged off reddit to never be heard from again as I kept tabs and some have been inactive since.

Play stupid games, win stupid prizes. (Prize being handing your entire account to Bitmex)",2019-04-23 23:39:00
eljy1ul,TheSimkin,44,"Buy a bit at a time.  Use bonuses, tax returns, Cash back from cc, any way you can to trick yourself into saving more!

I am way better at saving/not spending money by decided to put it into bitcoin instead!",2019-04-23 14:38:38
eljwd4i,j4c0p,43,"This last 2 years were speed up crash course for me.... of human behavior.  
Its unbelievable that even meme bubble chart is actually spot on .  
90% of people in market are drawn like flies into light to do exactly opposite of what they should do.  
We buy into pumps, we are shorting 3k bitcoin, same mistakes just new people getting burned.  
In face of uncertainty and in uncharted territory we really just turn on some built in rekt procedure, that is same for most of human.

Its like using red laser pointer to a cat, it just haywire its brain and it go nuts.  
If you want to see how mature person is, put him into unknown situation multiplied by his own funds and you will very quickly see how exceptional person is.  
""Put your money where your mouth is""- Now I understand what it REALLY means .  


hodl",2019-04-23 14:07:13
elirzs1,woke_centrist,41,"""Yeah we made this AI, but it keeps buying Child Porn with Bitcoin.""",2019-04-23 05:22:59
elipm7n,ryanmercer,40,"I traded bitcoin I mined for WoW gold when it was effectively worthless, even at today's price it would be equal to 72% or so of my FIRE number.

*shrugs*

&gt;how did you get past that?

I'm not a time traveler and can't change the past so I moved on with my life",2019-04-23 04:58:09
elkc0jp,WippleDippleDoo,40,"The first huge wave of this happened against the Bitcoin XT and Bitcoin Classic implementations.  


The modus operandi of the Cult of Core did not change since then.",2019-04-23 20:33:15
elilfhc,exab,38,Pro-Bcash isn't the main problem. The main problem is it's anti-Bitcoin.,2019-04-23 04:15:42
elk9cuh,Manticlops,36,"Changes to bitcoin *should* be difficult. And if they rid the ecosystem of bad actors along the way, so much the better.",2019-04-23 19:35:45
elkbbgv,CrapCloud,36,"I'm being approached by colleagues at work, friends and family because they are noticing Bitcoin is going back up. I didn't think they were watching 

the price like I do. most asked me if I was selling, to which I replied with a no.  I direct them to atms where they can buy. It sure is nice to witness

them feeling confident that the bottom was in at 3200 and that we are never looking back.",2019-04-23 20:19:33
eli13ck,linuxfan1,36,$1.6 billion in Bitcoin?! Who knew $2 billion of Bitcoin could fit in that small of a space. I don't know what I'd do without $500 million in Bitcoin.,2019-04-23 00:37:31
elkq1fo,maff1989,34,"u/adam3us, claim responsibility for this shitshow of a Bitcoin network",2019-04-23 23:32:18
elihnok,twilborn,30,Its sad because I saw a lot of BCH supporters stood up for hodlnaut on Twitter.  Now hodlnaut is promoting the @bitcoin account removal.,2019-04-23 03:36:07
