Comment ID,Author,Score,Body,Publish Date
ekvvtsl,snajm01,28,"It's frustrating for most of us. But if you understood how stupidly speculative this market is, you wouldn't feel this way. 

We are invested in a new digital asset that isn't even regulated yet and that carries a lot of risk. All altcoins and even Bitcoin could easily crash to 0 in the next couple of years. Yes, this is a very big possibility, believe it or not. Just because we are invested and understand the technology and its power, doesn't mean everything will work out the way we want it to. The truth is that nobody has any idea how to go about crypto valuation, not even fintech geniuses. It's just baffling. Make your way outside of our beloved crypto bubble and you will see a whole world where people don't even understand the basics of blockchain. 

It doesn't matter if Brave or Dogecoin or ""Shitcoin"" are currently valued higher. It's all bullshit, and will likely remain so for the foreseeable future. We are gambling. WE ARE GAMBLING in uncharted territory. And to do this, you must have a big appetite for risk, which involves regularly conducting due diligence on the tech that you're invested in without worrying about short-term market fluctuation. The end goal is many, many years away still.",2019-04-15 03:09:01
ekvkmzp,quinn9648,28,"This is a classic example of a bubble, people. It’s bitcoin: war thunder edition. 

The price will only come down when either supply increases (it will, inevitably) or demand decreases, which will come when people believe that it has no combat value.",2019-04-15 00:53:26
ekwarnf,haddock420,26,"So if someone steals your watch, not only do they have your watch but your bitcoin as well.",2019-04-15 06:21:03
ekwcyu9,S0XXX,24,"Its definitely true, when I was a newbie back in 2015 I didnt buy Bitcoin because I feared it would crash again. Once Bitcoin passed $1200, I started to gain confidence in it, and then when it got past $2000 I realized it was time.

&amp;#x200B;

The other thing is, a lot of people view $20,000 as a number Bitcoin might never get to again, a lot of people are unaware of the potential that Bitcoin could hit $100k, $250k etc......so until Bitcoin at least passes $20,000 and goes past it, such as $30,000, then people will gain confidence. I know because I was in these peoples shoes a few years ago, I honestly though Bitcoin would never reach $1200 again, but I was a newbie, I didn't know what a market cap was, I didnt understand the limited supply, the halving, none of it, all I knew was that Bitcoin got to $1200 and came down, and that $1200 number felt so far away, the same way people view $20,000 as a pipe dream now.",2019-04-15 06:49:56
ekxkt4j,where-is-satoshi,23,"&gt;Aside from expecting the cycle to repeat itself, there are indications  that the next price rallies will be unlike what we have seen before.

In the other Summers, BTC was an *electronic cash system* with room to grow exponentially. Expecting the ""cycle to repeat"" when BTC is *no longer* an electronic cash system and has already slammed into its max 3 TX/Sec capacity limit, fails to recognize that only the BTC name remains the same while everything under the hood has shrunk or has been removed.

&gt;major mainstream technology companies and financial institutions are getting involved with the blockchain technology more than ever.

Bitcoin BCH carries the dream of peer-to-peer electronic cash and has gained the development initiative. The conditions are set for a flippening.",2019-04-15 20:06:52
ekxziji,Glasshouse813Ebay,22,Good news today.. Bitcoin Cash SV is being delisted by Binance... Hopefully the money flows into other coins as people see how much of a skidmark Craig Wright is with the crypto community.,2019-04-15 23:53:17
ekx75bu,TyMyShoes,22,"Or because they believe that, that's why they own 1% of all Bitcoin.",2019-04-15 14:04:33
ekwe6sk,LucidDreamState,21,I would also say that if I owned 1% of all Bitcoin.,2019-04-15 07:05:52
ekw5e1q,Regjohn,21,Bitcoin is a female now? That explains the mood swings,2019-04-15 05:10:03
ekzh052,KatKing420,1670,WHATS THE PRICE OF MY BITCOIN,2019-04-16 09:53:26
el01852,chiraq101,794,It’s bitcoin before the 19k crash,2019-04-16 14:33:52
ekzjzih,cirquefan,177,"Hello Dugdiggadome you don't know me but I accessed your computer while you were (ahem) pleasuring yourself (good job bro) and for 987 dollarydoos in Bitcoin I will not send everyone this video, you can trust me

Bitcoin: 727zbdh483icbsISCAMYA",2019-04-16 10:28:23
ekzdlkj,ButtmanNaNaNaButtman,82,"“What is ‘I will pay you in Bitcoin for a two-minute video of you stomping barefoot on a Subway $5 footlong while making strangled cat noises,’ Alex?”",2019-04-16 09:12:20
ekzcbop,flippyfloppydroppy,72,This is good for Bitcoin,2019-04-16 08:55:33
el04eom,consistentbenny,67,"&gt;Cryptocurrencies, do you know about this? I know everything about it, probably more than anybody else. It's like internet money, bits and stuff. All digital. Japanese made it. They are smart people, very smart people. Very clever too. Natoshi Sakamoto, he invented it. Great guy, I tell you. I met him. In fact, he came to meet me to get my opinion and I told him ""You better make sure the US is going to be the leader on this."" He shook his head. That's how they say yes in Japan, did you know that? It's crazy. Tremendous people. Great culture. So you can trust me, I will put the right people in place to make sure the United States of America will be leading this Bitcoin thing. We'll be way ahead of China, they have no clue about all of this. I recently met Xi, a great man. Kept telling him about Bitcoin, he did not know anything, talked about something called XRP. They got rid of all the mining he said. The people there suffer, no jobs. I will bring tons of mining jobs to our country. Nobody will mine more Bitcoins than the US, I promise. Trust me.  
&gt;  
&gt;\- Donald Trump some time in 2020, probably.

&amp;#x200B;

Also, still waiting for him announcing an ICO to fund his wall - Wallcoin.",2019-04-16 15:43:39
ekziwdb,about831,59,That’s exactly what someone who’d pay Bitcoin for a two-minute video of some girl stomping barefoot on a Subway $5 footlong while making strangled cat noises would say.,2019-04-16 10:15:39
el08i3k,sugarpuffextreme,54,Jokes on them. As if they are the only exchange or seller of bitcoin. Just buy bitcoin on any other real exchange and watch idiots like that go under,2019-04-16 17:35:17
el0kjpw,BashCo,50,"&gt;make the habit to upvote everything relevant in this sub.

Upvoting relevant content makes all the difference as to whether or not a thread hits r/all, and often times we are just below that threshold. The tricky part is that 'relevant' means different things to different people. Personally I always try to **upvote high-effort original content and downvote low-effort repetitive content.** Occasionally I will upvote memes that are new and make me chuckle, especially if I think they have potential to hit r/all.

r/Bitcoin/new and r/Bitcoin/rising are both great spots for voters to keep an eye on if they wish to help curate the front page.",2019-04-16 21:57:44
el0618w,lazyjoo,46,"I don't like Roger. I especially do not like that he has control over [bitcoin.com](https://bitcoin.com) and the twitter. That said, he's done very well for himself and was a Bitcoin believer and investor before most of us even heard of Bitcoin. And that said, I hope that BCH goes away with SV that way BCC has. 

It's one thing to try to improve on the original... It's just downright distasteful to say that you *are* the original. Whichever one has the longest chain is the original. Using the Bitcoin brand to gain attention and confuse newcomers while simultaneously trashing BTC is scummy and extremely lacking in integrity.",2019-04-16 16:25:25
el0sb2q,Hizonner,46,"Bitcoin is designed that way because, in 2008, it wasn't obvious to one random guy how to make it private.

There's every sign that he and everybody else involved early on would have *preferred* to make it private. There's even very early advice to use a different address for every transaction... which was probably based on believing that to be more effective than it actually is.

Lack of privacy *is* contrary to the spirit of decentralization and permissionlessness. Permissionlessness doesn't work without privacy.

'Course, Bitcoin itself is now totally dominated by the forces of speculative gold-buggism, but I think it's reasonable to say that permissionlessness is actually much more central to any reasonable conception of the animating spirit behind its original creation, and the same is true for most other cryptocurrencies.",2019-04-16 23:35:49
el0ldsf,smadgerano,45,"The point of one crypto is different to another.

In the case of Bitcoin, the point is to be a ""system for electronic transactions without relying on trust"", nothing more. The fact that all transactions are open to everyone is a byproduct of using the distributed ledger.

But you are correct about keeping your addresses and keys private.",2019-04-16 22:09:32
ekyaw05,CryptoNoob-17,43,"4. Bitcoin (Shit Vision) BSV gets delisted from Binance

I love it when a plan comes together.",2019-04-16 01:56:18
ekyw7ds,MaximumInflation,42,"&gt;gold is widely accepted as sound money, but the price of gold vs bitcoin sky rocketed in 2018 because of bitcoin's price falling, that would mean gold's value was suddenly appreciating.

fucking bulletproof.",2019-04-16 05:32:37
el0m646,Tokeyzebear,40,"Yeah, but like, you are using a system (bitcoin) where the goal of the design is transparency for all the users including how and what addresses you send your coins. So while you feel that way it doesnt really describe the most inherent nature of bitcoin and many public blockchains.",2019-04-16 22:20:08
ekzowd0,bs-scientist,39,"No. 
The comment I replied to was an actual email scam. 

They say they tapped your webcam and have videos of you watching porn (like how in the original post a guy was seen watching porn and jerking off). They put my actual correct Facebook password in the email. 
And it was fabricated to make it look like my email was hacked. Like it was sent from my email to my email. 
Bitcoin wallet number, request for money, and the “you can trust me.” 

IT told me something like 50,000 people got similar emails.",2019-04-16 11:26:47
el0e97g,Omaha_Poker,38,But if I get paid from someone in bitcoin that has come from a poker website how the fuck am I supposed to that.,2019-04-16 20:07:52
el0dfdk,WorkingHardNot,38,Reminds one of Bitcoin. Just buy all these CPU and ASCI miners and you'll be able to make your money back in maybe 6 months - definitely by a 9 months. It was great until sanity both slapped everyone.,2019-04-16 19:49:13
ekzo3up,Nandistine,37,"Holy shit. 

This, it’s a good idea. 

Like, 1 bitcoin for a turn in but a massive bonus like 2 bitcoin and some euros for finding items in raid. 

It’s almost like that would give players a freedom of choice in progression.",2019-04-16 11:16:55
ekyu0e0,Subfolded,37,"I traded stocks for 10 years before I discovered crypto – honestly I see nothing rational over there either.

Here’s my thoughts on your observations:

\#1. I think the cost of upkeep is very low in crypto and so there’s no reason for a project to “officially” die. An exchange could let some garbage coin bounce around on their platform indefinitely, really. What’s it cost them to leave it hanging out there besides some reputation and minimal bandwidth, disk space?

\#2. “News outlets… none of it is useful.” You didn’t need the middle portion, crypto or otherwise.

\#3. I echo your frustration, but I wouldn’t expect much more. Humans are a dramatic bunch.

\#4. I feel like crypto and Wall St are both pretty much run by algos skimming headlines (works in theory, but in practice every headline is clickbait so… problems.)

\#5. I agree – I just HAD to hop over to CMC to check out the damage and was astounded to see BSV at -10% (at the time). Bear in mind, this was AFTER Binance, Shapeshift AND Kracken had already piled on. I find this absolutely mindboggling. My only explanation is that if you consider who on earth was actually still holding BSV today, it’s only 2 people: Actual BSV believers and OG Bitcoin HODLers who received BSV from their BCH from their BTC.  In either case, they’re not selling no matter what (delusion in the former case, inertia in the latter case.)",2019-04-16 05:10:19
el0mya4,TicTacToeFreeUccello,37,"Alternative theory: Nick actually cashed out on bitcoin at the exact right time, is secretly a millionaire and he’s laundering his bitcoin money to the Patreon to support stav and Adam.",2019-04-16 22:30:13
el063al,yul_brynner,35,THIS MENTAL GRIFTER literally put a bitcoin miner and got exposed for it!  Projection 101,2019-04-16 16:26:57
el07blq,cyborg23_,35,"Not in the spirit of crypto, just one of the reasons Bitcoin must increase privacy.",2019-04-16 17:01:12
el0d3w0,ironlabel1,35,I have found 4 cheaters so far. You really want to find them take a m4 or a bitcoin and go sit in a corner somewhere away from the hotspots on a map. Within 5 minutes someone will come and shoot you.,2019-04-16 19:41:42
el0l8y2,jossfun,31,"I like how they say ""it's against the spirit of crypto"". I mean it's not bitcoin has public transactions by design",2019-04-16 22:07:41
ekzqket,VictorCobra,31,"I’m around. Just taking a break from spending a lot of time on reddit :P Happened to see this comment. I’m not affiliated with Cobra Bitcoin though. Didn’t even know he existed when I made this account.

-Victor Cobra",2019-04-16 11:47:45
ekzxxhz,dalebewan,31,"While I'm 99% sure this is sarcasm (since the chances of Craig Wright being Satoshi are lower than the chances that I'm Satoshi and just forgot it), I'm going to follow this thought through anyway...

If Wright is Satoshi and dumps all his coins next week, that'd be a good thing for Bitcoin in the long run.

1. It'd remove fear of that ""whale"" existing in the future which some people still have.
2. It'd allow everyone to stop talking about what Satoshi wanted, realising that somehow it turned out Satoshi was a complete dickhead that apparently just stumbled across one of the greatest ideas in history by mistake, freeing us up more to actually talk about what's a good idea instead.
3. It'd drop the value temporarily, allowing those of us who actually care about Bitcoin to accumulate even more of it ;)",2019-04-16 13:35:11
ekyiovf,truquini,31,"Bitcoin had cancerous cells. It got removed and it was named Bcash. As you would expect with cancerous tumors, it started attacking itself after not so long. It split and spawned a second cancerous faction, so now we have, Bitcoin ABC (BAB), which is Roger's and Wu's social attack to Bitcoin and Bitcoin SV (BSV), which is Craig Wright and some other pedos pet project. Because the bear market is incredibly boring, Bitcoiners seem to be bored and CW bait, giving those tons of undeserved attention and creating noise in the space.",2019-04-16 03:15:54
el0rnbk,floridamans-florida,30,The banks are just making the case for bitcoin here.,2019-04-16 23:27:55
ekzp6n6,BitttBurger,29,"My buddy who is a FedEx Pilot and was just moved to Hong Kong just sent this to me with the comment:    


""They are crazy about Bitcoin Cash out here!"" 

&amp;#x200B;

Apparently he's seeing it all over.",2019-04-16 11:30:20
el35l56,TheGreatMuffin,100,"Misleading. Take a look at the same charts in bitcoin volume (not fiat volume) ;)  

It doesn't make sense to look at fiat volume when the local currency is (hyper)inflating. You'll get all time highs every week, even if the amount of bitcoin being traded is going down.",2019-04-17 17:18:08
el1b7th,RoqueNE,72,"We'll see. But if it's similar to all the others before, you need knowledge in computer science, cryptography, steganography, Bitcoin history, excellent google skills and probably some completely absurd subject like premesopotamian agriculture or mating behavior of the stink beetles.

As a loner you can not solve it anyway. It is necessarily a group work.",2019-04-17 02:49:57
el1ft21,EnglishBulldog,58,"The idea that the real Satoshi would sue Adam, a man whos work Satoshi cited in the Bitcoin white paper as inspiration, is laughable.",2019-04-17 03:35:43
el3j95k,Bots4Peace,50,Blockchain being used for stock trading in several countries too. You don't have to own bitcoin to benefit from the huge potential of this new technology.,2019-04-17 22:04:52
el3lg2d,Merlin560,48,"BITCOIN UPDATE PNF Charting

This is going to be a long post.  I want to address the “bullish catapult” formation that I posted about before I started my drive back to New England.

I do not name the formations.  These names are decades old.  I know “catapult” sounds silly—but it’s not my name.  I just read the charts.  

The second thing to consider is that formations in PnF charting are trend formations.  Just because a formation is bullish, it’s not going to fire up immediately.  Most of the formations are targeted for the next 30-60 days.  In the stock market, some formations are created over months—not days are they are in BTC.  This charting is used to identify inflection points and trends.  

If you know how to trade them, and understand how fast things move—you will make money.  If you are day trading, you have to know the target points and how to “see” when these are going to play out.  

I am not going to take any responsibility for someone missing a $100 move, and then listen to complaints.  My intent here is to share my daily chart reviews and educate some folks on how to look at these markets.  Over time they have been remarkably accurate in terms of identifying ""price points"" for action.  You make your trades.  You decide whether a $10 move or $150 move is worth your while.  

The final thing I want to point out is the the final couple of paragraphs on my last post about this:  I warned people that the volume was not great and to watch out for a sudden reversal.  

That is exactly what happened.  

If you are day trading and swing trading, you better have an exit strategy.  If you are not watching it like a hawk, put in stops and accept a few dollars gain over a loss.

&amp;#x200B;

***On to today,.***

We dropped from the catapult breakout, then dropped and now we are moving back upwards.  As of this morning we’ve broken a double top and it is moving forward on moderate volume.   This is positive in the environment of the ongoing trend back up off of the earlier year lows.

On the way down, we broke the positive trend, and we are back in a negative trend.  This copies what happened in November.  With all of the BS news about exchanges and fake trades, it is possible that we see another drop down into the nether regions.  I personally do not see that happening, but it is something that should be sitting in your brain.  

Recognize it if it happens and act accordingly.

&amp;#x200B;

The price this morning is sitting right below the trend reversal back to positive.

Here are the numbers we need to keep in mind:

* We reverse at a price under $5,150 tomorrow.
* We are in a positive breakout.  The formation is a double top breakout.
* A negative breakdown would happen at any price under $4,950.
* The formation is 4 columns wide. So, any movement should be moderate.
* The trend is negative.  We are one box under the target price of $5,300 to change the trend.

That's it.  Back in New England.  Taxes are done.  I am always stunned when my “trading” accounts show more money transacted than I’ve made in most three year periods of my life.  I wish the gains were as much.  But 2019 is going to be the year, right?

&amp;#x200B;

\[Chart of the Day\]([https://imgur.com/gallery/9JgpHiu](https://imgur.com/gallery/9JgpHiu))

&amp;#x200B;

",2019-04-17 22:30:22
el3cdni,hiphopheadybear,47,"This is not an analysis or an opinion, but just my thanks to all of you who have shared your thoughts/analysis over the past year. 

After reading this daily for over a year, I decided to throw my hat into the ring and start trading on Bitmex. I tried to follow so many words of wisdom that I've heard about such as never going poor taking profit, never using more than 10x leverage, using stop losses, trend is your friend, trading with a % of my cold stack, not to get emotional etc. And I did well these past two weeks. Managed to be up 350%. But last night I entered a short position that skipped past my stop loss and turned my 350% into 40%. 

I didn't realize that a loss would have such a negative impact on my emotions outside of Bitcoin. I felt so stupid (even though I was still barley up) that it distracted me when hanging out with friends and doing my work at the office. I realize that I cannot keep my emotion out of trading and just these two weeks showed me how stressful it can be to constantly check your positions, manage your risk, and do research for future positions. It kept me up, woke me up early, distracted me from conversations with friends, calls at work. It's not for me. I closed all my positions on Bitmex up 40% and transferred all back to my cold storage. Even though I want to give it another shot I realize that constantly trading strains my mental health. It's time to step away. 

For those that can handle this without emotions, I salute you. To me the hardest part isn't figuring out which direction to open a position, but handling how trading impacts the other parts of your life that require your full attention. I hope you all continue to succeed and I'll see everyone in a few years. Thanks for the entertainment. 

&amp;#x200B;

TLDR emotions, man.",2019-04-17 20:15:51
el1ywal,AuntJemimah7,46,"Well that sounds like pure, unadulterated bullshit. The Health Department isn't ICE. Do they want you to pay in Bitcoin?",2019-04-17 06:50:17
el175eu,gr8ful4,36,"I love to see all those new comers (Q4 2013 and later) who think BTC (the market) has to do this or has to do that because &lt;REASONS&gt;.

Bitcoin has to do NOTHING.

Even more I love it, when I read some old timers that seem to have forgotten how crazy this market can become.

If you think it's impossible, that BTC can dump to sub 3k tomorrow and still rally to 100k within 3 months get ready to learn a lesson. Of course this is not the scenario I rate most likely. But it has the potential to seriously fuck me if I don't prepare accordingly.

This post is therefore intended to encourage you to think about some possible scenarios and do some proper risk management for some edge cases. Why? Because I think we will see some irrationality soon. The whole 20k &gt; 4k move was a self-fulfilling prophecy. Everybody knew the target. Now we are in no-man's land an that opens up the possibilities for speculation. Everybody tries to name some ""rationalized"" numbers both on the bear as on the bull side. But that's not how this market works. Never has.",2019-04-17 02:08:16
el15n74,simplelifestyle,35,"Don't forget [Roger Ver](https://pbs.twimg.com/media/DOZraZBXcAAM4Rz.jpg).

A trio of scammers with a long criminal history:

https://old.reddit.com/r/Bitcoin/comments/7cgzbv/so_i_did_5minutes_of_digging_and_oh_my_god/",2019-04-17 01:53:13
el3nrnb,intentionally-obtuse,34,"I can't remember if it was on /r/legaladvice or not but some dude was subletting a room and had included all costs with the rent. Long story short, homie gets a $1500 bill on the first month - turns out new roomie is a bitcoin mining enthusiast.  
  
Some people are just dicks.",2019-04-17 22:55:36
el3i6pu,lubokkanev,34,"Great post. Here's a summary:

* What is ""free speech"".
* Why what theymos did, fucks with free speech, no matter that r/bitcoin is his private sub.
* Vitalik's comment at the 2018 event that ""CSW is a fraud and should be allowed to speak"", and why it wasn't against free speech. 
* Delisting of BSV not necessarily fucks with free speech, maybe only Binance's delisting.",2019-04-17 21:51:15
