Comment ID,Author,Score,Body,Publish Date
ekb4557,jstolfi,27,"&gt; If you want to help me further decentralize our money

Why would I want to do that?  ""Decentralized money"" is trash money; that is the main economic lesson that bitcoin demonstrated in the last 10 years.  

nd Satoshi himself did not care for it: what he wanted to build was a decentralized **payment system**.  He only created the currency because there was no way to do that with dollars or euros.

But the other economic fact that bitcoin demonstrated in the last 8 years is that the only people who would benefit from a decentralized payment system are criminals.

And the third economic fact that bitcoin demonstrated in the last 7 years is that mining will inevitably become centralized in a handful of companies, maybe even one.  So a decentralized payment system fails just on its own.

And the fourth fact the bitcoin demonstrated in the last 6 years, but techno-political this time, is that every cryptocoin will have a central authority that has the last word on changes to the protocol.",2019-04-07 21:03:55
ekb2ox2,jstolfi,26,"You call this an echo chamber?  Check /r/bitcoin, where anyone who is even slightly critical of bitcoin (and their particular sect of bitcoin) is automatically banned.  They are so luddite over there, that, 600 years later, they are still hating *banks*.  Paper money and credit cards, then...

The only thing that is more stupid that comparing your pedoponzi pesos to ""the early internet"" is calling it ""the new internet"".  The project failed 9 years ago, and the corpse is only kept sitting because scammers can use it to milk billions from suckers.

If bitcoin is the ""new internet"", how come you are here?   Shouldn't you be interacting with your echos on a ""new generation"" forum, on  The Bockchain?
",2019-04-07 20:27:44
ekc206x,0d35dee,710,"i like carl sagan, and his commentary seems apt regarding the issue he is discussing, but please do tell me what the fuck this has to do with bitcoin?",2019-04-08 04:37:07
ekccl4f,WantedToGetInvolved,284,He's saying spam bitcoin on social media and don't make the posts longer than 5 seconds,2019-04-08 06:30:09
ekcj3ag,AkaGooby45,188,I bet you 3 trillion bitcoin dollars that the artist doesn't have a gi2,2019-04-08 07:44:31
ekc718t,SimonGallupsBass,131,"FALL 1994

""Clearvest, John speaking,"" I said as I answered the phone.

""Um, hi,"" the far away voice on the other end stammers, ""I'm looking to put a substantial amount of money into Bitcoin, about $680k worth if the price is below $200k, can you help me out?""

""Is that one of those new new tech companies?  Lots of IPO's and private placement going on in tech.  What is Bitcoin?  Is that American?  Japanese?"" I ask as I scribble it down in the corner of my notepad.

There was only silence.  The line was dead.

""Ok then,"" I say as I hang up the phone.  ""This new internet thing sure is bringing out the crazies,"" I yell out to Aileen.  I can hear her laugh through the glass.  Sometimes I cant tell if she's laughing with me or at me.   I decide to get back to work on the Rosenberg Estate plan.


SUMMER 1998

Aileen dropped off the mail around 11:30.  New issues of Fast Company, the Economist and Wired had come in along with 4 AOL trials, 2 on CD and 2 on Floppy.  I liked it when they sent the floppy disks, I could use those.  I had a whole drawer full of those things.  They were handy.  CD's were worthless though.  They made terrible coasters.  I know because I tried.  That foil shit would lift from the substrate and get all over the place if you put a Coke on them.  I guess it was the future.  I just found them exponentially annoying.  The floppies at least had some value.

I start looking at the Economist when the phone rings.

""Clearvest, John speaking,"" I said as I answered the phone.

""Hi again, sorry for the disconnection,"" said the strange and tinny voice on other end.  It was that crazy dude.

""Oh hey, you're the guy that called about....Bitcoin or whatever, right?"" I said.

""Ya, do you know what the price is?  I'd like to buy about $680k worth if I can.  Is the price still under $200k?"" he asks.

""Man, I don't know what the hell that is.  Is that some new company that is IPO'ing?"" I ask.

""It's a digital currency.  It's THE digital currency."" he says, ""This might sound strange, but what year is it?""

""It's fucking 1998 dude, what year do you think it is?"" I reply.

""Give me a second,"" He says as he muffles the phone and I hear him yell to someone ""It's fucking 1998.  It called 1998.  That's like 10 years before the first version.""

He returns and says ""Look, this is going to sound really weird but in about 10 years there's going to be an economic crash.  Some anonymous programmer is going to release a software that creates a digital currency called Bitcoin in response to it.  Horde as much of it as you can.  Because about 12 years after that, around 2020ish, the global economy is going to completely implode.  The only thing that will hold any value around the world is Bitcoin.""

""Look man,"" I say, frustrated, ""I don't have much tolerance for bullshit.  I have a lot of clients with real money that pay for my time.  The last thing I need is some paranoid schizophrenic telling me about some fake digital currency of the future.  I deal in real investments and financial planning.""

I hear him mumbling to someone again on the other end.  ""He thinks I'm a fucking nutjob.  I mean, I would too.  It's 1998.  Get the address.""

""Are you there? I ask more than a little annoyed.

""Ya.  I'm here John.  My name is Aaron Stafford, I'm sorry I didn't introduce myself before.  I know this is a lot to take in, but I'm actually calling from 2033,"" he says.

I bust out laughing.  ""Oh that's good.  Is that you Jeff?  You fucking with me again?""

""No, my name is Aaron.  I'm actually living down in South America and it's 2033.  I'm living in a community just outside the Guarani Aquifer in Paraguay.  No bullshit.  You're in the heydey of the internet tech boom.  Have you heard about Artificial Intelligence and Quantum Computing yet?  Things get really interesting once they come on the scene.  They make a lot of this stuff possible.""

""Ok 21st century digital boy, how bout you give me some stock tips and make this worth my while,"" I challenge him.

""I'l tell you what.  If I do and they pay off, do you promise to buy 10,000 Bitcoin sometime around 2010 and transfer it to my address?  They shouldn't cost you much at all if you buy around then.""

""Sure,"" I say, because fuck it, what did I have to lose?

""Ok,"" Aaron says, ""In 1998 you're going to want to buy Apple.""

I burst out laughing again.  ""Apple's about to go bankrupt!"" I say.

""Jobs comes back.  Microsoft puts them on life support with like a $350M placement.  They end up taking over the tech industry around 2007 with smart phones.""

Sure enough, Jobs had just come back and was making cuts to Apple's business.  Maybe he did know something.

""I need more than that,"" I say.

""Ok, Amazon is something you should buy too.  They dominate online retailing in the future.""

""I already have some of them,"" I say because I had just bought some after the IPO last year.

""Buy more.  Buy a lot more,"" Aaron said.  ""And Google.  You probably don't know who they are.  Maybe around 2003.  Buy a lot of them.  And Sell Yahoo if you have them.  They don't make it.""

I keep scribbling notes on my pad.  I'm a sucker for stock tips, especially with this dot com boom going on.

""Anything else?"" I ask.

""Netflix.  They're still probably doing mail order DVD's but they are going to transition at some point to streaming video over the web.  But they only do well for about 15-20 years before they get crushed by Disney.""

""Ok, so if these pan out, how much is 10,000 Bitcoin going to cost me?"" I ask.

""Well,"" Aaron says, ""if you can get in around July of 2010, maybe about $80.  Would you be willing to send it to an address if I give you one?""

""Address?"" I ask.

""Yea, each Bitcoin wallet has an address like computers have an IP.  I can give you my wallet address and my buddy here is convinced that we'll see the funds on our end,"" Aaron says.

""What about the $680k you were talking about?"" I ask

""That's kind of tricky to get to you given the, umm, circumstances.  You should be able to make millions if not billions on the tips I give you.  All I ask is you buy about $80-$100 of Bitcoin in June of 2010.  It's very important you don't put it off because the price starts escalating quickly after that.  And youll want some for yourself too because those stocks we talked about earlier are going to crater in the 2020s.""

""OK,"" I say.  ""I'll tell you what, if this Apple pick pays off, because right now it looks like they are at death's door, I'll do it.  Do you want to give me the address?""

""Ok, this is a long ass string of characters.  It's important you get this right.  Let me know when you're ready."" Aaron says.

""Ready right now,"" I say, listening intently.

""Ok my address is:  33jNuGa7Nazi6mWT9DaX11iETyYvicRCXR.  Read it back to me."" Aaron says.

""Ok, 33jNuGa7Nazi6mWT9DaX11iETyYvicRCXR.  Is that right?"" John asks.

""Yea, sounds right."" Aaron says and muffles the phone again and tells his friend to check the balance in the background.

""Holy shit John.  Thank you so much.  You have no idea what this means to me and my family.""  Aaron says back.  ""Like, seriously, thank you.""

""Thanks for what?"" John asks, confused.

""For following through."" Aaron replies.  ""And look, you're going to want to move out of the US by 2020.  I'd suggest buying land in Paraguay, by us, near the Guarani Aquifer.  Do that before you even buy Google in 2003.""

""Why's that?"" John asks

""Just trust me.  Water is going to be more valuable than gold.""  Aaron says.  ""Good luck John.  Thanks again.""

""Alright Aaron, sure, no problem."" I say.  ""Take care of yourself.""

Aaron disconnects before John can hang up the phone.

John grabs the new issue of the Economist.  Leans back in his chair and puts his feet on the desk.  ""Get ready for a world currency"" the headline says.",2019-04-08 05:30:50
ekcwj08,NullFlex,121,random shitposter online predicts bitcoin more accurately than modern TA,2019-04-08 10:39:11
ekck8dp,Bob_Sconce,119,"Yes.  It's a scam.   Here's how it works:

Fraudster sends you a check.  It looks real.  It may even be certified.  You deposit it and the bank makes the money available to you while the check clears the banking system.  You take some of that money and send it back to the Fraudster (with bitcoin or giftcards or anything else that cannot be reversed).  The check eventually comes back as fake and the bank withdraws the full amount from your account.   If you're overdrawn as a result, then the bank comes after you for the amount.

So, don't send him any money.  Don't contact him any more.  Report it to your bank.",2019-04-08 07:57:39
ekd3d74,ebliever,89,Which is why the only part of that prediction I find unbelievable is the notion that Bitcoin will have over 40% market dominance. Other coins will necessarily shoulder some of the load as cash replacements.,2019-04-08 12:11:14
ekc2hpi,Linkamus,77,"Move your BTC off exchanges to make the exchanges prove they actually have the coins. I am highly suspicious that the exchanges have less ACTUAL coinage than what their user accounts say should exist. 

No one even has to buy bitcoin anymore for prices to skyrocket. Everyone just needs to move their BTC off of exchanges, and that will drive prices up to insane levels.",2019-04-08 04:42:02
eke2u68,jungans,66,"Some of the comments there are from people that still have some common sense left. But their judgement seem to be clouded by emotional reasons. Take for example this comment:

&amp;#x200B;

&gt;So how do we normal people who aren't millionairs transact if onchain transactions cost thousands of dollars each? Even if we use lightning we'd still need to pay thousands of dollars just to open or close a channel. Sorry but this is going to drive most people away from Bitcoin if this is the direction it is going. \[...\] I will be forced off the network if this becomes a reality and I will simply have to be looking for an alternative **(no not bcash)**.

Why on earth you would be so opposed to BCH when your arguments are the very foundation of it existing?

&amp;#x200B;",2019-04-08 23:53:25
ekbmeov,DoomBot5,56,"The joke is on him, selling his bitcoin was why it crashed. It's a self fulfilling prophesy.",2019-04-08 01:34:12
ekbpgq6,lilpaki,51,"Tendies, bitcoin, and $MU? Add in Daddy Elon and you'll get at least 5 gold",2019-04-08 02:10:30
ekdzo3y,ducksauce88,48,Who are these idiots shorting Bitcoin? If I had $30mil I'd buy $15 mil of Bitcoin and hodl. Call it a day. Sit back and do what the fuck I want with my life. Lol,2019-04-08 23:14:03
eke0wsd,RedGolpe,47,"It went pretty well [last time](https://www.reddit.com/r/Bitcoin/comments/b80lsk/for_the_first_time_since_ath_bitcoin_rises_for/), so...

Data from Bitstamp, week from monday to sunday, CET time (UTC+2).

Weekly changes %: +2.90, +1.58, +2.86, +1.73, +0.11, +3.18, +26.73",2019-04-08 23:29:34
ekckbmr,RBXJ,46,"It’s a common scam, the $900 won’t clear and your bank will take it away in a few days. Don’t try to spend any of it.

You got lucky, you would be out $700 if you had sent him the Bitcoin.",2019-04-08 07:58:46
ekbmqc1,Sometimes_Lies,46,"Is it true that you can eat your human if they don't feed you for 2 hours   
Is it true that you can eat your human if they don't feed you for 3 hours   
Is it true that you can eat your human if they don't feed you for 4 hours   
When is it legal to eat your human  
Do humans notice being eaten  
Do humans notice being eaten when asleep
Ways to eat your human without getting caught   
Eliminating evidence you ate your human how to  
Can dogs testify  
Can you eat dogs  
Do fish feel pain  
Catnip for bitcoin how to buy  
How to make fish feel pain  
",2019-04-08 01:38:04
ekdo5pi,Kain_niaK,45,"/r/bitcoin --&gt; Compression is a scam! 

",2019-04-08 20:07:17
ekdj9ui,nowitsalllgone,43,"&gt; Can we have a civilized discussion about LN and block size?

Probably not, but let's try anyway.

&gt; I like the idea of LN but it seems that it's not ready yet.

True. 

&gt; What worries me is that I am reading a lot of articles in the ""other camp"" about how important it is for LN to have blocks that can handle the traffic.

It's not ready yet. We shouldn't scale the blockchain until the network is ready for mass adoption. It's not ready yet. All the proposals to bring on mass adoption right now involve getting everyone to run a wallet on their phone, not a node in their home. This means that a comparatively small number of full nodes would be securing the network for all the phone wallets. This is an enormous security compromise with potentially catastrophic effects for the whole network. Phone wallets need to be connected to a secure and large network of economically relevant full nodes. We need to keep the ratio of full nodes to phone wallets high, and until we can do that we must not try to scale up.

&gt; Since we can see that people are becoming enthusiastic again about Bitcoin, discussing this thing is of utmost importance.

No one is opposed to increasing the blocksize when the network is large enough for a capacity increase. But it's not. Those who want to scale now don't seem to realize the dangers of putting everyone on a phone wallet. Phone wallets do not validate the rules of the bitcoin network, they merely hold private keys. Instead of validating the rules, they trust third parties to validate the rules, keep them connected to the network, and give them valid information about what transactions have been sent to the user's wallet. Usually, these third parties are either the wallet maker (who runs a full node that all of his users' wallets are connected to), the electrum network (which is currently under a denial of service attack because it is a weak point in the network), or the miners (in the case of SPV wallets).

All of these methods of running phone wallets are open to a variety of attacks. Remember when the majority of the miners wanted to break off and form a separate network (segwit2x)? That is just one demonstration of the insecurity of SPV wallets, which trust miners to give them valid information. Relying on the electrum network is also increasingly difficult because of denial of service attacks and the sybil problem. DoS attacks on electrum servers are designed to overload the cpus of the volunteers who run electrum servers with requests for information. The result is that ""real"" users have a hard time finding a server that can actually give them information. There's also a high prevalence of scam servers which refuse to relay transactions but merely tell you to visit scam sites and download a coin-stealing malware. Since it is easy to set up an electrum server, many scammers are doing so, which is a quintessential sybil problem. Then there's the option of just using a wallet that connects to the wallet maker's node. This is the most common type of wallet, and it's insecure because the node operator for that batch of wallet users then controls what network his users are on and what rules he's validating. A wallet operator who controls his users' connection can feed them false data or censor their transactions.

All of the above reasons are why our scaling priority needs to be: help more people run full nodes. That's the only way to give the network a secure foundation for the future. Getting everyone to run phone wallets is not a scaling solution, instead it creates a massive scaling problems and security vulnerabilities. A big reason for keeping the block size low right now is because the network is not ready to scale and won't be until running a full node is easy enough that there's a high ratio of full node operators to phone wallet users.",2019-04-08 17:48:50
eke2m7k,MemoryDealers,43,This is why I’m so bullish on Bitcoin Cash.,2019-04-08 23:50:47
ekdoucj,HenryCashlitt,40,"\&gt; a small increase in block sizes would solve a lot of problems including the separation of the community

No, that ship has sailed. Well, Bitcoin Cash (BCH) is sailing. BTC-Titanic is sinking.

\&gt; Since when is it taboo to speak about technology?

In the BTC world, it's been taboo to speak about technology since at least August 2015:

[https://www.reddit.com/r/Bitcoin/comments/3h9cq4/its\_time\_for\_a\_break\_about\_the\_recent\_mess/](https://www.reddit.com/r/Bitcoin/comments/3h9cq4/its_time_for_a_break_about_the_recent_mess/)",2019-04-08 20:22:17
ekd9ky3,x_FatKitty_x,40,"Checks are, relatively, a very slow and ungainly method of payment. When your bank takes the check they have zero idea if the check is real, fake, real but from an account with no money in it, etc. The only way I know of to get a check verified is to go to the host bank (if it's a Wells Fargo check, go to Wells Fargo) and cash it in person. 

Checks take as short as 1 business day, and as long as 7, to clear the maker account (assuming it's all domestic).

But banks, as a courtesy to their customers, will generally release some or all of the funds early. Most checks are legitimate, so banks try to release your money early as a convenience factor for you. To be 100% clear, *just because you can withdraw the money does NOT mean the check cleared. At all.*

You will probably pay a bounced check fee (in US it's $10-$25) and the bank's loss mitigation department might call you to see what happened. No other ramifications. It's very good your bank held the check, because had you withdrawn the cash and sent it by Bitcoin, you would probably be on the hook for $700 unless Canada has some very generous consumer protection law covering this instance (which is unlikely).",2019-04-08 13:47:46
ekbqlis,jtoomim,40,"Writing blocks to disk is sequential. Checking transaction validity is not.

You need to use SSDs for the UTXO set. This is `~/.bitcoin/chainstate/*`. The UTXO set is a LevelDB map (i.e. prefix tree) of all (TXID, index) -&gt; (output script, value) mappings for the currently unspent transaction outputs. Reading and writing to the UTXO set is the main bottleneck on syncing a full node from scratch unless you cache the whole thing in RAM. The UTXO set size increases with larger blocks and increases over time. Right now, with 1 MB blocks on BTC, we have a UTXO set size of about 3.1 GB on disk, or about 8 GB in RAM. With 1 GB blocks, after a few years we would use about 3 TB of SSD space or 10 TB of RAM.

Processing these UTXOs will require handling an average of about 30k database reads and 15k writes per second. Each read and write can require multiple SSD accesses (trees are O(n log n), so total throughput requirements for the disk array might be 450k random access IOPS. This is well beyond HDD speeds, and beyond even mid-range SSDs. [That kind of performance](https://www.storagereview.com/liqid_element_aic_review_768tb) isn't cheap to get. This requirement can be reduced if you use a ton of RAM as a UTXO cache (i.e. using the `-dbcache=xxxxxx` command-line option, but this would probably require hundreds of GB or terabytes of RAM to be effective.

Your bandwidth usage numbers are also off by a substantial margin. Most of the node's bandwidth isn't used by sending and receiving transactions; it's used by *announcing* those transactions or uploading historical blocks. If a node has 100 peers, it only has to send and receive a (e.g.) 400-byte transaction once on average, but it has to announce that 32+8 byte TXID (with the lowest possible overhead) 50 times. This means the node will use 4 kB for announcing the transaction, but only 0.8 kB sending and receiving it. If we assume that the average full node operates for about one year, then your node will have each historical block requested from it on average once per year.  This becomes more burdensome as each year passes. The first year, you would upload historical blocks at 0.5 times the bandwidth used for transactions in current blocks. During the second year, it would be 1.5x. During the tenth year, it would be 9.5x.",2019-04-08 02:23:41
ekbrklt,rpitchford,39,"Bitcoin. No, not how it works, but why it is needed? I mean, besides paying ransoms and buying illegal shit...",2019-04-08 02:35:33
ekcflb7,bitusher,39,"My favorite aspect of Bitcoin is the empowerment of the individual by allowing them self sovereignty over their wealth. 

The peace of mind that I have from never having to worry if my registered value gets frozen or stolen and I can travel anywhere in the world as a free person where my wealth can be protected. 

I sold all of my gold because compared to Bitcoin it is a horrible investment(much worse than stocks even,good store of value only), is much more difficult to secure, isn't very divisible, is difficult to validate, difficult to transport, and much more difficult to spend. ",2019-04-08 07:03:26
ekbq2p5,sraymansmoles,39,"Agreed and The Nano Center is already doing this!  I really like what I’m seeing from Brian and everyone part of that team.  Also, despite the tackyness, things like what /u/nanoissuperior has been doing lately with stickers, shirts etc.

I have also been sharing with family and friends, though they’re not even into bitcoin so it’s not been very effective yet.

Also, once brainblocks and nanoray push their POS devices that will open up a whole new form of marketting to merchants which will see an increase in “nano accepted here” signs which will lead to more interest.

Things are looking good for the future.",2019-04-08 02:17:33
ekbnnqn,Onsyde,39,"Well, Bitcoin has stabilized at almost exactly $5,100/coin. I'm tired of waiting for a jump, so I'm taking the loss and getting my cash back. ",2019-04-08 01:49:22
ekclr1b,wickedplayer494,38,And how is this relevant to Bitcoin?,2019-04-08 08:16:27
ekdwkcg,filip57,36,"&gt; Bitcoin is a currency, just like $, £, €, ¥

Oh wow, must've missed when it started being accepted everywhere like every other currency!",2019-04-08 22:32:28
ekc1ic5,Bitcoinawesome,36,"Bitcoin needs to lose top spot so all these ""Thought leaders"" are thrown overboard.  I dont care which coin takes the #1 spot. ",2019-04-08 04:31:56
ekdghra,parentis_shotgun,35,"Well for one they got caught bundling a bitcoin miner, and a LOT of other malware. Its closed source, bloated, and the other clients surpassed it around 8 years ago. ",2019-04-08 16:27:02
ekc7ken,etmetm,34,"If you currently have issues getting your Electrum wallet to ""synchronize"" or even to connect to a server this is because a botnet of several thousand zombies is running custom code to connect as an Electrum client and use of ressources.

There is a [patch all pull request to electrumx](https://github.com/kyuupichan/electrumx/pull/785) to introduce per IP ressource limits. The default 30k RES_LIMIT seems a little low for larger wallets but works fine to keep up servers.

Fairly responsive servers with TLS connections are:
 * ecdsa.net:110
 * electrum.hodlister.co:50002
 * vps.hsmiths.com:50002
 * btc.jochen-hoenicke.de:50002

Also see https://1209k.com/bitcoin-eye/ele.php

Servers at the top should be more responsive than the ones further down the list.

Please be patient trying to find a server that works for you (disable auto-connect doing so). Do not download alternative Electrum versions from random sites stating they will fix this issue - those are by scammers trying to steal your coins!",2019-04-08 05:36:37
