Comment ID,Author,Score,Body,Publish Date
cyi14bc,ZionCluster,61,"No, they (not the same person i don't think) did have an article or two this year about how Bitcoin was the best performing currency in 2015. Credit where it's due.",2016-01-01 13:24:32
cyhnnsv,evoorhees,57,"It's a reasonable question. The answer is twofold: 1) I came to realize that to the extent any digital asset (and I avoid the term cryptocurrency here intentionally) did something economically useful, it would warrant a value/price and 2) I realized it was unecessarily difficult and unsafe to trade such assets with old school custodial order book exhanges. 

On 1) I realized not all coins were exact clones of Bitcoin. Some were significantly different (and I don't mean just a ""faster block time""). Some were fundamentally different and would thus likely find unique use cases. Therefore there would be a universe of assets, and they deserved frictionless exchange.  On 2) I discovered an elegant way to enable users to trade coins, with no custody and no accounts. Faster and easier and safer.... thus a business opportunity. And to be able to do it without banks and fiat entirely? And to nurture both the transparency of Bitcoin (all of our txs are visible on homepage) and the privacy which is a right of all humans (no accounts or personal info required)...  Match made in heaven. 

So did I change my mind on alts? Yes. That doesn't mean they are all valid, indeed most are at best experiments and at worst half assed attempts for pump and dumps. Some are valuable though, and beneficial to this industry we are building. They should be judged individually on their merits. I cringe when I hear people refer to the whole body of them as scamcoins. It's lazy bigotry, and often perpetrated by those who aren't confident deep down about Bitcoin itself, which isn't an affliction from which I suffer.

And do I hope to make tons of profits by building a business on these observations? Hells yes. ",2016-01-01 05:54:38
cyhzkbx,huntingisland,54,"I have to think the miners and other adults in the room are getting tired of the people associated with the small-block position who start boycotts, hire botnets to launch DDoS attacks, and engage in censorship and vote-hiding on /r/bitcoin and other internet fora.",2016-01-01 12:24:37
cyhw5tg,[deleted],45,Holy shit 65.9 million nodes? Bitcoin really is taking off. I can't believe we didn't see this coming. Its newyears and I'm all out of skull lube.,2016-01-01 10:22:42
cyhd6as,A_sexy_black_man,42,"&gt; he had 4400 followers, there are 12 year old girls with more 

Did I miss something? What the hell does this have to do with anything at all

Anyway One of his tweets that caught my eye was ""@jacksormwriter wants me dead"" then if you get on that page it's a page with barely any tweets and no picture but there is one tweet to a link of a transcript of all of Ian's tweets [posted to pastebin](http://pastebin.com/yk8bgru5). Don't know what to make of it but what a strange thing to do. 

 And as far as your question of who, well all i did was search 'dead' in this subreddit and here's all that i found. Keep in mind there are probably dozens more that we've never even heard of. 

All of these are titles that you can search literally right in this sub.

- [Gary Webb](https://en.wikipedia.org/wiki/Gary_Webb) is the reporter who broke the story about the CIA selling Cocaine in the US had his reputation smeared, career destroyed, and was found dead from TWO gunshot wounds to the head... it was ruled a suicide.

- in July 2003, Dr. David Kelly testified to the fact that Iraq had no biological weapons. Two days later he was dead. ruled suicide

- A New York man had his home taken from him, his life threatened by a judge and then ended up mysteriously dead from a head injury shortly after compiling the evidence of this…

- Author of 9/11 conspiracy books found dead along with his two teenage children. All three were killed with a single handgun bullet to the head.

- RIP Michael C. Ruppert, author, peak oil awareness advocate best known for ""Collapse"". Dead of an apparent self inflicted gunshot wound.

- Wall Street Journal Reporter Found Dead After Controversial OPEC Investigation

- 28 Year Old CEO Of Bitcoin Exchange Dead After Possible Suicide

- A British oil executive whose job was to promote greener fuels has been shot dead in Brussels. Judges banned Press from reporting details for 14 days. Family believe was a professional hit.

- Andrew Breitbart, Publisher and Author, Dead - As he was about to release Obama College videos..

- Man shot dead by FBI knew Boston bombing suspect, friend says - FOX 35 News Orlando

- Guantanamo Attorney Found Dead in Apparent Suicide


- [Two Murdoch Whistleblowers Dead](http://yesbuthowever.com/two-murdoch-whistleblowers-dead-5000943/)

- TIL: Bill Cooper predicted 9/11 three months before it happened. Two months after 9/11 he was dead.

- The Guy Who Created RT (Russia Today) Has Been Found Dead in DC Hotel

- 9 missing dead whistle blowers from BP oil spill…

- Almost Every Cleanup Worker From the 1989 ExxonValdez Oil Spill Is Now Dead

- Twelfth holistic doctor found dead, alleged suicide",2016-01-01 01:00:27
cyhs7js,insane1112,38,You could probably say that on /r/bitcoin too. Negative opinions on XT are OK!,2016-01-01 08:15:32
cyhcm7p,FullClockworkOddessy,37,"The article is being very inaccurate when it describes bitcoin's ""growing pains."" Growing pains imply growth. What bitcoin is experiencing right now are its death throes.",2016-01-01 00:42:31
cyhbtp6,dezmodium,32,"Lies and propaganda.

1 bitcoin foundation = 1 bitcoin foundation",2016-01-01 00:15:35
cyhd2jw,SirEDCaLot,32,"Hi Amanda!

I warn you I've been up for more than 24hrs so this may be a bit disjointed...

1. Yes.  BIP101, if adopted, increases the block size limit in several steps.  Bitcoin Unlimited by default does not have a block size limit.  Therefore it will be compatible with whatever larger blocks BIP101 creates.  

2. If by support you mean 'works with' (not 'shows support for') then yes.  A Bitcoin Unlimited node with its max block size set to 8MB or above will accept any blocks created by BIP101 in the first two years.  In 2018, BIP101 raises the max block size to 32MB, and doubles every 2 years after that.  
It's worth noting that this is the MAX block size, not how big the blocks actually are.  How big the block actually is depends on how many transactions there are to go in it.  Right now blocks are around 900KB.  If we raised the max block size to 50GB tomorrow, blocks would still be 900KB because that's all the transactions there are.  

3. The fork requires 750 of the last 1000 *blocks* to be tagged as supporting BIP101 (that's about 1 week worth of blocks).  This has nothing to do with nodes, only miners.  So if we could persuade a few of the big Chinese mining pools to adopt BIP101, that could make BIP101 activate.  Running a BIP101 *node* doesn't actually help things, but it does show community support for BIP101.  If the miners see a majority of the community running BIP101 they are more likely to support it themselves.  

4. The fork will happen once a. BIP101 activates, and b. the first block &gt;1MB is mined.  At that point all Core nodes and miners will reject the &gt;1MB block and keep mining on top of the previous block, while all BIP101 nodes and miners will accept the BIP101 block and start mining on top of it.  The blockchain forks into two new chains.  See the right side of [this chart](http://i.imgur.com/qgkzCjR.jpg) (but ignore the left please).  The two chains will still try to relay transactions to each other, but they will grow further apart over time.  
Now at this point, the Core chain will only have 25% of it's normal hash power (due to only 25% of the miners working on it) but the difficulty will stay the same.  That means that at 1/4 speed, blocks on the Core chain will only be mined about once every 40 mins, reducing the transaction capacity of the Core chain to 1MB per 40 mins (250KB/10mins).  This chain will quickly become overloaded- only transactions with absurdly high fees will confirm.  Since the difficulty adjustment happens every 2016 blocks, the overload will persist for 1-2 months.  I believe all remaining Core miners will switch to BIP101 in that time and this chain will die.  
With 75% of the hash power and the same difficulty on the BIP101 chain, blocks will come out about once every 13 mins.  With 8MB/13mins capacity, the BIP101 chain will have plenty of space for all transactions.  It will keep working normally and become the official Bitcoin blockchain.
Within about two weeks the difficulty will adjust and it will be back to 10 min blocks, so 8MB/10mins capacity.  

5. You can't vote by node, node votes are a vote of public opinion.  It's voting by blocks mined that has actual effect.  I think if BIP101 is adopted, Bitcoin-Core will have to implement BIP101 fairly quickly.  It remains to be seen how and if the community heals from this whole thing.  It certainly will mean a vote of reduced confidence in the Core developers' roadmap.  

6. No major mining pools have officially switched.  A few community pools have offered a BIP101 node (so individual miners can support BIP101 mining) however these were DDoS attacked for a long time.  That seems to have mostly gone away so we're starting to see them pop up again.  

7. Block height decides the main chain- the chain with more blocks wins.  The exception to this is Core nodes will ignore a chain with &gt;1MB blocks even if it's much bigger, however if BIP101 is adopted that means 75% of the miners are on board which means everybody else will be getting on board quickly.  So to answer the question in a sentence- the chain with more hash power will have more blocks, and the chain with the most blocks is the official chain.  

Now a few other things to consider.

The majority of mining power is in China, and the Great Firewall (GFW) slows down connections into or out of China.  This presents issues since the Bitcoin protocol is currently very inefficient at propagating new blocks when they are mined.  If a block takes too long to propagate it risks being orphaned- one-upped by another block or two mined by another miner.  An orphan block ceases to exist, and the miner that mined it doesn't get a reward, so they try to avoid that.  Miners can and do cap the size of the blocks they create, separately from the hard coded block size limit.  

At Scaling Bitcoin Hong Kong, Jonathan Toomim (/u/jtoomim) gave a great talk on block size propagation.  The conclusion was that today the network is ready for blocks of 2-3MB size.  Now that shouldn't preclude increasing the cap to 8MB (with BIP101), because remember the blocks will only be as big as there are transactions to put in them, and we won't have 8MB worth of transactions for quite some time.  

By the time block sizes reach 2-3MB, several improvements (that are being developed now by both Core and XT devs) will greatly improve the efficiency of block size propagation.  Thin blocks are the basic idea- if a node already has the transactions in the block in its mempool, then you don't need to send those transactions again.  Just send the block headers (block signatures and the IDs of the transactions that block contains) and the nodes can then assemble the block without having to be sent all the block's data.  That's a very simplified explanation, but the end result is it could easily double or more the efficiency of block propagation.  With thin blocks, we'd be ready for 8MB blocks once transaction load gets there.  

Hope that helps!  Please feel free to ask or PM if you have any questions!  :)",2016-01-01 00:57:09
cyhezie,spookthesunset,29,"Why are you getting downvoted?  You are right!  These graphs are not log charts, and worse, they have arbitrary timescales.  /r/bitcoin forum traffic has done absolutely nothing but go **up** since 1800.  For a technology that will someday replace the need for cancer drugs, wars, and reproductive medicine, the fact that bitcoin has an infinite growth curve is simple astonishingly good news!!!!!!!",2016-01-01 01:53:57
cyi5cgu,BeastmodeBisky,29,"This guy was a bouncer in the UK. Bitcoin being Bitcoin, the guy somehow managed to raise over a million dollars to open some kind of Bitcoin bank type operation in ~~Malta~~ Cyprus. 

He acted like he was some rich Bitcoin early adopter when he wasn't, apparently bought(?) a Bentley with what now appears to be investors funds. Paid for lots of advertising in Cyprus and blew a lot of smoke up the media and peoples' asses.

Yadda yadda, there was no substance to any of it. Investors lost lots of money. He fled the country. And another chapter in Bitcoin history was written.

That's a very rough view from someone not involved. Perhaps someone more knowledgeable can shed some more light on what happened.",2016-01-01 16:58:15
cyhrxzb,mikey991,28,"**[YOUTUBE HD 720p](http://freecast.in/NNBBA1.html)**

**[Donations gladly accepted - PayPal ](https://www.paypal.com/cgi-bin/webscr?cmd=_s-xclick&amp;hosted_button_id=NXZPY838ARTLA)**

**Bitcoin   1Lw3q8CriqfcPF7tpULskB8KmnK35m328H**
",2016-01-01 08:06:59
cyian3l,uxgpf,28,"I'm beginning to feel that this schism is beneficial to the Bitcoin community.

It has given us r/btc and paved way for more open forums of discussion. We wouldn't have quality discussions of bitco.in without it, AMA's of bitcoin.com etc.

Seems like this crisis, while splitting the community in opinions, has brought all parties in the Bitcoin community into closer contact with eachother, increased transparency and opened new avenues for discussion and understanding.",2016-01-01 23:47:14
cyhcvkj,SnapshillBot,28,"
Please, I'm hodling coins I bought at $1200. It will take more than a little volatility to get me to sell.


Snapshots:

1. *This Post* - [1](https://archive.is/rFUxp), [2](https://web.archive.org/20151231155056/http://www.reddit.com/r/Bitcoin/about/traffic?mass=adoption)

*^(I am a bot.) ^\([*Info*](/r/SnapshillBot) ^/ ^[*Contact*](/message/compose?to=\/r\/SnapshillBot))*",2016-01-01 00:50:56
cyi9mkg,timetraveller57,27,"Through transparency we force honesty.

The pseudonymous nature of bitcoin will change the political spectrum of the wider world.

This is going to be an excellent case example.",2016-01-01 22:41:46
cyheix4,Rub3X,26,"&gt; recent change in direction of the trend. You have cherry-picked the data which supports your argument.

 Here's your trend reversal:  http://i.imgur.com/aBIHmDN.png

That is every month of /r/bitcoin's existence.  There's no trend reversal lol.

&gt; Yes, still quite misleading given that you have neglected to include the data from this year which shows the plateau and recent change in direction of the trend.

That data can literally be found by clicking the link I submitted in OP.  

&gt; There are also many other statistics which show bitcoin to be growing and expanding healthily: https://blockchain.info/charts/n-unique-addresses?

BREAKING NEWS: randomly generated numbers and letters is at an all time high, mass adoption imminent!!!



bitcoin(er)s.......LOL",2016-01-01 01:40:59
cyi7k9y,michaelKlumpy,26,"well of course, /r/bitcoin deletes most of the postings ;)",2016-01-01 19:46:09
cyi7uy7,jtoomim,24,"Soft forks are developer-sanctioned systematic 51% attacks (or 95% attacks) against miners who do not upgrade. This is the reason why they're ""safe"" -- you can rely on miners to exclude any transactions that do not follow the new rules. Any miners who do not upgrade are censored from the Bitcoin network.

https://lists.linuxfoundation.org/pipermail/bitcoin-dev/2015-December/012176.html",2016-01-01 20:12:53
cyhyzd0,scotty321,23,"Satoshi's intentions are spelled out right there in that thread: ""The existing Visa credit card network processes about 15 million Internet purchases per day worldwide.  Bitcoin can already scale much larger than that with existing hardware for a fraction of the cost.  It never really hits a scale ceiling.""",2016-01-01 12:02:10
cyhflkn,HamBlamBlam,22,"No, that can't be right. Thermos has said it's very important that off topic posts be removed, even off topic posts about Bitcoin.",2016-01-01 02:11:00
cyhmqmm,mikey991,21,"**[YOUTUBE HD 720p](http://freecast.in/Bowl.html)**

**[Donations gladly accepted - PayPal ](https://www.paypal.com/cgi-bin/webscr?cmd=_s-xclick&amp;hosted_button_id=NXZPY838ARTLA)**

**Bitcoin   1Lw3q8CriqfcPF7tpULskB8KmnK35m328H**
",2016-01-01 05:28:04
cyhoocu,Sugar_Daddy_Peter,20,"Same. 

I get that they're basically a bitcoin bank, and I also get why some people are against them. That having been said it's not a good idea to keep all your eggs in one basket. Also I'm probably more likely to lose my coins than coinbase is. ",2016-01-01 06:24:46
cyhxwvn,Bidofthis,20,"For the Record

http://www.bloomberg.com/news/videos/2015-12-29/from-worst-to-best-bitcoin-s-2015-comeback

http://www.bloombergview.com/articles/2014-12-23/and-2014s-worst-currency-wasbitcoin

http://www.bloomberg.com/news/articles/2014-12-22/the-best-and-worst-investments-of-2014

http://www.bloomberg.com/news/articles/2015-12-31/here-are-the-best-and-worst-performing-assets-of-2015

http://www.bloombergview.com/articles/2015-12-29/bitcoin-won-in-2015-but-apple-lost-big",2016-01-01 11:23:37
cyhcxv7,Rub3X,19,"However, demand for drugs has [remained a constant.](https://www.reddit.com/r/darknetmarkets/about/traffic)  /r/DarknetMarkets has a solid half or more as many unique visitors per month as the biggest bitcoin themed community out there.  ",2016-01-01 00:53:03
cyhqcoy,WILLYOUSTFU,18,"Just a pedantic note (I know you're making a reference), but the bitcoin ledger is public, so transactions are not untraceable. If you buy your coins with Coinbase or similar service, your bank account details can theoretically be tied to your transaction. Some people use a tumbling service or pass the coins through a couple intermediary accounts for plausible deniability. I've never heard of anyone being busted based on the blockchain, but I thought I'd mention it's possible.",2016-01-01 07:17:18
cyhxm9l,tmornini,18,"The worst thing you can say about Satoshi is that he was not entirely prescient.

To the extent they think he was wrong, it's in the little things.

What they're most concerned with is keeping Bitcoin what the title of the paper described it as:

  [""Bitcoin: A Peer-to-Peer Electronic Cash System""](https://bitcoin.org/bitcoin.pdf)",2016-01-01 11:13:35
cyhlcf4,Rub3X,17,"Point me to the spot in this thread where it says ""all bitcoin supporters are libertarian"".  If you want to post in an /r/iamverysmart tone with logical fallacies, I believe yours is a Red Herring.",2016-01-01 04:48:26
cyhphm1,evoorhees,17,"A number of people use it as a derogatory term against everything non-bitcoin. The implication being that everything else is a scam. Nothing wrong with using the term to refer to coins that are actually scams, but I think it's often thrown around too casually. Off topic, but do you still hold the opinion that SatoshiDice was causing an intentional DDOS attack against Bitcoin?",2016-01-01 06:49:48
cyi8jp1,bitofalefty,17,This happened a couple of days ago too (Luke Jr posted about it in /R/bitcoin). There's some serious hashing power coming online,2016-01-01 21:14:27
cyhflmh,spookthesunset,17,"thank you.  as you can now clearly see, most of your FUD is just lies.  Nothing has really changed with regards to /r/bitcoin traffic.",2016-01-01 02:11:02
cyiavma,EndlesslyManipulable,84,"&gt; &lt;Aquentin&gt; you obviously recognise we have to address scalability... but then you pre-judge.... invoking power in an academic debate

&gt; &lt;Aquentin&gt; in the process doing the unthinkable in the bitcoin space... outright censorship

&gt; &lt;Aquentin&gt; because it seems you were terrefied that ppl would str8 out flog to it cus they all stupid right... they need theymos the master

&gt; &lt;Aquentin&gt; you're the one who is stupid theymos

&gt; &lt;theymos&gt; Even if you could twist things in that way and argue that XT could be allowed on /r/Bitcoin in consistency with past and expected-future precedent, it's still bad from a utilitarian perspective for XT to be pushed to users. If it succeeds, that'd damage Bitcoin immensely. (And it doesn't really matter whether or not /r/Bitcoin matters in the grand scheme of things, it's the principle of the matter that

&gt; &lt;theymos&gt; hostile hardforks should not be done, promoted, or used)

/u/theymos, even though you won't respond in a hostile environment, the potential of hostile hard forks, buy the very nature of open-source software, not just bitcoin, exist so as to keep people like you and the Core developers honest. If hostile hard forks are in principle disallowed, then you and the Core developers like /u/adam3us, /u/nullc, /u/ptodd, /u/pwuille, among others cannot be assumed to be honest and assumed to be acting in good faith EVEN IF YOU ARE, and therefore bitcoin is broken at a fundamental level.

Developers, you absolutely know this, and therefore theymos is killing your credibility in the community. By not standing up against theymos'censorship actively you are killing your own credibility. By dismissing the idea of hostile hard forks in principle rather than in the specific instance of XT you are killing your credibility. Not not opening up the concept of consensus in the free market of ideas and marginalising &amp; slandering dissenting voices in the core community YOU ARE KILLING YOUR CREDIBILITY.

source: https://www.reddit.com/r/bitcoin_uncensored/comments/3l6oni/theymos_i_know_how_moderation_affects_people/",2016-01-02 00:00:14
cyj4ihs,slowmoon,68,Don't taunt bitcoin. There's no price it can't deliver.,2016-01-02 16:57:13
cyiloyn,ahyes,63,"I was talking to a friend of mine thats a higher up for a pretty big hosting company in California, and they just had some group basically throw an extortion threat at them demanding bitcoin or else they'd ddos them until their customers left. This happened to them right around the time that the attacks on Linode started up. Gotta wonder if the two related.",2016-01-02 06:07:16
cyj53n8,Dude-Lebowski,59,"Believe it or not, this doesn't matter. 

VISA can be used to spend Dollars, Bitcoin, Euro and Gold products. If there were demand, I'm sure Visa could figure out how to spend copper and Brent crude oil. 

Point is, visa is not money but a system to transfer money (insecurely I might add) from one party to another. The receiving party can not be sure they are securely paid for over 90 days. 


Bitcoin on the other hand is money and is secure meaning the receiving party can be sure they are paid within one hour. 

Someday it will be more common that credit cards of the world add Bitcoin like they currently do major Gov't currencies, but those visa spent bitcoins will have the same problem as visa spent dollars meaning a 90 day clearing window for the receiving party. 

Let's not forget the 2.5% - 3% fee for a visa receiving party. 

To compare, Bitcoin can transfer value so much better. Approx. $0.01 - $0.20 and received securely in less than 1 hour. ",2016-01-02 17:30:19
cyiefjm,DrugieDineros,36,"The myth of no serious bugs having ever been found in bitcoin is quite simply a blatant lie.  Look at these:

CVE-2010-5141

&gt; wxBitcoin and bitcoind before 0.3.5 do not properly handle script opcodes in Bitcoin transactions, which allows remote attackers **to spend bitcoins owned by other users via unspecified vectors.**

CVE-2010-5139

&gt; On August 15 2010, it was discovered that block 74638 contained a transaction that created 184,467,440,737.09551616 bitcoins for three different addresses.[1][2][3] Two addresses received 92.2 billion bitcoins each, and whoever solved the block got an extra 0.01 BTC that did not exist prior to the transaction.

If you pictured what the worst possible case scenario is for a bug found in bitcoin, the above two examples are exactly what you would envision.  Spending other people's coins, and generating new coins at will.  It can not possibly get worse than that, and both of those things happened.",2016-01-02 02:30:05
cyicajb,majorpaynei86,35,"As you can see, I was in there defending bitcoin.

Individuals there lack cognitive ability to reason and critically think. I fucking hate /r/anarchism. 
It is filled with high schoolers and the mentally ill.

The place is a joke.",2016-01-02 01:08:42
cyic0x5,CC_EF_JTF,31,"We aren't looking to have a huge push for adoption up front - this is the first attempt at a decentralized market at scale and we're not sure that our first release is going to meet the needs of the mainstream users. 

So we plan on catering to the bitcoin community first, learning from them, iterating on the releases, then only begin promoting once we're confident it provides something of value to mainstream users. ",2016-01-02 00:56:54
cyins8k,_Mr_E,31,Voting with CPU power is the ONLY way bitcoin was designed to come to consensus. ,2016-01-02 07:10:34
