Comment ID,Author,Score,Body,Publish Date
cz9wz80,nextblast,52,"**Nine-Two Consensus for BTC**

*A note by the translator:*

*[Historically Nine Two Consensus](https://en.wikipedia.org/wiki/1992_Consensus) is a political term referring to the outcome of a meeting in 1992 between the semi-official representatives of the People's Republic of China (PRC) in mainland China and the Republic of China (ROC) in Taiwan.*

*The title has a two-fold meaning: like the historical Nine-Two Consensus, this announcement shares the same view to seek common ground while reserving differences; Nine Two Consensus is short for Ninety Percent support and Two Megatbytes cap increase. --End of translator's note.*


**[Baseline]**

* We support 2MB upgrade with the precondition of 90% hash power agree. 

Our vision comes from Satoshi's original white paper -- Bitcoin: a Peer-to-Peer Electronic Cash System. 

The white paper has defined bitcoin as a currency, not a settlement system. 1MB will not meet the requirement for a currency, neither can it satisfy the needs in a settlement network (1MB=7 tx/second, SWIFT=60 tx/second)

This ""Nine-Two Consensus"" is our effort to avoid the split of the community, and ensure the safe and sustained development of this community.

Meeting held Jan 23, Beijing, with people from many Chinese BTC companies including AntPool/Bitmain, Bither, HaoBTC, BTC123, BTCKan, Richfund, Yunbi, SoSoBTC .... 

**[Details]**

As Miami conference has not yet reached consensus, the Chinese community members gathered in Beijing to seek consensus within China. The aim is to prevent the split of community, seek common ground while reserving differences. Core has said that a scaling without consensus is too risky. We will give them the consensus. If the consensus is reached, btc market will be more stable, and in the meantime, future efforts will be more practical.

**Here in this meeting we, the attendees, all agree the following plan**

* When blocks are full, and at that time, 

* if Core has not yet upgraded to 2MB, 

* and if Classic is not enough widely supported, 

* We will do what Satoshi has pointed out https://bitcointalk.org/index.php?topic=1347.msg15366#msg15366 
We will add a code patch to increase the cap from 1MB to 2MB to solve the pressing problem.
This means, as we think, has a big potential to reach consensus, and urge Core to accommodate.


**[Risks in Segwit]**

Core’s Segwit plan will indirectly expand block size, but not without risk.

Firstly, Segwit has only 1.6MB theoretical effect. There’s considerable complexity in code development, which would make other applications difficult to upgrade, or even unwilling to upgrade. If only 50% tx adopts Segwit, the 6-12 months hard work will only achieve 1.3MB effect, which is more or less meaningless.

Secondly, Segwit has large modification in bitcoin low-level logic. While the workload is huge, the community is exerting great pressure. The core team has to work overtime to deliver it in time. 

Bitmain CEO Mr. WU Jihan also confirmed that ""There are Core devs working more than ten hours a day and try to get the work done faster.""

Many of us here has tech background. We know what overtime often means to quality.
The history of bitcoin is not absent of bugs. As indicated here https://en.bitcoin.it/wiki/Common_Vulnerabilities_and_Exposures .For instance a hacker exploited bitcoin vulnerability to produce 184.4 billion bitcoins in 2010-08-15 http://8btc.com/thread-23642-1-1.html.

Currently our bitcoin is stable and solid. This is a joint hard work of six years. If we push to produce segwit, the risk is too large. We may suffer grievous loss. Bitcoin price may even go down with one order of magnitude. Which is enough to kill the future. 

So we think it’s vital to prevent core from hastily delivering Segwit.

**[Support Now]**

We will do our best to ask all bitcoin companies / users to join us. 
Please reply in this thread to help.

**[Supplementary]**

- Why is 90% a consensused hash ratio?

- Because some hash power is not in mining pools (solo mining or in private pools), which means they cannot express their voice. We subtract this silent portion, and get an actual 95% of total public hash, which means a consensus.

**[EOF]**

*Edit: Added explaination of the Nine-Two title; A minor fix of translation; Translated the Supplementary part which was added later by the author.*

*If you liked it, consider buy me a dumpling :) 1FRSRsdjTfh6S47YfzPtJZ6Qr9bBaUyJnu",2016-01-24 20:17:12
cz9xu1a,tomtomtom7,50,"Very nice.

I think we can conclude that the bitcoin incentive system is working.

Unlike wallets, merchants, exchanges and developers, the income of miners is primarily dependent on the bitcoin price.

Now we see that they are making well informed, reasonable decisions, purely aimed at the benefit of bitcoin.

They are the guardians of the protocol, exactly as originally envisioned.

EDIT

Removed copy of translation as it has been restored",2016-01-24 21:18:49
cz9crfx,FrancisPouliot,49,"They're thinking about how to increase the capacity of Bitcoin gradually and conservatively with a long-term vision and not falling into the trap of a half-assed solution pushed by CEOs and the Reddit mob that are disappointed in the status of their BTC investment.

Decentralized e-cash, digital gold, censorship-resistant anonymous transactions. Not a better paypal.",2016-01-24 07:04:59
cz9h7jr,sockpuppet2001,37,"Large blockers know what core is thinking because they already said all that in their roadmap.

Large blockers believe the *order* in which Core proposed to make these changes may subject bitcoin to a potentially disasterous economic change event, and centralization due to fee spikes limiting who can use it. Core used to call this a ""fee market"" and said it was desirable - despite there being no Lightning Network or sidechains in place to take over the existing load. Core have stopped mentioning the fee market now but the big blockers still suspect Core wants the economic change event, or at least is not interested in avoiding it, and have merely gone silent over it.

So repeating the known doesn't help, what large blockers don't know about what the heck Core is thinking is their projections for the period before their roadmap meaningfully extends throughput, and how they weigh the risk of the economic change event.

(Theymos deletes the informative referenced big-block explanations from here and leaves all the childish ones, so \/r/bitcoin readers tend to be uninformed on the topic)",2016-01-24 09:15:22
cz8ztye,canadiandev,34,"Wherever they take Bitcoin, I use Bitcoin. This is the best way to support the ecosystem.",2016-01-24 00:56:41
cz9jl7k,lanceschaubert,31,"Thank you for continuing your BERNFACTS subscription. We will send your bill of [FIFTY][BITCOIN] per BERNFACT via your chosen method of [USPS].

Did you know:

Bernie has more grassroots supporters than Obama had in 2008?

DID YOU KNOW:

Bernie wants to tax carbon?

#DID YOU KNOW:

Bernie once killed a yak from three hundred miles away with mind bullets?

(that's telekinesis, [/u/writingtoss])

Would you like to receive a BERNFACT every hour? &lt;reply ""Tieuns435$%^*&amp;seT"" to cancel&gt;",2016-01-24 10:26:25
cza0h7i,SirEDCaLot,31,"Ad hominem attacks are one thing- I expected better from both sides of the issue, but oh well.  Sticks and stones and all that.

What DOES bother me is that back when XT nodes were getting DDOS'd, I don't remember seeing one single Core developer or even supporter speak out against them.  

DDoS attacks should have no place in Bitcoin.  I'm a big block supporter, but if someone was DDoSing Core nodes I'd publicly condemn that attack and tell whoever was doing it to stop.  I neither need nor want that kind of 'help'.  If big blocks can't win on their own merits through respectful debate, then they should not win.  DDoS attacks should have no place in the argument.  

Yet when XT came out and XT nodes were getting HUGE DDoS attacks (as in, knocking entire ISPs and hosting operations offline), nobody said anything.  Perhaps the Core developers don't care and perhaps their supporters feel the ends justify the means.  But IMHO that's a bad way to run things.  ",2016-01-24 23:43:39
cz9x5ce,oakpacific,29,"The title is an exaggeration: F2Pool and BTCC Pool's representatives are noticeably missing, you can't phrase it as a ""consensus"" of the Chinese mining community, much less that of the Chinese Bitcoin community.",2016-01-24 20:29:48
cz9t2go,smog_alado,26,Where did you get that impression that bitcoin is for routine transactions? Bitcoiners have always said that the future is using sidechains for routine transactions and high fees are a good thing. (And we have always been at war with Eastasia),2016-01-24 16:03:04
cz91yft,tsontar,22,"**XT, Classic, and Unlimited have now formed a Nakamoto coalition.**

(Yes, I just now coined that term.)

What this shows is that consensus on larger blocks can emerge even though the different user bases have different priorities and run different software.  This is directly analogous to a group of minority parties forming a *coalition government* to unseat a leadership with less than majority support (in a multiparty government).

Note that the change can still occur without forcing everyone to agree on one client (we don't all have to join the same political party in order to win the vote).

Imagine if we forked with Classic, XT, and Unlimited each taking 1/3 of the hashpower in the new Bitcoin.  Together, these three teams ""control"" the ""reference"" and support blocks up to 2MB.

Once we reach the 2MB limit, provided no ""block size catastrophe"" has occurred, we can imagine that the XT and Unlimited users will keep voting for larger blocks, but maybe the more conservative Classic users aren't ready for larger blocks.  Then the 2MB Nakamoto coalition will divide again, large vs small blocks, and the scenario will replay, with the market forcing a new Schelling point to emerge at a higher limit.
",2016-01-24 02:00:24
cz94ycg,midgetsnowman,21,"See, the thing is, bitcoin's death has already happened. All thats left is scammers and the people who would be throwing all their money into Gold and silver if bitcoin didnt exist. Theres pretty much zero chance of bitcoin ever becoming a currency because that'd require a whole bunch of things like a bitcoin being wirth a lot less individually, and the ability to trade them for goods and services being much easier. All bitcoin is is Internet Gold. Its never going to be useful except as a speculative lottery gamble on the hope prices spike and you get out at the right moment.",2016-01-24 03:24:28
cz9qixf,charles-babbage,21,"Lol. They keep chipping away at that list of things that supposedly makes bitcoin good. We also have (sometimes) high fees, government regulation/tax, mostly centralized mining, centralized (cloud) wallets, etc.

Regarding fees, if they could be a small fraction of a penny, then it would make micro-payments possible. Like payments for reading a news article. But the $.01-.10 is way too high for that.",2016-01-24 14:15:28
cz9nwjf,street_fight4r,21,Blockstream Core is now busy crafting a story about why this isn't good for Bitcoin.,2016-01-24 12:42:38
cz94dbc,nanoakron,20,"Get back under your bridge, troll. 

What have you contributed to Bitcoin except hatred and hot air?",2016-01-24 03:08:00
cz9k1ss,maqp,20,"The problem is these devices are basically system on chip computers running stripped down Linux. The problem isn't Linux, the problem is human error: all software has security bugs. How are non-techies going to obtain security updates to their smart babymonitors, toasters, washing machines etc considering the typical life cycle of such appliance and models updating annually. ""Buy another toaster every year to avoid ransomware that burns your house unless you pay/let it mine bitcoin."" I'm not sure that even helps: how likely is it that a company manufacturing a 30€ device with internet access has spent money to secure the device against active attacker? The main aspect consumers will always consider is the price. When only cheapest sells, you know what the outcome will be.

My guess is there will be regulation to IoT device security after the first couple of houses burn down. Make sure you're not among those, trying to get compensation from your
insurance company; let IoT mature until it's not possible to avoid. ",2016-01-24 10:40:33
cz93g3z,mpyne,16,"&gt; Do you think that's taking a toll on the ""captains of industry in here? Serious question.

If you think we're here to actively subvert Bitcoin then I can see why you'd think the question makes sense.

Some of us are just here to admire the show though, and in that regard we're actually pleased that the collapse of Bitcoin will be prolonged and drawn-out.

I mean, some of us still manage to mine comedy gold from *Litecoin*, and that currency has been an also-ran even in the altcoin space for some time!",2016-01-24 02:42:45
cz9gnt6,auxon0,16,"""In order to scale the Bitcoin network, a faster less bandwidth intensive method is needed in order to send larger blocks. The thinblock strategy is designed to speed up the relay of blocks by using the transactions that already exist in the requester's memory pool as a way to rebuild the block, rather than download it in its entirety. """,2016-01-24 08:58:34
cz923jv,pangcong,15,"Bitfury as the representative of bitcoin businesses: We agreed that enterprises should support the core developers, but consensus is more important",2016-01-24 02:04:28
cz9d0bi,NicolasDorier,15,"Requirements = Global Internet Cash. They are reaching it very well. I can go almost anywhere in the world and live with my bitcoins, I can't say as much with my Visa card.

Off chain system like LN and Payment channels ARE Bitcoin. Those are not some sort of IOU where you need to trust someone's good will to get your coins.",2016-01-24 07:11:58
cz913wc,pangcong,14,"Bitfury: you cannot vote by walllet, it has no meaning; Exchange profit from fees, they don't have much input, they care about coins,  not a long time interest. Miner is the real concern bitcoin long-term interest groups",2016-01-24 01:36:27
cz95djd,dashed,14,"I've been managing and tracking investment assets/financial using Excel/Google Spreadsheets, which was fine for a while, but it has becomes extremely cumbersome with large amounts of data; and it has become very apparent that my system (using a spreadsheet) wouldn't scale. 

I wanted to migrate to something more robust, like a database (e.g. SQLite, MySQL). I prefer tracking and micro-managing my assets myself, rather than hiring an accountant, or letting a service handle it (.e.g Mint).

I'm a software developer, both professionally and as a hobbyist, and I was about to design my own system, when I stumbled upon [ledger-cli](http://ledger-cli.org/), a double-entry accounting system. It's a command-line program, which might not be for everyone; but if it is, I highly recommend checking it out. Another alternative, is [hledger](http://hledger.org/) (imo, not as a powerful), which has a web UI if that's something you prefer.

- http://ledger-cli.org/
- ledger set-up example (not mine): https://github.com/dmp1ce/ledger-cli-example
- docs: http://www.ledger-cli.org/3.0/doc/ledger3.html

The gist of it is that you store transactions in a text file (or multiple) using your favourite editor, and you would run ledger to read and crunch numbers from the file and display them to you according to the command-line flags you give it. Note that ledger never modifies your files. Example of a file: https://github.com/dmp1ce/ledger-cli-example/blob/master/Bitcoin.ledger


Some of the things I really like about ledger is that it reads numbers into actual rational numbers (fractions), manipulate them as rationals, and convert them back into decimals when displaying the final result to you. This was something that was very hard to do well in a spreadsheet.

It's also currency-agnostic, which I really like, and especially useful when you have accounts in multiple currencies; in fact, I've seen folks use ledger to track billable hours (rather than money).
More info here: http://www.ledger-cli.org/3.0/doc/ledger3.html#Currency-and-Commodities

When you want to see the value of your accounts, you can feed it [ledger] the prices of certain commodities via another file: https://github.com/dmp1ce/ledger-cli-example/blob/master/prices_db For stocks, funds, and bitcoins, I have a script to generate/update this file at periodic intervals, and I would just run `ledger -f finance.ldgr --price-db prices_db -V bal` to see the balances in market value.

---

For tracking capital gains and realization, there are some amazing tips here: 

- https://www.reddit.com/r/Bitcoin/comments/155gw5/heres_how_you_use_ledger_to_account_for_bitcoin/
- particularly: https://www.reddit.com/r/Bitcoin/comments/155gw5/heres_how_you_use_ledger_to_account_for_bitcoin/c7k9n7l
- https://news.ycombinator.com/item?id=10510394


",2016-01-24 03:36:14
cz9u04x,ObiWontchaBlowMe,14,YOU DECIDED TO ACCEPT Bitcoin YOUR RESTAURANT?,2016-01-24 16:52:47
cz9rfex,Badgerisbest,13,"Bitcoin had this eternal reaction of turning every setback, no matter how brutal and bad for cryptocurrency, *that it was good for bitcoin.* like if there was a giant scandal that destroyed the infrastructure, and tons of people got money stolen. *This is good for bitcoin because security will get better.*",2016-01-24 14:50:31
cz9ftwt,mike73144,13,"https://youtu.be/o7b3XNJ02ME  HD



bitcoin 1DZgfgkYPMXnqhHBCyATEtsjY3XgbndXkw bitcoins donations thank you

PAYPAL: msg me thank you",2016-01-24 08:33:28
cza0nmb,tomtomtom7,13,"&gt; Miners only care about the short term. Once they've got everything their ASICs have got to give, they can just not invest in the new fab lines and withdraw from bitcoin.

This seems like a rather expensive business strategy.

&gt; It's irresponsible of them to try to force a hard fork when theres plenty of disagreement in the real economy.

I understand (and believe in) the consensus mechanism of the protocol.

I am not entirely sure how we can come to agreement in the ""real economy"". Social media? Forums? Polls? What is the plan?

To me, it seems that the bitcoin consensus mechanism is still the first and only workable decentralised mechanism for reaching agreement.",2016-01-24 23:51:16
cza02pi,rberrtus,12,"IMO, given that the censorship there is an in your face fact I, cannot understand why anyone would subscribe to that forum.  It certainly goes against the ideals we should all hold as members of the bitcoin community.  It is also possible that there really are not so many 'genuine' active readers there.  I believe some numbers might be inflated.  Here is my reasoning:  15 trolls might have 60 accounts and that could turn into 180 'users here now' based on possible errors in reddit's accounting.  So if that was going on there might only be say 25 genuine newbies there who have no clue the waters they have entered.  Well, I have no idea the numbers but we should not *assume* too much from the 'users here now' number.",2016-01-24 23:25:38
cz9p47m,auxon0,12,"Nope, that would be Peter Tschipper.  I'm just an interested dev, trying to get started developing for Bitcoin.",2016-01-24 13:23:49
cz97015,Zarathustra_III,12,"&gt; In organizations the same rationale explains why dysfunctional businesses stay dysfunctional.

Exactly. And the same is not only true for the Bitcoin society, but for the society in general. As long the Bitcoiners don't start the revolution they deserve to be ruled by the Blockstream tyranny. That's what I tried to transport here:


https://www.reddit.com/r/btc/comments/41uhh0/remember_the_forbes_article_something_rotten_in/cz5nrne?context=3",2016-01-24 04:20:59
cz9df6h,out-snoop,12,"&gt; With time running out, Rand asked me to please check in with you to let you know he's really counting on your support IMMEDIATELY!

How fucking slimy can you get. Seriously?

The only two possible forms of employment for libertarians seems to be either running for government office or slimy bitcoin salesman. This guy seems to have rolled all of the charm required for the second job into the first.",2016-01-24 07:23:40
czadhcu,blockstreamcoin,60,"Man, fees are nothing of your business! You are not a market regulator, you are a programmer. The very thing bitcoin wanted to get rid of was a market/money regulator.

If any fee discussion and regulation is necessary bitcoin already failed. ",2016-01-25 05:55:59
czb6n3j,cjmalloy,60,"Adam Back has publicly denounced censorship of any kind. When pressed about theymos censoring dissent on Reddit he simply replied that that was a private forum so it was not his place to criticise.

This is just lip service. Reddit represents a major schelling point for bitcoin, and the devs should threaten to revoke theymos's alert keys. ",2016-01-25 22:37:19
czahtnu,fiah84,50,"That's what I don't understand, if bitcoin ever actually goes mainstream, 1MB blocks won't be enough even for just a settling layer",2016-01-25 07:43:37
czb5gfq,segregatedwitness,44,Maybe you should post this on the bitcoin-core github.,2016-01-25 21:42:01
czae2nq,majorpaynei86,39,Who the fuck is he to state what is 'too cheap'? Isn't this what markets are for? There are already use cases where transactions on the bitcoin network are too expensive (microtransactions) so they have to be done elsewhere (changetip for example).,2016-01-25 06:08:31
czajeqz,mike73144,38,"https://youtu.be/gm5D3Q1Rj-o  HD HAWKS WGN 


bitcoin 1DZgfgkYPMXnqhHBCyATEtsjY3XgbndXkw  bitcoins donations thank you


MSG: for paypal thank you",2016-01-25 08:18:52
czb8nkm,[deleted],35,"He is against it because if Bitcoin had cheap transactions, then Blockstream can't charge you to be on their cheaper transaction network. 

tl;dr Blockstream wants to make money, thats why. ",2016-01-25 23:49:06
czaly21,kingofthejaffacakes,32,"Even if a forced fee market were a good idea; it's definitely not a good idea at 1MB -- that makes a bitcoin so small that there is no space for it to develop into something that would _need_ a fee market.  It's hobbling it before it's grown legs.
",2016-01-25 09:15:29
czb5pcb,trilli0nn,31,"&gt;Core Would Need to Increase Block Size If Classic Succeeds

That's not what he said. What he really said was this:

""I think — [I’m] not sure. And I’m not speaking for Bitcoin Core here; I’m speaking for myself here. If it [turns out] that Classic takes off — everybody’s running Classic — and if there’s a hard fork on the road, I think Core would probably need to follow because I think Core won’t risk splitting the whole community. But that’s my personal opinion; I don’t want to say that for every Bitcoin Core developer.""",2016-01-25 21:54:46
czaowra,VitaliButeri,31,"BTC was formally added into the source code with the addition of the QT client. See [tagged release 0.5.0](https://github.com/bitcoin/bitcoin/releases/tag/v0.5.0), The Honourary Reverend Gavin. Because it is part of Bitcoin Core Source Code it is now also part of the Network Specifications, since the Source Code is the Official Network Protocol. Calling it anything other than 'BTC' would be referring to it as an altcoin, which is heresy.",2016-01-25 10:27:01
czb8ge2,rnicoll,31,"Am I Core? Never sure if I count. I'm certainly here because I got fed up of the moderation policies in /r/bitcoin
",2016-01-25 23:42:58
czacq9j,coin-master,30,"So there is hope he leaves for good once we get 2 MB?

Or maybe it is a misunderstanding: The only reason he puts his time into Bitcoin to limit the block size.",2016-01-25 05:40:21
czaahmp,Gobitcoin,28,Oh sweet Jesus I didn't know that troll eragamus become a mod in r/Bitcoin. That place went from bad to worse by adding him. ,2016-01-25 04:45:01
czaa0p6,reifenstag,28,"I'm a dev who finds Bitcoin very interesting on a technological level, but all the infighting,viability of projects in the space, etc. make it kind of unappealing to put a lot of time (and therefore money) into. Just my two cents.",2016-01-25 04:32:22
czav5um,jstolfi,26,"He was involved with Intersango as well, another bitcoin exchange that collapsed and ate client deposits.",2016-01-25 13:02:38
