Comment ID,Author,Score,Body,Publish Date
cyrmn50,SooperModelsDotCom,19,"I Laughed OL'd at this Butter's comment:

&gt; *It works at any Visa ATM! I tried withdrawing cash at a Chase bank's ATM with it, worked like a charm. I could even check the balance, it was surreal how seamless it was.*

Wow... Imagine that.  A [VISA debit card](https://www.shiftpayments.com/assets/img05-5e825badc9e273228dbbcefe3e964a934ec31f4d016542b4eeb67e7879d144bd.png) that works at any VISA ATM! Even being able to check the card's balance!

I swear to God BitCoin has to be a satire performance.  Can people really be that stupid?",2016-01-09 17:10:04
cyrerox,gburgwardt,19,"To limit full nodes to even half the average upload speed of US internet users would have us slightly over 1mb, using data from http://testmy.net/country

Here's all the countries they've tested- http://testmy.net/rank/countrycode.up/

Most countries there can handle it.

I'm sorry you have shitty internet but you are being ridiculous to try and limit the blocksize of bitcoin because you refuse to move, pay for better service, or use an SPV client.

&gt;I am not some anomaly, either.

Yes, you are.",2016-01-09 11:52:41
cyqrfmi,bearjewpacabra,18,"That's a good question, especially if you include those being paid to make the blocksize the #1 debate and to prevent it from moving forward. Fairly basic political tactic that always seems to work on the masses.

Also, what is their agenda? I think it is to cripple bitcoin entirely, and the lightning network is just a carrot in front of the mule.",2016-01-09 01:57:05
cyr9vvk,paperraincoat,18,"Recognized the potential back in 2011, uses LocalBitcoin and Coinbase, uses Bitcoin for nearly all purchases, owns private keys on a Trezor. 


You sir, are a pro Bitcoin user. I salute you. Have an upvote. ",2016-01-09 09:22:18
cyredbn,FLFTW16,17,"I wouldn't put up with that. There are a number of things a man can do to fight back.

Follow her around protesting her. Protest her workplace. Protest her parents. Protest in front of the courthouse and invite the press. Tell them the disgusting details and even make up some. They will love to print a nasty creampie cuckold love tryst fueld by coke and booze. The story will embarrass her to her friends and family. Roll around with the pig in the mud and enjoy it.

Refuse to pay. Make a demonstration of ripping up the check and lighting the pieces on fire. Have people recording it. Make up signs. Pay actors to protest with you if you have to.

Leave the state. Leave the country. Hide out in Hong Kong or Thailand or Vietnam or any fucking place. Take your precious pieces of fiat paper with you. Spend them on asian hookers and beer. ANYTHING other than spreading your buttcheeks for the state to give you a deep financial dicking for a woman that lied.

Or go full commando and scare the fuck out of her. Intimidate her. Slash her tires. Spray paint her car. Put all of your assets into a bitcoin brainwallet so the state can not simply seize them without torturing you first.

If a man just rolls over and allows himself to be raped then the situation gets worse and worse. I think the woman smelled a bitch and figured this guy will never flip out. He'll take it. Don't be that guy or at the very least make like you will flip out to make people think twice about fucking over you.",2016-01-09 11:39:59
cyr2390,twfry,16,"Hearn's problem is the SW implementation is inefficient and horrible because it was forced in as a soft fork, and a hard fork version would be much much better.

But it is because hearn has the best interests for bitcoin in mind while blockstream wants to break the network.",2016-01-09 06:01:01
cyqspg2,twfry,16,"This, Maxwell and team has worked hard to drive everyone who follows Satoshi's vision of bitcoin out, and then after that they claim consensus. 

The reality is very little development is happening today in Bitcoin core compared to the 2009-2012 era. And that is because Maxwell and team are focusing on crippling Bitcoin and making off chain solutions. ",2016-01-09 02:26:31
cyrampm,-SetsunaFSeiei-,16,"&gt; The fact that this means that very few of them actually spend their bit-coin which in turn means that there's no economy to actually fuel the increased demand needed for the deflationary part to work is completely lost on them.

I feel like this is a very important point, and will seriously hurt the progress of bitcoin eventually. You seem pretty knowledgeable, what's your take? Do you think bitcoin will survive?",2016-01-09 09:43:53
cyrvk1s,cryptowho,179,"Shame shame shame

I could go online and insta buy $1000 worth of bitcoin in seconds. Thats what they gave us. 

There are only a few of services that give us this option. They are the most safest way in. In my opinion. No mater what they say. Business is business and its a damn shame to see them treated this way. ",2016-01-10 01:32:03
cyrvgcj,RedRhino007,73,"Isn't this a no brainer  ?  Does bitcoin.org think bitcoin is mainstream enough NOT to list one of the best funded wallet providers...

hahahahahaha good job guys... good job... this is so ridiculous",2016-01-10 01:28:48
cyrx8vt,josiah-,52,"If XT, or any alternative implemention, ever gains majority adoption wouldn't that make it the 'true' bitcoin and Core therefore, CoreCoin? Assuming conflicting rule sets.

I'm just confused why people try to only tie this risk to XT, when it could just as well happen with Core.

I may be missing something though--just let me know if so.",2016-01-10 02:22:38
cyry5mn,AgrajagPrime,52,"Absolute bollocks. The potential XT chain split doesn't exist until a supermajority, and in that case, that's the one true chain. 

Bitcoin is just the chain that the most people are using. ",2016-01-10 02:49:39
cystcwj,JoelDalais,46,"Quit your bank and go here - https://www.fidorbank.uk/

We won't shaft you at Fidor.

Keep in mind we're a very young bank with only basic facilities for now, most everything we don't currently have will be integrated this year, but you can still get your bitcoin fix through us.",2016-01-10 21:18:00
cyslpei,Capt_Roger_Murdock,43,"Welcome!  

One note. Personally, I think the debate over *where* the block size limit should be set is a lot less important than the debate over *how* it should be set.  Most ""small blockers"" claim to support small blocks because they worry that ""big blocks"" are a threat to Bitcoin's ""decentralized"" nature. But to me, the biggest immediate threat to Bitcoin's decentralization is an ""implementation monoculture"" that's effectively allowing a single development team to unilaterally set a controversial economic parameter (an economic parameter that, it's worth noting, was not originally intended to be an economic parameter, but instead a temporary anti-DOS measure). It seems to me that whether we need a block size limit and if so, where it should be set, are two questions that should be answered in a decentralized way by the market (which is why I support the approach proposed by Bitcoin Unlimited).  [Now ultimately, it's my view that those questions WILL be determined by the market](https://www.reddit.com/r/btc/comments/402v32/forking_pressure_may_2015_vs_now_by_ubitcoo/cyr6h3n).  Bitcoin has always been defined, not by any quasi-official ""reference"" implementation, but by the code that people choose to run and the version of the ledger that people choose to value. My main goal re: this whole debate is to help undermine the ""psychological barrier"" that I believe is vesting the Schelling point reflected by the Core devs' recommended setting with undue ""authority.""  ",2016-01-10 14:15:37
cysputn,DigitalGoose,29,"The fact that if bitcoin continued to gain popularity, he'd be in possession of tens or hundreds of millions of dollars of it? I would want to stay anonymous, too!
Tor is neat and all, but he probably didn't think he could realistically stay 100% anonymous any longer if he kept posting.",2016-01-10 17:13:48
cyrtmp7,gox,26,"&gt; Ultimately bitcoin.org is devalued not Coinbase.

I am considering whether that is a bad thing.

Unlike, for instance, Linux, this central information outlet is attempting to define, and in effect govern, the nature of the entire Bitcoin ecosystem. If Linux OS scene was dominated by this sort of centralist aspirations, would it have succeeded in replacing user-friendly proprietary OS's, or would it have completely failed to take off? I'm more inclined to the latter.
",2016-01-10 00:25:04
cys7nux,jtoomim,25,"I intend to submit pull requests for the major changes to Bitcoin Core as well. They may get rejected. So be it.

My goal is to build a project that implements features that users and miners say they want. It currently appears that Core does not share that goal. If that is the case, and if I am successful in my goal, then Bitcoin Classic will likely go somewhere.",2016-01-10 07:19:21
cys0g3k,E7ernal,24,"Remember, when there's huge popular sentiment against something, it's brigading!

Being pro censorship is only hurting you guys, and it's completely antithetical to everything Bitcoin stands for.",2016-01-10 03:55:38
cys80n0,kraml,24,"/r/bitcoin does feel like North Korea though. Censoring stuff is way uncool. And no, don't tell me discussing possible futures of Bitcoin is off topic.",2016-01-10 07:29:22
cys39w4,throckmortonsign,23,"Actually, that very likely is /u/nullc. Maxwell worked on sound compression algorithms before Bitcoin. I promise I'm not a stalker of these people, but I do look at the dev's past FOSS work.

Edit: BTW, Greg Maxwell's body of work is probably only second to Adam Back's when it comes to being a friend of internet freedoms. I won't go into all details of this, but they both deserve high praise for the work that they've done to advance the freedoms we (currently) enjoy on the internet. That's one big reason I give Blockstream the benefit of the doubt when it comes to all the crazy conspiracy theories that come out about them. It's hard for me to believe a person who, just to make a point, exported munitions in the form of a t-shirt would be acting maliciously.",2016-01-10 05:16:21
cysrreg,wshanahan,23,"In this moment I am euphoric, not because of any phony fed chairman's QE policy, but because I am enriched by my own bitcoin investment. ",2016-01-10 19:19:47
cysvhl5,jstolfi,23,"&gt; I expect it to be an over-engineered half-baked idea that will somehow solve all the problems with bit-Coin¹ without any regards for the consequences of implementing it (if it's even possible).

You nailed it!

The size of a transaction is usually dominated by the signatures that authorize spending each input.  The original idea of Segregated Witnesses was to split blocks and transactions into two records: an ""extension"" record with all the signatures, and a ""main"" record with all the other information.  The main expected advantages were 

1. simple clients who need a block, but do not intend to validate the signatures of every transaction in it, can fetch only the main record, thus saving bandwidth.

2. The 1 MB limit would apply only to the main record size plus a fraction (1/4 in the current proposal) of the extension record size; so the change would increase the capacity of the network

3. the ID of a transaction (txid), that is currently a hash of the whole thing, would be redefined to be a hash of the main record only.  That would fix in one swoop all the sources of transaction malleability.  

    (Currently, a third party can intercept a transaction and, even without access to the private keys, tweak its signatures in such a way that the transaction remains valid but its ID changes.  Such ""transaction malleability"" attacks break many wallets and other software out there, and invalidate chained transactions that use the original txid to refer to its outputs.  Mark Karpelès tried to blame MtGOX withdrawal problems and losses on malleability attacks.  Recently some Russian programmer jammed the bitcoin network for several days with that trick, just for fun.)

4. Other vaguely specified information could be stuffed into the extension record.

I suspect that this proposal has other motivations that Blockstream is not telling.  The Lightning Netvapor seems to require exceedingly complicated signatures, so perhaps SegWit is a way to fit a meaningful number of LN transactions (or even only one) in a block, without raising the holy 1 MB limit.

Pieter Wuille, one of the Blockstream co-founders and one of the Core devs with commit access, said that he had this brilliant idea a few months ago, but put it aside since it would require a hard fork.  But then Luke Jr had another brilliant idea that allowed it to be deployed as a soft fork -- that is, without telling users about it.  

The idea is to redefine another script opcode, that is currently a no-op, to mean ""check the signature in the extension record"".  A transaction that uses the SegWit format will use a script with this opcode in place of each output address.  Then old clients will read that opcode as ""no-op"" and think that the output can be spent by anyone; whereas new clients, and at least 95% of the miners, will know that the spending must be signed in the extension record.

Pieter is enthusiastic and is now pushing the deployment of SegWit at full speed, ignoring all criticisms.   IN particular, he has never explained why the radical reformatting of the blockchain is necessary, given that the same benefits above can be obtained, much more effectively, without any change to the format.   

SegWit will considerably weaken the security of simple clients, and will require extensive changes to any program that requires the signatures, such as block explorers.  It will also allow a weak form of ""reverse malleability"" (changing the signatures of a multisig without changing the txid).  

Just by probabilities, SegWit it certain to have unforeseen consequences and exploits that will not be revealed by Blockstream's tests.  For me, it is the best evidence that the current Core developers are so incompetent that they cannot even suspect that they are incompetent for their job.
",2016-01-10 23:25:38
cysniqs,ydtm,23,"Upon doing some further forensics investigation (applying unreddit.com to some other controversial /r/bitcoin threads), indications are now starting to come to light that the coverup of ideas and opinions went far beyond merely censoring [""comments of frustration and jabs""](https://www.reddit.com/r/btc/comments/409kcg/omg_i_just_discovered_unredditcom_it_shows_all/cysmuz0).

Instead, there appears to have been a **systematic attempt on the part of the mods at /r/bitcoin to cover up some of the most important and crucial serious (and persuasive) arguments involved in the debates on scaling and blocksize.**

For example, see this other thread showing some rather shocking ""smoking gun"" evidence regarding the sort of systematic, heavy-handed censorship many of the most important, substantive, and persuasive ideas and proposals in the scaling and blocksize debates.

&gt; RescuedComments - Shocking, concrete evidence of ongoing systematic censorship in /r/bitcoin: Now you can use unreddit.com to rescue all comments deleted by Theymos (and/or other mods) in their desperate underhanded attempts to distort and suppress free speech in the Bitcoin community

&gt; https://np.reddit.com/r/btc/comments/40a5td/rescuedcomments_shocking_concrete_evidence_of/

It is interesting to note that (despite the many months of systematic censorship), many of these important suppressed ideas and proposals did actually go on to become quite accepted and mainstream (as they eventually got re-submitted to other, less-censored sites on the internet), simply due to their sheer persuasiveness (for example, notions about decentralized development, or blocksize as an emergent phenomenon of markets).

We can only guess at the amount of damage done to Bitcoin by the censors at /r/bitcoin who desperately attempted to prevent these important ideas and proposals from even being mentioned.

It is clear, however, that the people engaging in such censorship have inflicted considerable (although hopefully only temporary) harm on Bitcoin as well as on Reddit (as a site considered to be useful for discussion and debate), by keeping most of the community in the dark for many months about what some of the most important Bitcoin thought leaders were actually proposing and discussing.




",2016-01-10 15:21:18
cysfith,mikey991,22,"**[HD CSN FEED Working on Phones](http://freecast.in)**

**[Donations gladly accepted - PayPal ](https://www.paypal.com/cgi-bin/webscr?cmd=_s-xclick&amp;hosted_button_id=NXZPY838ARTLA)**

**Bitcoin   1Lw3q8CriqfcPF7tpULskB8KmnK35m328H**


",2016-01-10 11:00:32
cysln4o,SouperNerd,21,"&gt; I'm a r/bitcoin refugee but also a small block supporter

Welcome.

If you want to make the most impact, debate, participate and educate according to how you see things.

r/btc will be what you make of it.",2016-01-10 14:13:35
cysvwwb,OptimistLib,21,"This reluctance to do hard forks will be bad for bitcoin. Let's accept the fact that hard forks will be required and it is better to get used to it.
Noone is opposed to segwit. But that does not mean blocksize should NOT be increased. If it is technically feasible, blocksize should be increased as much as possible",2016-01-10 23:45:15
cyrw1ew,mikey991,20,"**http://freecast.in/facup.html HD EN Working on Phones**

**[Donations gladly accepted - PayPal ](https://www.paypal.com/cgi-bin/webscr?cmd=_s-xclick&amp;hosted_button_id=NXZPY838ARTLA)**

**Bitcoin   1Lw3q8CriqfcPF7tpULskB8KmnK35m328H**",2016-01-10 01:46:49
cyrvd22,Emocmo,20,"Point and Figure Chart of the Day

Ok, so while we hit a new high of $464 yesterday, we did not “break out.”  Instead, today we dropped three boxes to $447.  This reversed our chart into a column of Os.  If the price spikes up over $465 sometime before the end of this 24 hour period, this reversal would be moot and we will break out into a double top.  It could happen, and that is why on the chart I’ve indicated today’s reversal with a grey background.  This is to remind everyone that the reversal is not “official” yet.

Keep in mind a reversal, in and of itself is not a reason to sell or buy.  There are some times when they are—the long poles for example—but this particular one does not seem to have the “drama” associated with it.  That is my term, not an official charting term.  I don’t think anyone would call a drop the likes of which we have seen over the past few days “dramatic.""

A reversal changes a couple of things.  The formation is now ten columns wide.  That is almost a record for bitcoin—at least in recent memory.  What this means is that when the next move (up or down) it should have some “umph” behind it.  I am not making any predictions at this point.

We also change our reversal to a new column at $460.  This would match the previous high column and set up a triple top.  In PnF charts, this is kind of a big deal.  But again, no predictions until we see some movement.

We still have to fall a considerable distance in order to cause a negative break down.  

So, we are still in a consolidation mode.

I apologize for the gun control comment yesterday.  I thought it was kind of funny, but this is not /r/politics.  I will steer from those areas from now on.

Anyway, I should have posted the story about Justin Bieber getting tossed out of a Mayan ruin for being naked.  I think we call all agree, that WAS funny.  And that guy is just “out there somewhere.""

[Chart of the Day](http://i.imgur.com/iEvflSD.png)


Resources

*[Dorsey-Wright, the best source of PnF Information](http://dorseywright.com/education/point-and-figure-glossary)*

*[Investor Intelligence explanation of PnF Charts](http://www.investorsintelligence.com/x/using_point_and_figure_charts.html)

*[Market Edge Explanation of  PnF Charts](http://www.marketedge.com/MarketEdge/DRME/drPFChart.aspx)

*[Stockcharts](http://support.stockcharts.com/forums/30077/entries/21293)
",2016-01-10 01:25:46
cyst8rs,homopit,19,"&gt; SegWit is only 1.75 MB if 100% of transactions use it. I do not expect that to be the case for quite a while, perhaps a year. For the next few months, I expect SegWit transactions to comprise only 50% or so of the total, which would make the effective capacity only about 1.375 MB. (https://www.reddit.com/r/Bitcoin/comments/40275p/forking_pressure_may_2015_vs_now/cyrknra?context=3)",2016-01-10 21:09:35
cysqkwe,theymos,18,"I think:

For some time, Satoshi lurked on various cypherpunk mailing lists. It was a little hobby of his, but he wasn't famous or a major participant. One day the idea for Bitcoin came to him. He wasn't sure that it'd work, but he was excited about it, so he thought that he'd give implementing it a try. In the two years that it took him to finish 0.1, new interesting facets of the problem presented themselves, and he was able to solve them. He considered a number of future use-cases, and added support for them to his software. When it all seemed to be working OK, he released it.

You have to understand that the ideas behind Bitcoin are not way out there. All of the crypto already existed, and even the idea of a block chain already largely existed in the form of git. Satoshi didn't need to be a mathematician, cryptographer, or master software engineer to come up with the ideas behind Bitcoin and then implement them. In fact, I think that Satoshi might not have been much of a programmer before building Bitcoin. But he was dedicated and detail-oriented. Maybe he read a good C++ book front-to-back before starting on the coding, and then put real effort into following best practices (with a large amount of success, though some imperfection).

In 2009 Satoshi was probably disappointed that Bitcoin wasn't getting much attention. But when things started picking up in 2010, he enjoyed explaining Bitcoin to people. He liked talking about the technology that he'd spent so much time thinking about and coding.

But then various more difficult problems arose. He didn't have a solid idea for long-term scalablity. He'd always planned to implement SPV in his client, but doing so looked like it'd take some major hacking. He'd had vague plans of auctions &amp; trading systems built into the client, but he couldn't find a good design for these things. Etc. Additionally, he was having to deal more and more with people, which he didn't much enjoy. Some people started to question his technical decisions, making it more difficult for him to make changes, and he couldn't always depend on miners running his code. There was also wikileaks and Gavin's CIA visit. All in all, Satoshi probably felt like he was losing track of the project, and moreover he didn't see anything technology-wise that he particularly wanted to work on; the programming that needed to be done was huge and/or conceptually very difficult (including some things which haven't been settled even today). So he just gradually lost interest. Most people forget that he didn't just completely vanish one day; first he left the forum and only responded via email, then he only responded to a handful of his usual correspondents via email, and finally he stopped responding to even these people.

After his last forum post were he said he was ""venturing into more complex ideas"", I think that this was not some hint that he was quitting Bitcoin and doing something else. I think that sometime after this post he actually did do a lot of work on solving some big technical problem, but failed to really solve it. And then when he looked back at the Bitcoin community, where there were now a few devs (Gavin, Sirius, lazslo, etc.) doing some work, and some real companies/organizations starting to form, he found it too tempting to just leave things alone.",2016-01-10 17:57:36
cysalom,jtoomim,16,We have been in conversations with Brian Armstrong of Coinbase. We have used some of BitPay's code already. We've talked with the Bitcoin Unlimited folks and are discussing collaborations (e.g. on **[blocktorrent](https://bitco.in/forum/threads/towards-faster-block-propagation-jtoomims-blocktorrent-proposal.742/)**).,2016-01-10 08:39:47
cys2sk4,Vibr8gKiwi,16,"The scum at /r/Bitcoin cause this. To avoid getting caught up, don't post or comment there and don't link to there. The place needs to die anyway and causing traffic there is counter productive.",2016-01-10 05:02:38
cys81yd,jtoomim,16,"&gt; In Satoshi's vision there was no such thing as developers setting the capacity, or a 'safe' capacity.

Yeah, I don't like that either. In all fairness, though, Satoshi was the one who implemented the 1 MB cap. He wanted to [increase it](https://bitcointalk.org/index.php?topic=1347.msg15366#msg15366) eventually. Like maybe 270,000 blocks ago. We're interested in a permanent solution like a flexcap, BU-style stuff, or BitPay's branch, but none of those ideas have consensus yet among both miners and users. I think a 2 MB hard fork in the next few months has consensus, so that's what we're coding now. A more permanent solution can come later.

&gt; In Satoshi's vision, the transaction fee should be sufficient to pay for the marginal cost of adding the transaction to a block. Every transaction that pays such a fee should be processed in the next block, without any artificial capacity limit.

That's the general idea that we have for Bitcoin Classic, yes.",2016-01-10 07:30:23
