Comment ID,Author,Score,Body,Publish Date
d0z6hd6,Zarathustra_III,15,"&gt; &gt; Bitcoin terrorist No. 1.

&gt; This is disgusting.

Indeed!

&gt; What absurd justification for the ""collaborator"" moniker. Are Evoorhees and Andreas also ""collabators"", since they've posted in /r/bitcoin? 

Depends on what you are doing there. If you call out the terror of the totalitarian traitors there, you are of course not a collaborator.
If you defend the terror or contribute to it by using that channel as your preferred reddit channel, you are a collaborator:

https://np.reddit.com/r/Bitcoin/comments/4a89hq/word_against_word_some_experts_say_bitcoin_can/d0ycdek

&gt; You're making this subreddit look like a bunch of crackpots. If that's your intention, bravo.

You are a counter indicator as you should have learned already. You are constantly downvoted by the users of this uncensored channel. You can call us crackpots as much as you want. No problem.
",2016-03-14 19:06:48
d0yw2lu,davidcruva,14,"I am lucky to have friends from the past, otherwise I'd have a hard time adjusting to these amounts of money. I recently started earning $50k a month, and I'm only starting to understand the corrupting power money has. Hell, I even have a hard time confiding in my accountant because they look at me jealously with this. Similar things will happen to you. This happened so sudden that I'm catching up adjusting to the new dynamics.

Rule number one of wealth club is: No one is going to be happy for you receiving that amount of money. Do with that what you will, but make it your law. If you want to make people unhappy, go tell them that you're rich now :)

I'm figuring out the other rules as I go along. I invested a lot in cryptocurrencies like bitcoin and ethereum, and they have gone up sizable since then. I also have mining contracts that mine these coins through genesis mining. Then, I have $25-50k in both Euro and USD. I also have a silver stash. That's about it, if you find some cool stuff to invest in let me know!",2016-03-14 11:13:16
d0z8dfp,ThePlagueDoctor0,14,"Someone should redo the chart using Chinese yuan instead of US dollars (EDIT: and the Chinese calendar instead of the Gregorian calendar), translate the text into Chinese, and share the translated infographic with the Chinese miners.

---------
**EDIT:**

**Chinese translation (final version):** [**https://imgur.com/7D4OawG**](https://imgur.com/7D4OawG) / [**https://sli.mg/OkTbjE**](https://sli.mg/OkTbjE)
------------
**DOCX (final version):** https://mega.nz/#!qEdElAIA!1_iO8xwt0ZvH2Xc2ZuycuSlbhxxuHNNIYBK5MQCxOfY
--------
**Everyone please share this to any Chinese Bitcoin-related forums you know!**
-------",2016-03-14 21:00:51
d0yt9ii,SpontenousEmergence,14,You can use google to search estimates of bitcoin wealth concentration. Winklevii + Ver + Satoshi probably at 25% alone.,2016-03-14 09:53:58
d0z7o84,robbak,14,"They argue, and with reason, that consensus for protocol changes should be widely supported by the users of bitcoin, not just the miners. The miners are just one group of users of bitcoin.

Of course if they had not created a controversy over the blocksize - if 18 months ago they had said, ""block sizes are aproaching the temporary limit, we're bumping it to 4MB (or 8MB), K?"" - there would have been some bikeshedding over the number, but it would have been done in a week or so with almost universal support. ",2016-03-14 20:22:50
d10mp3t,fobfromgermany,346,"See I think he was taking a shot not only at encryption, but also crypto currencies like Bitcoin. Using coins bypasses the entire banking system, and we can't have that now can we ",2016-03-15 23:36:06
d0zguph,firstpageguy,170,"That seems to be part of the reason they are doing it, to prevent illicit sales.  Not that it will work.

Undoubtedly something will replace cash on the black market.  Maybe something like bitcoin or gift cards.
",2016-03-15 01:22:39
d10mpul,jratcliff63367,129,"Why are we banning people on /r/btc, and who is doing the banning?

This doesn't make sense to me. I thought this was going to be a more open forum with little to no censorship.

Clearly there are things that alt-coins are doing which has relevance to bitcoin. I don't see why they can't be discussed. If the community doesn't want to hear about it, they can use the standard voting method to express their opinions.

**edit** 

I posted this reply, like right before I stepped on an airplane. When I landed I see this has blown up. 

I'm a mod here, but all I do is delete duplicate posts, remove spam, and mostly *undelete* posts that the auto-moderator script flagged.

I don't have ban authority, I don't want it, and wouldn't use it if I had it. Even though I  spend a decent amount of time online, not so much I monitor every single thread and comment 24/7.

I don't believe in banning people on message forums. Deleting messages seems sufficient for 99.9% of all problems.

I hope we can get back to lighter moderation soon.
",2016-03-15 23:36:41
d10eezo,midmagic,52,"Many of us gave away *significant* volumes of bitcoin in order to guarantee that lots of people had an ownership stake.

10,000 bitcoins back even when they were a few pennies a piece, or the 3500 BTC later on which were given to him by the EFF is indeed admirable, but if you're talking sacrifice-as-evaluation-of-character, tens of thousands more were given away by others as well. It was a good way to bootstrap the network. *Donating to the faucet* was an actual thing.

Yes, I'm answering a troll post with a serious answer. Yes, I know I'm technically legitimizing a troll post. History is important, and posts like this that muddy the historical record are used as reference material for people with agendas.
",2016-03-15 16:58:58
d10n5x6,redditchampsys,46,"I see the need to censor 'Heavy Altcoin discussion'. u/SouperNerd probably deletes many altcoin spam messages a day.

But when a respected member of this community posts about a successful hard fork in the next most successful altcoin, it has important and clear implications for bitcoin. The post got upvoted and commented on. Removing it was a mistake imho. Removing it without communicating why was terrible.

Slamming down the 7 day ban hammer on u/aquentin without a warning or reason was horrendous and unacceptable.

I agree that the way u/aquentin went about trying to circumvent the removal of a post wasn't that cool (Why not argue your case in r/btc_mod_chat/ first?), but please try to assume good faith and communicate before moderating to r/northkorea's level.",2016-03-15 23:48:35
d0zp1pz,ozme,40,"~~Uphold is a joke~~ BitReserve was a joke. Without BTC they were/are nothing and yet they astutely ran an ad campaign vilifying BTC and encouraging their customers to ""lock"" (read: sell) their BTC for BitReserve deposits. I haven't used their new rebrand, Uphold, but at least a few people in the UK seem to find it useful, so I will reserve judgment on their service and leave it at that they seem only to opportunistically care about Bitcoin and need to really rethink their approach.",2016-03-15 04:31:58
d1016mv,buddhamangler,38,It's a start.  It will show hard forks are possible.  We will gather useful data.  It will also show that Core != Bitcoin.,2016-03-15 09:25:20
d0zwqz6,hellobitcoinworld,35,"Austin is accusing r/btc of things that r/bitcoin is far, far more guilty of. And r/bitcoin is where Blockstream goes to communicate.

So why isn't Austin Hill complaining about r/bitcoin???

/u/austindhill",2016-03-15 07:30:53
d0zspwr,sedonayoda,32,Glad they messed up. We get some free press and the public gets reminded that Microsoft accepts bitcoin at all.,2016-03-15 05:53:51
d10n4nw,gox,31,"Well, I am unsubscribing. There has been how many such ""mistakes"" now?

It is not the job of the ""Bitcoin"" moderators to be the though-police. I don't care what the norm of Reddit is.
",2016-03-15 23:47:40
d10n0sj,seweso,29,"Because clearly within the Bitcoin community people don't want to look in the rearview mirror. As if that is a good way to remain in the lead. 

The reality is that if the only reason we use Bitcoin is because we are shielded from alternatives, then Bitcoin has no reason to exist. It might as well get replaced. ",2016-03-15 23:44:51
d0zrtw0,MineForeman,28,"Don't worry, I just heard that China banned bitcoin! 

^^^^^fud ^^^^^enough ^^^^^for ^^^^^you?  ^^^^^:P

",2016-03-15 05:33:45
d10le4m,tsontar,27,"**The ""social contract"" / ""shared understanding"" was always, and remains, that the block size limit is a temporary anti-spam limit that can and will be removed if it ever affects economics.**

Theymos and everyone else knows this.  It's baked into the historical record going back to Satoshi.

The limit was a knee-jerk reaction to [an unexpected attack](http://gavinandresen.ninja/One-Dollar-Lulz) in the earliest days of Bitcoin that is unlikely to ever repeat and which can be dealt with in [much more elegant ways](http://www.bitcoinunlimited.info/) than a consensus rule.",2016-03-15 22:59:01
d0zumbr,xlance,27,"Ok.

Your first site:

If I made a Venn-diagram of your target audience and people who knows what crypto currency are - that would be a sad sight. Design is nice, but you are saying that I can buy these for sisters or for BFFs. Why do you only have one in stock then? Its impossible to buy two...

Your second site:

Why does everything have to be so black? Why only one product? You need to cater to an audience, I wont follow your site if you have a product about crypto one month, and dogtraining the next. Way too much text on the page. 

It seems like you are overthinking everything with all these % donations etc. Let your product be good enough to sell itself, without you having to give your money to anyone. 

http://unbounce.com/

Use this, build a simple landingpage with payment through paypal. Sell a simple product, get some sales. 

You seem very interested in crypto currencies. Make an ebook about ""Beginners way to buy Bitcoin!"", and market it on Facebook. Read The $100 startup. ",2016-03-15 06:38:15
d0zokfv,token_dave,26,"Uphold and Anthony Watson represent the absolute worst element of the Bitcoin ecosystem.  100% opportunist, 0% ideologue.  ",2016-03-15 04:21:00
d10l6aw,tsontar,24,"Bang on:

&gt; So, as someone who generally feels like the least-technical person on this forum and who hasn't really dug into segwit, am I crazy to think that it has almost nothing to do with scaling? In other words, I see people say that it's not ""primarily"" about scaling and that the effective increase in the block size limit is more of a lucky ""side effect"" or ""bonus""... but even that seems wrong. The proposed formula could have been:

&gt; transaction data + witness data &lt;= 1,000,000 bytes

&gt; which would have resulted in no increase in the block size limit, correct? But it would still have addressed segwit's main goals (i.e., fixing malleability). So it seems to me that the effective increase in the block size limit that we get from Core's actual SegWit proposal is more like a bribe: ""hey, Bitcoin network, you know how you're now desperate for an increase in the block size limit because of the years we've spent stonewalling and goalpost-moving on that issue? Well, if you give us segwit (which we need for the Lightning Network), we'll give you a (token) increase in the (effective) block size limit. Oh, but not an honest, straightforward increase. No, part of the deal is that the effective increase must provide a huge (and completely arbitrary) discount for witness data, which -- it just so happens -- will provide an effective subsidy for Lightning Network settlement transactions (which will have more witness data than typical transactions).""

Or to put it another way, no, you cannot use extra space in the blockchain for onchain transactions, because we need that extra space to scale offchain transactions.

""Bitcoin Core.  Keeping business off the blockchain since 2013.""",2016-03-15 22:52:30
d0zkkjn,ThePenultimateOne,24,"&gt; ""we've waited this long, what's a few more months"".

Probably the death of Bitcoin. But whatever, it's their loss too.",2016-03-15 02:50:10
d10i1lt,Zotamedu,23,"It is more easily scripted and there are a couple of poorly documented scripting languages that work with it so in theory, you can make decentralized code that runs in the cloud where anyone can validate the code. Problem is you cannot easily change the code so if you put something out in the cloud with a bug, it will execute anyway. It is also a bit special because of the massive pre-mine and the people behind the whole thing are rather open with that the inflation rate is flexible and controllable by them. So they have a nifty tool to control the price of ether which is handy since they also just happen to be the biggest bagholders. 

So it's a technically interesting thing that is useless in the real world and they are not even trying to hide that it's a massive pump and dump ponzi but people buy into it anyway.

So it's basically Bitcoin 2.0. Same basic scam but with more useless bells and whistles and it will probably play out quicker. ",2016-03-15 20:50:42
d0zwz8a,MentalRental,23,"I don't think the thread was really relevant to Bitcoin but deleting it seems a little heavy handed. Trust in the /r/btc community. If it's irrelevant, the community will downvote it. It doesn't look like the post violated any sidebar rules (including #6 since this wasn't a ""heavy altcoin discussion"" but merely a heads up about a hard fork occurring at another popular cryptocurrency which would be an interesting thing for someone in the Bitcoin community to observe).

I understand that being a mod can be a difficult and thankless job. /r/btc however has been doing pretty well. Let's have some more trust in the user base. We can help out. I hope the ban is lifted especially since the entire community is still dealing with theymos's ""moderating"".

Thanks for reading!",2016-03-15 07:36:41
d0zycmi,CheesyGames,20,"I don't think it's possible to pump anything in here, I told the truth and came in here as it's more fun than any other Bitcoin forum.",2016-03-15 08:11:35
d10h5dl,timetraveller57,19,"&gt; Block stream Core really think we are stupid.

Unfortunately has worked on a lot of people .. (/r/bitcoin)",2016-03-15 20:01:44
d0zq6go,n0mdep,18,"Bitcoin companies that bridge the gap between fiat and Bitcoin are **absolutely essential** to the Bitcoin ecosystem. They literally help power Bitcoin's network effects.

Crucially, it's all **opt-in**. Feel free to ignore Coinbase completely if you like, but ""regressing the cause""? _Sigh_ (to whoever says that).

EDIT: Of course it would be cooler if USAA would add support for read only personal wallets, Trezor and the like.",2016-03-15 04:57:23
d0zu0tu,antyv2k,18,"Amazing work as always /u/nbr1bonehead. Ethereum is definitely far ahead of Bitcoin at the moment and with contributions like yours, we'll slowly but surely convert them. :)",2016-03-15 06:24:01
d10418z,redmarlen,18,I think r/btc would also get more attention afterward and r/bitcoin etc would lose subscribers.,2016-03-15 10:38:44
d0zx2sl,Bitcoinopoly,17,"&gt; if he tought that reddit can be used as a showcase... he's wrong .

He's actually not wrong. Buying Theymos and /r/bitcoin was his way of being able to showcase his company on a supposedly neutral subreddit without the competition being able to speak.",2016-03-15 07:39:13
d10igmc,jazybebus,16,"The Bitcoin belongs to them though, so different rules apply.",2016-03-15 21:11:28
d10ffkt,seweso,16,"From when I could still comment on the other side: 

https://np.reddit.com/r/Bitcoin/comments/3y2zfb/segregated_witness_is_good_but_not_so_good_that/

How time flies when you are having fun. ",2016-03-15 18:06:16
d103zfp,FaceDeer,16,"That's not the root of the problem. The root of the problem, IMO, is the Chinese miners. The fact that there's a handful of insular people in control of Bitcoin who listen to just one dev team and whose economic interests are not aligned with the users of the system is what's made this into such an insanely hard slog, and that's not going to change in any significant way even if Theymos resigned from everything forever the moment Classic forks.",2016-03-15 10:37:28
d1014ha,ReverendDS,15,"I might end up killing someone.

I got a call at about 1330 today from a user saying that she was browsing the e-fax files and ""there's a bunch of files names gibberish.locky and some file with instructions about bitcoin"".

Seriously?

Yes. It's encrypting shit on eight servers and one user's workstation.

So, I start triage. While I'm finding out how far it's spread, I find out from a coworker that he took a call from that one user around noon. The user was complaining about how his workstation was acting funny and all his files on his computer had been renamed to something.locky.

So, what did this coworker do?

Created a ticket, assigned it to himself and then left for lunch.

That's it.

No isolating, no checking anything else, no telling anyone.

So, now I'm restoring seven servers from backups - we're losing at least two days of possible data (since no one is supposed to be working on the weekend, but may be doing so anyways) ... and one of the servers is having to be redeployed from scratch.

I'm so furious I haven't even had the energy to finish drinking my second cup of coffee.",2016-03-15 09:23:54
d0zee2h,tsontar,15,"&gt;You are comparing apples to oranges here. ETH is made to fork often per its design according to VB. Bitcoin should be hard to fork... 

Please find me even one shred of evidence that says that Bitcoin is not designed to fork.",2016-03-15 00:22:05
d11wbtz,iamtherealdylan,78,"This finally answers my question! I've always been thinking to myself, ""when are Prague police finally going to figure out Bitcoin? When are they gonna do it?""",2016-03-16 22:13:10
d10owvz,erktheerk,59,"Qbittorrent is basically an open source version of utorrent without the possibilities of bitcoin miners, ads, or the security risks of not updating an app for years at a time.

EDIT: I also disagree with monetizing P2P, which is what utorrent has done. ",2016-03-16 00:32:25
d11rhak,[deleted],56,"Segwit as a soft fork is a hack job. It wouldn't even be possible at all if it wasn't for a hack that Luke-jr discovered. It's a trick on the Bitcoin protocol which gets it to behave in a way that wasn't intended. Funnily enough, part of Core's road map is to clean up the sloppy soft fork mess with a cleaner hard fork once SegWit has been adopted. Why? Why do it as a soft fork at all? What an embarrassing, illogical, and convoluted path to take. There is no good reason to do it this way. Only bad reasons.",2016-03-16 17:56:00
d11fyao,Soulja_Boy_Yellen,39,"I found a good one on s4p:

&gt;THE WORLD NEEDS A VOTING APP THAT UTILIZES BITCOIN ENCRYPTION TECHNOLOGY TO ENSURE THE VOTES CANNOT BE HACKED!
WHY IS THERE NOT A VOTING APP YET?
WHICH COMPUTER NERD WANTS GLORY?! AND TO BE REMEMBERED FOREVER! MAKE THIS APP CHOP CHOP!!
FUCKERY IS AFOOT!",2016-03-16 10:49:36
d10zsu4,nopara73,34,"&gt;It's an attack if some person or group is intentionally disrupting normal operations for most people on the network. We're seeing wallets sending coins to themselves over and over, spending unconfirmed transactions repeatedly, sending a high volume of low fee transactions, and constantly requesting large blocks to max out bandwidth.  
  
&gt;Sure, you can say that these are not attacks and we should allow everyone to use Bitcoin as they see fit, but let's try a simpler example. If someone loots all the toilet paper from the public toilet, is that a bad thing? Is the solution to double the amount of toilet paper stocked each day?

It's hilarious.",2016-03-16 04:39:18
d11h9k6,BitcoinIsLiberty,28,These guys are crazy out of the box thinkers. I'm glad bitcoin has them on our side! ,2016-03-16 11:19:56
d10o4zn,chip_ninja,28,"He's referring to things like Bitcoin, a cryptocurrency, which can in fact only be accessed on your phone if all you use is a mobile app. 

Still, I agree with the question. These people are either ignorant of the modern world or they don't care. Either way they should be out.",2016-03-16 00:13:30
d10umob,n0mdep,25,"This from the guy who was convinced by Blockstream's Adam Back (not Core devs) to follow Core, and then promptly signed a commitment letter to _not run anyone else's code_ (could that move be any less Bitcoin?).

&gt; But the block size limit has another function; it maintains a low bar for anyone to run a full node, which serves to promote decentralization.

Strangely, he didn't care about this when he was arguing in favour of 8M blocks last year. He also ignores that SegWit requires 2M+ and allows an attacker to push 4M ""blocks"".

The fact he had a three-hour call with Adam Back ""about Core"" speak volumes.

&gt; We're now at the point where block size should be determined by technical and network constraints.

Which are made considerably worse by the slightly hacky SegWit and the ""adversarial conditions"" he mentions. Yet he's perfectly willing to accept that trade-off?

/rant :)

I really hope someone comes up with an acceptable flexcap idea for the promised HF...",2016-03-16 02:44:40
d11yl5j,farmdve,23,"Somewhere, there is a Bitcoin-only donut shop.",2016-03-16 23:20:25
d10x5wf,sqrt7744,23,"He's an arrogant asshole who would be entirely irrelevant were it not for the company that for some inexplicable reason hired him. Fits in with the Blockstream/core team perfectly as unfunny jester.

Edit: and Bitcoin magazine is a farce.",2016-03-16 03:40:52
d10o4q2,seweso,23,Slowly but surely /r/buttcoin seems to become the best way to get a perspective on all things Bitcoin. I don't like getting forced to wear these ridiculous rose-colored glasses.,2016-03-16 00:13:19
d10y56l,flix2,22,"&gt; *Not everyone seems very happy about the outcome, though. At least two pool operators – F2Pool's Wang Chun and AntPool's Jihan Wu – indicated they want their hashers to vote?*


&gt; Everyone is a bit frustrated, but **there is no problem with them offering their users a chance to vote.** F2Pool is technically not running Bitcoin Classic. Maybe there was a bit of misunderstanding there ... or a bit of a loophole in the agreement. We agreed to give Core more time. I have faith that everyone will keep their word and stick to the commitments made in the letter.

Good. Let miners vote. That way we will finally see where support lies. I am fed up with both camps claiming ""overwhelming support"".",2016-03-16 04:02:17
d1176ag,TheShadowCat,22,"R2:  Usually you can't sue because you don't like what is said on the internet.  This R2 would be easier if they gave actual reasons, but it's the bitcoin community, so no reasons needed, just straight to the moon.",2016-03-16 07:27:30
d11nvgh,buddhamangler,22,"This is coming from a guy that thinks we need to decrease the limit.  The truth is you have no idea.  You cannot estimate what opportunity cost the limit is currently imposing on velocity, utility and price.  Based on your previous statements it seems you believe that bitcoins value is derived mostly from arbitrary and vague ""decentralization"" when the reality is the price increases over the last years have been in lockstep with services being built around Bitcoin and the resulting utility, acceptance and transaction counts.

I think you are absolutely and fundamentally wrong.  Further, given you respond that there is no plan b shows just how much you care about transaction counts in the first place, which should give the OP all he really needs to know.",2016-03-16 14:38:12
d10ts9b,erktheerk,21,"Sorry work got busy. Won't be expanding on this topic.

However I will say that I personally have a 1 strike policy when it comes to integrity of the software I use. In the past utorrent has done many shady things with their software. Since it is closed source and proven to contain malicious code more than once it is no longer a viable option for the security minded. The bitcoin miner was plenty for me to dump it forever, but I was already moved on by that point. I personally use open source over proprietary software any day. Especially if the solution for alternatives is using outdated versions.",2016-03-16 02:25:50
d10rrqp,IntoTheTrashHeap,21,"While it is possible to use bitcoin completely anonymously, most people do not have the technical skill and time to do so. 

Even though particular addresses aren't tied to names, those bitcoins likely come from _somewhere_ that may be subject to a subpoena and those people likely have information on the person who owns the bitcoins being tracked.",2016-03-16 01:39:54
