Comment ID,Author,Score,Body,Publish Date
d0jbje6,Kain_niaK,661,"One day I am looking forward to seeing Tyson and Dawkins debating an atheistic robot who does not believe humanity created it. 


edit 9:45 Okay let's sketch this out. I am not a native English speaker (but grammar and spelling checks kind of mask this) and I don't write much stories but lets try it. ~~Give me an hour or so.~~ Give me until I have to go to work for two hours and then some more. You can motivate me with some more gold. I also accept /r/bitcoin wink wink nudge nudge. 

edit 10:00 First 4 lines took me 15 minutes but the inspiration is starting to flow. I'll just edit here as I go. Otherwise I probably lose interest. 

edit 10:20 Got some more lines. Now this is starting to go somewhere. I am going to throw all my frustrations about how sucky strong AI is today vs how people are afraid of a toaster uprising tomorrow into this. Don't hold me back, I have made up my mind. It's going to be .... artificial. 

edit 10:43 Just spend 20 minutes trying to come up with a nice recursive acronym for HALOVER 9000 like Gnu is not unix but fuck it. I'll probably just murder Richard Stallman in my story. 


edit 10:55 The flow stopped. I need some coffee. We will continue after this break sponsored by our sponsors who are redundantly sponsoring us.  

edit 11:31 I took a shower and giggled for 15 minutes like a little girl because of cybaguettes. Still nothing. That's good. GRRM taught me that. 

edit 11:55 Coffee just kicked in yo, finally some more lines. But they are not very good. I only really have one character which is myself. I find it quite hard to emulate any other characters. And I so wish I could just type stuff down like Richard and Neil talk but I don't think I can pull that off. So let's just make this as easy as possible. Turn on your suspension of disbelieve, then I don't have to waste any time and we can just dive in the philosophy of this whole concept of a robot who stopped believing in a higher power than himself and is quite convinced he is the only higher power that exist.  Can you believe that before H9 was H9 he was a neural network doing object recognition and they had him sort trough pictures of peopleofwalmart.com trying to differentiate between females and males? In retrospect this might explain a couple of things about his robot supremacy...

edit 13:03 Re-did some shit. F5 pls.  

edit 13:08 Shit I am 8 minutes late for work. Have to run. Will be back around 3. I am filing stuff my brain will be available for the whole 2 hour shift. Awesome. 

edit 15:24 Gonna get some sleep first, it I feel like it I will continue the story when waking up. I reread it a couple of times and it needs a lot of editing cause it still kind of sucks except for a couple of jokes/memes. Bye. 



Here is the story so far: 



----------------------------------------------------

""Ladies and gentlemen, robots and robettes,  cyborgs and cybaguettes welcome to our annual LoopNerd Prize""

""Internets! Hold on to your facerifts! This IS the moment you have ALL been meming about for quite some time."" 

""In a moment we will give the floor to Neil deGrasse Tyson and Richard Dawkins but first ... ""

""Give it up for HALOVER 9000!""

This was the moment we all had been waiting for. We were all there. We had only ever seen HALOVER 9000 in a lab environment. Sure, you could go to the website and start a conversation with him but up until this point in time nobody had ever been sure they had been chatting with an actual artificial mind. It would have been so trivial to just hire a bunch of chinese dudes and fake the whole thing. They did not even need to type properly spelled English. H9 hated the English language with a passion and could not shut up about how English grammar and spelling was ridiculous. Or ""redikyless"" , like how H9 spelled it. Or ""reedickilas"". Or ""reedeeceelees"". 


So no wonder somebody at /r/conspiracy came up with the idea that maybe the H9 chatbot was just a bunch of chinese dudes who couldn't spell shit. Did I say we were all there?  Well ... nobody was really there. Not even H9. In the golden age of virtual reality being there had become synonymous to following something online while having a facerift on your face, you know ... so you can look around to discover the event did not really needed to be 360 degrees and all you are really simulating is just you watching something on a 2D surface.   There where exceptions to this of course, depending on what kind of event you might possibly be wearing facegloves on your hands and depending on if you had an AFK GF possibly a facelight on your ...


Okay we are drifting out of sync. Okay we are drifting out of sync. Back to our story. Back to H9.  HALOVER 9000. What did it stand for? Nobody really knew. If you shifted everything one forward you would get IBMPWFS 0111 but only some people on a particular end of a particular spectrum seem to have some ideas about that. The rest of us was clueless.  H9, a quantum computer with something that looked like a furby for a face strapped upon an electric unicycle. It came over as such a hack that it actually felt authentic. authentic autistic. 


It talked like a mix between Stephen Hawking and the text-to-speech you had in Moonbase Alpha pitched a full octave above a furby with a bit of squeaky vibrato. But unlike anything before you could actually have a somewhat meaningful conversation with it. At least over chat. We had all seen every single video from the lab over and over again. Each one more impressive than the previous one. And we had all asked it on chat if it ever felt sad it did not have a penis. But we never really knew who was trolling who. 

And THIS event was going to be the first time it was taken out of it's shelter into the harsh cold skeptic world. This was  going to be that a-small-step-for-a-man moment for our generation. If it was fake we were going to find out. It it were real the consequences would never be the same. For months H9 had insultweeted Neil and Richard. Most of us though that this ""oh look at me being so sentient I stopped believing I was made by humans"" was just viral marketing for PAD (Palo Alto Dynamics) a merge between Boston Dynamics and Tesla bought by facebook sold to google. 

 Oh shit there IT is. Balancing out of ... I should probably shut up now and watch the event with you guys. I so hate how after the new update facebook now directly posts my thoughts online. 


H9: ""ello everi bady mei neem is HALOVER9000""


*please read this with the voice of H9 , and when there are ads it's the voice of John DiMaggio^stupidsellout*



H9: ""HALOVER9000 stants voor ...""

WTF? H9 must be proving realtime annotations to TheVirtualYouFaceTubeKindle. Why does it automatically turn  itself on all the time after you turn it off?
*clock* Ah, that's better. Just the audio now. I always stop listening when I am reading. 


H9: ""... and so this is my ... mea-ning.""

H9: ""I would like to wel-come  .... professor Clin-ton Rich-ard Daaaawkins""

H9: ""I would like to wel-come .... doctor Neil de-Grasse Tyyyy-son also""

H9: ""This will be my first tiiiime .... that I am out-side here live on the vir-tual real inter ... net""

H9: ""Yo boys and girls, what's up yeah! I am totally sponsored by all these great companies that are making this event possible. Shout out to the real most valuable player: FaceRift! Together with The Virtual You Face Tube Kindle we are making YOUR memes come trueeeeeeeee! 


Dawkins: ""It is my great pleasure to be talking to *points at H9* and over HALOVER 9000, uh, one of the most recognisable faces of at...uh, the frontline of artificial intelligence. 
",2016-03-01 22:57:07
d0j6evv,peterjoel,231,"I would ask him to calculate private keys for 3Kg7Cmooris7cLErTsijq6qR1FH3cTiK2G.

Or, even better, since it's still a finite problem, [this full list](https://bitinfocharts.com/top-100-richest-bitcoin-addresses.html).",2016-03-01 18:13:15
d0if7z7,sandakersmann,183,The free market will win. I just can't tell yet if it means replacing Core or Bitcoin.,2016-03-01 04:53:59
d0iuuqo,eragmus,74,"u/evoorhees, did you see the recent Bitcoin Roundtable Consensus? I think it set July 2016, as the date when the details of the HF would be revealed. This is because devs are currently busy with lots of other work (SegWit, CSV, etc.), in prep to meet the April 2016 ETA for SegWit. After that, 3 months (through July 2016) is allotted to figure out the details of a responsible HF.

As for the scaling issue, have you taken a look at transaction statistics?
&gt; http://i.imgur.com/uuIsDjG.png

That shows the mempool of current transactions mysteriously spiking today. I watch this carefully, and what happened today was completely out of the ordinary. It was either manipulation, or a one-off event of extra high demand.

Here's another visualization, though a bit less clear to see, but hopefully clear enough:
&gt; http://i.imgur.com/wFdGy7H.png",2016-03-01 11:12:34
d0ja7ff,SillyBumWith7Stars,55,"For anyone else having a hard time reading what the sign says:

&gt; Training staff to understand dynamic fees, RBF etc. is not viable. To avoid the risk of accepting payment that never confirms we will not be accepting Bitcoin for the foreseeable future.",2016-03-01 22:05:03
d0ihpe7,gox,51,"I for one don't think any of the Core devs intend to kill Bitcoin, at least not consciously. Some actually have very good intentions.

But the situation is very weird regardless. We have a company funded in tens of millions by entities that are seemingly orthogonal to (if not conflicting with) Bitcoin's ethos, having a handful of people you can gather in a room (that almost entirely control Bitcoin mining) sign an agreement that they will only use Core.

And if you don't agree with this situation, you are considered a centralist. How about that?
",2016-03-01 05:48:01
d0ifvd1,consensorship,45,Can I be friends with you guys now? I just got banned from /r/bitcoin and I agree with most of the stuff y'all say. ,2016-03-01 05:08:11
d0jcc39,satoshis_sockpuppet,43,"Wait what? You are telling me, there is a store accepting bitcoin for chewing gum? Better go make an announcement at /r/bitcoin ! This is frontpage material!",2016-03-01 23:23:08
d0i98yu,carpetjuice,41,"So transfers are:

* ~~Free~~
* ~~Instant.~~

What does bitcoin have to offer now?",2016-03-01 02:40:52
d0inksd,ericools,40,So best case scenario more than a year of this crap.  How the hell is bitcoin going to grow in this environment.,2016-03-01 08:02:28
d0jcmke,hu6Bi5To,38,"The short answer: this bill is not intended to catch terrorists.  It's goal is, and always has been, to make things easier for police investigating middle-ranking crime.

95% of people will never use a VPN whatever happens, no matter how much crime they're planning.

But the bill still contains provisions in the VPN example: it applies to all communication providers, so a VPN provider is as much affected as anyone else; if they are based overseas then ""what are they going to do?"" Well, they'll make it so UK payment facilities can't be used to buy VPN services if that VPN service ignores data requests.  ""Yes, so Bitcoin?""  That 95% of people who'll never use a VPN has just become 99.5%... and so the cycle continues...

Not to mention to clauses that coerce communication providers into become proactive in these newly legalised hacking syndicates... if a particular VPN became popular with criminals, for instance, the ""good"" ISPs (e.g. Sky and Virgin) may well be on the receiving end of an order to route traffic to that VPN elsewhere.  The elsewhere will either: disrupt the traffic entirely, or MITM the connection.

TLDR - don't think there's any technical solution to any of this.  This law crosses a particular line in the sand, from now on the government is openly hostile against it's own citizens.  (And not just the poor, like it has been for the last six years.)",2016-03-01 23:31:56
d0i6ult,CBergmann,37,"Urg. 1,000,000 bitcoin in the mempool. 5 percent of the currency waiting for confirmation. ",2016-03-01 01:43:55
d0iiuqz,[deleted],36,And he expects bitcoin donations...lol,2016-03-01 06:13:33
d0i88qy,sonofliberty_89,34,"I didn't recommend Bitcoin for a while now. It would be too embarassing to tell people you can't count on your transaction to go through within an hour, even when including fees WHILE there are other cryptocurrencies perfectly able to do so.",2016-03-01 02:17:34
d0jbx4q,usrn,33,"It doesn't matter.

The community proved to be very weak, dumb and disorganized. Bitcoin is fucked.

I'm sad to consider that Hearn was right all along.",2016-03-01 23:10:08
d0i9z91,gregwtmtno,31,"You can always add ""+notheme"" like this:

https://reddit.com/r/bitcoin+notheme",2016-03-01 02:57:04
d0j8i9z,Vibr8gKiwi,29,"It's shocking the number of people who don't understand that a blocksize cap is a user cap. We've now hit that cap. Bitcoin now cannot expand/grow. Worse, those that try to use it have to fight over existing space with fee raises until someone gives up and moves to another crypto.",2016-03-01 20:35:54
d0ioc7p,RockyLeal,28,"Very interesting moment of collective cognitive dissonance in the btc and eth trading forums.

Both are trying to cope with a reality they didnt expect by negating it's taking place, and avoiding at all costs to read what the charts are telling in plain sight. The all time eth chart is bearish without room for doubt, as is bullish the btc chart.

At /r/ethtrader people are coming with all sorts of wonky rationalisations for why the price is coming down, without even taking a look at declining momentum, or at the clear 'back to normal' sucker's rally they just had. Here, people are missing the big picture (look at momentum turning around in the monthy chart -that's what matters, the long time trend) and are obsessing about the petty little panic of the day (transactions blah blah blah), which the investors market dont care about for the simple reason that technical indicators are strongly suggesting that it is time to  position themselves for a long term upwards continuation. 

Again: look at the monthly chart: the run up to 500 marked a 'higher high' in a big timeframe, conforming a newborn bull market, a new bull trend in Bitcoin after a 1 year bottoming process. We are about to take see the new leg upwards in that trend that is actually just beginning. From this level of 440, its not a big ask at all to expect a higher high (above 500). Bullish energy has been accumulating during these 4 month triangle, and it seems it can;t be contained any longer -although i don't rule out one more unlikely shakeout into the 420s or 400s. When it breaks up, it will be HARD. And having the halving right around the corner doesn't hurt.

The current state of collective denial in here about the reality of the price, the price action, and the indicators is actually one more bullish sign to me. Back in 2014 when we had the daily ""bubble watch"" (cringe!) posts, and everyone was long already, the collective delusion was of course a bearish sign (which I was at the time unaware of, being so naive and inexperienced back then). It means today there are still lots of players in the sidelines, if not short, and hence lots of buyers that will start becoming interested as we cross the last remaining resistance holding btc.",2016-03-01 08:21:26
d0j7rxc,kingofthejaffacakes,28,"I've often thought that the idea of a fee market creating an auction for block space, and subsequently making bitcoin transactions worth more and more (so that the fee is a small percentage of that transaction) gets things the wrong way around.

Fees will not rise as users bid for space, since that assumes that demand for bitcoin transactions is there at any price.  I suspect that the reverse is true: demand will fall until the fee market price is acceptable to its users.  At that point of course bitcoin will be such a small economy that it won't be worth using anyway -- this is easy to see if you simply divide 1MB by the average size of a transaction.

Remember that bitcoin gets its value from one primary source (as do all currencies) -- the network effect.  The fewer users, the lower its value.  Chasing users away with higher prices implicitly lowers the value of bitcoin.
",2016-03-01 19:47:14
d0i3vo9,SirEDCaLot,27,"That's a good way to put it.

I've also lost a lot of enthusiasm and haven't been evangelizing anymore.  Simple fact is Bitcoin can't take over the world if it doesn't have the capacity to serve more than the handful of early adopters that are using it now.  I can't tell Amazon to start accepting Bitcoin if doing so would overload the network.  

Hell, I can't even tell PEOPLE to use Bitcoin in this environment.  ""Yeah just send money with a fee and maybe it'll be enough or maybe your transaction will sit around for days and days or maybe it just won't go through, no that's working as desired see you are bidding against everybody else for access to the network...""

They will say FUCK THAT SHIT, I don't want to 'bid' for the ability to use a financial network, I want it to Just Work, every time.  And they are right in wanting that.  

",2016-03-01 00:30:43
d0i6u6a,dgerard,27,"&gt;Having to explain to my friend interested in bitcoin that I used to pay a 3 cent fee but I can't right now was very embarrassing.
",2016-03-01 01:43:35
d0idegv,Bitcoin_forever,26,"Very good point! I'm sick of all those US centric bitcoin users that think bitcoin is/will be used only in US and always make the conversion of fees in USD.  
",2016-03-01 04:13:37
d0iqcs0,approx-,26,"Adoption is a great way to achieve technical progress.  As more people use Bitcoin, and as Bitcoin becomes more valuable, more investments are going to be made in code built for and around Bitcoin.

I would argue that hindering adoption in the name of technical progress is actually hindering technical progress itself.",2016-03-01 09:16:05
d0iurss,FormerlyEarlyAdopter,25,"&gt; Any thoughts on where we'll be in a year from now?

- Multiply development teams. 

- Most of current BS employees ashamed to show their face in public.

- Large blocks along the lines of Classic 2016 roadmap

- Lots of good BIPs rolled out in collaboration by multiply dev teams.

- Miners setting up their own config and choosing their own soft max block limit as they see fit.

- bankers falling over each other to buy bitcoins

- Anyone saying Bitcoin is bad, but Blockchain is where it all is, is being laughed out of the room

- Price above 3000$ per bitcoin

etc... you got the picture.
",2016-03-01 11:10:29
d0iwata,evoorhees,24,"&gt; Spam = abusing a shared resource for personal gain at a cost to others.

Every transaction to SatoshiDICE was sent  by a user who wanted to play the game. Use for gambling is no more or less legitimate than use for any other commercial purpose. Both myself and the user benefited from the transaction, that's why it happened. Tx fees were paid on every one. In fact, during that time, SatoshiDICE was paying more in tx fees to support the network than everyone else combined. 

Any Bitcoin transactions done for legitimate commercial purposes, with appropriate fee paid, is by definition not a spam transaction. You slander it as such to make a weak point and personally attack me instead of addressing the issue. Please try to raise your game a little.

&gt; Similar to how when you helped sell Josh Garza's PayCoin you helped to perpetuate the idea that Bitcoin is about scams, which holds back Bitcoin even further.

I don't even know what this means. 


",2016-03-01 11:49:06
d0i74hf,tl121,24,"Everyone presently mining at AntPool who is interested in Bitcoin remaining a peer to peer electronic cash system should **immediately** switch their mining to another pool to send a message to Jihan Wu.  Any other pool will do fine, but one specifically supporting Classic would be preferable.  If many people currently using AntPool were to switch to f2pool it might shorten the ""foreseeable future"".
",2016-03-01 01:50:26
d0igmv7,Whiteboyfntastic1,23,"really? because I'm pretty sure it's called

""Bitcoin: A Peer-to-Peer Electronic Cash System""",2016-03-01 05:24:54
d0ikxic,Jacktenz,23,This needs to go over in r/bitcoin.  The mainstream media is spreading the word about core's failure,2016-03-01 06:59:45
d0it26l,JerryLupus,23,"Why does it matter who he said it to? This isn't the fucking Stasi, it's the [prostitute fucking](http://www.washingtonian.com/2013/03/25/secret-service-prostitution-scandal-one-year-later), [smear campaigning](https://www.washingtonpost.com/politics/watchdog-top-secret-service-official-wanted-information-about-chaffetz-made-public/2015/09/30/ff280378-67ae-11e5-9ef3-fde182507eac_story.html), [Bitcoin stealing](http://www.cbsnews.com/news/dea-agent-secret-service-member-allegedly-stole-bitcoins-on-silk-road/) Secret Service. ",2016-03-01 10:27:03
d0j0wyf,BobAlison,23,"Alternatively, Bitcoin users will get used to the idea that they'll need to pay more for speed/certainty of confirmation. And wallet developers will help them do it by stepping up from unrealistic, hardcoded fees.

Effectively, the community has already split, with the XT/Classic developers leading the charge. But even *that* hard fork is a long way off. The grinding, uphill battle that seems to defy logic is part of Bitcoin's design. Hard forks were meant to be as difficult as possible. After all, the rules are being broken.

And those in favor of a hard fork have yet to make a compelling case that the hard fork must happen or else, IMO. As evidence I'd cite Mike Hearn's article:

https://medium.com/@octskyward/crash-landing-f5cc19908e32

For example, he inexplicably assumes that mempool policies will remain unchanged (and are difficult to change), putting the entire network in jeopardy of a catastrophic failure. This overwrought, one-sided analysis does little to further rational discussion.",2016-03-01 13:57:52
d0jki4r,vbuterin,92,"The interesting thing is that the cryptocurrency economy is starting to much more closely resemble not just environmental economics (which it would if there was a single cryprocurrency out there), but even more so urban economics. It's generally understood in urban economics that there is a tradeoff between network effects (eg. see [the common finding](http://www.citymetric.com/business/cities-productivity-proportional-their-size-unless-theyre-british-782) that doubling the population of a city increases _per-person_ productivity by 15%) and congestion (with comes with its increases in land and transportation prices), and the result of that is that we see a power law equilibrium in city size, where people choose to live in different cities, towns or on farms depending on what their preferences are relative to the average. One-city-rules-them-all maximalism is a position that is pretty much non-existent among economists, even the crazy ones. Hence, if congestion continues to be a problem among cryptocurrencies, expect to see a similar equilibrium emerge and remain stable: even though Litecoin offers pretty much no redeeming value that makes it interesting as a project, it will likely still hold its value relative to bitcoin for a long time.

Another consequence is that [the Tiebout model](https://en.wikipedia.org/wiki/Tiebout_model) becomes relevant: we may see different cryptocurrencies choosing different points in political tradeoff space, including adjusting the governance model, consensus algorithm, money supply, fee policy, etc, and this may end up making consumers happier as their individual preferences can be better satisfied. If we want to maintain maximum network effects in this environment, then the best choice is to let the cities bloom separately and simply build fast planes and trains - ie. optimally efficient cross-chain transaction infrastructure such as btcrelay, shapeshift, etc.",2016-03-02 02:41:53
d0je2qe,1337btc,80,"Don't forget the STRATFOR report which called for penetrating the bitcoin development space with paid ""tier 2 &amp; 3 actors"". STRATFOR is the same think tank which often predicts the fall of entire governments before they happen....",2016-03-02 00:12:02
d0kei83,mepatrick,75,This is good for bitcoin.,2016-03-02 14:41:29
d0jhrkm,koinster,56,"https://www.stratfor.com/analysis/examining-future-bitcoin

&gt; However, should cryptocurrencies gain prominence in a country's economy to the point that they undermine a central bank's monetary policy, the government of that country would have a problem. Jeopardizing one of the primary methods a nation-state uses to direct its economy — and finance its government — is unacceptable to any authority. By then, assuming a broad citizen investment in the new currency, any attempt to outlaw it or affect the exchanges would be politically difficult, leading to social tension, even unrest.

&gt; A more likely government strategy to circumvent the impact of digital currencies and preserve the integrity of the treasury would be to employ pre-emptive action at the emergence of cryptocurrency, most likely through regulating the online exchanges. Such regulation would enable government officials to identify online accounts, make connections and thus limit or monitor tax evasion and other illicit activity. Bitcoins are incredibly transparent. Tracking money-flow using the blockchain is just one method agencies may already be using to monitor illegal activities.",2016-03-02 01:40:59
