Comment ID,Author,Score,Body,Publish Date
d16t8hx,d4d5c4e5,20,"According to Wladimir (http://lists.linuxfoundation.org/pipermail/bitcoin-dev/2015-May/007890.html):

&gt;3b. A mounting fee pressure, resulting in a true fee market where transactions compete to get into blocks, results in urgency to develop decentralized off-chain solutions. I'm afraid increasing the block size will kick this can down the road and let people (and the large Bitcoin companies) relax, until it's again time for a block chain increase, and then they'll rally Gavin again, never resulting in a smart, sustainable solution but eternal awkward discussions like this.

My question is: why isn't the opposite point also true, that mounting transaction volume pressure creates urgency for improving on-chain scaling?",2016-03-21 01:13:10
d17of56,ItsNotSherbert,20,Not Bitcoin but shitcoin,2016-03-21 18:41:39
d17h4yd,dunand,19,Classic will not block something that can help Bitcoin. ,2016-03-21 12:28:03
d17qo31,Zarathustra_III,17,"Either those investors are unspellable stupid to believe that settlement bullshit, or it is an investment to attack Bitcoin. 
Any other possibilities?",2016-03-21 21:02:30
d17736y,ftlio,17,"Man you people are confused.  Whether it's bots or a concerted effort by real people to categorically downvote anything posted in r/Bitcoin, you don't have a moral victory on your hands.  And I find your claim to be completely believable - that a bunch of astroturfed morons would do such a thing.",2016-03-21 07:42:37
d17j3st,dooglus,17,"&gt; warrant canary

It is possible for the government to order you to do something and also order you not to tell anyone that they have done so. A warrant canary is when you regularly publish a statement saying that you are under no such order. If you stop publishing the statement then it is safe to assume that you *are* under such an order without you explicitly having to say so.

I don't see how this applies to Gavin. He is acting as if he has been compromised by some enemy of Bitcoin, but I don't see how the ""warrant canary"" concept applies.",2016-03-21 13:36:09
d17uvzv,tl121,16,"Wanting ""segwit"" is meaningless, since segwit is an ever changing property.  (Unless one wants some early version that has already been shown not to work.)

Wanting certain features of segwit to be added to Bitcoin is a different matter.  Here is my take:

1. Fix method to compute signatures of transactions so that verifying large transactions is O(N).  AGREE
2. Fix methods to compute signatures of transaction so that transaction identifiers can not be modified except by signers. AGREE
3. Fix methods calculating block size limit to subsidize complex signatures without regard to their communications and processing costs.  STRONGLY DISAGREE.
4. Fix method of organizing new signatures into blocks so that older nodes think they are verifying transactions when they are not.  VIOLENTLY DISAGREE.
",2016-03-21 23:33:05
d17vdow,LD_in_MT,16,"I believe a competing, unofficial monetary system would spring up.  Like the way inmates use cigarettes.  Maybe a crypto-curacy like bitcoin.",2016-03-21 23:46:28
d174fs9,Mbizzle135,16,"Unlimited is working overtime. How can anyone be of the opinion that competing implementations is a bad thing for Bitcoin? It's the thing that'll divide us from the rest at this point. Ethereum has a point of failure in Vitalik Buterin, Monero can veto bad actors, which they've actually done with one to date. If we're allowed to attract as many talented coders as we actually could without this drama, Bitcoin will surge.",2016-03-21 06:28:48
d185y3a,ImNotKennethAndrews,236,"DAE:

* GTAV video
* Play Wind Waker, probably not because it's so underrated
* Third point? Half Life 3 confirmed
* All I see is hunter2
* Feel the Bern
* Hate Trump
* Love Trump
* Clinton is shady
* Thanks Obama
* Leo deserves all the Oscars
* Star Wars VIII News
* Comic book movies!
* Hi, I hope you're still reading these. Also Deadpool.
* Self driving cars will use bitcoin to provide universal income
* Hate Apple (sent from my iPhone)
* Facebook is full of people that I don't like, but refuse to unfriend
* Tumblr circlejerk incoming
* Trigger warning: I'm triggered by trigger warnings
* Now Reddit is just like digg
* Jerking off my two penises with my broken arms into this box
* We shouldn't protect minorities from crazy people
* WTF is it with these crazy cops shooting minorities
* This is a repost, so I'm just going to complain about reposts
* Correlation does not imply causation. Also, I'm going to ignore everything the researchers did to address this point.
* Women aren't harassed online, so fuck you bitch I'ma going to downvote your entire post history.
* It is literally impossible to find a job
* I just got a 100k bonus from my job, but I still have $250k in student debts
* Google's worse than the NSA, but it's ok because I'm behind 4 proxies and use adblock
* Your vlog has been removed due to a copyright claim by bullshit-shell-company. Sorry about that.
* My autistic boyfriend met a special needs WW2 vet and made this thing.
* I spend the first 10 hours of any game are spent tweaking the settings, take that console users!
* TIFU by having a threesome with Emma Watson and Jennifer Lawrence
* Shakeycam is ruining movies
* Here's a super shakey video captured from an oculus rift
* I hope this can actually be posted, because the mods are bent on limiting free speech and I'm on comcast.",2016-03-22 03:54:01
d17xdqc,Brizon,150,"Then they'll use Bitcoin with confidential transactions like the rest of us.

Edit: When I say confidential transactions, I meant [Greg Maxwell's definition](https://people.xiph.org/~greg/confidential_values.txt).

&gt; One of the most powerful new features being explored in Elements[*] is
Confidential Transactions, a cryptographic tool to improve the privacy and
security of Bitcoin. This feature keeps the amounts transferred visible
only to participants in the transaction (and those they designate).",2016-03-22 00:37:30
d17y8wk,righteous_hack,138,Bitcoin ain't confidential.,2016-03-22 00:58:08
d17xj5z,callmebrotherg,92,"I recall a discussion about how you could keep up Bitcoin in a zombie apocalypse, because it's possible to use radio as well. Just super difficult.",2016-03-22 00:41:09
d18gse8,Bitcointagious,76,"Since we're pledging money to shit that will never happen, I pledge $1 billion in bitcoin to Bernie Sanders to wrestle an alligator on the moon.",2016-03-22 08:08:30
d180tei,udontknowwhatamemeis,61,"Actually there are broad new innovations that will extend the bitcoin protocol to allow confidential use, rapid payment channels, and other incredible features only programmable money can offer. Search for the Elements Project if you're interested in more info!",2016-03-22 01:58:09
d186dp2,seweso,59,"Lets see how Core responds, and how long Bitpay stays neutral in all of this. 

At least Bitcoin isn't boring ;)",2016-03-22 04:03:42
d18hzq6,RenegadeMinds,58,"#ROGER FUCKING BITCOIN JESUS VER!!! :)

Gotta love that guy!

But Adam Kokesh? Hm... I'd have picked Tom Woods or Lew Rockwell or Hans Hermann Hoppe someone, but not Adam. But whatever... it's his BTC he's spending. ",2016-03-22 08:39:42
d18svun,spookthesunset,55,"The dude isn't even a US citizen anymore.  Why the fuck is he following the US primary elections?

Not that being a ""citizen"" means anything anyway.  Did you sign a document at bearth saying you agreed to obey the rules of an illegal corporation named ""UNITED STATES OF AMERICA?""  I know I didn't.  I am no citizen of a corporation besides my own persons corporation.  I am especially not a citizen of the sea.  I do not breathe water.  I have no gills.  I breathe air.  I travel freely in my personal conveyance. I forge my own bullets and build my own homestead.

Fuck this shit.  Roger Ver should be freed and so should Ross Ulbright.  They committed no crime against natural law and therefore have no right to be barred entry into their homeland.  Homeland that was, mind you, illegally assigned ownership to a false country that does not actually exist on paper.

Most of all, fuck all of you shills.  Shame on you for tricking people into continuing to use your dirty fiat when the rest of the galaxy has switched to Bitcoin.  You are what is wrong with this galaxy.  You and those fucking lizards with their fucking 747 tanker planes spraying all of the world into compliance.

Asshole.  Go fuck your moms skull and then light your tiny penis on fire.  For shame.",2016-03-22 13:47:56
d182fw1,nthterm,42,Or other cryptos that are already more feature rich than bitcoin ,2016-03-22 02:35:59
d18mrj2,MeowMeNot,40,"Can we stop posting what this joker says for a few days?  We get it, he's nuts and a scourge on Bitcoin. ",2016-03-22 10:41:54
d186j51,seweso,39,"&gt; while at the same time keep individual transaction fees as low as possible to allow Bitcoin to be more competitive as a payment network.

Bang bang, more shots fired :D",2016-03-22 04:07:06
d18f9to,butterNcois,32,"1. Actual Money exists

2. Actual Money is used to fund wars

3. Therefore we should use bitcoin

lol @ that logic

",2016-03-22 07:30:09
d18iyep,ForgedIronMadeIt,28,"bitcoin would never be used for violence, just ignore that its pseudo-anonymous nature has been used to buy illegal firearms and order hits",2016-03-22 09:04:46
d17x5el,Dailyderp,28,"The idea of a ""cashless world""  is a fallacy, there will always be a alternative currency.
The simple reason for this is there will always be demand for it, whether it turns out to be bitcoin/gold/copper/nuka cola caps who knows. The fact is there will always be something that is in limited supply which is used as a form of currency.",2016-03-22 00:31:47
d18fuk9,tothemoonsands,28,"&gt; Roger Ver pledges $100k in bitcoin to Bernie Sanders 

Nice!

&gt; to debate Adam Kokesh

Huh?",2016-03-22 07:44:38
d195921,hellobitcoinworld,27,"&gt;Generally the hard fork should be the last option to fix broken things.

Even if, from the beginning (by satoshi), the blocksize limit was meant to be temporary and intended to be removed later?

Also, a hard fork is not inherently dangerous. Forks in the Blockchain happen daily. And they become resolved. It's how bitcoin works-- the longest chain wins.",2016-03-22 23:30:53
d18192w,miserable_failure,25,"Actually, bitcoin is a modern-tech based system that is not future-proof.",2016-03-22 02:08:22
d1940s8,Piper67,25,Heh... take a look at how anti-fragile posted the same link to r/bitcoin  :-),2016-03-22 22:58:05
d18055n,jeradj,24,"Not a terribly important one.

The societal contracts and expectations that are behind a currency are vastly more important than the currency itself.

*Anybody* can create a currency (digital or otherwise).

Even with bitcoin, it seems probable to me that the overhead of the electricity is probably not worth using bitcoin unless you're a person who managed to cash in on earlier mining and/or exchange value and therefore have a heavily vested interest.",2016-03-22 01:42:45
d18rwxi,Essexal,22,"Ahahaha.  And go back to what, faith in the Pound?  Faith in my government actually knowing what they're doing?  Faith that my childrens' children won't be the most debt laden humans in existence?

It's not Bitcoin I've got the faith problem with, and it'll take more than even double digit figures for it not to be an alternative to the absolute shit storm we are currently faced with.

",2016-03-22 13:11:36
d17yem9,distincthead,21,"I'm assuming the resurgence of any kind of currency including precious metals would occur well after the initial ""we're fucked"" moment, when things are a tiny bit more stable. I can't imagine a situation wherein an intelligent person would trade food or tools for gold/bitcoin in the immediacy of a society-crushing event unless said event was relatively localized.",2016-03-22 01:01:51
d18ck4t,NuclearSpaceLegos,21,"This is good for bitcoin. 
",2016-03-22 06:23:25
d18ggh5,latetot,21,"Since Coinbase has stated that is an exchange and not a bitcoin wallet, is Coinbase open to allowing trading of other cyptocurrencies such as ETH on the exchange?",2016-03-22 08:00:03
d18prpa,hear_the_thunder,20,"This is good for ~~bitcoin~~ the ALP.

:) Keep up the shambolic interfering Tony! Keep that profile high!",2016-03-22 12:02:10
d192bfr,FormerlyEarlyAdopter,19,"no surprises here, only delusional idiots and/or sociopaths or psychopaths can remain in position of power at r\bitcoin, bitcointalk and the rest of core fiefdoms.",2016-03-22 22:06:53
d192g5a,ferretinjapan,19,"Ah good old BashCo, the passive aggressiveness is strong in that one. I love how it's always someone else's fault and he thinks he is always the good guy. I remember when I regularly complained about the rampant abuse and trolling in /r/bitcoin, to which he rigorously defended (even protected), other users' bad behaviour, but now that they need to crack down on users that don't share their agenda, now they are the good guys that resolve to ""improve civility"".

Fucking hypocrite.",2016-03-22 22:11:07
d189o7h,chrisrico,18,"You make so many assumptions it's difficult to know where to even start.

* Increasing the max block size will increase the median block size
* The current ratio of users to full nodes is the upper bound of what is optimal
* There is no overlap between the groups of miners/transaction-makers and full node operators
* 2 MB is the largest max block size that is affordable to full node operators
* Increasing the number of possible transaction-makers will not increase the number of full nodes
* Miners would, if unchecked, alter the subsidy schedule (effectively destroying bitcoin)
* Fewer full nodes is actually a problem (Satoshi did not seem bothered by a possible future where full nodes were hosted in data centers)

What does bitcoin succeeding look like to you?",2016-03-22 05:16:51
d18i3ay,Vendor_BBMC,18,"First of all, you're thinking from a drug buyer's perspective. Your coins are clean, obtained legitimately, and nobody is interested in them.

Second, if you buy bitcoins under your name, there is a good chance that the electrum wallet will have your name associated with it. Its vendors that the cops are after, and we have to turn our entire wages into somewhere to live, food to eat, and something to sell.

Its not illegal to send bitcoin to any wallet in the world, even a known darnet marketplace address. When you buy something and your bitcoin goes into the collective escrow with everybody else's (even just for 10 seconds if you FE) the cops can't see who bought what from who - its just bitcoin pouring into a big bucket, and then dripping out of one of many holes to vendors.

This ""coinmixing"" has been keeping people pretty safe from prying eyes since SilkRoad.

Recently, there has been a problem. Marketplaces are forgetting their primary function - bitcoin mixing - and they desperatyely want your business. They show you your bitcoin going into its own individual escrow (like a tunnel between you and your vendor only), put a 2 out of 3 lever on it, and say ""look at me! I'm not stealing the escrow! Follow your money on the blockchain if you don't believe me""

Lets say you bought a quarter pound of weed from a vendor using a multisig escrow, then a week later a cop bought 3.5g, watched his bitcoin, and knew that the wallet it paid into belonged to HumboltFarms.  He also knows that all the other payments into it are from chumps buying weed.

Multisig escrows can always be stolen by the marketplace owner, and usually are. He coded them for god's sake! Even if a thief wanted to foil his future self with a software feature, he can't out-fox himself. He has root admin access and can take the market offline for 10 minutes and completely replace the wallets with wallets with a trap door. Or lock you and the vendor out before logging in as both of you. Or just press a big red button which says ""empty every wallet""

If youve ever used a multisig escrow with a vendor who forgot to tumble, just once when his rent was late, you are both in danger until 2140 when the blockchain is due to stop.

Script kiddies with Aspergers would love there to be a software solution to everything, they tell YOU that YOU don't understand multisig transactions if you say a bad word about them. They don't understand human social interaction and misread emotions, so they don't realise that **there will never be a software solution to matrketplace exit scams. Not when the exit scammer writes that software**

Bitcoin companies are always boasting about their startup capital. This company is trying to catchup with a free online product written by this guy in his bedroom

http://www.kyblsoft.cz/alesjanda/

and now has a high-paying job working for their competitor. Bitcoin is used to find, but rarely used to prosecute because no Jury can understand it.",2016-03-22 08:42:16
d17wzjl,illSeeMyselfOutNowOk,17,"you can still buy goods with your money, right? you can trade goods for bitcoin.",2016-03-22 00:27:47
d19nlec,lolhat,56,"We're talking about a man that [believes voting is what is wrong with Reddit.](https://www.reddit.com/r/Bitcoin/comments/4biob5/research_into_instantaneous_vote_behavior_in/d19i9vg)

&gt; More and more I've come to believe that voting is the thing that really drags Reddit down.

What does he think Reddit would be without voting?

That guy is a loonie at best.
",2016-03-23 06:20:32
d1975p5,Ant-n,53,"There is no way around it:

A 1mb limit is nothing different than central planning.

The same very people that said they are fighting for decentralisation are taking advantage of mining centralisation (meetings with the few that own the hash rate) to block an increase in capacity to push the Bitcoin network into an unpredictable state.

This state is supposed to be ""safe"" thanks to unpublished, unproven 2nd layer solutions and unproven or tested new fee economics.

This is nothing short of reckless.

The remaining decentralisation left in the network has been unable to prevent that so far.
That mean the remaining centralisation left in the network is irrelevant.

**Bitcoin is currently centralised and centrally planned.**

This is the hard truth and supporting Core is supporting that situation.

We would end up with a new bitcoin, similar to ripple. No more what Bitcoin was meant to be.

Edit typo",2016-03-23 00:17:32
d196m2w,thezerg1,36,"BTW, Bitcoin Unlimited is NOT what he described.  Its more like what he wants (no limit)... in BU there is a ""soft limit"" -- a bigger block is tracked by the client but the GUI won't be updated until it is clear that this block won't become an orphan chain.

He also completely ignores the probable chilling effect of full blocks on innovation and growth.  When such a limit is clearly not maxing out technological possibilities, companies that might base their services on Bitcoin think ""I might as well use X and get 16 times the capacity"".

And of course the Bitcoin-as-gold argument is hugely problematic.  I mean, if you believe that Bitcoin will to some degree suppliant gold -- if you believe that it is a ""better gold"", you likely believe so due to its enhanced transferability.  So if a new coin enters with even greater transferability, wouldn't it suppliant Bitcoin, just like Bitcoin is with gold?

",2016-03-23 00:04:38
d1adgg3,keepdoing2,31,"We won't know until it happens.  My guess is that the following is at play.....

1) Both parties are legitimately interested in the possibilities.  

2) Coinbase is partially sending a warning shot at Core/Blockstream/Miners.... underlining the fact that they DO play an important role.

3) The benefits are obvious to Ethereum - Coinbase did more than any company on the planet to build out Bitcoin.  Adoption of Ethereum would give us a Huge Boost.  Bitcoin really doesn't have anything Ethereum doesn't - except a several year head start in name recognition and user base.  Coinbase levels that playing field, catches us up fast.

4) There is a clear benefit to Coinbase also.... diversification &amp; setting up a 2nd basket for their financial eggs.  Lets face it - there is a real possibility that bitcoin eventually falls apart.   Or at the least, that it is substantially displaced by Ethereum.  What makes more sense..... To wait and do a transitional ""Buy-In"" to Ethereum once it has gained that marketshare on its own, and you are paying $50 - $100+ / per ETH?  Or transitioning in NOW, when you can work a contract deal with the Ethereum Foundation and get in with a negotiated Reserve ""Buy-In"" at say $8 - $10 / ETH?????   Because Coinbase will need an upfront ""Buy-In"" to put substantial Reserve ETH in place before launching.  But be careful, because that is on its own not going to be an upward market mover - that will be a lowball contract buy-in.  The real ""market mover"" is the fact that 3.5 million Coinbase accounts get exposed overnight to ETH.

Lastly, I have no idea of the timing of any announcement / decision.   I think it is a decision that WILL come at some point, simply because it is a sound business decision for both parties.  And it could come immediately, because the people that are saying, ""oooohh, decisions/prep etc has to be done"", clearly don't understand that we have no idea how far along this road they may already be.  There are the obvious rumours of Coinbase already running adds for an Ethereum coder, and nothing says they don't already have one.

My gut feeling is that the best we come out of this meeting with is some supportive language from Coinbase/Ethereum that it was a positive/productive meeting and that the two parties have committed to continuing to explore possibilities.  My guess is that this should be enough for some forward market propulsion.  Obviously a formal commitment would be a market shock to upside.  Either way could get a bit volatile.",2016-03-23 21:27:50
d196wq1,10101001101013,28,"But doesn't the lack of capacity planning deter investment in the ecosystem?

Also in every other system on the internet people usually consider 50% average usage a signal an upgrade must be done? Why should bitcoin run at 80% to 90% ?  How do u see bitcoin growing?",2016-03-23 00:11:45
d1aglrj,ajvw,25,Aaaannnndddd [it is gone](https://np.reddit.com/r/Bitcoin/comments/4bmgvq/we_should_stop_using_the_term_fee_market_its_not/) over at \r\Bitcoin,2016-03-23 23:07:16
d1ahet5,tsontar,24,"Hard forks are built into Bitcoin and are good, because they ensure consensus exists.

The real question is ""how bad are soft forks?"" Soft forks are actually a 51% attack because they bypass consensus.

For example if miners introduce a hardfork attempt to remove the 21M coin cap, it will go nowhere, because nobody but miners will accept these blocks.

But miners can introduce a soft fork to remove the 21M cap, and there's no way to prevent your node from accepting that block. You'd just have to sell your coins if you disagree.",2016-03-23 23:28:20
d1a2bb4,sendaiboy,23,"But he's **not**... he is a respected mathematician and computer scientist. He understands the technology - he fails at appreciating the real-world value and application. And that failure is directly due to his own admitted lack of economic understanding. And that just goes to point out why it is so odd to find him so vocal about the supposed lack of value in cryptocurrencies. 

It comes down to, I think, that bitcoin so violates his innate notion of what money is and how it should behave that he discounts the entire subject. I listened to more of the interview - he is quite happy to get into the weeds of the blocksize debate - but he totally ignores the forest of value. It may be a stereotypical academic blindspot - so much focus on minutiae renders you incapable of seeing the big picture.",2016-03-23 12:40:17
d1admw5,todu,22,"Yeah, as of lately I find myself watching the Bitcoin Classic block count even more than I watch the exchange rate tickers. ",2016-03-23 21:34:36
d19787g,usrn,21,"This whole thing is just sad.

I'll be converting all my bitcoin income to other assets.

No reason to be in bitcoin when majority of the ecosystem are apparently retarded.",2016-03-23 00:19:08
d19nsdj,TheDogeOfDogeStreet,21,"The answer is quite simple.. **Team Divide &amp; Conquer""** are working overtime in /r/Bitcoin

Just to refresh your memories ....
 
https://www.reddit.com/r/Bitcoin/comments/43agbb/rocketships_and_the_parable_of_the_desert_island/

**Bitcoin** is the biggest threat to the corrupt establishments of all jurisdiction's, and their tyrannical hold on humanity.

Therefore, they will not give up that power easily without a fight, and allow any beacon of light that points the way to freedom.

I suggest that you all buckle up! and **HODL**   

  ",2016-03-23 06:25:02
d1aaa9b,usrn,21,"By our legendary, unbiased pseudo-journalist and BlockstreamCore sockpuppet, Aaron Van Wierdum.

If you want to see manipulation then consider the procedures of /r/Bitcoin mod-thugs.

Ironically, the comment box is censored under the article, but Anti-classic sentiment is allowed.

pathetic.",2016-03-23 18:39:30
d1ac4v9,forseti_,21,I can tell you but first you have to wire me 1 bitcoin. ,2016-03-23 20:29:42
d19rsp3,nullc,21,It's important to note that many other subreddits do the same for the same reason; and the score hiding is a move recommended by reddit admins-- not some /r/bitcoin invention.,2016-03-23 08:04:13
