Comment ID,Author,Score,Body,Publish Date
d0s26nq,gixslayer,20,"&gt; By using the ESEA Client, you consent to the collection and analysis of information from your computer that ESEA deems reasonably necessary to identify and prevent the use of cheat software, files used to gain an unfair advantage, and to enforce bans. This information collection is not strictly limited to when you are logged in to the ESEA Client. Information analyzed or collected by the ESEA Client may include hardware, network and software identifiers; running programs; system configuration information; files or data suspected of being used to cheat or gain an unfair advantage; or screenshots while you are logged in and playing a game through the ESEA Client

AKA they can do whatever the hell they want with data on your system as long as they deem it 'reasonably necessary', which is coming from a company that has had quite a bit of a reputation of lacking security and of course deploying bitcoin miners on consumer machines. You can argue changes have been made, but personally I'm staying far away from them.

It is pretty much a rootkit yes (as in having similar access, read full access), which not only has the concern of directly ESEA related things, but if someone finds a way to exploit it, your -entire- machine is compromised. Nothing is ever completely safe, but the ESEA client is a great attack vector. Not sure how much the client has been audited (be it internally or externally), but it's definitely a risk.",2016-03-08 23:44:21
d0rz96r,2ndEntropy,20,"I'm glad you came through... Although I would have to disagree with you on Mike Hearn. He ran XT like Satoshi ran bitcoin in the early days.

A dictatorship within client development teams is not a problem. If you have loads of those kind of organisational structures each developing a client with their own feature set, then miners can vote on which ""dictatorship"" they want. As the client needs to be open source for miners to trust it, it also means that if you want miners to use it then you need to let your competition know what you're developing. Therefore the best feature sets are pretty certain get into the blockchain. 

Client development needs to become fragmented and decentralised if bitcoin is going survive the type of attack blockstream has performed. We should not be scared of hard forks, we should embrace them. After all they are not a bug that we should avoid, they are a feature of the anti-censorship nature of bitcoin.",2016-03-08 21:57:28
d0rl20r,commonsenseisreal,19,Electronic voting is a joke and will continue to be a joke until they start to use a public ledger like the bitcoin blockchain. Bernie no doubt won Iowa (they recounted 15 out of ~1700 precincts and found errors in 5... wtf!?) and now it looks like it wasn't just Bill having another senior moment in Massachusetts. Also if the South uses electronic voting machines it could explain how Hillary outperformed the polls by 20%.,2016-03-08 11:42:46
d0rqbaf,leviself,19,"Yes ether can be used as a currency. I would gladly sell a product for ether today, so I would imagine that makes it a currency. It's currently in circulation and can be used as a medium of exchange.

If they are trying to dissuade you from holding ether because they think the price vs fiat will go down, I'm not a prophet so I can't help you there. There was [a guy](https://bitcointalk.org/index.php?topic=92.0) who tried to auction 10000 BTC for $50 in the early days. If I could predict the future I would have bought that, then bought into the ether presale and turned that $50 into $200 million for a 400 million percent return in 6 years. But I can't predict the future and neither can your friends.

To understand ethereum, you first need to understand some bitcoin history. From the beginning, bitcoin included a scripting language with lots of instructions you could use. However, there is a [famous result](https://en.wikipedia.org/wiki/Halting_problem) in computing due to Alan Turing that makes it dangerous for miners to execute arbitrary code. So the scripting system inside bitcoin was purposefully weakened so that transactions couldn't gum up the works. The way this was done was to allow only a few handful of transaction types into the network.

Later, different protocols came about that tried to overcome this by specializing in other transaction types that were not present in bitcoin. Some of them had a number of transaction types, but if you had a new application you wanted the only way to get it would be to have the developers add code to the protocol which is not an efficient process.

Ethereum's solution to the above problem is the concept of gas. Since it's impossible to know if a transaction will halt, you specify how much gas you will be willing to pay to run a contract in the blockchain. If you run out of gas, the transaction is rolled back and you get your ether back. If it succeeds you pay for the gas you used with ether and the rest is refunded back to you.

There's a lot of other moving parts as well, but I believe that is the most important piece. If the central innovation of bitcoin is the solution of the double-spend problem via the blockchain mechanism, I would posit that the central innovation of ethereum is the mitigation of the halting problem via the gas mechanism.",2016-03-08 14:08:14
d0qz7uu,oleganza,19,UTXOs are more easily sharded/cached/parallelized than Ethereum's messages. This paper is illuminating to which lengths Bitcoin can be scaled within its structure: https://bitcointalk.org/index.php?topic=1382884.0 ,2016-03-08 02:58:45
d0rkpml,jtoomim,18,"It allows for the witness data to be pruned off after a while. (Of course, the old transactions can already be pruned off, but witness pruning can happen a bit sooner.)

It allows for fraud proofs to be performed fairly efficiently.

Because SegWit stores data in a way that hides it from old versions of Bitcoin, SegWit also allows for a bunch of other changes and fixes that we previously thought would require a hard fork:

1. It provides a new format for transactions that do not suffer from the O(n^2 ) validation cost bug (though it does not disallow old-style transactions that do suffer from the bug, so the attacks are still possible).

2. It allows a new format in which Schnorr signatures can be implemented.

3. It allows a new format that does not suffer from transaction malleability.

And probably a few other things I've forgotten.",2016-03-08 11:33:57
d0ra8kz,lclc_,18,They could start with paying people to work on Bitcoin implementations instead of just making demands.,2016-03-08 07:08:17
d0rb669,vattenj,18,"Let him explain what is segwit, what is lightning network, what is thin block, and see if he really understand what are those things. Segwit dramatically increase the scaling difficulty of bitcoin (for each 1MB of real transaction data, you must provide 4MB bandwidth for stopping spam transactions with lots of witness data) and drive on chain transactions to offchain",2016-03-08 07:30:39
d0rijzh,BeYourOwnBank,18,"Could somebody please copy-and-paste this entire post and submit it to r/bitcoin?

(I can't because I'm apparently banned there.)

It would be interesting to see if they **censor pure quotes from Satoshi Nakamoto.**

Also it would be educational for people on r/bitcoin to finally hear how Bitcoin was actually intended to work - before it got ""forked"" by Core / Blockstream.",2016-03-08 10:37:36
d0rmsbw,ItsAConspiracy,17,"Ethereum has already done 8 tx/sec in production and 25 tx/sec in testing, while Bitcoin's bogged down at 3 and the Bitcoin Core devs are claiming it's fundamentally unscalable. Vitalik has said that Casper (proof-of-stake) can take it over 100, and a simple sharding scheme to 10,000. It's looking like these will be implemented together, within a year. Long-term scaling plans may go even higher.

Off-chain payment channels like Lightning uses can already be implemented in Ethereum smart contracts, in less than a page of code. Here's an [example](https://github.com/obscuren/whisper-payment-channel).

And for privacy, Vitalik posted a contract that uses ring signatures like Monero, and the latest Casper proof-of-concept includes changes to prevent a potential privacy leak when using it.  

Bitcoin doesn't have real cryptographic privacy at all, just mixers that require you to trust a third party. And it seems pretty clear that Bitcoin has become quite difficult to upgrade.",2016-03-08 12:26:19
d0rcl6p,RoadStress,17,"I was an XT supported myself, but now I am Core all the way because people simply can't see further than **their** problem. The Classic supporters keep repeating that there is a blocksize issue right now and that we must raise the 1MB limit **right now**.

We had a small congestion for a couple of days and everyone was acting like the sky was falling, like it was a human right to have access to the bitcoin network. They didn't bother to question what is going on, they simply demanded access! Nothing else. They don't want to hear about fees, about network costs, about how a secure and decentralize network works and I can understand that! That is not for everyone, not even for Coinbase who is planning to make a long term profit out of this. But pushing against having access to the network no matter what is simply stupid imo. When the lights go out people don't get their forks and riot the electric company, when the internet stops they don't storm their ISP. Why is this happening to bitcoin?",2016-03-08 08:05:18
d0rzjri,eric67,17,and bitcoin miners a few years ago,2016-03-08 22:10:37
d0stui9,realistbtc,62,"that's just the last proof that /r/bitcoin , Blockstream and Core aren't Bitcoin anymore . They have forked Satoshi's vision . their is just the back/maxwell coin .",2016-03-09 10:46:23
d0sdnd9,slush0,48,Link to this video was censored on /r/bitcoin. It's unbelievable.,2016-03-09 04:20:18
d0srieu,BTC_Learner,44,"Brutal read.

TL;DR: Starts post by ragging on most of the attendees for having an inflated sense of importance. Proceeds to spend majority of remaining post: talking about how people were excited to see him; dropping names; proclaiming the contributions he's made to the bitcoin community; generally trying to sound important. All while trying more than a little too hard to let you know that he's too cool for school.",2016-03-09 09:46:18
d0s570v,Falkvinge,36,"**Hmm.** The package manager doesn't uninstall Core and install Classic. In fact, it just tells me that everything is fine.

    rick@corvid1504:~$ sudo apt-get install bitcoind
    Reading package lists... Done
    Building dependency tree       
    Reading state information... Done
    bitcoind is already the newest version.

A few more parameters are necessary to tell the package manager that this conflicts with Bitcoin Core and uninstall Bitcoin Core when installing Bitcoin Classic. As is now, if you've installed Core previously, nothing happens - you're suddenly subscribing to two channels that both provide the same package, and a version bump in _either_ of them will cause an upgrade _to that channel_.

**This means that people who have previously installed Core, and are switching to Classic in this PPA, will unwittingly switch back to Core if Core publishes a versionbumped package. This would be of particular concern for server farms with automatic upgrades on hundreds of VMs.**

The binaries can still be name, location and behavior compatible, but there should probably be a ""Conflicts: bitcoind"" directive in the config file, and the package(s) would need a different name (""bitcoinclassic"" suggested) to avoid this behavior.

I'm happy to help set this up if there's a chat somewhere - I have some experience setting up Debian packages.

---

EDIT - here's [an example from Github](https://github.com/Swarmops/Swarmops/blob/master/BuildFiles/Packaging/templates/control-backend-release.template) on a package I'm maintaining with a Conflicts line. Note how the package name is ""Swarmops"" and it comes in three flavors (""swarmops"", ""swarmops-internal"", and ""swarmops-stable""), and how they conflict with each other - this leads the package manager to detect that you're switching flavors and uninstall the previously installed flavor first.",2016-03-09 01:06:21
d0sbirk,klondike_barz,34,"Tldr: the experiment is running trace route on an overseas server. ""Lightning is like that"".

~~What a shitty~~ Its an uninformative article, literally nothing of use other than some details on how the author pings an Australian server over the Internet (no bitcoin involved), and then magically assumes LN is just like that with instant transfers and tiny fees.

No explanation of how channels are established, or the centralised nature of channels. 

But hey, if LN is like pinging a server, bitcoin must be like saving to the cloud.

edit: because insulting the article isnt a good way to make a point, and I want to make the point that LN =/= pinging a random server",2016-03-09 03:34:01
d0td5jh,VenomSpike,33,"There are some interesting calculations you are using here, but generally I agree that the value of the blockchain is in fact directly proportionate to the security of bitcoin.  You will not see valuable assets being secured, or monetized on the blockchain when the underlying value of the securing protocol is significantly less than the asset itself. These numbers go hand in hand.  By increasing the value of the underlying chain, we continue to open the field for additional asset layers.

It's a fallacy to assume that the value of bitcoin has to already achieve critical mass to allow for ANY transfer of value, timestamping, or digitizing of assets.  Transfer of value can still occur, but will be limited to the asset value that the existing currency/chain can support.  

A very simple example is to look at the current market cap of bitcoin, roughly $6.2b.  It's easy to support the purchase of a coffee, or even a car.  Suddenly it gets far more complicated when you are talking about much larger value transfer, for example the purchase of a company.  Could Tesla purchase a tire manufacturer for $2b using bitcoin? The answer would be no.  Would Facebook have been able to purchase WhatsApp for $19b? Obviously not given that the purchase value far exceeds the existing market value.
'
Take this example to the next level and assume that we have listed equities that settle on the blockchain.  In our hypothetical listing, Facebook is listed via Nasdaq and it's public shares trade and settle on the bitcoin blockchain.  FB carries a valuation of roughly $300b.   FB conducts an all equity buyout of WhatsApp for $19b and existing equity shareholders for WhatsApp receive $19b worth of FB stock which is settled via the blockchain.  This transactions far exceed the underlying value of the chain they settle on and would present ample opportunity for attacker to attempt to disrupt the transaction.  It is entirely plausible that these settlements could still occur, but there is additional risk to settlement on a chain where it's value is far less than the assets as this compromises potential security.

For the meantime we will continue to see the value of settlements and transactions rise as the price of bitcoin rises. These two go hand in hand and create a positive feedback loop.  There is no reason to stop development on one process or another, the value is derived from the usage that the bitcoin and the blockchain can provide.  The more settlements and smart contracts that can occur on the blockchain, the more value that is implied in the underlying currency and the chain itself causing a price increase.  Increased price in bitcoin creates additional trust and security, bringing more settlements and smart contracts.  This will occur in a positive feedback loop until some sort of parity is reached.

Thanks for your analysis.",2016-03-09 23:27:04
d0t6gu4,dooglus,32,"I've asked them about this before and they told me it's to do with licensing. Accepting Bitcoin means they can't limit distribution by country which some of their content providers demand.

Edit:

&gt; Oct 15 2015
&gt; 
&gt; Hi there,
&gt; 
&gt; Thanks for getting in touch with us. I'm sorry, the Bitcoin option is occasionally not available for certain bundles. Due to our agreements with the developers, we can't make it available for the Capcom Bundle; but hopefully it will be back for the next big bundle!
&gt; 
&gt; I'm sorry about that! Let me know if you have any other questions and I'll be happy to help. Thanks for your support!
&gt; 
&gt; Best,
&gt; 
&gt; -Anna
&gt; Humble Bundle

So it seems I made up the bit about 'distribution by country', and it's really due to ""agreements"" in general.",2016-03-09 17:37:00
d0t1z6y,berock212,29,Did you by chance decide to try bitcoin mining on your android phone?,2016-03-09 14:16:35
d0tbg5b,mtaw,26,"Great brain trust here..

&gt; These are, without a doubt, the same people who would answer ""Faster Horses"" when John Ford asked what people wanted. [*](https://np.reddit.com/r/Bitcoin/comments/49lnza/the_bitcoin_enabled_browser_ive_a_feeling_many/d0t7jkr)

Like.. in his Westerns? 

&gt; We launched Kryptokit, world's first Bitcoin wallet in the browser, in 2013. Just recently we launched its predecessor Jaxx. [*](https://np.reddit.com/r/Bitcoin/comments/49lnza/the_bitcoin_enabled_browser_ive_a_feeling_many/d0t9nyb)

'Pre' means 'after' right?

&gt; You can see exactly how that works in the source code [*](https://np.reddit.com/r/Bitcoin/comments/49lnza/the_bitcoin_enabled_browser_ive_a_feeling_many/d0t938l)

Oh well that's _total_ transparency!

&gt; VIM for the WIN [*](https://np.reddit.com/r/Bitcoin/comments/49lnza/the_bitcoin_enabled_browser_ive_a_feeling_many/d0ta1cu)

Is this the guy who aslo put down Vim as his favorite editor on [this CV?](http://i.imgur.com/UwD72zQ.jpg)

&gt; I truly believe that this is Bitcoin's killer app. [*](https://np.reddit.com/r/Bitcoin/comments/49lnza/the_bitcoin_enabled_browser_ive_a_feeling_many/d0t7uiw)

Hey guize, the goalposts are back at micropayments again!

",2016-03-09 22:28:34
d0srpzh,timepad,23,"The Bitcoin Classic team is killing it! This is an actual solution that significantly helps with scaling the network *today*.

The Bitcoin Core team has some great long-term scalability improvements, but they are experimental and may not work the exact way they hope. It's great to have some people doing long term R&amp;D, but we need working scaling solutions *right now*. 

The Classic team is continuing to prove that they're the team that is capable of delivering solutions that miners and users need now.",2016-03-09 09:52:01
d0t94g8,tropser,22,"Yeah, bandwidth is not issue nowadays. Usually you have more than you need, but /r/bitcoin core devs need to run full nodes with their 486 PC computers and 28.8k dial-up connections.",2016-03-09 20:35:37
d0tcos2,unvocal_username,22,"&gt; No /r/bitcoin mod will likely respond to this, since you guys have proven that you will just censor any reply they make:

How come the comment is still there if it's censored?",2016-03-09 23:12:27
d0sedrn,InclementDeath,21,"The ""Bitcoin Fiasco"" generated 6,700$ and was done by a lone developer who was fired. ",2016-03-09 04:36:12
d0s3fk5,hellobitcoinworld,21," The only flaw to this is that slush has decided that ""continuity"" means using Core. But actually, since continuing to use Core introduces a **new** fee market, this is not continuity.

Using Classic as default is actually ""continuity"" because it lets bitcoin  perform as it always has, with non-full blocks usually.

But either way, regardless of what each of us individually thinks ""continuity"" means, we don't know what each miner considers ""continuity""  means. Thus, setting the default to solely one implementation is deciding *for* the miners.

Clearly, the best solution is distributing hashrate based upon existing votes, as this removes slush as the centralized and sole decider of what ""continuity"" means for others.",2016-03-09 00:20:26
d0svq5t,Ilogy,20,"&gt;Fourth, that the bitcoin blockchain is of interest, but not the currency. Some people believe this is wrong, too. They state that you cannot have a blockchain in banking without a native currency—and why would you replace bitcoin as the native currency when it's had five years and thousands of man hours of development effort invested? It's an interesting discussion, and one I disagree with personally as you can have a dollarchain or eurochain, rather than a bitcoin blockchain, but only time will tell on this one.

It is important to understand that SWIFT does not represent a settlement layer. All SWIFT is is a network for communicating financial transactions between banks internationally. 

The settlement layer in the legacy banking system is always central banks. That is, the exchange of government money, whether that be cash handed to a homeless person on the street or Federal Reserve deposits exchanged between banks, represents final settlement. If you have cash in your hand, that is real money. 

When two domestic banks need to settle with one another, that settlement ultimately takes place through a simple transfer of money between the respective banks' accounts at the central bank. This transaction is the equivalent of transferring bitcoins in the Bitcoin monetary system. 

In the United States, most banks use CHIPS (Clearing House Interbank Payment System) to settle between one another in a way that is less cumbersome than using the Fed for every transaction. It is functionally similar to a system like the Lightening Network. That is, using CHIPS they add up all of their transactions and then only at the end of the day do they commit a final settlement at the Fed. This way the Fed can be the backbone for a tremendous number of transactions without that much government money actually moving around.

When international payments are made, what happens is that a communication network like SWIFT is used, primarily for its security, to communicate between two independent monetary systems. Then each system settles independently. That is to say, if you want to send money to China, simplistically speaking, the Fed deposits dollars into some Chinese account at the Fed and then the Chinese deposit Yuan into some US account at the PBoC independently. The communication between the two banks is facilitated by SWIFT. Put simply, no actual money is transferred through SWIFT, simply a communication telling the two central banks who is owed what. I guess you could call SWIFT a kind of payment network.

So the only reason you need a network like SWIFT is because there is no final global settlement layer. There is no global currency. The reason we even have global reserve currencies, like the US dollar, is because we don't have a global settlement layer so some central banks ends up acting more or less as such out of necessity. Right now it is the Fed. This creates demand for the US dollar and a rise in its value far beyond what it would be without this status. 

The problem with saying blockchain technology is going to replace a communication network like SWIFT is that blockchains are *not* payment networks, they are settlement networks, they are money. Therefore, blockchains replace the role currently filled by central banks. 

If you have a blockchain that transfers value using US dollars, Fedcoin as it were, that blockchain would effectively replace the clearing house role currently played by the Fed. But nothing has changed with regard to international settlement. You still need to communicate between the closed system represented by Fedcoin and the closed system represented by some other blockchain, say Yuancoin. This isn't to say that SWIFT won't be replaced, we all know it will, but rather that you are still going to have to find a way of communicating between national blockchains, the problem SWIFT is meant to solve will still persist. 

That is unless you have one blockchain to rule them all. That is unless you have a global currency. But why would nations settle on that global currency being one of their competitors' national currency? Why would they agree to let the global currency be a national currency whose monetary policies are aimed ultimately at prioritizing their interests over all others? The world tolerates reserve currencies today because it has no choice. But in the age of cryptocurrency, global currencies become a reality. 

So the question of whether Bitcoin, or any blockchain for that matter, will replace SWIFT is really a question of whether the world will accept a global currency. If so, then all settlement will take place through its blockchain and the need for an international financial communication network will disappear. But why should the world accept such a global blockchain that is controlled by one nation, or worse, by a cabal of international bankers? Will everyone all over the planet simply submit to a global currency controlled by the super elite when there is an alternative controlled by no one?







  ",2016-03-09 11:31:59
d0s3qm6,JuggernautClass,19,"It's like that old joke, ""This is good for Bitcoin."" ""Bernie is down by 300 delegates? Just what we wanted!""",2016-03-09 00:28:37
