Comment ID,Author,Score,Body,Publish Date
d748ma0,UNU_AMA,99,"Last month I worked with r/bitcoin to make financial predictions related to the price of Bitcoin.  It was very successful.  

Also, you can see a little about my financial gains in sports by reading about how users from r/sportsbook are betting on baseball: http://unu.ai/unu-correctly-predicts-11-12-games/
",2016-09-01 02:24:42
d7587pg,Gyn_Nag,38,"""Donkey on midget porn""  
*Scrolls*  
.  
.  
.  
""How to build a hydrogen bomb""  
*Scrolls*  
.  
.  
.  
""Your bitcoin purchase for £7,000,000 has been accepted""  
*Scrolls*  
.  
.  
.  
""The Great British Bake Off S7 E1""  
**AH *HA*! Stick 'em up mister!**
",2016-09-01 19:57:36
d751mf6,Coin-Dance,32,"&gt; Would you mind showing us the statistics?

[Sure](https://i.imgur.com/BGobS37.png).

Of our Reddit traffic for the month of August, 2016:

 - 47.64% are from /r/btc 
 - 49.79% are from /r/bitcoin.

&gt; Also your poll does not include ""Do not care"".

Although the primary goal of the Coin Dance project is to provide a platform for those who *do* care, this is something that we will be doing in the future.

To take this one step further, we'll be adding the option for the community to create and manage their own polls, starting in September. This furthers our goal of providing the tools for those who want to be heard but haven't been given that chance to participate in a meaningful way.

&gt; It skewers the result.

mmm... sounds tasty!",2016-09-01 14:08:16
d74zm1y,Coin-Dance,30,"We'd just like to re-affirm that the majority of our users come from /r/bitcoin, not /r/btc.

Our goal is to simply provide access to information in a way that's as inclusive as possible, nothing more.",2016-09-01 12:59:30
d74sm4s,nsarwark,29,"&gt; I'm no economics major, but returning to the gold standard seems like a horrible idea from what I have read. I will be voting for Gary Johnson, but can you speak to why Libertarians favor the gold standard?

Some Libertarians favor the gold standard, some like bitcoin, some favor a Friedman static rate of monetary inflation.  The thing that ties all of those together is that they are not susceptible to manipulation by governments to inflate away savings or give out special favors to cronies in the way our current central banking system allows.
",2016-09-01 09:51:38
d753gzo,SHEDINJA_IS_AWESOME,26,"And now we also have bitcoin, based on math...",2016-09-01 15:27:12
d748n8b,garoththorp,26,Why does it seem like nobody is working to compensate nodes anonymously with bitcoin? Wouldn't that make the Tor network massively bigger and more robust as people can make a living running nodes?,2016-09-01 02:25:14
d74ckq5,9e7b96475,25,"&gt; Now imagine that you don't even need to manually ""Add funds to your Brave Payments Account"" if you have something like a mining chip integrated into the hardware you're using.

Now imagine that you don't even need to pay at all, because you are not using some bottom-tier, BitCoin-infested rubbish.",2016-09-01 03:46:10
d746on1,peoplma,22,"&gt;What is the other challenge? Well, security.

Just to throw some numbers out, let's assume a common, modern, efficient yet powerful CPU, the i7 6700k with a power consumption of 133W under full load, and a relatively low price of electricity, $0.08 / kWh.

Electricity will cost $0.255 / day.  So from that we can plug in numbers of expected transaction fees per day, and approximate the number of CPUs that will be securing the network (with the mining-as-a-zero-sum-game assumption).  Let's say we have tons of transactions a day, enough to average 1 BTC / block in fees.

144 BTC / day - $82,800 / day

$82,800 / $0.255 ~ 324,705 CPUs mining, with a return of 0.00044348 BTC per day.

Let's say starting out, we have very few transactions and low fees, 0.05 BTC / block.  Then we get ~16,235 CPUs mining.

Botnets cost anywhere from $200 to $1000 for 10,000 hosts.  So if we only have a 0.05 BTC block reward, we could be 51% attacked for around $400.  If we have an enormous block reward of 1BTC per block, it would be ~$20,000 to 51% attack.

In contrast, it would cost over $1 billion to 51% attack bitcoin.

***

This is fundamentally why sidechains will not work.  They cannot have a block subsidy (or else the 21 million BTC limit is violated) so they cannot be secured.  If an altcoin gets attacked, nobody cares.  If a bitcoin sidechain gets attacked, it will make international news and bitcoin will be (correctly, for once) declared fundamentally broken.",2016-09-01 01:44:38
d74jabq,solex1,21,"Thanks for your support! It keeps us going. 
If Bitcoin is not about permissionless innovation then it is a sad day indeed.",2016-09-01 06:04:21
d749702,ftrader,18,"&gt; A fork is an attack on the existing bitcoin network

I know this is Core dogma, but it only makes sense if read in a Dalek voice.

What's your opinion of the soft-fork attack then?",2016-09-01 02:36:30
d754pjk,sharperguy,17,"It's nice how they show people paying using a QR code. Not so nice that they used the Dread Pirate Roberts name for a site which has sex trafficking. Plus so far E-Coin seems to be for more ""legitimate"" use and Bitcoin seems to be more for ""nefarious"" use.
",2016-09-01 16:30:56
d74yybb,Coin-Dance,16,"Greg,

Our intention with this project is to simply provide free-flowing access to information as reasonably as possible.

We'd like to point out, for the record, that the majority of our inbound Reddit traffic comes from /r/bitcoin, not /r/btc.

We've put measures in place to limit abuse as best as we can. No solution is perfect, but we disagree with the idea that [verifying votes with signed \(weighted\) messages](https://www.reddit.com/r/btc/comments/4ptv2p/satoshi_designed_bitcoin_with_the_idea_that_the/d4o4wud/) is the right approach here.

We feel that we've good a reasonable job responding to the feedback we receive each day. If you'd like to provide our team with feedback that we can take action, please let us know.",2016-09-01 12:39:54
d7513p2,Mentor77,15,"You didn't authenticate users in any way. This poll is easily Sybilled. Very simple to run a script that deletes trackers, changes IP and re-votes.

Anyway, this poll says fuck all about Bitcoin users. It's a poll of Internet users who happened to see it. I saw it earlier today -- of course I didn't vote, because the results are meaningless.
",2016-09-01 13:48:40
d74m6y7,the-goat-herder,14,"Gregonomic's version of bitcoin:

Higher fees = less users = less nodes = less demand = less nodes = lower security = lower value = less demand = lower app development = more spillage into Alt-Coins = less demand = less value etc

Satoshi version of bitcoin:

lower fees = more users = more nodes = more demand = higher value = more miners = higher security = higher value = more users = more nodes = more demand = higher value = more miners = higher security = higher value = more app's = more users = more nodes = more demand ...... etc ..... etc ......
",2016-09-01 07:09:34
d75218d,tat3179,13,You impose visa transfer fees and then suddenly a black market emerges out of nowhere to circumvent those fees. Perhaps a longer transfer route to Canada then to Mexico and Latin America. Perhaps via Bitcoin online. To think transfer fees will pay for the wall is stupid.,2016-09-01 14:24:17
d74g06q,SWt006hij,12,"Greg, why do you insist on crippling Bitcoin at 2TPS? ",2016-09-01 04:56:16
d74py52,peoplma,11,"The advantages of the litecoin *community*?  That's easy, it's not the bitcoin community, pretty big advantage.",2016-09-01 08:42:12
d742d4m,blockologist,11,"&gt;This is how new experimental features should be done; not by doing dramatic changes to the main network.

Changing a 1 to a 2 is not dramatic. Even changing it to a 4 isn't overly dramatic. Creating adaptive block sizes isn't dramatic. You guys are making it dramatic because it's your political goal to do so. These are not radical ideas, they are only viewed as such by those who are intentionally making the block size small. So you have to ask yourself, why would they do that? 

Decentralization? If that is the case, they wouldn't implement Segwit to get to 1.75MB and possibly up to 4MB under certain conditions. It's not about decentralization, it's about control, and what else?

Oh and PS: if you want to say that the mainnet is not for experimenting with such ""dramatic"" changes, why is Segwit being deployed to it? It is the most significant and dramatic change to come to bitcoin in some years. Its highly controversial, but yet Core will say consensus applies to controversial changes only when the controversy is not against them. ",2016-09-01 00:12:23
d74tas1,coinaday,11,"See how the list is being sold for Bitcoin? That's great for Bitcoin, because being a criminal's currency is a brilliant strategy!",2016-09-01 10:09:21
d748ag7,itsnotlupus,11,"Slightly stale manufactured outrage that an exchange you send Ethereum tokens to and that lets you get Ethereum tokens back isn't letting you withdraw 200 bucks worth of weird minority fork tokens yet.

This aligns nicely with the rest of the maximalistas brouhaha predicting Coinbase was going to go bankrupt and lose all of its customers' funds for not really giving a shit about ETC. (See [Peter Todd's FUDing](/r/Bitcoin/comments/4v35e6/peter_todd_so_coinbase_is_still_leaking_etc_if_i/) and [Theymos' theymosing](/r/Bitcoin/comments/4v35e6/peter_todd_so_coinbase_is_still_leaking_etc_if_i/d5v6t6y) about it.)

On the plus side, I doubt ETC merits to be called ""pedo pesos"", as I'm not sure you can actually use it to buy anything.

",2016-09-01 02:18:02
d75772v,UntitledDude,11,"Yes, exactly. What we need is not the option between cash (from banks) and digital cash (from banks). It's the option to use decentralized payment methods. Bitcoin is an example, but I hope we'll have further development to provide our societies.",2016-09-01 19:01:18
d74ndhv,DaSpawn,10,"I've been having a ""conversation"" since last night with all mighty greg, he claims he does not control bitcoin and is in no way holding back bitcoin (plus a whole lot of hand waving to doge my many questions also)

impossible to get straight answers from that insidious ""person""",2016-09-01 07:37:34
d745k3l,blockologist,10,"If you believe block size shouldn't increase or we shouldn't have a new or different dev team, then I think we have fundamental differences in how Bitcoin should be that go way beyond the block size issues. 

Bitcoin needs to evolve and right now it's not. It's a stagnant mess with huge political problems. The only way to change these things is for it to evolve for long term goals that were set by Bitcoin's creator as per the social contract invoked in the Bitcoin Whitepaper. ",2016-09-01 01:21:08
d74z6if,peoplma,10,"Greg has some weird long-standing grudge against Vitalik.  One time, I referenced an article Vitalik wrote about quantum-safe crypto algos ([this one](https://bitcoinmagazine.com/articles/bitcoin-is-not-quantum-safe-and-how-we-can-fix-1375242150)) in a comment to Greg.  This was before the block size debate even kicked off full swing, and I believe it was before Ethereum even launched.  He replied something along the lines of ""well I can see by where you get your information from that you don't know what you're talking about"", I'm paraphrasing because I don't remember what it was exactly and he ninja-edited his reply to remove that ad-hominem towards both of us, but I saw it before he edited it out.  ",2016-09-01 12:46:36
d74yz1m,dchou,9,"Yes, they can shut Monero down... just like they can shut Bitcoin down. /humor - They can try, but it would be equivalent to shutting down bit torrent ",2016-09-01 12:40:30
d74zggp,peoplma,9,"I'm not Greg, but I believe I can speak for him in this matter.  If you could do whatever it takes to make it look like a minority of the bitcoin community support a max block size increase, he'd appreciate it very much.  Thank you.",2016-09-01 12:54:50
d750yrs,mumuc,9,"The problem is not only the delays. I bet people understand Bitcoin is still a young technology and are willing to forgive some problems if the future looked bright (I know I do).

But the development has been overtaken by people who lie and manipulate, bully people around, buy and censor internet forums... all to take control of Bitcoin and impose centrally planned parameters, which is an anti-Bitcoin feature.

If there were only some development problems I would not be worried. But it is much worse.",2016-09-01 13:43:46
d74n680,labago,9,Have a link to that bitcoin prediction?,2016-09-01 07:32:43
d74buvr,gizram84,9,What if the mining algorithm wasn't changed.  We could then have merged mining with bitcoin.  Does that solve this problem?,2016-09-01 03:31:25
d75kzc4,ASFx,112,"The article says Amazon accepts bitcoin. 

Amazon does not accept bitcoin.",2016-09-02 01:45:02
d75jvxp,Feelsgood767,56,Buy bitcoin in China. Send to US exchange and sell for dollars. Transfer to bank account.,2016-09-02 01:21:28
d75ww9p,datums,35,"It's a bitcoin joke.   
  
It used to be the case that every time the price crashed, or an index was hacked, bitcoin fans would argue that it was actually a good thing for bitcoin.   
  
",2016-09-02 06:02:16
d75luma,MemoryDealers,27,"Someone else gave them that $500K,  but I'm considering giving them another $500K of my own money.  BTW,  how much of your own money have you invested in Bitcoin startups now?",2016-09-02 02:03:30
d75kica,MrMuahHaHa,26,Blockstream and the Core devs are doing a fantastic job of running Bitcoin into the ground.,2016-09-02 01:34:52
d75hl5z,MemoryDealers,25,"Z-cash isn't out yet.  Sadly, I'm diversifying some of my assets out of Bitcoin because the current Core team isn't making any effort to scale quickly enough to keep up with customer demand.  So customers like myself are starting to leave and seek alternatives. ",2016-09-02 00:31:51
d76ilmi,rainbowbadger50,23,"Use Tails OS off a flash drive, make Alphabay market account on TOR, get some Bitcoin from Coinbase, and voila, you'll have it at your doorstep in 2-5 days.

For specific instructions on how to obtain safely go to r/darknetmarketsnoobs",2016-09-02 16:55:12
d75gzmh,EWBears,19,"Hey Roger - I noticed this trend as well and recently made my first moves into alt coins.

I was rather late to the Bitcoin game (2014), but for someone like you with a large stake in bitcoin's growth and acceptance it must be quite frustrating to see the stagnation. ",2016-09-02 00:19:02
d75mriu,adoptator,18,"Of course, ""fees"" is an oversimplification of the situation.

It is now evident that there *is* a de facto standard development structure of Bitcoin which decides how it will evolve, and they do not plan to ""absorb well tested features"" of alternative networks, like most of us imagined years ago.

Now, ""specialized"" coins are somehow not ""alternatives"", but accepted (whenever rhetoric necessitates, but not really) as harmonious citizens of this space. Since Bitcoin is no longer an all-in-one solution to the world's problems, but rather just another specialized coin, the market will need to adjust accordingly. ""Fees"" is just a part of the whole situation.

Since most of what gives Bitcoin value is speculation about its future, this all still drives people to altcoins. Arguing otherwise seems like denial to me.
",2016-09-02 02:22:59
d763fyk,nullc,18,"'cept testnet is a public interworking environment, and not a testbed except as a last resort. Testnet is now incompatible with BIP109 and can't be 'tried again' without redoing how BIP 109 works.  Moreover, the failure wasn't even noticed, and the software being tested had already been released to production use months ago. Thankfully the Bitcoin network wasn't foolish enough to run it.",2016-09-02 08:46:22
d75m8ln,valerian253,17,"And with that, millions of people will have their first bitcoin wallet. #ToTheMoon",2016-09-02 02:11:55
d764kgc,nullc,17,"&gt; Segwit in April

Did you actually read the [Capacity FAQ](https://bitcoin.org/en/bitcoin-core/capacity-increases-faq)?  It points out that segwit design would be done them and it would be released for review and testing, and that activation would come months later. It went out to review and testing mid april just as scheduled.  0.13 was release a couple weeks behind schedule (in part due to the bitcoin.org snafu). Testing on testnet is going well, mining software was dragging behind but is now going well. 

I'm not sure what else you're expecting, but if you'd like things to go faster you could help out with review and testing. Unfortunately AFAIK none of the companies that were saying they urgently needed more capacity have contributed to these efforts, much to my disappointment.",2016-09-02 09:15:30
d76jdhs,7a11l409b1d3c65,15,"&gt;The amount of time you save by not loading/watching ads is tremendous. Literally years of your life. 

Because making seven Bitcoin transactions to the seven ad-providers and waiting for those transactions to be broadcasted before you can load the website is faster than just locally blocking the ads in the first place. 

Right. ",2016-09-02 17:41:20
d75jal8,satoshis_sockpuppet,14,"From the top 10 altcoins only Monero is imho really ""better than Bitcoin"" (I don't think the advantages would be enough to have a mentionable market share, if Bitcoin wasn't capped at 3 tps. In fact, I think no altcoin, including Ethereum, would have any marketshare combined &gt; 5% if Bitcoin was allowed to grow.)

If you are honest, Ethereum is, regardless of the language they use, pretty centralized and imho too much influenced by bankers.

But zCash really is another deal. I can't understand how people like you and Gavin think so high about it. The absolute deal breaker should be this: http://monero.stackexchange.com/questions/83/how-does-monero-privacy-and-security-compare-to-zcash/99#99

&gt; Perhaps the biggest security risk with Zcash is the possibility of collusion among those participating in the trusted setup.

&gt; If all parties involved in the ""trusted setup collude (either willingly or under duress) then there would become a possibility for the creation of an unlimited number of coins without detection. Zcash is so private even the coin supply cannot be verified if the trusted setup described above fails.

&gt; With Monero, coin supply is easily verifiable on the blockchain in real time so any exploit altering the coin supply (other than coinbase transactions) would immediately be noticed.

Apart from that, I really don't like the company-like setup and the 20% mining reward for the company.

edit: thanks to u/krakrakra for originally pointing that out to me btw.",2016-09-02 01:08:42
d76ek8w,evanescott,14,People that use cash at Western Union aren't going to Bitcoin let's be serious.,2016-09-02 13:49:50
d7638r5,nullc,13,"I suppose you haven't looked? Or was it just that my commons being hidden in this subreddit prevented you from finding the other places where I pointed it out?

Here is Tom Zander pointing out the BIP 109 invalid transaction that forked off Classic: https://www.reddit.com/r/btc/comments/4znayx/is_bitcoin_classic_v110_no_longer_compatible_on/d6xagdl

The TXID from Zander's post: f5c6f8cf65e13cd23c5e6b542b72e3663d6bf776df24b865065420e1bde285cf

It is in mined in testnet block [916495](https://www.blocktrail.com/tBTC/blocks/916495) which signals BIP109 support and was mined by pool.bitcoin.com according to its coinbase transaction. 

     $ ./bitcoin-cli -testnet=1 getblock 0000000000002e5b3a37e06735f69ef0265071ffcd39efbf73bf36c8759a9667
     {
       ""hash"": ""0000000000002e5b3a37e06735f69ef0265071ffcd39efbf73bf36c8759a9667"",
       ""confirmations"": 9846,
       ""strippedsize"": 663816,
       ""size"": 663816,
       ""weight"": 2655264,
       ""height"": 916495,
       ""version"": 805306368,
       ""versionHex"": ""30000000"",   &lt; signals BIP 109
       ""merkleroot"": ""8c8e4a240209a9bda547aac351353abefbbb1d57602ba57b5db8b51eb2a86e94"",
       ""tx"": [
         ""a66cc7775c851877c3363333faa06e09b414315e7639331727746aa713d34709"", 
         ""960964d8fea273d4f5ac4cc54dad78f14ea62799907403e194c523421efbc6a7"", 
         ""f5c6f8cf65e13cd23c5e6b542b72e3663d6bf776df24b865065420e1bde285cf""  &lt; has fork trigger
       ],
       ""time"": 1469882129,
       ""mediantime"": 1469881722,
       ""nonce"": 2246956187,
       ""bits"": ""1b00ffff"",
       ""difficulty"": 65536,
       ""chainwork"":    ""00000000000000000000000000000000000000000000000ec0ac1418606ec107"",
       ""previousblockhash"":  ""00000000000055c475f63a00c0c42f8a39b7508892330730542ab0f303a6ba30"",
       ""nextblockhash"": ""0000000000004b1cb6e3be807763f353504af9e7ccd5c18ed2e77ff10e4c3222""
     }

     $ ./bitcoin-cli -testnet=1 getrawtransaction a66cc7775c851877c3363333faa06e09b414315e7639331727746aa713d34709 1
     {
       ""size"": 149,
       ""vsize"": 149,
       ""version"": 1,
       ""locktime"": 0,
       ""vin"": [
         {
           ""coinbase"":   ""030ffc0d11102f454231362f4144342f42552046545704119f9c5704c467a
     6390c177486570952000000000000
     122f706f6f6c2e626974636f696e2e636f6d2f"", &lt; decodes to a bunch of junk then ""/pool.bitcoin.com/""
           ""sequence"": 4294967295
    }
       ],
",2016-09-02 08:41:14
d76luwt,MemoryDealers,13,How soon do you plan to help Bitcoin scale via Bitcoin Unlimited?,2016-09-02 20:08:54
d75wkgx,Richy_T,13,"To summarize, Classic is misbehaving and did not follow the robustness principle allowing it to be falsely activated. This is less likely on the main net (but was advocated as an attack by some small-blockers).

Classic should fix the issue (sorry guys, I'm on your side but this is on you). Bitcoin Unlimited has no blame in this (and this is some evidence towards their approach being superior). Roger Ver should be congratulated for bringing this potential danger to the fore. Greg Maxwell should stop and think for a minute before throwing feces at every available target. 

Though people should realize the nature of testnet. It would be trivial to hard-fork on there and bring enough hash power to leave Core, Classic and possibly even BU off on some minor chain. This is why it's the test net. It's the 51% attack made cheap &amp; easy (The hashrate is 45Th/s FFS). This is why we don't hodl and trade testnet coins and why, when some people tried, testnet got reset.",2016-09-02 05:54:46
d75pbc0,fluffyponyza,13,"Here's what I said to them:

&gt; Hello - I understand, per https://twitter.com/diiorioanthony/status/771033721881362432, that there is an official list of cryptocurrencies that are approved by Apple. I'd like to add my voice to those requesting to add Monero to that list.
&gt; 
&gt; Monero is an open-source cryptocurrency that has been around for two-and-a-half years, and is a privacy-enhancing and scalable digital currency that shares no code with Bitcoin. In fact, Monero uses Curve25519 for much of its core cryptography, which is another aspect we share with Apple's software:)
&gt; 
&gt; As I am one of the Core Team members stewarding the Monero project, I remain at Apple's disposal should anyone wish to discuss the project or get any further details. Thank you for your consideration of this!",2016-09-02 03:17:23
d7612cy,misterbitcoins,13,"Or you could just use http://Protip.is - which works with Chrome, charges NO FEES (brave charges 5%) and is open source and free.....  

for Content Creators: just add your bitcoin address to your work.  

no complicated legally questionable ad-replacement system needed.   ",2016-09-02 07:44:55
d768tjj,choco_beach,12,"Rand Paul has been accepting bitcoin donations for over a year...

http://money.cnn.com/2015/04/07/technology/rand-paul-bitcoin/",2016-09-02 11:02:43
d76nou8,derustzelve1,12,Too bad it does not state the actual bitcoin amount... Fix needed by bitkassa? :-),2016-09-02 21:26:17
d75je9w,Thrownawayandtrash,12,Would Bitcoin work? Check circle or coinbase ,2016-09-02 01:10:54
d75jqpi,eric_sammons,12,"What is frustrating to many of us is that Bitcoin was explicitly promoted as *both* a long term store of value *and* a way to buy coffee. And that was clearly Satoshi's vision as well. So to have some small group of people just decide that it can now only be one of those things (and for dubious reasons)...well, you can see why many of us are looking at other alternatives.",2016-09-02 01:18:21
d75rb1l,Zyoman,11,It's ironic that you say that... I'm not aware nor bother with that because I never visit \r\bitcoin... I guess you are :),2016-09-02 04:00:21
d75hafz,silver-saguaro,11,How can Bitcoin grow? It can only process 7 transactions per second with no possibility of an increase in block size in the future.,2016-09-02 00:25:27
d75nsw6,notanundercover,11,"First and foremost, sellers accepting Monero only serves to their advantage as this is just one of many listings. http://i.imgur.com/uvZl2Bu.jpg

As a buyer just look at the quicker transfer times over Bitcoin.

Monero ~10 min. http://i.imgur.com/HXgljqS.jpg

Bitcoin ~45 min. http://i.imgur.com/K8K1SHH.jpg",2016-09-02 02:44:50
d75w1wq,PM-ME-CRYPTOCURRENCY,11,"Hullo I am nigeriern royilty.  ( Please excuse the fact I can not spell Nigerian or royalty) and if you send me your bank details then I will send you many seafoods from my mansion in exhile in Burkina Faso . That come from our wonderful burkinan coast. Also some gold. But I need 2 bitcoin to bribe Interpol .

Genuineli notta-scamma

Nigerierns royalteeshirt",2016-09-02 05:43:26
d75yme4,hodlor,11,"I think that's only a worry if the foundation itself is building everything - but it's not.  Most of the projects are just software that runs on the VM.

After leaving the bitcoin scene in summer 2015, let me tell you, I'm ready for some ambition.  It's time somebody tried to turn the promise of blockchain into reality.",2016-09-02 06:44:03
