Comment ID,Author,Score,Body,Publish Date
d7xx7v3,helix400,20,"I don't want to threadjack too much, but I have noticed a trend among those who want to gain attention while utilizing mass media to attack the church.  They ask for money.  Lots of it.  
 
Jeremy Runnells has been soliciting money for a while now (correct me if I'm wrong, but I recall it being used to effectively supplement his personal income).  Kate Kelly had a GoFundMe account to get a laptop.  Tom Phillips requested money after heavily pitching himself and that ""October Surprise"" suggesting that he needs help with legal fees.  And now this guy is pushing his bitcoin account under the justification that there is no work to be found in the Salt Lake area because the Mormon church controls everything. 

Obviously not everyone who fights against the church asks for money, that seems really rare.  But of those who constantly put thmselves in the spotlight (often with accompanying over-the-top, dramatic, open letters), there's a strong correlation for also wanting cash.  
",2016-09-23 05:10:06
d7yuna8,drawingthesun,19,"Isn't that what Trump does? Add silly names to things he doesn't like?

Fly by night? Right.....

Monero and Ethereum have been building up for a few years now.

What argument are you trying to make?

Bitcoin wants to be cash but the fees are getting too high.",2016-09-23 23:08:31
d7xrd0p,Sergeant_Darwin,19,"Nah dude, fuck that. The Mormon Stories donations go back INTO Mormon Stories. You're asking for handouts. So yeah, it's way different. You don't need bitcoin donations to upload documents.",2016-09-23 03:07:43
d7y780e,winky_pop,19,"Have you read our blog? Probably not, so here it is:

https://gemini.com/blog/introducing-the-first-ever-daily-bitcoin-auction/",2016-09-23 09:07:11
d7yl5lh,kyletorpey,19,"Yes, but it's unclear how long it will take (at least to me). Some say implementing SegWit in a wallet library only takes a few days.  
  
Sources: https://bitcoinmagazine.com/articles/bitcoin-core-developer-eric-lombrozo-many-incentives-to-implement-segwit-1455557934 and https://bitcoinmagazine.com/articles/this-bitcoin-developer-is-working-hard-to-prepare-projects-for-segregated-witness-1461340309",2016-09-23 16:10:45
d7xq90r,apbq,19,"Money.
Bitcoin is expensive to attack. Ethereum is not.",2016-09-23 02:44:29
d7xzarw,fidelitypdx,18,"yo fam, i gut u - PM me 4 bitcoin, ill send the passsword.",2016-09-23 05:55:03
d7xu3vf,parishiIt0n,17,"next week on cnn ""bitcoin used to sell drugs anonymously on the streets""",2016-09-23 04:05:04
d7yrcxe,OtroPoema,17,"Simple law of supply and demand. Buying all of the xmr available for sale on exchanges would cause a massive spike in price and therefore defeat the purpose of their approach. The huge volume and price spike would draw massive attention to Monero and then everyone in ""FinTech"" would know it is a superior form of cash to fiat and bitcoin :)",2016-09-23 21:35:08
d7xuhan,Severian_of_Nessus,15,Had to set up that Bitcoin account.,2016-09-23 04:12:58
d7zdoxc,bmxtiger,142,This is Windows Microsoft. Your computer has much virus on it. May Remote I in and fix for 2.097638t8y9fcjsv bitcoin? I accept MoneyPak card also.,2016-09-24 06:00:14
d802bt7,Badluxbro,105,About 0.0830 Bitcoin to anyone Internet like myself,2016-09-24 21:57:11
d7z1l0f,056C42S,68,"Valve allows the distribution of third-party software like ""[ESEA](http://store.steampowered.com/app/479130/)""(Third-Party Counter-Strike Match-Making system) that does something similar.  The sad thing about ESEA is that at one point, [they were even caught using their access to users machine to silently bitcoin mine.](http://www.pcgamer.com/esea-accidentally-release-malware-into-public-client-causing-users-to-farm-bitcoins/)  

And that's not even the first time ESEA has done something shady.   Still surprised Valve let them onto their Steam ecosystem with their sketchy as fuck history.",2016-09-24 01:39:09
d7z8hfn,056C42S,34,"Yeah, that was the flimsy story they went with after they realized the severity of the situation and how much public attention they were getting.  At the time, even the bigger gaming blogs were reporting on he story, and that was relatively uncommon for Counter-Strike.

The ""rogue employee"", as they called him, was their lead programmer and was no stranger to the company or the scene.  In fact, he was often considered(for admittedly good reason) the reason why their anti-cheat was so great.  He was definitely an integral part of ESEA at the time.  

When the bitcoin mining scandal first occurred, their story was that it was an April fools joke and that the lead programmer had floated the idea to one of the owners, 'lpkane', and he signed off on it.  Then when the shit hit the fan and they realized how big they had goofed, they changed their story to pinning it on the programmer, presumably because they realized as a company that they could all go down or only 1 person needed to go down.  I imagine they came to some agreement to let go of the programmer while letting him take the blame in exchange for some undisclosed compensation.  After all, the client they use is their baby so its not like it would be hard to justify some sort of compensation for him.  

Anyone that's been part of the pro cs scene knows well that ESEA is a very manipulative and inclusive group.  Even in minor dispute, they will typically cover each others asses and do whatever is best for their company and sort of protect each other.  They've even gone so far as to scrub stuff from their website and their forums, hand out lifetime bans to those that criticize them and pursue others that disparage them even outside of their website.  

lpkane recently sold the organization but the people he hired during his involvement are still running the show and, in my opinion, they are still very shady.",2016-09-24 04:04:58
d7zcl6q,nullc,34,"After reviewing it, I think this proposal is not a good one-- though I'm happy that it was actually written up as a proposal. It took considerable effort to review because the proposal isn't well specified-- you couldn't implement this from the BIPs because none of the serialization is defined. I hope the proposal is improved to the point that it can be evaluated as a standalone unit, but at least it was documented at all and with some help from the author I was able to give it some review.

Unfortunately, it follows Bitcoin ""classic"" newspeak tradition by being named the opposite of what it does: It actually removes flexibility by ripping out several fields of transactions in order to make the transaction slightly smaller. The result of doing this eliminates CSV's functionality, since there are no longer sequence numbers on inputs.

We can think of this proposal as accomplishing several distinct ends: It's a proposal for transaction compression-- which itself wouldn't be a consensus change at all and which could be done on a link by link basis, it's a proposal to change txids, it's a proposal to change transaction costing,  and it's a proposal to change the signature hashing.

It's useful to break it down along the functions and consider how well it does each:

As a compression scheme it's marred by incompatibly with existing transactions. A good compression scheme would work for all transactions, past and future. It gets about half the savings of other proposals that serve this function because it wastes space coding types and lengths even though there is absolutely no flexibility in most of them (the mandatory fields are all hard coded, and something changing them would be a new hardfork and a new transaction version number). It also fails to exploit common redundancy inside scriptsigs. By welding the compression to the hashing and consensus it also means that its not feasible to quickly evolve the compression according to changing usage patterns.

As a proposal to change TXIDs it only accomplishes the goal of getting signatures out of the ID, no other benefit, and breaks compatibility network wide (all bitcoin using software would require a synchronized flag-day update); despite these deployment complexities it is no simpler than segwit's improvement there: both require an additional commitment to the witnesses.

As a proposal to change transaction costing, it actually makes it relatively cheaper to create entries in the UTXO database than to remove them. This worsens the incentive misalignment, encouraging people to spam the UTXO set instead of cleaning it up.

As a proposal to change signature hashing, it fails to fix the N^2 signature hashing problem, it fails to reduce the size of the revealed data for safely spending. 

I expect that the other proposals for transaction compression will eclipse this because they have perfect compatibility, vastly greater impact, and can be deployed in a highly permissionless manner without creating network flag days and requiring every user to upgrade-- plus deliver greater compression.",2016-09-24 05:35:04
d7yym10,Chris_Pacia,27,"This article sums up everything I've been saying for a while now:

* People wont adopt bitcoin if they can't use it. Since the stores on campus didn't accept it, people lost interest. The pipe dream of a hispster coin which people only invest in and not use is delusional. 

* Since they couldn't use it, they just sold it. Again, assets don't have utility because people save it (as the small blockers believe) instead people save because the asset has utility. If you take away that utility, people simply have no reason to save it. ",2016-09-24 00:36:51
d7zf4js,cointastical,25,"- Day 3: 3,098 BTC @ $599.50
- Day 2: 2,090 BTC @ $595.75 http://reddit.com/r/Bitcoin/comments/5417yd
- Day 1: 2,104 BTC @ $593.67 http://reddit.com/r/Bitcoin/comments/53vk7w",2016-09-24 06:35:10
d7z7e9n,BowlofFrostedFlakes,24,"I believe this is the ultimate test for Bitcoin's survival.  We are witnessing history play out in front of us.  

The big test is ""Can bitcoin really be controlled by one or a group of people?""  If we are able to successfully expand on-chain scaling and HF even though Blockstream has 76 Million to fight against it, then I have no doubt that Bitcoin can survive anything.",2016-09-24 03:41:43
d7zzumf,Joloffe,24,"Thought for the day:

It was obvious to me from a at least 9 months before the bitcoin Halving that it would have a massive effect upon the price. I positioned myself for this four yearly event and did very well from the price surges. Gaming it out I surmised that rather than after the halving as previously, the rises would happen before the halving took place this time, as prior history was factored into the market. 

It seems obvious to me that the same game is soon to be played with ethereum. Let's see we have huge development progressing with a multitude of startups, DAPPS and already ethereum is #2 in terms of market cap behind bitcoin. DevCon 2 showcased how big ethereum is trying to be.

But inflation is high (1 million coins a month) and it will be probably 9-24 months before PoS is released in the Serenity release with synchronous scaling improvements to ~1000 - 1500 tps through sharding. Also don't forget monetary inflation will drop to between 0 and 2% forever and reward those holding the currency who support the network with a validating node (very different from bitcoin nodes and centralised Chinese miners). 

The EF dev's are constantly saying ether is not 'supposed to be money'. But once the countdown to Serenity becomes more clear I would posit that ethereum will experience a super Halving phenomenon. As serenity goes live on testnet and the market can see it works then a massive influx of capital will begin to move into ethereum. Once the highly publicised switch from POW to POS occurs ethereum will be very dangerous to bitcoin. At this point ethereum has a chance to become a 'bitcoin killer' and take the crown. I believe it will coincide with a x10 or greater rally which will be breathtaking in ferocity.

The big question is when are metropolis and serenity pencilled for release!",2016-09-24 19:53:26
d7yxqi9,impulse110,23,"Great find, how much bitcoin do we owe you?",2016-09-24 00:18:15
d7yyjv5,ProHashing,22,"/u/BashCo has lost all credibility when he refused to resign as one of /u/theymos's moderators.

I think that SegWit is a poor implementation and that there can be better ways of accomplishing what it does.  But even if that weren't the case, I just think that this is the best opportunity to overthrow the Core's control of the bitcoin protocol.

I don't have any malace against those developers; I just think that they are poor leaders, act unethically, and are not putting bitcoin in the right direction.  Escalating Segregated Witness to a hard fork will diminish their authority and standing, and allow other more ethical developers to achieve more recognition and influence.",2016-09-24 00:35:37
d7znfs5,HandyNumber,20,Yep. I was at DevCon and nobody I spoke to even mentioned that exchange. The world is moving on. Bitcoin exchanges are free to choose to not trade ETH if they so wish. The more liquidity the better. There are many flows in and out of ETH. Includinga proof of concept fiat gateway such as that demo'd by Santander.,2016-09-24 10:29:47
d7yxmg9,Plesk8,20,"I ""knew"" BashCo back in the day - few years back. Him and I colluded on several tipping sprees and had good conversations in /r/Bitcoin. He was much different then. I have a feeling his account may be one that was bought-out by the powers that do what they do... and is now a shill account... Just a hunch.. cuz this guy used to be very cool and level-headed.",2016-09-24 00:15:52
d7zbw86,GaryNevillesValencia,20,And want to play with bitcoin miners instead.,2016-09-24 05:19:26
d7zo1a5,prison_reeboks,19,"Hmm. What stands out as ""unnecessary"" most of all to y'all in season 2?

Theres three things for me: 

1) Ray the Warden's bitcoin service problem (hot wallet/cold wallet)

2) The power grid on the Eastern seaboard going in and out

3) Price's whole thing with the Congo

Here's what I think is up: 

Esmail is exposing the viewer to the intricacies of bitcoin banking and how bitcoin can be protected through servers, how its value works, what it is. When Phillip Price reveals his eCoin idea to ""Jack"" the high ranking American politician, he is initially told no, he cant get the president to do that, then Price goes on to talk about how with no other alternative, the Chinese are using bitcoin, and what could be worse than not having control over the currency (i wish i had the manuscript with me for what exactly he said) instead they should control the money themselves through eCoin. 

I believe Mr Robot/Elliot always had the desire to avenge his father's death. So he went back and he looked at what was Washington Township. He found that it was a massive computing center created by eCorp, powered by coal (which burned at high levels can cause radioactive waste leading to something like leukemia) which pushed the limits of data storage, computing power, and required a lot of electricity. 

Elliot/Mr Robot's idea is to retool the township as a bitcoin mining center, that way when eCorp falls (phase 2), eCoin fails, the monetary system collapses entirely, all physical records that were to be digitalized are destroyed. Something will need to be introduced in its stead, ""the Chinese are using bitcoin"" already, but transferring bitCoin internationally is tricky business. In fact, in 2008 China made it so that bitcoin could not be transferred through international finance (CALLING ALL EXPERTS ON BITCOIN, please enlighten us on this in particular). So Elliot goes to the Dark Army/WhiteRose in order to find people with the power and the will to take down the powerstructure, who can manage to take control of Washington Township, *siphon energy from the american power grid* in order to mine massive amounts of bitcoin *in the United States*. 

The precious metal white rose is hoarding (mentioned in the last minutes of season 1 between him and Price) is why Price asks Colby to use his influence to let the Chinese have Congo (Esmail even has Colby ask the question we should all be wondering *why Congo?*. Well it could very well be because this metal is critical to a new type of processor that WhiteRose has been able to use at the Township Project, allowing him to harness exponentially greater computing power (thus bitcoin mining ability), but requiring more energy to run (thus stealing from the grid).

Imagine Elliot/Mr Robot trying to figure out a way to take power away from the elite, the same elite that killed his father. Obviously he would want to use their own project, the one that killed his father, against them... if he could find a way. So he does... Or did WhiteRose find him??? Thats the real question...",2016-09-24 10:48:43
d7z6byh,tulasacra,19,"&gt; Yes, bitcoin as a settlement layer is fine

NOT fine. It would be fine if it were a natural restriction. However, artificially crippled system is inevitably a dead system.",2016-09-24 03:19:15
d7zl3hj,smartfbrankings,19,"Yes, invest your Bitcoin in a cold wallet, sit back, and relax.",2016-09-24 09:17:55
d7zblv4,nullc,18,"&gt; Its the best way to get Lightning running on Bitcoin.

What?  This scheme rips out sequence numbers, provides no replacement, -- it breaks lightning.  Based on comments on rbtc I thought this was an explicit and intentional goal.",2016-09-24 05:12:59
d7yzb06,sycore1,18,"Once they blow up the records it will show you can not keep finicial records on paper or digitally in a central place like E-Corp. So if you want more than $50/day the government will mandate you get tiny E-coin/Bitcoin microchip wallet injected under your skin. This will give the DA a way to hack humans and led to mind control, which leds to robots. This is what the Washington Township Plant has been doing. Coltran refined into Tantulum which can form new nerve connections in the brain. ",2016-09-24 00:51:17
d7zqm99,Blacksheep2134,17,"You'd think so, and there's definitely some self-jabs in there (see:  Bitcoin), but it's on a pro-Johnson channel, so I'm going to have to assume no.",2016-09-24 12:10:20
d7zhi2d,nullc,16,"I don't know why anyone thinks that Jeff Garzik as any particular knowledge or expertise here which would be relevant. I'd earnestly love to see a fact based argument on this front.

His claim here-- at least as I read it--, is flatly untrue: _Other_ people using segwit will free up capacity for people who are not using segwit.  If _no one_ upgrades for segwit, well then it won't exist-- sure. But that is pretty circular and inherently true of any possible improvement. Once miners upgrade to it and begin using it for their own payouts everyone will enjoy increased capacity.

I think the tweet is also indirectly misleading, since for most wallets supporting segwit isn't that big of a deal, many have done the work already-- and lowering transaction fees is a pretty good incentive to make use of it. By contrast, Jeff's collaborators on Bitcoin Classic prefer schemes which would forcibly knock every user off the network-- e.g. Zander's ""flexible transactions""-- and force software upgrades (or replacement, if their preferred software is no longer maintained) onto all of them.",2016-09-24 07:36:41
d7z8alm,zimmah,16,"The future of bitcoin is bright, but that doesn't mean it's not fragile.    
/r/bitcoin is full of cultists that honestly believe that 1MB blocks are good for bitcoin while it could legitimately kill bitcoin. I'm not even joking.     
We have been debating this issue for 2 years, which may have been one of the main reasons behind the longest bear market bitcoin has ever known. And even though we aren't truly in a bear market anymore, the market sentiment is still unsure.",2016-09-24 04:00:50
d7yz8h8,atreyu64,15,"I turned one into a bitcoin miner. It ran OpenWRT and had one of those USB ASIC miners. Ran cgminer, would repeat my actual WiFi used for internet and get the blocks that way. 

Another one I turned into an onboard computer for a quadcopter that streamed a webcam over a (roughly) 50ft WiFi hotspot. 

A third one I turned into a 32gb storage unit that saves various important things. Tried to make it an aircracker but I got lazy and forgot til now. ",2016-09-24 00:49:52
d7z8a5i,Adrian-X,15,"/u/BashCo don't be concerned, 99.999% of people involved in bitcoin have absolutely no say in the activation of segwit. 

It's literally just up to Blockstream/Core to convince about 8 miners or so to activate it. I think I'm a little more conservative when I say [about 8 it's actualy just 7](https://bitcoinchain.com/pools), anyway u/nullc thinks it's as little as 3 people who literally control bitcoin. 

So no sweat you've got this one in the bag. 
",2016-09-24 04:00:34
