Comment ID,Author,Score,Body,Publish Date
d7ndv11,okredditwtf,13,"The instant she started shilling for Dash full-time, her presenter-skills skyrocketed (you might say they went 'to the moon'), to the point where she actually manages a pretty good faux-newscaster cadence now. Was bitcoin holding her back or something? I'm very conflicted here: On one hand it's awesome, but on the other I kinda miss robot lady.",2016-09-15 12:36:15
d7n1iau,Joloffe,12,"Eloquent treatise as usual from Eric.

But https://coinmarketcap.com/charts/#btc-percentage shows that no matter what the bitcoin maximalists say the market isn't having any of it. 

To my mind bitcoin is now a dated supertanker with the crew squabbling over the wheel controls.  ",2016-09-15 07:20:51
d7nc7i5,Purplekeyboard,11,"Yeah, you in your ivory tower just can't relate to the billion people out there living in poverty, farming their potatoes and yams and making $1 per day.

These people want to rent cars and boats and time share condominiums in Florida, and they're crying out to be able to do so with Bitcoin!",2016-09-15 11:51:19
d7niz7q,JustFinishedBSG,11,"Lol what ? Not only is gitlab barely crippled but I don't see what P2P has to do with that. You're missing ""bitcoin powered"" to achieve maximum cringe too",2016-09-15 15:48:47
d7mp1ax,slapdashbr,11,"it's not worthless, it just operates as a fiat currency. 

bottle caps are a decent currency for a wasteland situation where the caps themselves have an important use (sealing purified water bottles) but are also convenient to carry, like coins. So they are ""backed by water"". However, they have all the drawbacks of commodity money (i.e. the gold standard, bitcoin, w/e). Deflationary spirals are uncontrollable in the event of a systemic economic shock. Lending is next to impossible, without traceable currency or a central bank. 

Fiat money allows for a real financial system to develop. ",2016-09-15 03:03:58
d7mkl8g,gh0st3000,11,"But it also makes the transaction final, as in if the consumer fucks up the car they can't be charged additionally without their express consent. Not as much of a problem if you use your own KYC on top of bitcoin though so they can at least be sued.",2016-09-15 01:32:31
d7mo8cq,anon_smithsonian,10,"I just wanted to take a moment to say thank you: while I was in Germany with my wife for a friend's wedding, a couple of weeks ago, I was able to see that a Mr. Mime spawned 1.5 blocks from where we were for the wedding, thanks to fastpokemap.se, and was able to catch it (for both of us!). We were only in Germany for a total of four days, so we didn't have much time for hunting pokemon... if it were not for FastPokeMap.se, we wouldn't have been able to catch a Mr. Mime in the short time we were there. 

Do you have a BitCoin wallet address for BTC donations, by any chance? I only saw the link for donating via PayPal on your site...",2016-09-15 02:47:44
d7n1gfy,Tyrasth,10,"Alright, set it up so that you have a block chain like bitcoin, and assign every citizen a pub/priv key (like your social security card). The public key is public, assigned to you, and can decrypt anything encrypted by your private key. Only you encrypt your vote and push it to the block chain, and anyone, even you or the government, can verify that vote. All votes are stored in the same place and verify able by all. Boom, I just made that up within the last 10 minutes. ",2016-09-15 07:19:38
d7nkhwg,petertodd,10,"Absolutely - GuardTime was one of the things that inspired me to start writing OpenTimestamps back in 2012. Equally, one of my goals was to be able to timestamp something with services like GuardTime and Bitcoin simultaneously, and have both timestamps be in turn timestamped by each other to cross-check.

edit: FWIW, GuardTime isn't actually keyless: there's a set of trusted signers who sign the merkle tree, and those trusted signers have secret keys that can be used to create fake timestamps.",2016-09-15 17:11:55
d7n3z42,dEBRUYNE_1,9,"Note that the average transaction size is around 1-3 kB currently, which, at a price of 10$, would equate to 0.02$ - 0.06$ per transaction. As far as I know this is lower than the current transaction fee in Bitcoin*. 

*For getting a transaction into a block at reasonable time. ",2016-09-15 08:21:21
d7mwngf,Joloffe,9,"Since we already know it isn't a ""no news"" event why bother?

Ethereum has great support propping the price up. In spite of existential risks to the project through the DAO the price has kept price support in the 10-12 dollar range. That's just a technical - but isn't a bad place to open a position which remains psychologically cheap to the new user in spite of the 1bn overall market cap (12 bucks sounds a lot better than 620). It is also gaining new on ramps all the time - coinbase being the most significant this year.

It is clear that ethereum has the most development momentum within the entire crypto ecosystem, both in relation to the main core project and in terms of allied startups building out the ecosystem than any other cryptocurrency - including bitcoin at this stage (with Gregory Maxwell driving governance and scalability concerns so successfully he may as well have divested his entire net worth into XMR/ETH). 

Out into next year we can expect a series of network upgrades in the form of PoS (which reduces effective money supply by encouraging holding through compound interest gains, accompanied by a major reduction in new coin emission, akin to the Halving in bitcoin - or a super Halving if you think about it) and improvements like sharding / raiden to allow ethereum to actually scale up to become the public ledger of the internet.

Meanwhile bitcoin has the worries of an impending hard fork, a battle coming between implementations (unlimited vs core) with entirely different views of what the bitcoin ledger should become. The incumbents have (unbelievably) capped transaction throughput on the ledger to favour a nebulous concept of decentralisation over drawing in fresh waves of users - whilst damaging bitcoin usability by removing 0-conf transactions and inflicting long delays on transaction confirmations by failing to make even basic upgrades to the network in a timely fashion. Decentralisation is worthy of protection - but not at the price of destroying any potential of the project from attracting or supporting new users. Complete naivety or perhaps Gregory Maxwell has a 'sponsored by JP Morgan' on a t-shirt somewhere. 

Either way, on hype alone ethereum is virtually guaranteed a run at bitcoin at some point in the next 18 months. And with the above headwinds it seems like a speculators paradise for the financial engineers to shift value from bitcoin to other chains as the almost inevitable exit from bitcoin continues (https://coinmarketcap.com/charts/#btc-percentage). 

COI: holding bitcoin and ethereum and XMR.

PS: the dirty little secret of the developers who keep saying ether is not a currency is that the ethereum roadmap treats ether exactly as a potential bitcoin-killer scalable cryptocurrency for the internet. They just aren't announcing it as that and they probably won't until it the price spikes after PoS and/or it overtakes bitcoin and becomes obvious in retrospect.",2016-09-15 05:36:19
d7ntko3,DaSpawn,9,"the bitcoin community forked 1-2 years ago.  The bitcoin code forked into multiple compatible implementations at the same time (Classic, BU, etc) as the original ""core"" implementation and development is completely shifted focus away from bitcoin itself and onto side pet projects and future features needed for said projects (SW, LN).  The blockchain itself however has not forked in over 5 years and the control of the miners became centralized and co-opted by politics (as Satoshi feared/predicted)

Currently there is a concerted effort to prevent bitcoin itself to scale by using misdirection and hollow promises of future scaling with side chains (LN) requiring implementation of new ""features"" needed for it to work (SW).  The political control of the miners is preventing the blockchain itself from forking as the community has been trying to move forward with bitcoin itself for years impeded by politics, greed and censorship of information sources for bitcoin to keep people from discussing scaling bitcoin itself instead of side chain projects only like LN

During the community and code fork of Ethereum it was shown that multiple implementation CAN survive a fork and the community will support the fork they see fit, if not both.  

User are being denied the choice of the blockchain they want to follow by forcing through changes using soft fork techniques that fool the rest of the network into thinking new convoluted transactions are valid instead of doing a hard fork and allowing users decide what software they want to run.  this also ensures these convoluted features are forever part of bitcoin, good or bad, broken or not

bitcoin is in a precarious place, there is tons of understandable animosity in the community and blind following/worship of potentially dangerous roads people are trying to put bitcoin onto.  Bitcoin itself will survive, but the solidness and dream of what bitcoin was to become is lost for many people

people were already reluctant to try bitcoin/cryptocurrencies and all of this intentional division of the community will forever hurt bitcoin, whatever it becomes and only keep away what was needed the most for bitcoin to grow, new users

tl;dr; there is no tl;dr, it is a multi-faceted problem that is easilty taken advantage of by those pushing an agenda, whoever they may be and whatever that may be",2016-09-15 23:24:34
d7mjhhd,o--sensei,9,"Because Monero is not a bitcoin cloned shitcoin and things work differently, so exchanges have to study Monero and do some real development work to implement it, not just some tweaking.

Why they haven't done that work before is up to them, but now that Monero has exploded in value and volume, it's probably that sooner or later some other exchanges will join the party.

",2016-09-15 01:09:44
d7pa0xd,thatBeatisDistorting,113,"In actuality. Buy bitcoin in person using cash. If you live in a populated area you can find people who are selling bitcoins by thousands of dollars. Just to be safe, tumble those bitcoins through a money cleaning site and youre set",2016-09-16 23:50:21
d7p129e,EL_ClD,39,"Polaris has a higher clockspeed compared to previous generations; but you're forgetting that pascal and polaris are two completely different architectures, so they are designed with different goals in mind. If I'm not mistaken, polaris actually has a higher IPC (instructions per clock) than pascal, and this sacrifices clock speed.

While IPC is not necessarily the trump card many seem to believe, it is still important. More GHz is not necessarily better (unless under the same architecture).

Nvidia's efficiency is achieved by sacrificing many features in architecture and board design, such as double compute (although AMD is also nerfing this I believe), a hardware scheduler, vram (which takes up a lot of the power for a card), processing methods such as asynchronous compute, and so forth. However, these features are more intended to heavier workloads than gaming so Nvidia should put these on their Tesla lineup. Nvidia's architecture is focused on gaming, while AMD's cards are usually all-rounders (e.g. AMD is much better for bitcoin mining) but this doesn't mean that Nvidia is directly better than AMD for gaming.",2016-09-16 18:47:08
d7p2d84,Egon_1,30,"&gt;These days, the bitcoin community is neck deep in an internal debate over what it even should be. **Public adoption has significantly slowed down**. 

Not fiction, reality people!",2016-09-16 19:59:12
d7p5ij1,Pannota,20,"Introduction to computer Science:

- Harvard OpenCourseWare with David J. Malan. *Introduction to computer Science*. Awesome and accessible. [12 lectures of 50 minutes](https://www.youtube.com/user/AsimHakim01/videos).


Books about blockchain technology:

- *Mastering Bitcoin*. Andreas Antonopoulos

- *Blockchain: Blueprint for a New Economy*. Melanie Swan


How to code on Ethereum:

- [Fundamentals of Javascript](https://www.codecademy.com/learn/javascript). Solidity is based on.

- Solidity documentation [online](https://solidity.readthedocs.io/en/develop/) or [*.pdf](https://media.readthedocs.org/pdf/solidity/latest/solidity.pdf).

- [Learn Solidity in Y minutes](https://learnxinyminutes.com/docs/solidity/).

- [A 101 Noob Intro to Programming Smart Contracts on Ethereum](https://medium.com/@ConsenSys/a-101-noob-intro-to-programming-smart-contracts-on-ethereum-695d15c1dab4#.bob3d3aon).

- [Getting started with Ethereum dApps](https://github.com/ledgerlabs/ethereum-getting-started/wiki).

- [Solidity contracts tests and templates](http://ether.fund/contracts/solidity) 

And do not forget:

- [Why Your Brain Needs More Downtime](http://www.scientificamerican.com/article/mental-downtime/).


",2016-09-16 21:57:58
d7nxyfi,elsbot,19,"We can theorize all we want about what a free market justice system would look like, but really, we know about as much about it as we could've known about Bitcoin in the year 1999. The freedom to switch services means innovation in ways we can't presently foresee.

Snapshots:

* *This Post* - [1](https://archive.is/CBFN5), [Error](https://web.archive.org/save/https://imgur.com/s8quqta), [Error](http://megalodon.jp)


*I am a bot. ([Info](/r/elsbot) | [Contact](/r/elsbot/submit?selftext=true))*",2016-09-16 00:59:18
d7osbt5,QuinticSpline,18,"For those who don't want to read through the whole article, here's the money sentence:
&gt;One way to think about bitcoin/blockchain is that it is perpetually engaged in reinventing all of the aspects of regular modern finance, but slightly worse.",2016-09-16 12:22:26
d7nyi5n,3xploit,16,"""You can't expect bitcoin to be what you want it to be.""
You're right. I have to want it to be what BS wants it to be. My bad, I forgot. /s",2016-09-16 01:10:46
d7onr5c,sapiophile,16,"&gt; Forcible wealth redistribution is impossible without central banking. 

That isn't true at all. Look at the Autonomista movement of Argentina of the last fifteen years - the excellent documentary [*The Take*](http://topdocumentaryfilms.com/the-take/) (full stream at that link) documents them well.

Squatters' movements have also been reclaiming the commons without state or bank intervention for as long as there has been such a thing as private property.

Those movements, and many others, not only effectively redistribute property, but do so directly in defiance of the State, and are often quite violently opposed by it.

But here's the real kicker: socialism doesn't even prescribe ""forcible wealth redistribution"" - that's a strawman. Seriously. Sure, a number of Leninist states pursued such a goal, but Leninists today are a very small minority of socialists - there are many more [anarchists](http://anarchism.pageabode.com/afaq/secA1.html) than Marxists pretty much anywhere on the planet, and we get a great deal more done than Marxists do, besides.

Now, that's not to say that there aren't many anarchists in favor of reclaiming the commons by whatever means are necessary and just for people's survival (I happen to be one of them), but to say that this is a ""socialist"" tenet is false on its face, and further, it absolutely does *not* require any kind of central banking.

**Socialism is literally nothing more than workers being the owners of their workplaces.** Period. That's it. That's the actual, technical definition of socialism, and it's the one that nearly all anarchists (who, as already mentioned, constitute a sizable majority of socialists worldwide) use the term. It's also how qualified political scientists define it.

So what you're thinking of is Leninism, sometimes also called or ""lumped in"" as ""MLM"" (Marxist-Leninist-Maoism), ""Marxism,"" ""State socialism,"" ""Authoritarian socialism,"" or ""State capitalism,"" this last being the term preferred by scholars like Noam Chomsky and many other anarchists. And those types are, frankly, basically irrelevant in any kind of politics today, except in a few peculiar nations where they have organized vigorously over decades, with some solid momentum from the old Maoist bloc.

It is almost undeniable that if there is anything ""socialist"" about the crew behind Mr. Robot, they are quite assuredly in the Libertarian wing of the idea.

----

So, with that out of the way, let me further contribute why I, as a socialist, also embrace Bitcoin, to quote a comment of mine originally written [here](https://www.reddit.com/r/Anarchism/comments/4ipad9/what_about_bitcoin/d30kd6q):

I'm pretty in favor of it in the short- and medium-term, but I'm also quite wary. I think it's a great way for people to stop paying war taxes (and other taxes) and to dismantle the power of banks, etc. It's also extremely useful for fundraising for radical causes - let's say you want to donate money online to Rojava, or the Chicago bail fund, or whoever - if you use a credit card, paypal, etc., there's a clear paper trail linking your legal identity to your support of those causes, which is potentially problematic. Donating with Bitcoin, it's a lot more like just sticking cash in a hat - much, much more private. This benefit also extends to other situations, as well - in a hypothetical, actual revolution-type scenario, a system for moving resources around that cannot be interrupted or censored has obvious applications. There are still privacy concerns with Bitcoin, though, and using it with strong privacy is still somewhat tricky, but at least it doesn't yield a direct line to personal data with every transaction. And improved privacy (often referred to as ""fungibility"" in the Bitcoin community) is squarely on the roadmap for the future, and seems pretty solvable.

I also moderate /r/DarkNetMarkets and I believe that the darknet drug trade has done a ton of good towards harm reduction in the drug-using community. DNM drugs are by and large purer, safer, more accurately dosed, and so on, and when they aren't, there's *infinitely* more accountability of the vendors than in the ""conventional"" drug trade. There are organized efforts for publicized purity tests (even crowdfunded subsidies for testing samples from people who can't afford it themselves), scandals surrounding dangerous cuts that emerge, as well as access to lifesaving resources like Naloxone (Narcan) through the same channels as the drugs themselves. As a medic and public health advocate, I see all of this as a huge step forward.

The last thing that excites my about cryptocurrencies is that it's a great entry point for introducing and adopting other important cryptographic systems and methods. I earnestly believe that widespread understanding and adoption of strong cryptographic tools for communications, security, and anonymity have enormous potential to subvert the current global order, especially as technology becomes more and more integrated into our lives. The Bitcoin community is **filled** to the brim with people who never in a million years would have otherwise used [Tor](https://torproject.org), [I2P](https://geti2p.net), [GPG](https://gnupg.org) and other security and privacy technologies, and because of the network effect, with every person who starts learning about and using those tools, they become even more useful. In that way, Bitcoin might one day be indirectly responsible for killing Facebook (and replacing it with [something better](https://en.wikipedia.org/wiki/Comparison_of_software_and_protocols_for_distributed_social_networking) based on strong cryptography and privacy controls), for thwarting mass surveillance, and for facilitating the crypto-anarchist/cypherpunk vision for the future (which is largely tainted by ancapism, but there is also a significant leftist presence in that field, as well). To all my comrades here, I strongly encourage you to start learning about cryptographic and anonymity software - it is one of the best tools in our kit for liberation!

**I have a lot of critiques of Bitcoin, too, though**: for one thing, obviously, currency itself is a problematic thing. Hence the ""short- and medium-term"" qualifier above. It still allows the hoarding of resources away from the commons, and the subversion of the consent of workers and others, as well as being a means to facilitate hired oppressive forces. Of course, this is true of any currency, not just cryptocurrencies like Bitcoin.

For another, the Bitcoin community itself is quite toxic. Rampant misogyny, out-and-out privilege-blindness, Just World Hypothesis bullshit, patronizing and racist ""charity"" and ""benevolent globalization"" ideals, and just old-fashioned insecurity and bad-faith arguments in defense of fragile egos are everywhere in Bitcoin-related communities online, which I believe are a reflection of the extremely privileged demographics that are its mainstay.

Additionally, even Bitcoin's *best case* endgame may largely just end up being a shift of the power balance into something equally oppressive - from the current dominant ruling class of old imperial hegemony to a hegemony of privileged nerds who are largely clueless about pressing social issues and the world. While pulling the rug out from under 10,000 years of accumulated power certainly sounds fun (and I'd love to see it, regardless, if only because it would be fascinating), as we anarchists are very well aware, it matters little *who* holds the power - it is the holding of power itself that is problematic.

Then there's the oft-cited environmental impact of mining, or even just the baseline resources expended just to run the non-mining computer network. For me personally, I actually believe that this problem is overstated - it's easy to overlook the very real environmental impact of conventional money systems, which rely on the construction, furnishing, and utility consumption of enormous office complexes, an entire physical security infrastructure (including the production and operation of armored vehicles, vaults, and so on), and of course the incalculable but overwhelming impact of middlemen and other inefficiencies that employ millions of people towards what are essentially redundant and unnecessary ends - lawyers, bankers, accountants, escrow agents, fund managers, and so on, which cryptocurrency technologies have the potential to greatly reduce (and in some cases even eliminate). The resources expended to accommodate such inefficiencies are enormous and impossible to survey completely. Funny - I feel pretty gross talking about ""inefficiencies"" like this... feels a bit too much like ancapery to my sensitive and thoroughly communist brain. But it's true. Anyway, so while ""well this *other* way isn't any better"" is a really frustrating and stupid argument, it is in this case at least appropriate, and my best estimate is that the environmental impact of cryptocurrency is probably approximately a wash, on this front, or possibly a modest net improvement.

All in all, I'm excited by cryptocurrencies, and I really think more folks from our movement should get on board. The community issues I mention above are (partially...) solvable by changing the constituents of that community, and this is a technology that has a lot of benefits for us, if we manage not to be too turned off by its shortcomings. There is also, of course, the small but not dismissible chance that cryptocurrencies could really take off in a big way, and largely supplant traditional money, in which case it would behoove us to not be left in the dust as the new global underclass, and claim a significant share of those resources while we still feasibly can.",2016-09-16 10:27:38
d7olwpo,VoiceofKane,16,"&gt;Bitcoin is about power

Is it about the power of a dozen Chinese guys to control an entire currency?",2016-09-16 09:43:09
d7ohbc7,RDS,16,"Bitstream has received tons of money from one of the Rothschild's investment groups, and as far as I understand it, they are actively working to handicap bitcoin to maintain the relevance of their sidechain technology.

If the block limit stays where it is, it will be impossible to use without lightning and sidechain, and ultimately they want control.",2016-09-16 07:47:19
d7o36al,MakeTotalDestr0i,15,"sample size.

also bitcoin doesn't require breaking laws of physics like what most techno-utopians visions require

",2016-09-16 02:46:37
d7omdv6,tabarra,15,"There's your biggest mistake.  
You may not be a target, but you for sure can be currency or a medium.  
  
You [your processing power] can be used for rendering farms or mining bitcoin.  
And you can be a vector, or even just a collateral effect. For the Stuxnet virus, where the only target was a specific uranium enrichment plant, millions got infected just to eventually the malware reach it's target.  
  
e:typo",2016-09-16 09:54:37
d7oo5oc,awareness1111,14,"Maybe I've been too deep down the geo-financial rabbit hole, but I thought most of you guys knew this already.

You should be worried.

I'm nearly 50, and I've never seen politics, finance, culture and the world (in general) *this* batshit crazy.

Up is down, down is up.

I think 2Pac was quoted in a meme as saying ""trust nobody...""

That is especially true when looking at the financial market(s).  Every chart, graph &amp; statistic is cooked - for them.

Yes, buy gold.

Yes, buy silver.

Yes, buy bitcoin.

The fiat currency game ends soon, and you'll want something that's real - if nothing else, as an insurance policy.

**EDIT** And yes, food, water, protection, etc (again, I thought that went without saying).  When Russia collapsed, vodka was currency...",2016-09-16 10:37:21
